,tweet_lang,poi_name,poi_id,verified,id,tweet_text,tweet_emoticons,hashtags,mentions,tweet_urls,country,text_en,tweet_date,text_es
253,en,BarackObama,813286,True,1313901931903942656,#ImVotingFor the future of our democracy—for the young folks who will inherit whatever we leave them. They’ll take the baton from us and do their part to keep carrying progress forward. But it’s our time right now. And the best way to do that is to vote early for @JoeBiden. https://t.co/ST4nBVWPqM,[],['ImVotingFor'],['JoeBiden'],['https://t.co/ST4nBVWPqM'],USA, ImVotingFor the future of our democracy—for the young folks who will inherit whatever we leave them  They’ll take the baton from us and do their part to keep carrying progress forward  But it’s our time right now  And the best way to do that is to vote early for  JoeBiden  https   t co ST4nBVWPqM,2020-10-07 18:00:00,
254,en,BarackObama,813286,True,1313856721497083905,".@JoeBiden has a plan to build our country back better and create millions of jobs—jobs that can help working families get ahead. Joe helped manage the Recovery Act, which jumpstarted the longest stretch of job growth in our history. And he’ll do it again. https://t.co/pNOyfrvgB9",[],[],['JoeBiden'],[],USA,  JoeBiden has a plan to build our country back better and create millions of jobs—jobs that can help working families get ahead  Joe helped manage the Recovery Act  which jumpstarted the longest stretch of job growth in our history  And he’ll do it again  https   t co pNOyfrvgB9,2020-10-07 15:00:00,
255,en,BarackObama,813286,True,1313528659270041603,This is as powerful an argument as I’ve heard about the stakes of this election. Watch it. Share it. And get everyone you know to vote for @JoeBiden. https://t.co/XdZz4dh82T https://t.co/8MRUsmG4I0,[],[],['JoeBiden'],"['https://t.co/XdZz4dh82T', 'https://t.co/8MRUsmG4I0']",USA,This is as powerful an argument as I’ve heard about the stakes of this election  Watch it  Share it  And get everyone you know to vote for  JoeBiden  https   t co XdZz4dh82T https   t co 8MRUsmG4I0,2020-10-06 17:00:00,
256,en,BarackObama,813286,True,1313211169394614276,"States across the country have voter registration deadlines coming up––and many of them are today. Do your part to protect this democracy and change our country for the better. Register or check your registration, and make a plan to vote: https://t.co/Q5BUeMaOB5 https://t.co/YNgC4G1Llo",[],[],[],['https://t.co/Q5BUeMaOB5'],USA,States across the country have voter registration deadlines coming up––and many of them are today  Do your part to protect this democracy and change our country for the better  Register or check your registration  and make a plan to vote  https   t co Q5BUeMaOB5 https   t co YNgC4G1Llo,2020-10-05 20:00:00,
257,en,BarackObama,813286,True,1313101777533898753,"Don’t wait—complete the Census today. From funding for education, health care, and infrastructure in your community to the way you’re represented in government, getting counted matters. Take a minute to call 844-330-2020 or visit https://t.co/FxSZQbJC0r.",[],[],[],['https://t.co/FxSZQbJC0r'],USA,Don’t wait—complete the Census today  From funding for education  health care  and infrastructure in your community to the way you’re represented in government  getting counted matters  Take a minute to call 844 330 2020 or visit https   t co FxSZQbJC0r ,2020-10-05 13:00:00,
258,en,BarackObama,813286,True,1312166607821529089,"Michelle and I hope that the President, First Lady, and all those affected by the coronavirus around the country are getting the care they need and are on the path to a speedy recovery.",[],[],[],[],USA,Michelle and I hope that the President  First Lady  and all those affected by the coronavirus around the country are getting the care they need and are on the path to a speedy recovery ,2020-10-02 23:00:00,
259,en,BarackObama,813286,True,1311780749109010447,"Last night, I surprised a group of first-time poll workers at the @NBA Finals. These @MoreThanAVote volunteers are stepping up to make sure this election runs safely and fairly in their communities –– and you can too by signing up to volunteer at https://t.co/Ge4XvvPwpW. https://t.co/7RHB5dIzuE",[],[],"['NBA', 'morethanavote']",['https://t.co/Ge4XvvPwpW'],USA,Last night  I surprised a group of first time poll workers at the  NBA Finals  These  MoreThanAVote volunteers are stepping up to make sure this election runs safely and fairly in their communities –– and you can too by signing up to volunteer at https   t co Ge4XvvPwpW  https   t co 7RHB5dIzuE,2020-10-01 22:00:00,
260,en,BarackObama,813286,True,1311742965308633088,I'm looking forward to catching up with @KamalaHarris and folks around the country at our grassroots fundraiser tomorrow to talk about what's at stake in this election. You still have time to join us! I hope to see you there: https://t.co/SEmQcX6u3z https://t.co/4JhaHTj1Ox,[],[],['KamalaHarris'],['https://t.co/SEmQcX6u3z'],USA,I m looking forward to catching up with  KamalaHarris and folks around the country at our grassroots fundraiser tomorrow to talk about what s at stake in this election  You still have time to join us  I hope to see you there  https   t co SEmQcX6u3z https   t co 4JhaHTj1Ox,2020-10-01 19:00:00,
261,en,BarackObama,813286,True,1311518463538716673,"Always look forward to watching the NBA Finals––and tonight I had the chance to thank a great group of first-time poll workers with @morethanavote.

It’s critical that everybody votes in this election––by mail or in person if you can. Register to vote at https://t.co/d5gaMVt7hl. https://t.co/KgW5DAxnvn",[],[],['morethanavote'],['https://t.co/d5gaMVt7hl'],USA,Always look forward to watching the NBA Finals––and tonight I had the chance to thank a great group of first time poll workers with  morethanavote It’s critical that everybody votes in this election––by mail or in person if you can  Register to vote at https   t co d5gaMVt7hl  https   t co KgW5DAxnvn,2020-10-01 04:00:00,
262,en,BarackObama,813286,True,1311400185793216514,Joe knows this isn’t about him—it’s about us. Make your plan to vote right now. We’ve got to vote like our democracy depends on it. Because it does. https://t.co/Q2RbOQZwv9 https://t.co/TfX6EdmhfJ,[],[],[],['https://t.co/Q2RbOQZwv9'],USA,Joe knows this isn’t about him—it’s about us  Make your plan to vote right now  We’ve got to vote like our democracy depends on it  Because it does  https   t co Q2RbOQZwv9 https   t co TfX6EdmhfJ,2020-09-30 20:00:00,
263,en,BarackObama,813286,True,1309479802978676739,"I’m proud to endorse these outstanding Democratic candidates who will work to get the virus under control, rebuild the economy and the middle class, and protect Americans’ health care and preexisting conditions protections. Support these candidates––and vote early if you can. https://t.co/KETni3uwBt",[],[],[],[],USA,I’m proud to endorse these outstanding Democratic candidates who will work to get the virus under control  rebuild the economy and the middle class  and protect Americans’ health care and preexisting conditions protections  Support these candidates––and vote early if you can  https   t co KETni3uwBt,2020-09-25 13:00:00,
264,en,BarackObama,813286,True,1309185985796886528,You don't need me to tell you what's at stake in this election. Now is the time to show up and vote like never before to elect Democratic candidates up and down the ballot. Educate yourself on the candidates running and vote: https://t.co/Q2RbOQZwv9 https://t.co/DifTbqUYo1,[],[],[],['https://t.co/Q2RbOQZwv9'],USA,You don t need me to tell you what s at stake in this election  Now is the time to show up and vote like never before to elect Democratic candidates up and down the ballot  Educate yourself on the candidates running and vote  https   t co Q2RbOQZwv9 https   t co DifTbqUYo1,2020-09-24 18:00:00,
265,en,BarackObama,813286,True,1308769164190941187,"All right, let's try something new. If you’re in the United States, send me a text at 773-365-9687 — I want to hear how you're doing, what's on your mind, and how you're planning on voting this year. 

I'll be in touch from time to time to share what's on my mind, too. https://t.co/NX91bSqbtG",[],[],[],[],USA,All right  let s try something new  If you’re in the United States  send me a text at 773 365 9687 — I want to hear how you re doing  what s on your mind  and how you re planning on voting this year  I ll be in touch from time to time to share what s on my mind  too  https   t co NX91bSqbtG,2020-09-23 14:00:00,
266,en,BarackObama,813286,True,1308390673939410944,"Your vote has never mattered more than it does right now.

Today is National Voter Registration Day. Go to https://t.co/XdZz4dh82T to register and make a plan to vote. And make sure everybody you know does, too. https://t.co/ItarX1d4zw",[],[],[],['https://t.co/XdZz4dh82T'],USA,Your vote has never mattered more than it does right now Today is National Voter Registration Day  Go to https   t co XdZz4dh82T to register and make a plan to vote  And make sure everybody you know does  too  https   t co ItarX1d4zw,2020-09-22 13:00:00,
267,en,BarackObama,813286,True,1307165496484208640,"Justice Ruth Bader Ginsburg fought to the end, through her cancer, with unwavering faith in our democracy and its ideals. That’s how we remember her. But she also left instructions for how she wanted her legacy to be honored. My statement: https://t.co/Wa6YcT5gDi",[],[],[],['https://t.co/Wa6YcT5gDi'],USA,Justice Ruth Bader Ginsburg fought to the end  through her cancer  with unwavering faith in our democracy and its ideals  That’s how we remember her  But she also left instructions for how she wanted her legacy to be honored  My statement  https   t co Wa6YcT5gDi,2020-09-19 04:00:00,
268,en,BarackObama,813286,True,1307031800909385733,"If you're looking for a way to get involved in this upcoming election, sign up to volunteer as a poll worker for early voting and Election Day. You can help your community and make sure this election runs fairly and safely. Sign up: https://t.co/Ge4XvvPwpW https://t.co/wb4Ap7xmtt",[],[],[],['https://t.co/Ge4XvvPwpW'],USA,If you re looking for a way to get involved in this upcoming election  sign up to volunteer as a poll worker for early voting and Election Day  You can help your community and make sure this election runs fairly and safely  Sign up  https   t co Ge4XvvPwpW https   t co wb4Ap7xmtt,2020-09-18 19:00:00,
269,en,BarackObama,813286,True,1306535933475532803,"There’s no feeling like finishing a book, and I’m proud of this one. In A Promised Land, I try to provide an honest accounting of my presidency, the forces we grapple with as a nation, and how we can heal our divisions and make democracy work for everybody. https://t.co/T1QSZVDvOm",[],[],[],[],USA,There’s no feeling like finishing a book  and I’m proud of this one  In A Promised Land  I try to provide an honest accounting of my presidency  the forces we grapple with as a nation  and how we can heal our divisions and make democracy work for everybody  https   t co T1QSZVDvOm,2020-09-17 10:00:00,
270,en,BarackObama,813286,True,1306246499882369026,"Over the last few months, I've learned a thing or two from the young people in our country. I figured I would return the favor by sharing with you how to make a plan to vote in this upcoming election.
 
Get registered and vote early: https://t.co/Q5BUeMaOB5 

Video: @attn https://t.co/CNqjS7Dmxo",[],[],['attn'],['https://t.co/Q5BUeMaOB5'],USA,Over the last few months  I ve learned a thing or two from the young people in our country  I figured I would return the favor by sharing with you how to make a plan to vote in this upcoming election  Get registered and vote early  https   t co Q5BUeMaOB5 Video   attn https   t co CNqjS7Dmxo,2020-09-16 15:00:00,
271,en,BarackObama,813286,True,1304442086289297408,"Today we remember the lives we lost on 9/11. Even the smallest act of service is a way to honor them. And just like Jay Winuk, we can honor their memories through service. https://t.co/BdKDozK5t0 https://t.co/Jc4vg4Dqoh",[],[],[],"['https://t.co/BdKDozK5t0', 'https://t.co/Jc4vg4Dqoh']",USA,Today we remember the lives we lost on 9 11  Even the smallest act of service is a way to honor them  And just like Jay Winuk  we can honor their memories through service  https   t co BdKDozK5t0 https   t co Jc4vg4Dqoh,2020-09-11 16:00:00,
272,en,BarackObama,813286,True,1303859640980172800,The fires across the West Coast are just the latest examples of the very real ways our changing climate is changing our communities. Protecting our planet is on the ballot. Vote like your life depends on it—because it does. https://t.co/gKGegXWxQu,[],[],[],[],USA,The fires across the West Coast are just the latest examples of the very real ways our changing climate is changing our communities  Protecting our planet is on the ballot  Vote like your life depends on it—because it does  https   t co gKGegXWxQu,2020-09-10 01:00:00,
273,en,BarackObama,813286,True,1303302067847663617,"Great to catch up with our next Vice President, @KamalaHarris. I wanted to make sure to share a few tips about serving alongside our friend @JoeBiden. https://t.co/ncidvmylch",[],[],"['KamalaHarris', 'JoeBiden']",[],USA,Great to catch up with our next Vice President   KamalaHarris  I wanted to make sure to share a few tips about serving alongside our friend  JoeBiden  https   t co ncidvmylch,2020-09-08 12:00:00,
274,en,BarackObama,813286,True,1303015313320050688,"This Labor Day, let’s thank all those who've kept our country going this year—nurses, teachers, delivery drivers, food service workers, and many more. We can honor them by building our system back even better—so that essential workers are treated like it, pandemic or not.",[],[],[],[],USA,This Labor Day  let’s thank all those who ve kept our country going this year—nurses  teachers  delivery drivers  food service workers  and many more  We can honor them by building our system back even better—so that essential workers are treated like it  pandemic or not ,2020-09-07 17:00:00,
275,en,BarackObama,813286,True,1302275331592785923,"It might be Labor Day weekend, but let’s all remember that we're still in the middle of a pandemic. Wear a mask, practice social distancing, and follow the experts. It’ll save lives.",['xp'],[],[],[],USA,It might be Labor Day weekend  but let’s all remember that we re still in the middle of a pandemic  Wear a mask  practice social distancing  and follow the eerts  It’ll save lives ,2020-09-05 16:00:00,
276,en,BarackObama,813286,True,1301622917965459462,"The election’s only two months from today. Americans all across the country are making their plans for how and when they’re voting this year, and I hope you are too. Get registered and make sure your friends, family, and neighbors do the same at https://t.co/NKXRGNgbZX.",[],[],[],['https://t.co/NKXRGNgbZX'],USA,The election’s only two months from today  Americans all across the country are making their plans for how and when they’re voting this year  and I hope you are too  Get registered and make sure your friends  family  and neighbors do the same at https   t co NKXRGNgbZX ,2020-09-03 21:00:00,
277,en,BarackObama,813286,True,1301528018687528960,"Completing the Census is crucial because it will shape our communities for the next decade. Everything from critical funds and resources for health care, infrastructure, and education to political representation. Complete it now online, by phone, or mail: https://t.co/WXZb2jhBMP",[],[],[],['https://t.co/WXZb2jhBMP'],USA,Completing the Census is crucial because it will shape our communities for the next decade  Everything from critical funds and resources for health care  infrastructure  and education to political representation  Complete it now online  by phone  or mail  https   t co WXZb2jhBMP,2020-09-03 15:00:00,
278,en,BarackObama,813286,True,1301188137855655938,".@JoeBiden is a man who learned to treat every person he meets with respect and dignity, living by the words his parents taught him: “No one’s better than you, Joe, but you’re better than nobody.” That empathy, that decency, the belief that everybody counts—that’s who Joe is. https://t.co/RW8o39zQJL",[],[],['JoeBiden'],[],USA,  JoeBiden is a man who learned to treat every person he meets with respect and dignity  living by the words his parents taught him  “No one’s better than you  Joe  but you’re better than nobody ” That empathy  that decency  the belief that everybody counts—that’s who Joe is  https   t co RW8o39zQJL,2020-09-02 16:00:00,
279,en,BarackObama,813286,True,1300826832078594048,"If you can volunteer as a poll worker for early voting and Election Day, I hope you’ll do it. You can help make sure this election runs fairly and safely—and that’s one of the most crucial things any of us can do for our country right now. Sign up here: https://t.co/ZtXWL9aTlM https://t.co/hrlYejlE7y",[],[],[],['https://t.co/ZtXWL9aTlM'],USA,If you can volunteer as a poll worker for early voting and Election Day  I hope you’ll do it  You can help make sure this election runs fairly and safely—and that’s one of the most crucial things any of us can do for our country right now  Sign up here  https   t co ZtXWL9aTlM https   t co hrlYejlE7y,2020-09-01 16:00:00,
280,en,BarackObama,813286,True,1299718379440398337,"Chadwick came to the White House to work with kids when he was playing Jackie Robinson. You could tell right away that he was blessed. To be young, gifted, and Black; to use that power to give them heroes to look up to; to do it all while in pain – what a use of his years. https://t.co/KazXV1e7l7",[],[],[],['https://t.co/KazXV1e7l7'],USA,Chadwick came to the White House to work with kids when he was playing Jackie Robinson  You could tell right away that he was blessed  To be young  gifted  and Black  to use that power to give them heroes to look up to  to do it all while in pain – what a use of his years  https   t co KazXV1e7l7,2020-08-29 15:00:00,
281,en,BarackObama,813286,True,1299384266678304769,"As people exercise their right to protest all across the country––let the undeniable paths of our progress be a guide going forward: peaceful, sustained protest; strategic, committed organizing; and purposeful, overwhelming participation at the ballot box.",[],[],[],[],USA,As people exercise their right to protest all across the country––let the undeniable paths of our progress be a guide going forward  peaceful  sustained protest  strategic  committed organizing  and purposeful  overwhelming participation at the ballot box ,2020-08-28 17:00:00,
282,en,BarackObama,813286,True,1298786988833857537,"I commend the players on the @Bucks for standing up for what they believe in, coaches like @DocRivers, and the @NBA and @WNBA for setting an example. It’s going to take all our institutions to stand up for our values. https://t.co/rUGETgAt7P",[],[],"['Bucks', 'DocRivers', 'NBA', 'WNBA']",[],USA,I commend the players on the  Bucks for standing up for what they believe in  coaches like  DocRivers  and the  NBA and  WNBA for setting an example  It’s going to take all our institutions to stand up for our values  https   t co rUGETgAt7P,2020-08-27 01:00:00,
283,en,BarackObama,813286,True,1297893023276249093,"Ella Baker, a giant of the civil rights movement, embodies the idea of ordinary people’s ability to create change. She fought for the right to vote and led a movement of young people towards the fight for freedom. You should know her name:

https://t.co/6z0o7uUiBg",[],[],[],['https://t.co/6z0o7uUiBg'],USA,Ella Baker  a giant of the civil rights movement  embodies the idea of ordinary people’s ability to create change  She fought for the right to vote and led a movement of young people towards the fight for freedom  You should know her name https   t co 6z0o7uUiBg,2020-08-24 14:00:00,
284,en,BarackObama,813286,True,1296824463816888320,"While other countries around the world have successfully managed this pandemic, we've seen things get worse. It's not too late for us to work towards recovery, but it's going to require leaders with coherent plans to move us forward.
https://t.co/qWNaFGUa4d",[],[],[],['https://t.co/qWNaFGUa4d'],USA,While other countries around the world have successfully managed this pandemic  we ve seen things get worse  It s not too late for us to work towards recovery  but it s going to require leaders with coherent plans to move us forward https   t co qWNaFGUa4d,2020-08-21 15:00:00,
285,en,BarackObama,813286,True,1296650388100255745,Tonight our next President @JoeBiden made the case for his vision for this country and his plan to get there. I'll be doing everything I can over these next 75 days to make sure we get it done. Join us: https://t.co/Kboaxi3MVL,[],[],['JoeBiden'],['https://t.co/Kboaxi3MVL'],USA,Tonight our next President  JoeBiden made the case for his vision for this country and his plan to get there  I ll be doing everything I can over these next 75 days to make sure we get it done  Join us  https   t co Kboaxi3MVL,2020-08-21 03:00:00,
286,en,BarackObama,813286,True,1296494925719248897,"Do make a plan right now for how you’re going to vote and vote early, by mail or in person: https://t.co/XdZz4dh82T https://t.co/vIPPT03VTf",[],[],[],['https://t.co/XdZz4dh82T'],USA,Do make a plan right now for how you’re going to vote and vote early  by mail or in person  https   t co XdZz4dh82T https   t co vIPPT03VTf,2020-08-20 17:00:00,
287,en,BarackObama,813286,True,1296288887011246080,".@JoeBiden made me a better president. I’m asking you to believe in his and Kamala’s ability to help make us a better country. More importantly, I’m asking you to believe in your own and to help them, in this election and beyond. 
https://t.co/YYEAFxx4nW",[],[],['JoeBiden'],['https://t.co/YYEAFxx4nW'],USA,  JoeBiden made me a better president  I’m asking you to believe in his and Kamala’s ability to help make us a better country  More importantly  I’m asking you to believe in your own and to help them  in this election and beyond  https   t co YYEAFxx4nW,2020-08-20 04:00:00,
288,en,BarackObama,813286,True,1295917438249381889,"Congrats, Joe. I’m proud of you. https://t.co/YVyctn5o3N",[],[],[],['https://t.co/YVyctn5o3N'],USA,Congrats  Joe  I’m proud of you  https   t co YVyctn5o3N,2020-08-19 03:00:00,
289,en,BarackObama,813286,True,1295843193435676685,"The 19th amendment is the legacy of all those who marched and organized for transformational legislative change. Progress isn’t about just politics or protest––it’s about both. 100 years later, we’re all so much better off because of their commitment. https://t.co/jnQ7vam64a",[],[],[],['https://t.co/jnQ7vam64a'],USA,The 19th amendment is the legacy of all those who marched and organized for transformational legislative change  Progress isn’t about just politics or protest––it’s about both  100 years later  we’re all so much better off because of their commitment  https   t co jnQ7vam64a,2020-08-18 22:00:00,
290,en,BarackObama,813286,True,1295782636019949577,This is the Joe I know. https://t.co/mKZ6TqKgwq,[],[],[],[],USA,This is the Joe I know  https   t co mKZ6TqKgwq,2020-08-18 18:00:00,
291,en,BarackObama,813286,True,1295561597272961024,"As Michelle said, we’ve got to do everything we can to elect @JoeBiden and @KamalaHarris. So make sure you have a plan to vote. Vote early. And tell everybody you know to register to vote at https://t.co/XdZz4dh82T. https://t.co/rAUsWHusbV",[],[],"['JoeBiden', 'KamalaHarris']","['https://t.co/XdZz4dh82T', 'https://t.co/rAUsWHusbV']",USA,As Michelle said  we’ve got to do everything we can to elect  JoeBiden and  KamalaHarris  So make sure you have a plan to vote  Vote early  And tell everybody you know to register to vote at https   t co XdZz4dh82T  https   t co rAUsWHusbV,2020-08-18 03:00:00,
292,en,BarackObama,813286,True,1295484711566024705,"Over the past few months, I’ve spent a lot of time listening to music with my family. I wanted to share some of my favorites from the summer—including songs from some of the artists at this week’s @DemConvention. Hope you enjoy it. https://t.co/2ZFwdN46jR",[],[],['DemConvention'],[],USA,Over the past few months  I’ve spent a lot of time listening to music with my family  I wanted to share some of my favorites from the summer—including songs from some of the artists at this week’s  DemConvention  Hope you enjoy it  https   t co 2ZFwdN46jR,2020-08-17 22:00:00,
293,en,BarackObama,813286,True,1294284824325300225,"Everyone depends on the USPS. Seniors for their Social Security, veterans for their prescriptions, small businesses trying to keep their doors open. They can't be collateral damage for an administration more concerned with suppressing the vote than suppressing a virus.",[],[],[],[],USA,Everyone depends on the USPS  Seniors for their Social Security  veterans for their prescriptions  small businesses trying to keep their doors open  They can t be collateral damage for an administration more concerned with suppressing the vote than suppressing a virus ,2020-08-14 15:00:00,
