,tweet_lang,poi_name,poi_id,verified,id,tweet_text,tweet_emoticons,hashtags,mentions,tweet_urls,country,text_en,tweet_date,text_es
1014,en,BarackObama,813286,True,746365522292408320,"Because Senate leaders refuse to do their jobs, the Supreme Court cannot properly do its job. #DoYourJob https://t.co/DvqUdLN2pA",[],['DoYourJob'],[],[],USA,Because Senate leaders refuse to do their jobs  the Supreme Court cannot properly do its job   DoYourJob https   t co DvqUdLN2pA,2016-06-24 16:00:00,
1015,en,BarackObama,813286,True,746106163414982656,Speak up and demand that Congress act on gun violence prevention: https://t.co/Mo8ulIwRZg #DisarmHate,[],['DisarmHate'],[],['https://t.co/Mo8ulIwRZg'],USA,Speak up and demand that Congress act on gun violence prevention  https   t co Mo8ulIwRZg  DisarmHate,2016-06-23 22:00:00,
1016,en,BarackObama,813286,True,746086073361543168,Congress: Listen to the millions of voices demanding a vote on efforts to reduce gun violence. #DisarmHate https://t.co/X2uYxbJSs0,[],['DisarmHate'],[],[],USA,Congress  Listen to the millions of voices demanding a vote on efforts to reduce gun violence   DisarmHate https   t co X2uYxbJSs0,2016-06-23 21:00:00,
1017,en,BarackObama,813286,True,746050114792218624,"Our immigration system is broken, and we need Congress for a long-term solution—speak up for #ImmigrationAction: https://t.co/apx4e9xPmN",[],['ImmigrationAction'],[],['https://t.co/apx4e9xPmN'],USA,Our immigration system is broken  and we need Congress for a long term solution—speak up for  ImmigrationAction  https   t co apx4e9xPmN,2016-06-23 19:00:00,
1018,en,BarackObama,813286,True,746008225020059648,LIVE: President Obama is speaking about today's Supreme Court immigration ruling. https://t.co/65QpzfLGS3 #ImmigrationAction,[],['ImmigrationAction'],[],['https://t.co/65QpzfLGS3'],USA,LIVE  President Obama is speaking about today s Supreme Court immigration ruling  https   t co 65QpzfLGS3  ImmigrationAction,2016-06-23 16:00:00,
1019,en,BarackObama,813286,True,745791074958991360,We need more than moments of silence. We need action. And that's what's going on in the House now: https://t.co/L9m0dSfipA #NoBillNoBreak,[],['NoBillNoBreak'],[],['https://t.co/L9m0dSfipA'],USA,We need more than moments of silence  We need action  And that s what s going on in the House now  https   t co L9m0dSfipA  NoBillNoBreak,2016-06-23 02:00:00,
1020,en,BarackObama,813286,True,745670465327247363,The kind of obstruction we're seeing from Senate leaders is unprecedented. #DoYourJob https://t.co/W4TbswBwvS,[],['DoYourJob'],[],[],USA,The kind of obstruction we re seeing from Senate leaders is unprecedented   DoYourJob https   t co W4TbswBwvS,2016-06-22 18:00:00,
1021,en,BarackObama,813286,True,745636531604324352,"If you're one of the millions of Americans who believes Judge Garland should get a fair hearing, add your voice: https://t.co/51SBeDdTKl",[],[],[],['https://t.co/51SBeDdTKl'],USA,If you re one of the millions of Americans who believes Judge Garland should get a fair hearing  add your voice  https   t co 51SBeDdTKl,2016-06-22 15:00:00,
1022,en,BarackObama,813286,True,745376418381471744,Judge Merrick Garland just received the American Bar Association's highest rating: https://t.co/9ew2WSpFqd,[],[],[],['https://t.co/9ew2WSpFqd'],USA,Judge Merrick Garland just received the American Bar Association s highest rating  https   t co 9ew2WSpFqd,2016-06-21 22:00:00,
1023,en,BarackObama,813286,True,745358789382017025,Say you support decisive action to tackle climate change. https://t.co/S9gkxn0wpv #ActOnClimate,[],['ActOnClimate'],[],['https://t.co/S9gkxn0wpv'],USA,Say you support decisive action to tackle climate change  https   t co S9gkxn0wpv  ActOnClimate,2016-06-21 21:00:00,
1024,en,BarackObama,813286,True,745342377796112384,Clean energy is here to stay. https://t.co/meQoPVWXtg,[],[],[],['https://t.co/meQoPVWXtg'],USA,Clean energy is here to stay  https   t co meQoPVWXtg,2016-06-21 20:00:00,
1025,en,BarackObama,813286,True,745311778502914048,"""There's something sacred about this place."" —President Obama on Yosemite National Park https://t.co/BOsfJ0C9W7",[],[],[],['https://t.co/BOsfJ0C9W7'],USA, There s something sacred about this place   —President Obama on Yosemite National Park https   t co BOsfJ0C9W7,2016-06-21 18:00:00,
1026,en,BarackObama,813286,True,744975532891136000,Staying informed is too important leave to chance. Join the @OFA Truth Team today: https://t.co/ltq6xPBNfI https://t.co/6FQZXGLTHA,[],[],['OFA'],['https://t.co/ltq6xPBNfI'],USA,Staying informed is too important leave to chance  Join the  OFA Truth Team today  https   t co ltq6xPBNfI https   t co 6FQZXGLTHA,2016-06-20 19:00:00,
1027,en,BarackObama,813286,True,744940151231549440,Join @vj44 on a conference call to discuss efforts we can take to help reduce gun violence. https://t.co/AzL9CkYA7z,[],[],['vj44'],['https://t.co/AzL9CkYA7z'],USA,Join  vj44 on a conference call to discuss efforts we can take to help reduce gun violence  https   t co AzL9CkYA7z,2016-06-20 17:00:00,
1028,en,BarackObama,813286,True,744925060721348609,"Take a look at President Obama's interview with @NatGeo on national parks, climate change and more. https://t.co/xtbFt2XMHI",[],[],['NatGeo'],['https://t.co/xtbFt2XMHI'],USA,Take a look at President Obama s interview with  NatGeo on national parks  climate change and more  https   t co xtbFt2XMHI,2016-06-20 16:00:00,
1029,en,BarackObama,813286,True,744590453840969729,"""To me, fatherhood means being there."" —President Obama https://t.co/rL6RROGvQg",[],[],[],['https://t.co/rL6RROGvQg'],USA, To me  fatherhood means being there   —President Obama https   t co rL6RROGvQg,2016-06-19 18:00:00,
1030,en,BarackObama,813286,True,744572774400692224,Happy Father's Day to all the dads out there. https://t.co/okqSRnQk6n,[],[],[],[],USA,Happy Father s Day to all the dads out there  https   t co okqSRnQk6n,2016-06-19 17:00:00,
1031,en,BarackObama,813286,True,744310856331198464,"In the weekly address, the President talks about setting examples for children in light of tragedies like Orlando. https://t.co/B1k1FHYR76",[],[],[],['https://t.co/B1k1FHYR76'],USA,In the weekly address  the President talks about setting examples for children in light of tragedies like Orlando  https   t co B1k1FHYR76,2016-06-18 23:00:00,
1032,en,BarackObama,813286,True,744190760904450053,President Obama has taken unprecedented steps to protect our land and water for future generations. https://t.co/D5PNr4itC5,[],[],[],[],USA,President Obama has taken unprecedented steps to protect our land and water for future generations  https   t co D5PNr4itC5,2016-06-18 16:00:00,
1033,en,BarackObama,813286,True,743913011975454720,"This week, people all over the world came together to stand with the LGBT community—take a look: https://t.co/YyZsmZOpUZ",[],[],[],['https://t.co/YyZsmZOpUZ'],USA,This week  people all over the world came together to stand with the LGBT community—take a look  https   t co YyZsmZOpUZ,2016-06-17 21:00:00,
1034,en,BarackObama,813286,True,741373595306360832,"""Minds open. Hearts change. America shifts."" —President Obama #Pride2016 
https://t.co/JJSBJW5UEb",[],['Pride2016'],[],['https://t.co/JJSBJW5UEb'],USA, Minds open  Hearts change  America shifts   —President Obama  Pride2016 https   t co JJSBJW5UEb,2016-06-10 21:00:00,
1035,en,BarackObama,813286,True,741357619089149952,"Today, #LoveIsLove in all 50 states. But millions of Americans are still fighting to end discrimination—join them: https://t.co/07hwYLJOy8",[],['LoveIsLove'],[],['https://t.co/07hwYLJOy8'],USA,Today   LoveIsLove in all 50 states  But millions of Americans are still fighting to end discrimination—join them  https   t co 07hwYLJOy8,2016-06-10 20:00:00,
1036,en,BarackObama,813286,True,741326032247083008,This is how you Slow Jam the News: https://t.co/bToPKW4UCM #POTUSonFallon,[],['POTUSonFallon'],[],['https://t.co/bToPKW4UCM'],USA,This is how you Slow Jam the News  https   t co bToPKW4UCM  POTUSonFallon,2016-06-10 18:00:00,
1037,en,BarackObama,813286,True,741068131347660801,Watch President Obama Slow Jam the News on @FallonTonight at 11:35 p.m. ET. #POTUSonFallon https://t.co/RuwpGwbTSA,[':3'],['POTUSonFallon'],['FallonTonight'],[],USA,Watch President Obama Slow Jam the News on  FallonTonight at 115 p m  ET   POTUSonFallon https   t co RuwpGwbTSA,2016-06-10 01:00:00,
1038,en,BarackObama,813286,True,740657416337924096,Be proud of how far we've come—and continue to push for progress. #LoveIsLove https://t.co/ApzHdiiO14,[],['LoveIsLove'],[],[],USA,Be proud of how far we ve come—and continue to push for progress   LoveIsLove https   t co ApzHdiiO14,2016-06-08 22:00:00,
1039,en,BarackObama,813286,True,740301586195349505,Senate leaders' refusal to give Judge Garland a fair hearing is pure politics. #DoYourJob https://t.co/8rzLIBigzM,[],['DoYourJob'],[],[],USA,Senate leaders  refusal to give Judge Garland a fair hearing is pure politics   DoYourJob https   t co 8rzLIBigzM,2016-06-07 22:00:00,
1040,en,BarackObama,813286,True,740285418604658688,Your support for a fair hearing and timely up-or-down vote to fill the vacancy on the Supreme Court matters: https://t.co/qfpOoUefet,[],[],[],['https://t.co/qfpOoUefet'],USA,Your support for a fair hearing and timely up or down vote to fill the vacancy on the Supreme Court matters  https   t co qfpOoUefet,2016-06-07 21:00:00,
1041,en,BarackObama,813286,True,740250235104940032,"Senate leaders' politicization of the Supreme Court is ""unconscionable."" https://t.co/f92L5TbGSR #DoYourJob",[],['DoYourJob'],[],['https://t.co/f92L5TbGSR'],USA,Senate leaders  politicization of the Supreme Court is  unconscionable   https   t co f92L5TbGSR  DoYourJob,2016-06-07 19:00:00,
1042,en,BarackObama,813286,True,740226482383917056,Love looks good on you. Wear it with pride: https://t.co/LlWSvS4uBE #LoveIsLove https://t.co/g5WjqYQvHq,[],['LoveIsLove'],[],['https://t.co/LlWSvS4uBE'],USA,Love looks good on you  Wear it with pride  https   t co LlWSvS4uBE  LoveIsLove https   t co g5WjqYQvHq,2016-06-07 17:00:00,
1043,en,BarackObama,813286,True,740202784457252865,This month and every month. #LoveIsLove https://t.co/L3kRhhRxA4,[],['LoveIsLove'],[],[],USA,This month and every month   LoveIsLove https   t co L3kRhhRxA4,2016-06-07 15:00:00,
1044,en,BarackObama,813286,True,739936468127342594,"Unemployment rate ⬇
Federal deficit ⬇
Uninsured rate ⬇ https://t.co/SGZTb0ZBf3",['⬇'],[],[],[],USA,Unemployment rate Federal deficit Uninsured rate  https   t co SGZTb0ZBf3,2016-06-06 22:00:00,
1045,en,BarackObama,813286,True,739897112960323584,Watch as President Obama tackles four common myths about our economy. https://t.co/9DdBoFj9y2,[],[],[],['https://t.co/9DdBoFj9y2'],USA,Watch as President Obama tackles four common myths about our economy  https   t co 9DdBoFj9y2,2016-06-06 19:00:00,
1046,en,BarackObama,813286,True,739864542142988288,Former Energy Secretary @GovRichardson: Why the #TPP will make a difference in fighting climate change. https://t.co/AuWKEGJIGW,[],['TPP'],['GovRichardson'],['https://t.co/AuWKEGJIGW'],USA,Former Energy Secretary  GovRichardson  Why the  TPP will make a difference in fighting climate change  https   t co AuWKEGJIGW,2016-06-06 17:00:00,
1047,en,BarackObama,813286,True,739120021297893376,"""We pray that the greatest fighter of them all finally rests in peace."" —President Obama #RIPMuhammadAli",[],['RIPMuhammadAli'],[],[],USA, We pray that the greatest fighter of them all finally rests in peace   —President Obama  RIPMuhammadAli,2016-06-04 16:00:00,
1048,en,BarackObama,813286,True,738833955093286913,The Supreme Court shouldn't be part of partisan political games. Add your name if you agree: https://t.co/j8T9Vqlffe,[],[],[],['https://t.co/j8T9Vqlffe'],USA,The Supreme Court shouldn t be part of partisan political games  Add your name if you agree  https   t co j8T9Vqlffe,2016-06-03 21:00:00,
1049,en,BarackObama,813286,True,738817224375304192,It's time for Senate leaders to end the obstruction of our Supreme Court. #DoYourJob https://t.co/oKSLU2ADQi,[],['DoYourJob'],[],[],USA,It s time for Senate leaders to end the obstruction of our Supreme Court   DoYourJob https   t co oKSLU2ADQi,2016-06-03 20:00:00,
1050,en,BarackObama,813286,True,738786217022488576,Make sure you have all the facts—sign up to be part of the @OFA Truth Team. https://t.co/WozNFfFzW2 https://t.co/FrHVjmzd62,[],[],['OFA'],['https://t.co/WozNFfFzW2'],USA,Make sure you have all the facts—sign up to be part of the  OFA Truth Team  https   t co WozNFfFzW2 https   t co FrHVjmzd62,2016-06-03 18:00:00,
1051,en,BarackObama,813286,True,738761552820469761,This is the largest annual global increase in renewable power capacity—ever: https://t.co/9Eha0d5gbb #ActOnClimate,[],['ActOnClimate'],[],['https://t.co/9Eha0d5gbb'],USA,This is the largest annual global increase in renewable power capacity—ever  https   t co 9Eha0d5gbb  ActOnClimate,2016-06-03 16:00:00,
1052,en,BarackObama,813286,True,738513124702068736,Watch: This is why people across the country have decided to #WearOrange today. https://t.co/IUguOJg2Zk,[],['WearOrange'],[],['https://t.co/IUguOJg2Zk'],USA,Watch  This is why people across the country have decided to  WearOrange today  https   t co IUguOJg2Zk,2016-06-03 00:00:00,
1053,en,BarackObama,813286,True,738498356352159745,Gun violence takes too many lives in our country. Congress must do something about it—add your name if you agree: https://t.co/H8Yh77Somm,[],[],[],['https://t.co/H8Yh77Somm'],USA,Gun violence takes too many lives in our country  Congress must do something about it—add your name if you agree  https   t co H8Yh77Somm,2016-06-02 23:00:00,
1054,en,BarackObama,813286,True,738481437393854464,"This National Gun Violence Awareness Day, keep the pressure on Congress to act. #WearOrange https://t.co/VplJtSGMaU",[],['WearOrange'],[],[],USA,This National Gun Violence Awareness Day  keep the pressure on Congress to act   WearOrange https   t co VplJtSGMaU,2016-06-02 21:00:00,
1055,en,BarackObama,813286,True,738462607141568514,"The noise around gun violence is loud.
But we can be louder.
#WearOrange https://t.co/lYA8JEFhvg",[],['WearOrange'],[],[],USA,The noise around gun violence is loud But we can be louder  WearOrange https   t co lYA8JEFhvg,2016-06-02 20:00:00,
1056,en,BarackObama,813286,True,738432041486667776,Join the thousands of people calling on Congress to do something about gun violence—add your name: https://t.co/M0QQvNiYdj #WearOrange,[],['WearOrange'],[],['https://t.co/M0QQvNiYdj'],USA,Join the thousands of people calling on Congress to do something about gun violence—add your name  https   t co M0QQvNiYdj  WearOrange,2016-06-02 18:00:00,
1057,en,BarackObama,813286,True,738413221179072512,Gun violence takes far too many lives in America. Congress needs to act. #WearOrange https://t.co/TYqb1fklcu,[],['WearOrange'],[],[],USA,Gun violence takes far too many lives in America  Congress needs to act   WearOrange https   t co TYqb1fklcu,2016-06-02 17:00:00,
1058,en,BarackObama,813286,True,738155058177576960,LAST CHANCE: Keep calm and enter before the midnight deadline. https://t.co/GRHmsl26Hd https://t.co/RJxiN938k8,[],[],[],['https://t.co/GRHmsl26Hd'],USA,LAST CHANCE  Keep calm and enter before the midnight deadline  https   t co GRHmsl26Hd https   t co RJxiN938k8,2016-06-02 00:00:00,
1059,en,BarackObama,813286,True,738129124410032128,Speak out against gun violence—#WearOrange tomorrow. https://t.co/IUguOJg2Zk,[],['WearOrange'],[],['https://t.co/IUguOJg2Zk'],USA,Speak out against gun violence— WearOrange tomorrow  https   t co IUguOJg2Zk,2016-06-01 22:00:00,
1060,en,BarackObama,813286,True,738114951139581952,Don't miss your chance to meet President Obama this summer. Enter before tonight's deadline: https://t.co/GLFCABWEuq,[],[],[],['https://t.co/GLFCABWEuq'],USA,Don t miss your chance to meet President Obama this summer  Enter before tonight s deadline  https   t co GLFCABWEuq,2016-06-01 21:00:00,
1061,en,BarackObama,813286,True,738096049798021120,This is progress—but there's still more work to do to make sure our economy works for everybody. https://t.co/Gm8wvx0Gan,[],[],[],[],USA,This is progress—but there s still more work to do to make sure our economy works for everybody  https   t co Gm8wvx0Gan,2016-06-01 20:00:00,
1062,en,BarackObama,813286,True,738090552244109312,"LIVE: President Obama is speaking in Elkhart, Indiana, highlighting America's economic progress. https://t.co/x8XPvevF8e",['XP'],[],[],['https://t.co/x8XPvevF8e'],USA,LIVE  President Obama is speaking in Elkhart  Indiana  highlighting America s economic progress  https   t co x8vevF8e,2016-06-01 20:00:00,
1063,en,BarackObama,813286,True,738076075037741057,"Tune in at 3:25 p.m. ET to watch President Obama speak in Elkhart, Indiana—seven years after his first visit. https://t.co/ams2ipvolb",[],[],[],['https://t.co/ams2ipvolb'],USA,Tune in at 3 25 p m  ET to watch President Obama speak in Elkhart  Indiana—seven years after his first visit  https   t co ams2ipvolb,2016-06-01 19:00:00,
1064,en,BarackObama,813286,True,738046701609488386,"""Make the choice to do some good in the world."" Watch Judge Garland speak to high school seniors at his alma mater: https://t.co/lkiWqSFra7",[],[],[],['https://t.co/lkiWqSFra7'],USA, Make the choice to do some good in the world   Watch Judge Garland speak to high school seniors at his alma mater  https   t co lkiWqSFra7,2016-06-01 17:00:00,
1065,en,BarackObama,813286,True,738027139178455040,You don't want to miss out on this opportunity—enter now before tonight's deadline. https://t.co/ZgquwBCiow https://t.co/VpuEcqR86Z,[],[],[],['https://t.co/ZgquwBCiow'],USA,You don t want to miss out on this opportunity—enter now before tonight s deadline  https   t co ZgquwBCiow https   t co VpuEcqR86Z,2016-06-01 15:00:00,
1066,en,BarackObama,813286,True,737771604805963776,Suit up—enter for a chance to meet President Obama before the deadline. https://t.co/5WQWYBGrAJ https://t.co/I79QxFVYGF,[],[],[],['https://t.co/5WQWYBGrAJ'],USA,Suit up—enter for a chance to meet President Obama before the deadline  https   t co 5WQWYBGrAJ https   t co I79QxFVYGF,2016-05-31 22:00:00,
1067,en,BarackObama,813286,True,737738496807337984,The Supreme Court shouldn't be part of partisan political games. Add your name if you agree: https://t.co/uqAYi3uxrI,[],[],[],['https://t.co/uqAYi3uxrI'],USA,The Supreme Court shouldn t be part of partisan political games  Add your name if you agree  https   t co uqAYi3uxrI,2016-05-31 20:00:00,
1068,en,BarackObama,813286,True,737688004509065219,"Because some Senate leaders won't do their jobs, the Supreme Court can't fully do its job. #DoYourJob https://t.co/gxXi7wCfg0",[],['DoYourJob'],[],[],USA,Because some Senate leaders won t do their jobs  the Supreme Court can t fully do its job   DoYourJob https   t co gxXi7wCfg0,2016-05-31 17:00:00,
1069,en,BarackObama,813286,True,737665350532136961,Share a laugh with President Obama—enter now for your chance. https://t.co/pZ4bvOtFVx https://t.co/JkBo1fVrJ0,[],[],[],['https://t.co/pZ4bvOtFVx'],USA,Share a laugh with President Obama—enter now for your chance  https   t co pZ4bvOtFVx https   t co JkBo1fVrJ0,2016-05-31 15:00:00,
1070,en,BarackObama,813286,True,737348118753255424,"""Today, and every day, let us remember the servicemen and women we have lost."" —President Obama https://t.co/x1lQbyFr2M",[],[],[],[],USA, Today  and every day  let us remember the servicemen and women we have lost   —President Obama https   t co x1lQbyFr2M,2016-05-30 18:00:00,
1071,en,BarackObama,813286,True,737291556080717824,"""This Memorial weekend, I hope you’ll join me in acts of remembrance."" —President Obama https://t.co/UxDZMDjMdu",['xD'],[],[],['https://t.co/UxDZMDjMdu'],USA, This Memorial weekend  I hope you’ll join me in acts of remembrance   —President Obama https   t co UZMDjMdu,2016-05-30 15:00:00,
1072,en,BarackObama,813286,True,736307695272103937,A new survey shows that the overwhelming majority of #Obamacare customers are satisfied with their plans: https://t.co/75eFrBUV0e,[],['Obamacare'],[],['https://t.co/75eFrBUV0e'],USA,A new survey shows that the overwhelming majority of  Obamacare customers are satisfied with their plans  https   t co 75eFrBUV0e,2016-05-27 21:00:00,
1073,en,BarackObama,813286,True,736262918979747840,Join the @OFA Truth Team and help set the record straight on issues you care about: https://t.co/FgwDveu3Ef https://t.co/aCEFVLB0ko,[],[],['OFA'],['https://t.co/FgwDveu3Ef'],USA,Join the  OFA Truth Team and help set the record straight on issues you care about  https   t co FgwDveu3Ef https   t co aCEFVLB0ko,2016-05-27 18:00:00,
1074,en,BarackObama,813286,True,736223791156764672,Enter now for the chance to get some pointers from the Commander-in-Chief. https://t.co/lGn4BecCBl https://t.co/XODRtQS0UI,[],[],[],['https://t.co/lGn4BecCBl'],USA,Enter now for the chance to get some pointers from the Commander in Chief  https   t co lGn4BecCBl https   t co XODRtQS0UI,2016-05-27 16:00:00,
1075,en,BarackObama,813286,True,735927121575444480,Stand up for a fair hearing and timely up-or-down vote for Judge Merrick Garland: https://t.co/DpeBdTFt8j,[],[],[],['https://t.co/DpeBdTFt8j'],USA,Stand up for a fair hearing and timely up or down vote for Judge Merrick Garland  https   t co DpeBdTFt8j,2016-05-26 20:00:00,
1076,en,BarackObama,813286,True,735902728258342913,"Judge Garland:

Independent mind ✓
Highly qualified ✓
Has had bipartisan support ✓

Senate leaders: #DoYourJob https://t.co/r2egTausVA",[],['DoYourJob'],[],['https://t.co/r2egTausVA'],USA,Judge Garland Independent mind Highly qualified Has had bipartisan support Senate leaders   DoYourJob https   t co r2egTausVA,2016-05-26 19:00:00,
1077,en,BarackObama,813286,True,735860765530329089,Tell your friends you fist bumped President Obama—enter now for your chance. https://t.co/s86eJjBJ0U https://t.co/zJEelmeIe6,[],[],[],['https://t.co/s86eJjBJ0U'],USA,Tell your friends you fist bumped President Obama—enter now for your chance  https   t co s86eJjBJ0U https   t co zJEelmeIe6,2016-05-26 16:00:00,
1078,en,BarackObama,813286,True,735597684149489665,Senate leaders' obstruction of our Supreme Court is completely unprecedented. #DoYourJob https://t.co/PvubG4dFnd,[],['DoYourJob'],[],[],USA,Senate leaders  obstruction of our Supreme Court is completely unprecedented   DoYourJob https   t co PvubG4dFnd,2016-05-25 22:00:00,
1079,en,BarackObama,813286,True,735549639714181120,Senate leaders need to stop obstructing our Supreme Court—add your name if you agree: https://t.co/sFaoUFD3eP #DoYourJob,[],['DoYourJob'],[],['https://t.co/sFaoUFD3eP'],USA,Senate leaders need to stop obstructing our Supreme Court—add your name if you agree  https   t co sFaoUFD3eP  DoYourJob,2016-05-25 19:00:00,
1080,en,BarackObama,813286,True,735532761629360128,Judge Garland was confirmed with bipartisan support in the past. He deserves a fair hearing. #DoYourJob https://t.co/TTcIByTScg,[],['DoYourJob'],[],[],USA,Judge Garland was confirmed with bipartisan support in the past  He deserves a fair hearing   DoYourJob https   t co TTcIByTScg,2016-05-25 18:00:00,
1081,en,BarackObama,813286,True,735502414699102208,Get some face time with President Obama. Enter now for your chance to meet him: https://t.co/rLstH6U5tU https://t.co/wqfAHCk5tN,[],[],[],['https://t.co/rLstH6U5tU'],USA,Get some face time with President Obama  Enter now for your chance to meet him  https   t co rLstH6U5tU https   t co wqfAHCk5tN,2016-05-25 16:00:00,
1082,en,BarackObama,813286,True,735225772537872386,"If you think Senate leaders should do their jobs and fill the #SCOTUS vacancy, add your name now: https://t.co/nNHxp6SyII",['xp'],['SCOTUS'],[],['https://t.co/nNHxp6SyII'],USA,If you think Senate leaders should do their jobs and fill the  SCOTUS vacancy  add your name now  https   t co nNH6SyII,2016-05-24 22:00:00,
1083,en,BarackObama,813286,True,735203904208543744,Don't pass this up—enter now: https://t.co/aIOZd4OfIH https://t.co/OgOyee6i4i,[],[],[],['https://t.co/aIOZd4OfIH'],USA,Don t pass this up—enter now  https   t co aIOZd4OfIH https   t co OgOyee6i4i,2016-05-24 20:00:00,
1084,en,BarackObama,813286,True,735175917052383232,"""People want Senate to act on Supreme Court vacancy."" See what editorial boards are saying: https://t.co/qzMRbnjD0N #DoYourJob",[],['DoYourJob'],[],['https://t.co/qzMRbnjD0N'],USA, People want Senate to act on Supreme Court vacancy   See what editorial boards are saying  https   t co qzMRbnjD0N  DoYourJob,2016-05-24 18:00:00,
1085,en,BarackObama,813286,True,735155647021359104,Ever wished you could meet President Obama? Here's your chance. https://t.co/XCeXSFtCYg https://t.co/AeFMTtBdf9,[],[],[],['https://t.co/XCeXSFtCYg'],USA,Ever wished you could meet President Obama  Here s your chance  https   t co XCeXSFtCYg https   t co AeFMTtBdf9,2016-05-24 17:00:00,
1086,en,BarackObama,813286,True,735137844021190657,Judge Garland has one of the most impressive resumes of any Supreme Court nominee in recent history. https://t.co/r2egTausVA,[],[],[],['https://t.co/r2egTausVA'],USA,Judge Garland has one of the most impressive resumes of any Supreme Court nominee in recent history  https   t co r2egTausVA,2016-05-24 16:00:00,
1087,en,BarackObama,813286,True,734838386041593856,You don't want to miss out on this chance. Enter today: https://t.co/rED8cKIqv4 https://t.co/PJoHc0lIGF,[],[],[],['https://t.co/rED8cKIqv4'],USA,You don t want to miss out on this chance  Enter today  https   t co rED8cKIqv4 https   t co PJoHc0lIGF,2016-05-23 20:00:00,
1088,en,BarackObama,813286,True,734795481675534337,Editorial boards to senators: #DoYourJob and fill the Supreme Court vacancy. https://t.co/rJi8Fy57Ii,[],['DoYourJob'],[],['https://t.co/rJi8Fy57Ii'],USA,Editorial boards to senators   DoYourJob and fill the Supreme Court vacancy  https   t co rJi8Fy57Ii,2016-05-23 17:00:00,
