,tweet_lang,replied_to_tweet_id,replied_to_user_id,reply_text,id,verified,text_es,tweet_date,country,tweet_text,tweet_emoticons,hashtags,mentions,tweet_urls
98,es,1440726586563514372,3362741, sopitas los 4t cariocas,1440734047735451651,False, sopitas los 4t cariocas,2021-09-22T17:45:39.000Z,Mexico,@sopitas los 4t cariocas,[],[],['sopitas'],[]
99,es,1440726586563514372,3362741, sopitas Esparciendo Covid en Nueva York,1440728867249876997,False, sopitas Esparciendo Covid en Nueva York,2021-09-22T17:25:04.000Z,Mexico,@sopitas Esparciendo Covid en Nueva York,[],[],['sopitas'],[]
100,es,1440726553340510211,303368340, Prodigi0 1 Hemos sidos tan listos de creernos todo lo que nos decían    que ahora somos inteligentes para hacernos estás preguntas    ,1440745850238476298,False, Prodigi0 1 Hemos sidos tan listos de creernos todo lo que nos decían    que ahora somos inteligentes para hacernos estás preguntas    ,2021-09-22T18:32:33.000Z,Mexico,@Prodigi0_1 Hemos sidos tan listos de creernos todo lo que nos decían....que ahora somos inteligentes para hacernos estás preguntas!!!!,[],[],['Prodigi0_1'],[]
101,es,1440726553340510211,303368340, maicawag  AlertFakeNews Hay síntomas muyy parecidos en vacunados ,1440732480982564879,False, maicawag  AlertFakeNews Hay síntomas muyy parecidos en vacunados ,2021-09-22T17:39:25.000Z,Mexico,@maicawag @AlertFakeNews Hay síntomas muyy parecidos en vacunados.,[],[],"['maicawag', 'AlertFakeNews']",[]
102,es,1440726472574992389,1256374969480732673, Alf19803  CharadaBea  FrayJosepho  libertaddigital  esRadio  Radiodecision En Madrid sólo funciona en la capital y el Corredor del Henares  a la sierra no llega  la sintonizo y me sale RNE5  ,1440782129244164097,False, Alf19803  CharadaBea  FrayJosepho  libertaddigital  esRadio  Radiodecision En Madrid sólo funciona en la capital y el Corredor del Henares  a la sierra no llega  la sintonizo y me sale RNE5  ,2021-09-22T20:56:42.000Z,Mexico,"@Alf19803 @CharadaBea @FrayJosepho @libertaddigital @esRadio @Radiodecision En Madrid sólo funciona en la capital y el Corredor del Henares, a la sierra no llega: la sintonizo y me sale RNE5 😱.",['😱'],[],"['Alf19803', 'CharadaBea', 'FrayJosepho', 'libertaddigital', 'esRadio', 'Radiodecision']",['https://t.co/BJBdeWoZvW']
103,es,1440726472574992389,1256374969480732673, CharadaBea  requetesigloXXI  FrayJosepho  libertaddigital  esRadio Libertad  Liberales Al guano con ellos ,1440781445153255435,False, CharadaBea  requetesigloXXI  FrayJosepho  libertaddigital  esRadio Libertad  Liberales Al guano con ellos ,2021-09-22T20:53:59.000Z,Mexico,"@CharadaBea @requetesigloXXI @FrayJosepho @libertaddigital @esRadio Libertad. Liberales.
Al guano con ellos.",[],[],"['CharadaBea', 'requetesigloXXI', 'FrayJosepho', 'libertaddigital', 'esRadio']",[]
104,es,1440725590433091588,1373987381125259271, sooconejito sipp todo bien  aunq me dio sueño y casi me quedo dormido en una silla KOSDKQLFNW,1440729288525836288,False, sooconejito sipp todo bien  aunq me dio sueño y casi me quedo dormido en una silla KOSDKQLFNW,2021-09-22T17:26:44.000Z,Mexico,"@sooconejito sipp todo bien, aunq me dio sueño y casi me quedo dormido en una silla KOSDKQLFNW",[],[],['sooconejito'],[]
105,es,1440725590433091588,1373987381125259271, koompletito Salió todo bien  Yo casi me muero   v,1440728820105973765,False, koompletito Salió todo bien  Yo casi me muero   v,2021-09-22T17:24:52.000Z,Mexico,@koompletito Salió todo bien? Yo casi me muero :'v,[],[],['koompletito'],[]
106,es,1440724997488529417,460485869, JesusRCuevas Mentiroso   el sello de la 4T   ,1440780541045837830,False, JesusRCuevas Mentiroso   el sello de la 4T   ,2021-09-22T20:50:24.000Z,Mexico,@JesusRCuevas Mentiroso...el sello de la 4T...🤡,['🤡'],[],['JesusRCuevas'],[]
107,es,1440724997488529417,460485869, JesusRCuevas   LizVilchis Apúrense ya ven que el presidente quería una vacuna antes de que se inventaran las vacunas  ,1440779815288664070,False, JesusRCuevas   LizVilchis Apúrense ya ven que el presidente quería una vacuna antes de que se inventaran las vacunas  ,2021-09-22T20:47:31.000Z,Mexico,@JesusRCuevas @_LizVilchis Apúrense ya ven que el presidente quería una vacuna antes de que se inventaran las vacunas .,[],[],"['JesusRCuevas', '_LizVilchis']",[]
108,es,1440724364157067265,110822488, Gestionpe Saludos    srs del https   t co UkRXix4nqE salud     urgente   activar los convenios internacionales para traer las vacunas para 3 ra ola covus y variantes  con la firma doctor Peter cajamarca ,1440727995971354636,False, Gestionpe Saludos    srs del https   t co UkRXix4nqE salud     urgente   activar los convenios internacionales para traer las vacunas para 3 ra ola covus y variantes  con la firma doctor Peter cajamarca ,2021-09-22T17:21:36.000Z,Mexico,@Gestionpe Saludos....srs.del https://t.co/UkRXix4nqE salud.....urgente...activar los convenios internacionales para traer las vacunas para 3 ra.ola covus y variantes..con la firma doctor Peter cajamarca.,[],[],['Gestionpe'],"['https://t.co/UkRXix4nqE', 'https://t.co/hOjw3yWsPo']"
109,es,1440724103682424833,460485869, JesusRCuevas ¿Que ha contestado  EmbEspMex  de que ellos trajeron la viruela y mataron a millones  pero incapaces  inútiles de hacer una vacuna entre 1492 y 1810 que estuvieron aquí En lo particular  a mi me Avergüenza  tal ridícula posición de quién no es presidente de muchos mexicanos ,1440782425190068227,False, JesusRCuevas ¿Que ha contestado  EmbEspMex  de que ellos trajeron la viruela y mataron a millones  pero incapaces  inútiles de hacer una vacuna entre 1492 y 1810 que estuvieron aquí En lo particular  a mi me Avergüenza  tal ridícula posición de quién no es presidente de muchos mexicanos ,2021-09-22T20:57:53.000Z,Mexico,"@JesusRCuevas ¿Que ha contestado @EmbEspMex  de que ellos trajeron la viruela y mataron a millones, pero incapaces, inútiles de hacer una vacuna entre 1492 y 1810 que estuvieron aquí?
En lo particular, a mi me Avergüenza, tal ridícula posición de quién no es presidente de muchos mexicanos.",[],[],"['JesusRCuevas', 'EmbEspMex']",['https://t.co/yyYgZLMW9R']
110,es,1440724103682424833,460485869, azucenau  JesusRCuevas Y cuándo vacunarán a TODOS los niños sanos  El derecho a la salud lo tienes todos ,1440782105856724994,False, azucenau  JesusRCuevas Y cuándo vacunarán a TODOS los niños sanos  El derecho a la salud lo tienes todos ,2021-09-22T20:56:37.000Z,Mexico,@azucenau @JesusRCuevas Y cuándo vacunarán a TODOS los niños sanos? El derecho a la salud lo tienes todos!,[],[],"['azucenau', 'JesusRCuevas']",[]
111,es,1440723630149697539,1235679742914965514, Amanecerabz  JDOS2021  BrownSugarNic  AdasRguez  martinez 270115  Uva22  TaniaPlomoFSLN  NikyAlegria 21  yadiratellez4  Angeles Nicas  bertavil  jbrisol  esbeltania Que  solidaridad de los pueblos  VacunandosePuebloQueVence  TodosConAmor  LeónRevolución  AmigosDeUnanLeon  NormaYanina2  Nbalmaceda2,1440744054791102469,False, Amanecerabz  JDOS2021  BrownSugarNic  AdasRguez  martinez 270115  Uva22  TaniaPlomoFSLN  NikyAlegria 21  yadiratellez4  Angeles Nicas  bertavil  jbrisol  esbeltania Que  solidaridad de los pueblos  VacunandosePuebloQueVence  TodosConAmor  LeónRevolución  AmigosDeUnanLeon  NormaYanina2  Nbalmaceda2,2021-09-22T18:25:25.000Z,Mexico,@Amanecerabz @JDOS2021 @BrownSugarNic @AdasRguez @martinez_270115 @Uva22 @TaniaPlomoFSLN @NikyAlegria_21 @yadiratellez4 @Angeles_Nicas @bertavil @jbrisol @esbeltania Que 👍 solidaridad de los pueblos #VacunandosePuebloQueVence #TodosConAmor #LeónRevolución #AmigosDeUnanLeon @NormaYanina2 @Nbalmaceda2,['👍'],[],"['Amanecerabz', 'JDOS2021', 'BrownSugarNic', 'AdasRguez', 'martinez_270115', 'Uva22', 'TaniaPlomoFSLN', 'NikyAlegria_21']",['https://t.co/wxmh5jMvIl']
112,es,1440723630149697539,1235679742914965514, JDOS2021  BrownSugarNic  AdasRguez  martinez 270115  Uva22  TaniaPlomoFSLN  Nbalmaceda2  NikyAlegria 21  Amanecerabz  Angeles Nicas  bertavil  jbrisol  esbeltania Excelente noticias    CubaSoberana,1440743531086184455,False, JDOS2021  BrownSugarNic  AdasRguez  martinez 270115  Uva22  TaniaPlomoFSLN  Nbalmaceda2  NikyAlegria 21  Amanecerabz  Angeles Nicas  bertavil  jbrisol  esbeltania Excelente noticias    CubaSoberana,2021-09-22T18:23:20.000Z,Mexico,"@JDOS2021 @BrownSugarNic @AdasRguez @martinez_270115 @Uva22 @TaniaPlomoFSLN @Nbalmaceda2 @NikyAlegria_21 @Amanecerabz @Angeles_Nicas @bertavil @jbrisol @esbeltania Excelente noticias!!!
#CubaSoberana",[],[],"['JDOS2021', 'BrownSugarNic', 'AdasRguez', 'martinez_270115', 'Uva22', 'TaniaPlomoFSLN', 'Nbalmaceda2', 'NikyAlegria_21']",['https://t.co/izxX7R4F6Z']
113,es,1440722732883144708,496650381, RafaPortobanco Vivivirrrr,1440750378086113285,False, RafaPortobanco Vivivirrrr,2021-09-22T18:50:32.000Z,Mexico,@RafaPortobanco Vivivirrrr😆,['😆'],[],['RafaPortobanco'],[]
114,es,1440722732883144708,496650381, RafaPortobanco Creo que voté  mal ,1440724324399280138,False, RafaPortobanco Creo que voté  mal ,2021-09-22T17:07:00.000Z,Mexico,@RafaPortobanco Creo que voté  mal 😂,['😂'],[],['RafaPortobanco'],[]
115,es,1440721957863915529,57764938, MariolaPR  unnegroahi Tiempo de eosición,1440723907007303681,False, MariolaPR  unnegroahi Tiempo de eosición,2021-09-22T17:05:21.000Z,Mexico,@MariolaPR @unnegroahi Tiempo de exposición,['xp'],[],"['MariolaPR', 'unnegroahi']",[]
116,es,1440721957863915529,57764938, unnegroahi Por no seguir recomendaciones pienso que en el momento de contagio la carga viral que los infecta es mayor …,1440723369712766985,False, unnegroahi Por no seguir recomendaciones pienso que en el momento de contagio la carga viral que los infecta es mayor …,2021-09-22T17:03:13.000Z,Mexico,@unnegroahi Por no seguir recomendaciones pienso que en el momento de contagio la carga viral que los infecta es mayor …,[],[],['unnegroahi'],[]
117,es,1440721572499636232,1313131255219843072, SaludQuilicura  AlertaQuilicura Gracias por la info  el tema es que yo concurri el martes cuando correspondia y la señorita que recive la documentacion me hizo ir hoy cuando deberia haber indicado que correspondia el viernes  Igual gracias por la respuesta,1440751585005473793,False, SaludQuilicura  AlertaQuilicura Gracias por la info  el tema es que yo concurri el martes cuando correspondia y la señorita que recive la documentacion me hizo ir hoy cuando deberia haber indicado que correspondia el viernes  Igual gracias por la respuesta,2021-09-22T18:55:20.000Z,Mexico,"@SaludQuilicura @AlertaQuilicura Gracias por la info, el tema es que yo concurri el martes cuando correspondia y la señorita que recive la documentacion me hizo ir hoy cuando deberia haber indicado que correspondia el viernes. Igual gracias por la respuesta",[],[],"['SaludQuilicura', 'AlertaQuilicura']",['https://t.co/Ntb2v5I60H']
118,es,1440721518850236428,256651733, KattySha   Y sabes que eso es una realidad   Así funciona,1440722942124462093,False, KattySha   Y sabes que eso es una realidad   Así funciona,2021-09-22T17:01:31.000Z,Mexico,@KattySha__ Y sabes que eso es una realidad ! Así funciona,[],[],['KattySha__'],[]
119,es,1440720043126493188,31023547, Reporte Indigo Webbonazzoo el PGRRUUPTTOO aprende náhuatl pues odia tanto España webbonnaazzoo  senadomexicano  Mx Diputados  GobiernoMX  GobCDMX o se la corta no habla el perro,1440724534319976458,False, Reporte Indigo Webbonazzoo el PGRRUUPTTOO aprende náhuatl pues odia tanto España webbonnaazzoo  senadomexicano  Mx Diputados  GobiernoMX  GobCDMX o se la corta no habla el perro,2021-09-22T17:07:51.000Z,Mexico,@Reporte_Indigo Webbonazzoo el PGRRUUPTTOO aprende náhuatl pues odia tanto España webbonnaazzoo @senadomexicano @Mx_Diputados @GobiernoMX @GobCDMX o se la corta no habla el perro,[],[],"['Reporte_Indigo', 'senadomexicano']",['https://t.co/6oyQ0gKXeH']
120,es,1440719812464832515,228596477, cynthia amp Eso hare hoy  ire al doctor  Gracias  por tu recomendacion  que linda  Te lo agradezco  tenia esta duda    Si me dicen que puedo  me la aplico hoy mismo   ,1440730593537388552,False, cynthia amp Eso hare hoy  ire al doctor  Gracias  por tu recomendacion  que linda  Te lo agradezco  tenia esta duda    Si me dicen que puedo  me la aplico hoy mismo   ,2021-09-22T17:31:55.000Z,Mexico,"@cynthia_amp Eso hare hoy, ire al doctor. Gracias  por tu recomendacion, que linda. Te lo agradezco, tenia esta duda.  🙌👍🌹
 Si me dicen que puedo, me la aplico hoy mismo!  

❤","['🙌', '🌹', '👍', '❤']",[],['cynthia_amp'],['https://t.co/uxWdSWgCVN']
121,es,1440719489817985024,2877732249,DATADISTA mantiene actualizadas decenas de fuentes de datos en abierto para facilitar el seguimiento de la pandemia  https   t co u2SfHB9tJs,1440719506570022912,False,DATADISTA mantiene actualizadas decenas de fuentes de datos en abierto para facilitar el seguimiento de la pandemia  https   t co u2SfHB9tJs,2021-09-22T16:47:52.000Z,Mexico,DATADISTA mantiene actualizadas decenas de fuentes de datos en abierto para facilitar el seguimiento de la pandemia: https://t.co/u2SfHB9tJs,[],[],[],['https://t.co/u2SfHB9tJs']
122,es,1440719489817985024,2877732249,Análisis completo de la evolución de la vacunación contra la COVID 19 en Españahttps   t co jrYYyRQF58,1440719504762306566,False,Análisis completo de la evolución de la vacunación contra la COVID 19 en Españahttps   t co jrYYyRQF58,2021-09-22T16:47:51.000Z,Mexico,"💉Análisis completo de la evolución de la vacunación contra la COVID-19 en España👇🏻
https://t.co/jrYYyRQF58","['👇🏻', '💉']",[],[],['https://t.co/jrYYyRQF58']
