,tweet_lang,poi_name,poi_id,verified,id,tweet_text,tweet_emoticons,hashtags,mentions,tweet_urls,country,text_en,tweet_date,text_es
170,en,JoeBiden,939091,True,1351265605840633858,"Dr. Martin Luther King, Jr.’s words remind us that darkness cannot drive out darkness and hate cannot drive out hate — only light and love can. As we seek to overcome this season of darkness in America, let us choose love and light and begin to heal — together. #MLKDay",[],['MLKDay'],[],[],USA,Dr  Martin Luther King  Jr ’s words remind us that darkness cannot drive out darkness and hate cannot drive out hate — only light and love can  As we seek to overcome this season of darkness in America  let us choose love and light and begin to heal — together   MLKDay,2021-01-18 21:00:00,
171,en,JoeBiden,939091,True,1351228360123318272,"Our Administration will lead with science and scientists — with a CDC and NIH that are free from political influence, a Surgeon General who is independent and speaks directly to the people, and an FDA whose decisions are based on science and science alone.",[],[],[],[],USA,Our Administration will lead with science and scientists — with a CDC and NIH that are free from political influence  a Surgeon General who is independent and speaks directly to the people  and an FDA whose decisions are based on science and science alone ,2021-01-18 18:00:00,
172,en,JoeBiden,939091,True,1350981483062706177,"I know @harrisonjaime and the new DNC team are ready to strengthen our party’s infrastructure and elect Democrats across the country — but they need your help to do it.

If you’re able, chip in to support them by donating to the DNC today: https://t.co/GMCVuvPrYT https://t.co/bCBmAH8MCt",[],[],['harrisonjaime'],"['https://t.co/GMCVuvPrYT', 'https://t.co/bCBmAH8MCt']",USA,I know  harrisonjaime and the new DNC team are ready to strengthen our party’s infrastructure and elect Democrats across the country — but they need your help to do it If you’re able  chip in to support them by donating to the DNC today  https   t co GMCVuvPrYT https   t co bCBmAH8MCt,2021-01-18 02:00:00,
173,en,JoeBiden,939091,True,1350926118409289730,"Service is a fitting way to start to heal, unite, and rebuild this country we love.

I hope you’ll join us in honoring the legacy of Dr. Martin Luther King, Jr. by participating in the National Day of Service: https://t.co/H4pDdtXc3V https://t.co/ecHlPK7PAO",[],[],[],['https://t.co/H4pDdtXc3V'],USA,Service is a fitting way to start to heal  unite  and rebuild this country we love I hope you’ll join us in honoring the legacy of Dr  Martin Luther King  Jr  by participating in the National Day of Service  https   t co H4pDdtXc3V https   t co ecHlPK7PAO,2021-01-17 22:00:00,
174,en,JoeBiden,939091,True,1350878051710750725,"I know masks have become a partisan issue — but it’s a patriotic act. Experts say wearing a mask from now until April will save more than 50,000 lives.",['xp'],[],[],[],USA,I know masks have become a partisan issue — but it’s a patriotic act  Eerts say wearing a mask from now until April will save more than 50 000 lives ,2021-01-17 19:00:00,
175,en,JoeBiden,939091,True,1350817905202630658,"Though pushed, tested, and threatened throughout the 2020 election, our democracy proved to be resilient, true, and strong. My Campaign Advisor Bob Bauer and General Counsel Dana Remus shared their thoughts on how the will of the people prevailed. https://t.co/glyZgv5AtZ",[],[],[],['https://t.co/glyZgv5AtZ'],USA,Though pushed  tested  and threatened throughout the 2020 election  our democracy proved to be resilient  true  and strong  My Campaign Advisor Bob Bauer and General Counsel Dana Remus shared their thoughts on how the will of the people prevailed  https   t co glyZgv5AtZ,2021-01-17 15:00:00,
176,en,JoeBiden,939091,True,1350634446475694080,"Across the country, approximately 14 million Americans have fallen behind on rent and many may soon be at risk of eviction.

We need to act now. That’s why next week, I’ll extend nationwide restrictions on evictions and foreclosures. https://t.co/kUxpcgOzRe",['xp'],[],[],[],USA,Across the country  approximately 14 million Americans have fallen behind on rent and many may soon be at risk of eviction We need to act now  That’s why next week  I’ll extend nationwide restrictions on evictions and foreclosures  https   t co kUcgOzRe,2021-01-17 03:00:00,
177,en,JoeBiden,939091,True,1350593782832500737,"The first @BidenInaugural event is here. Tune in as we celebrate America, reflect and honor our history, and highlight the incredible diversity of the nation. https://t.co/6iIPivVt5N",[],[],['BidenInaugural'],['https://t.co/6iIPivVt5N'],USA,The first  BidenInaugural event is here  Tune in as we celebrate America  reflect and honor our history  and highlight the incredible diversity of the nation  https   t co 6iIPivVt5N,2021-01-17 00:00:00,
178,en,JoeBiden,939091,True,1350562220367884289,"To get as many people vaccinated as quickly as possible, we need more clinics across the nation. That’s why my administration will harness the full resources of the federal government to establish thousands of community vaccination centers. https://t.co/c551gKJZwa",[],[],[],['https://t.co/c551gKJZwa'],USA,To get as many people vaccinated as quickly as possible  we need more clinics across the nation  That’s why my administration will harness the full resources of the federal government to establish thousands of community vaccination centers  https   t co c551gKJZwa,2021-01-16 22:00:00,
179,en,JoeBiden,939091,True,1350515133034819584,"Science will be at the forefront of my administration — and this group will ensure everything we do is grounded in science, facts, and the truth. Tune in as I introduce members of my science team. https://t.co/ZEhKL5k59t",[],[],[],['https://t.co/ZEhKL5k59t'],USA,Science will be at the forefront of my administration — and this group will ensure everything we do is grounded in science  facts  and the truth  Tune in as I introduce members of my science team  https   t co ZEhKL5k59t,2021-01-16 19:00:00,
180,en,JoeBiden,939091,True,1350480432341520384,Getting America vaccinated will be one of the most challenging operational efforts ever undertaken. But you have my word that we will manage the hell out of this operation. https://t.co/EtFTz9c3Lf,[],[],[],[],USA,Getting America vaccinated will be one of the most challenging operational efforts ever undertaken  But you have my word that we will manage the hell out of this operation  https   t co EtFTz9c3Lf,2021-01-16 17:00:00,
181,en,JoeBiden,939091,True,1350256455748882434,"We not only have an economic imperative to act now, we have a moral obligation. 
 
In this pandemic, in America, we cannot let people go hungry. We cannot let people get evicted. We cannot watch nurses and educators lose their jobs.

We must act.",[],[],[],[],USA,We not only have an economic imperative to act now  we have a moral obligation   In this pandemic  in America  we cannot let people go hungry  We cannot let people get evicted  We cannot watch nurses and educators lose their jobs We must act ,2021-01-16 02:00:00,
182,en,JoeBiden,939091,True,1350210150481555457,"Science will always be at the forefront of my administration — and these world-renowned scientists will ensure everything we do is grounded in science, facts, and the truth. https://t.co/fEbgDMkTDZ",[],[],[],['https://t.co/fEbgDMkTDZ'],USA,Science will always be at the forefront of my administration — and these world renowned scientists will ensure everything we do is grounded in science  facts  and the truth  https   t co fEbgDMkTDZ,2021-01-15 23:00:00,
183,en,JoeBiden,939091,True,1350156296012656647,"My administration will move Heaven and Earth to:

- Allow more people to get vaccinated
- Create more places for them to get vaccinated
- Mobilize more medical teams to get shots in arms
- Increase vaccine supply and get it out the door as soon as possible",[],[],[],[],USA,My administration will move Heaven and Earth to   Allow more people to get vaccinated  Create more places for them to get vaccinated  Mobilize more medical teams to get shots in arms  Increase vaccine supply and get it out the door as soon as possible,2021-01-15 19:00:00,
184,en,JoeBiden,939091,True,1350077778310270978,"To Pilar, and the countless other small business owners across the country, know that help is on the way. https://t.co/4mKPjN6rgx",[],[],[],[],USA,To Pilar  and the countless other small business owners across the country  know that help is on the way  https   t co 4mKPjN6rgx,2021-01-15 14:00:00,
185,en,JoeBiden,939091,True,1349894571094810626,"Direct cash payments.
Extended unemployment.
Rent relief. 
Food assistance. 
Aid to small businesses.
Keeping essential frontline workers on the job.

Those are the key elements of my American Rescue Plan.",[],[],[],[],USA,Direct cash payments Extended unemployment Rent relief  Food assistance  Aid to small businesses Keeping essential frontline workers on the job Those are the key elements of my American Rescue Plan ,2021-01-15 02:00:00,
186,en,JoeBiden,939091,True,1349872996920430595,We have no time to waste when it comes to getting this virus under control and building our economy back better. Tune in as I announce my American Rescue Plan. https://t.co/4YAg0nhJMn,[],[],[],['https://t.co/4YAg0nhJMn'],USA,We have no time to waste when it comes to getting this virus under control and building our economy back better  Tune in as I announce my American Rescue Plan  https   t co 4YAg0nhJMn,2021-01-15 00:00:00,
187,en,JoeBiden,939091,True,1349849776012087296,"We need to tackle the public health and economic crises we’re facing head-on. That’s why today, I’m announcing my American Rescue Plan. Together we’ll change the course of the pandemic, build a bridge toward economic recovery, and invest in racial justice. https://t.co/UzGFZY7Jhp",[],[],[],['https://t.co/UzGFZY7Jhp'],USA,We need to tackle the public health and economic crises we’re facing head on  That’s why today  I’m announcing my American Rescue Plan  Together we’ll change the course of the pandemic  build a bridge toward economic recovery  and invest in racial justice  https   t co UzGFZY7Jhp,2021-01-14 23:00:00,
188,en,JoeBiden,939091,True,1349563892087869442,"We’re in the teeth of this crisis, and we need to take immediate action to get the virus under control. That’s why tomorrow, I’ll be laying out my vaccination and economic rescue package to beat COVID-19 and build back better. https://t.co/YRzJ5nlkDm",[],[],[],['https://t.co/YRzJ5nlkDm'],USA,We’re in the teeth of this crisis  and we need to take immediate action to get the virus under control  That’s why tomorrow  I’ll be laying out my vaccination and economic rescue package to beat COVID 19 and build back better  https   t co YRzJ5nlkDm,2021-01-14 04:00:00,
189,en,JoeBiden,939091,True,1349556594237792256,"Today, in a bipartisan vote, the House voted to impeach and hold President Trump accountable. Now, the process continues to the Senate—and I hope they’ll deal with their Constitutional responsibilities on impeachment while also working on the other urgent business of this nation.",[],[],[],[],USA,Today  in a bipartisan vote  the House voted to impeach and hold President Trump accountable  Now  the process continues to the Senate—and I hope they’ll deal with their Constitutional responsibilities on impeachment while also working on the other urgent business of this nation ,2021-01-14 03:00:00,
190,en,JoeBiden,939091,True,1349375651883724804,"Ambassador Samantha Power is a world-renowned voice of conscience and moral clarity—challenging and rallying the international community to stand up for the dignity and humanity of all people. As USAID Administrator, she'll be a powerful force for principled American engagement. https://t.co/jwseGEsb8c",[],[],[],[],USA,Ambassador Samantha Power is a world renowned voice of conscience and moral clarity—challenging and rallying the international community to stand up for the dignity and humanity of all people  As USAID Administrator  she ll be a powerful force for principled American engagement  https   t co jwseGEsb8c,2021-01-13 15:00:00,
191,en,JoeBiden,939091,True,1349090628790067200,My number one priority is getting people vaccinated as quickly as we can to get our country back on track. https://t.co/JLY1DntIlR,[],[],[],[],USA,My number one priority is getting people vaccinated as quickly as we can to get our country back on track  https   t co JLY1DntIlR,2021-01-12 20:00:00,
192,en,JoeBiden,939091,True,1349068634413436929,"It’s long past time to raise the minimum wage, so hardworking people earn at least $15 an hour. 
 
I hope that Democratic control of the House and Senate will ensure prompt action to get it done.",[],[],[],[],USA,It’s long past time to raise the minimum wage  so hardworking people earn at least  15 an hour   I hope that Democratic control of the House and Senate will ensure prompt action to get it done ,2021-01-12 19:00:00,
193,en,JoeBiden,939091,True,1348994390690246657,"I urge every American to:

- Wear a mask
- Stay socially distanced
- Avoid large indoor gatherings

We can save countless lives if we step up together.",[],[],[],[],USA,I urge every American to   Wear a mask  Stay socially distanced  Avoid large indoor gatheringsWe can save countless lives if we step up together ,2021-01-12 14:00:00,
194,en,JoeBiden,939091,True,1348800612742402048,"Getting America vaccinated will be one of the greatest operational challenges we’ve ever faced, but my administration will spare no effort to get it done.

We’re going to ensure the vaccine is distributed quickly, equitably, and free of charge to every American.",[],[],[],[],USA,Getting America vaccinated will be one of the greatest operational challenges we’ve ever faced  but my administration will spare no effort to get it done We’re going to ensure the vaccine is distributed quickly  equitably  and free of charge to every American ,2021-01-12 01:00:00,
195,en,JoeBiden,939091,True,1348763039160532992,"Folks, I just received the second dose of my COVID-19 vaccine — and just like the first dose, it was safe, quick, and painless. 

I urge everyone to get vaccinated once it’s your turn. Because only together can we save lives and beat this virus. https://t.co/w1m8gEh2iL",[],[],[],[],USA,Folks  I just received the second dose of my COVID 19 vaccine — and just like the first dose  it was safe  quick  and painless  I urge everyone to get vaccinated once it’s your turn  Because only together can we save lives and beat this virus  https   t co w1m8gEh2iL,2021-01-11 23:00:00,
196,en,JoeBiden,939091,True,1348732665005023232,"The work of the next four years must be the restoration of democracy and the recovery of respect for the rule of law, and the renewal of a politics that’s about solving problems — not stoking the flames of hate and chaos.",[],[],[],[],USA,The work of the next four years must be the restoration of democracy and the recovery of respect for the rule of law  and the renewal of a politics that’s about solving problems — not stoking the flames of hate and chaos ,2021-01-11 21:00:00,
197,en,JoeBiden,939091,True,1348636095458717696,"I’m asking Ambassador Bill Burns to lead the Central Intelligence Agency because he’s dealt with many of the thorniest global challenges we face. As a legendary career diplomat, he approached complex issues with honesty, integrity and skill. That’s exactly how he’ll lead the CIA. https://t.co/ypnuH016BV",[],[],[],[],USA,I’m asking Ambassador Bill Burns to lead the Central Intelligence Agency because he’s dealt with many of the thorniest global challenges we face  As a legendary career diplomat  he approached complex issues with honesty  integrity and skill  That’s exactly how he’ll lead the CIA  https   t co ypnuH016BV,2021-01-11 14:00:00,
198,en,JoeBiden,939091,True,1348430675238678528,"$600 is simply not enough when you have to choose between paying rent or putting food on the table.
 
We need $2,000 stimulus checks.",[],[],[],[],USA, 600 is simply not enough when you have to choose between paying rent or putting food on the table  We need  2 000 stimulus checks ,2021-01-11 01:00:00,
199,en,JoeBiden,939091,True,1348351402624524288,"I am proud that we have finished naming the members of our Cabinet.
 
It’s a Cabinet that looks like America and taps into the full range of talents we have in our nation. https://t.co/DTX53k7sUx",[],[],[],[],USA,I am proud that we have finished naming the members of our Cabinet  It’s a Cabinet that looks like America and taps into the full range of talents we have in our nation  https   t co DTX53k7sUx,2021-01-10 20:00:00,
200,en,JoeBiden,939091,True,1348299813163474944,"In 10 days, we move forward and rebuild — together.",[],[],[],[],USA,In 10 days  we move forward and rebuild — together ,2021-01-10 16:00:00,
201,en,JoeBiden,939091,True,1348064513170567168,The bottom line is we need to provide immediate relief for working families and businesses. Now. https://t.co/syaHTaX3O4,[],[],[],[],USA,The bottom line is we need to provide immediate relief for working families and businesses  Now  https   t co syaHTaX3O4,2021-01-10 01:00:00,
202,en,JoeBiden,939091,True,1348004115121647622,"Our president is not above the law. 

Justice serves the people — it doesn’t protect the powerful.",[],[],[],[],USA,Our president is not above the law  Justice serves the people — it doesn’t protect the powerful ,2021-01-09 21:00:00,
203,en,JoeBiden,939091,True,1347947491300401152,"From the most inequitable economic and jobs crisis in modern history, my jobs team will help us build back better with an economy that works for all Americans. Let’s get to work. https://t.co/hx7cyOHF87",[],[],[],[],USA,From the most inequitable economic and jobs crisis in modern history  my jobs team will help us build back better with an economy that works for all Americans  Let’s get to work  https   t co hx7cyOHF87,2021-01-09 17:00:00,
204,en,JoeBiden,939091,True,1347704641136463872,My administration will get right to work distributing emergency aid swiftly and equitably. Our focus will be on the small businesses on Main Street — not those that are wealthy and well-connected. https://t.co/FlD8voUpcP,[],[],[],[],USA,My administration will get right to work distributing emergency aid swiftly and equitably  Our focus will be on the small businesses on Main Street — not those that are wealthy and well connected  https   t co FlD8voUpcP,2021-01-09 01:00:00,
205,en,JoeBiden,939091,True,1347665885666938886,".@GabbyGiffords — Your perseverance and immeasurable courage continue to inspire me and millions of others. I pledge to continue to work with you — and with survivors, families, and advocates across the country — to defeat the NRA and end our epidemic of gun violence. https://t.co/zN5J5YjXUM",[],[],['GabbyGiffords'],['https://t.co/zN5J5YjXUM'],USA,  GabbyGiffords — Your perseverance and immeasurable courage continue to inspire me and millions of others  I pledge to continue to work with you — and with survivors  families  and advocates across the country — to defeat the NRA and end our epidemic of gun violence  https   t co zN5J5YjXUM,2021-01-08 22:00:00,
206,en,JoeBiden,939091,True,1347649779921203201,"Ten years ago today, in Tucson, Arizona, six innocent lives were taken away by a senseless and brutal act of violence. Jill and I remember those we lost and everyone whose lives were irreversibly changed that day — including my friend Congresswoman @GabbyGiffords.",[],[],['GabbyGiffords'],[],USA,Ten years ago today  in Tucson  Arizona  six innocent lives were taken away by a senseless and brutal act of violence  Jill and I remember those we lost and everyone whose lives were irreversibly changed that day — including my friend Congresswoman  GabbyGiffords ,2021-01-08 21:00:00,
207,en,JoeBiden,939091,True,1347618371135705090,We need to build a new American economy where everyone enjoys a fair return for their work and an equal chance to get ahead. Tune in as I introduce members of the team that will get it done. https://t.co/PAOu57i9j5,[],[],[],['https://t.co/PAOu57i9j5'],USA,We need to build a new American economy where everyone enjoys a fair return for their work and an equal chance to get ahead  Tune in as I introduce members of the team that will get it done  https   t co PAOu57i9j5,2021-01-08 19:00:00,
208,en,JoeBiden,939091,True,1347571667598503937,"We need to restore the honor, the integrity, and the independence of the Department of Justice in this nation — and this is the group that will get it done. https://t.co/Yfuys8i73V",[],[],[],[],USA,We need to restore the honor  the integrity  and the independence of the Department of Justice in this nation — and this is the group that will get it done  https   t co Yfuys8i73V,2021-01-08 16:00:00,
209,en,JoeBiden,939091,True,1347377487374741508,I’m proud to nominate Judge Merrick Garland for Attorney General of the United States. https://t.co/xBR5PAN2wH,[],[],[],[],USA,I’m proud to nominate Judge Merrick Garland for Attorney General of the United States  https   t co xBR5PAN2wH,2021-01-08 03:00:00,
210,en,JoeBiden,939091,True,1347366160807981056,"For the past four years, President Trump has unleashed an all-out assault on the institutions of our democracy.

Yesterday was but the culmination of that unrelenting attack. https://t.co/Mcli7mzENu",[],[],[],[],USA,For the past four years  President Trump has unleashed an all out assault on the institutions of our democracy Yesterday was but the culmination of that unrelenting attack  https   t co Mcli7mzENu,2021-01-08 02:00:00,
211,en,JoeBiden,939091,True,1347352319726215168,"This team shares my belief that the middle class built this country and that unions built the middle class.

They will help us emerge from the most inequitable economic crisis in modern history by building an economy where every American is in on the deal. https://t.co/iorqb5Dxpj",['xp'],[],[],['https://t.co/iorqb5Dxpj'],USA,This team shares my belief that the middle class built this country and that unions built the middle class They will help us emerge from the most inequitable economic crisis in modern history by building an economy where every American is in on the deal  https   t co iorqb5Dj,2021-01-08 01:00:00,
212,en,JoeBiden,939091,True,1347298213422747649,"No one can tell me that if it had been a group of Black Lives Matter protestors yesterday that they wouldn’t have been treated very differently than the mob that stormed the Capitol. 

We all know that’s true — and it’s unacceptable.",[],[],[],[],USA,No one can tell me that if it had been a group of Black Lives Matter protestors yesterday that they wouldn’t have been treated very differently than the mob that stormed the Capitol  We all know that’s true — and it’s unacceptable ,2021-01-07 22:00:00,
213,en,JoeBiden,939091,True,1347287643776667648,Merrick Garland will serve as the Attorney General of the United States — not as my personal lawyer.,[],[],[],[],USA,Merrick Garland will serve as the Attorney General of the United States — not as my personal lawyer ,2021-01-07 21:00:00,
214,en,JoeBiden,939091,True,1347276822078218241,"What we witnessed yesterday was not dissent — it was disorder. 

They weren’t protestors — they were rioters, insurrectionists, and domestic terrorists.

I wish we could say we couldn’t see it coming, but that isn’t true. We could.",[],[],[],[],USA,What we witnessed yesterday was not dissent — it was disorder  They weren’t protestors — they were rioters  insurrectionists  and domestic terrorists I wish we could say we couldn’t see it coming  but that isn’t true  We could ,2021-01-07 20:00:00,
215,en,JoeBiden,939091,True,1347253347057733632,It’s time for a Department of Justice that serves the interests of the people — not a presidency. Tune in as I introduce key nominees to lead the Department. https://t.co/8eIm9NvQS8,[],[],[],['https://t.co/8eIm9NvQS8'],USA,It’s time for a Department of Justice that serves the interests of the people — not a presidency  Tune in as I introduce key nominees to lead the Department  https   t co 8eIm9NvQS8,2021-01-07 19:00:00,
216,en,JoeBiden,939091,True,1347200066646376448,"Our nominees for the Justice Department will restore the independence of the Department, so it serves the interests of the people—not a presidency. They’ll rebuild public trust in the rule of law and work to ensure a more fair and equitable justice system. https://t.co/MSCRAwsmaH",[],[],[],['https://t.co/MSCRAwsmaH'],USA,Our nominees for the Justice Department will restore the independence of the Department  so it serves the interests of the people—not a presidency  They’ll rebuild public trust in the rule of law and work to ensure a more fair and equitable justice system  https   t co MSCRAwsmaH,2021-01-07 15:00:00,
217,en,JoeBiden,939091,True,1346985653658116098,"Today is a reminder, a painful one, that democracy is fragile. To preserve it requires people of good will, leaders with the courage to stand up, who are devoted not to pursuit of power and personal interest at any cost, but to the common good.",[],[],[],[],USA,Today is a reminder  a painful one  that democracy is fragile  To preserve it requires people of good will  leaders with the courage to stand up  who are devoted not to pursuit of power and personal interest at any cost  but to the common good ,2021-01-07 01:00:00,
