,tweet_lang,replied_to_tweet_id,replied_to_user_id,reply_text,id,verified,text_hi,tweet_date,country,tweet_text,tweet_emoticons,hashtags,mentions,tweet_urls,text_en,text_es
98,en,1439841562939121665,207809313, BJP4India VERY NICE WORK,1440320485678465025,False,,2021-09-21T14:22:18.000Z,India,@BJP4India VERY NICE WORK,[],[],['BJP4India'],[], BJP4India VERY NICE WORK,
99,hi,1439811057476792324,2213932272, RadhamohanBJP जय हो,1440010843324702721,False, RadhamohanBJP जय हो,2021-09-20T17:51:53.000Z,India,@RadhamohanBJP जय हो,[],[],['RadhamohanBJP'],[],,
100,hi,1439776847017906176,1211625714941755393, PradeepBJPMilak जय हो,1440358776414957578,False, PradeepBJPMilak जय हो,2021-09-21T16:54:27.000Z,India,@PradeepBJPMilak जय हो,[],[],['PradeepBJPMilak'],[],,
101,hi,1439769197643374594,250677217, aniljaindr  narendramodi  BJP4India  JPNadda  PMOIndia  COVIDNewsByMIB  mansukhmandviya  MoHFW INDIA  BJP4UP  BJP4Delhi गुरुग्राम DC महोदय करे सहायता 5 वर्ष से दरबदर भटक रहे हैं किराए के घरों में PM आवासीय योजना के तहत दिलवाया जाए घर व करवाया जाए संभवत इलाज बीमारी का  DC Gurugram  cdgurugram  diprogurugram1  cmohry  Rao InderjitS  Dchautala  aniljaindr  anilvijminister  DiprHaryana  VPSecretariat https   t co YAVlIWDl87,1439891659936845824,False, aniljaindr  narendramodi  BJP4India  JPNadda  PMOIndia  COVIDNewsByMIB  mansukhmandviya  MoHFW INDIA  BJP4UP  BJP4Delhi गुरुग्राम DC महोदय करे सहायता 5 वर्ष से दरबदर भटक रहे हैं किराए के घरों में PM आवासीय योजना के तहत दिलवाया जाए घर व करवाया जाए संभवत इलाज बीमारी का  DC Gurugram  cdgurugram  diprogurugram1  cmohry  Rao InderjitS  Dchautala  aniljaindr  anilvijminister  DiprHaryana  VPSecretariat https   t co YAVlIWDl87,2021-09-20T09:58:18.000Z,India,"@aniljaindr @narendramodi @BJP4India @JPNadda @PMOIndia @COVIDNewsByMIB @mansukhmandviya @MoHFW_INDIA @BJP4UP @BJP4Delhi गुरुग्राम DC महोदय करे सहायता 5 वर्ष से दरबदर भटक रहे हैं किराए के घरों में,PM आवासीय योजना के तहत दिलवाया जाए घर व करवाया जाए संभवत इलाज बीमारी का @DC_Gurugram @cdgurugram @diprogurugram1 @cmohry @Rao_InderjitS @Dchautala @aniljaindr @anilvijminister @DiprHaryana @VPSecretariat https://t.co/YAVlIWDl87",[],[],"['aniljaindr', 'narendramodi', 'BJP4India', 'JPNadda', 'PMOIndia', 'COVIDNewsByMIB', 'mansukhmandviya', 'MoHFW_INDIA', 'BJP4UP']",['https://t.co/7pPbMVPqDX'],,
102,hi,1439769197643374594,250677217, aniljaindr  narendramodi  BJP4India  JPNadda  PMOIndia  COVIDNewsByMIB  mansukhmandviya  MoHFW INDIA  BJP4UP  BJP4Delhi हार्दिक शुभकामनाएं दीपक अवस्थी सूर्याभाजपा हरदोई उत्तर प्रदेश,1439769459057561605,False, aniljaindr  narendramodi  BJP4India  JPNadda  PMOIndia  COVIDNewsByMIB  mansukhmandviya  MoHFW INDIA  BJP4UP  BJP4Delhi हार्दिक शुभकामनाएं दीपक अवस्थी सूर्याभाजपा हरदोई उत्तर प्रदेश,2021-09-20T01:52:43.000Z,India,"@aniljaindr @narendramodi @BJP4India @JPNadda @PMOIndia @COVIDNewsByMIB @mansukhmandviya @MoHFW_INDIA @BJP4UP @BJP4Delhi हार्दिक शुभकामनाएं 

दीपक अवस्थी सूर्या
भाजपा हरदोई उत्तर प्रदेश",[],[],"['aniljaindr', 'narendramodi', 'BJP4India', 'JPNadda', 'PMOIndia', 'COVIDNewsByMIB', 'mansukhmandviya', 'MoHFW_INDIA', 'BJP4UP']",['https://t.co/s2rWRJCY6N'],,
103,en,1439755029238353928,3014871359, Saran dm  nildeoreIAS I have taken vaccine on 17th Sep 2021 but till now I have not got message regarding vaccination certificate  I also checked on Cowin app ,1439758868536385538,False,,2021-09-20T01:10:38.000Z,India,@Saran_dm @nildeoreIAS I have taken vaccine on 17th Sep 2021 but till now I have not got message regarding vaccination certificate. I also checked on Cowin app.,[],[],"['Saran_dm', 'nildeoreIAS']",['https://t.co/IP04k21qXK'], Saran dm  nildeoreIAS I have taken vaccine on 17th Sep 2021 but till now I have not got message regarding vaccination certificate  I also checked on Cowin app ,
104,hi,1439643876977872901,1231898968352788481, Nareshfiroda2  BertyThomas  healthminmp  JansamparkMP  MoHFW INDIA नागौर जिले की लिस्ट नही आती आजकल बंद हो गया क्या नागौर की लिस्ट,1439688868379299844,False, Nareshfiroda2  BertyThomas  healthminmp  JansamparkMP  MoHFW INDIA नागौर जिले की लिस्ट नही आती आजकल बंद हो गया क्या नागौर की लिस्ट,2021-09-19T20:32:29.000Z,India,@Nareshfiroda2 @BertyThomas @healthminmp @JansamparkMP @MoHFW_INDIA नागौर जिले की लिस्ट नही आती आजकल बंद हो गया क्या नागौर की लिस्ट,[],[],"['Nareshfiroda2', 'BertyThomas', 'healthminmp', 'JansamparkMP', 'MoHFW_INDIA']",[],,
105,hi,1439643162549493762,1240365224491806720, SuperStockist ऐसे तत्वों पर तुरंत कार्रवाई करनी चाहिए सख्त से सख्त कार्रवाई करें और उदाहरण प्रस्तुत करें ।,1439903313806331904,False, SuperStockist ऐसे तत्वों पर तुरंत कार्रवाई करनी चाहिए सख्त से सख्त कार्रवाई करें और उदाहरण प्रस्तुत करें ।,2021-09-20T10:44:36.000Z,India,@SuperStockist ऐसे तत्वों पर तुरंत कार्रवाई करनी चाहिए सख्त से सख्त कार्रवाई करें और उदाहरण प्रस्तुत करें ।,[],[],['SuperStockist'],[],,
106,hi,1439614500269793281,4848473616, DMGanganagar  DIPRRajasthan  ashokgehlot51  RaghusharmaINC राजस्थान सतर्क है,1439616460150558723,False, DMGanganagar  DIPRRajasthan  ashokgehlot51  RaghusharmaINC राजस्थान सतर्क है,2021-09-19T15:44:45.000Z,India,@DMGanganagar @DIPRRajasthan @ashokgehlot51 @RaghusharmaINC राजस्थान सतर्क है,[],[],"['DMGanganagar', 'DIPRRajasthan', 'ashokgehlot51', 'RaghusharmaINC']",[],,
107,hi,1439614500269793281,4848473616,इसके अलावा श्रीगंगानगर शहर में एसडी काॅलेज व एमडी काॅलेज में वर्कपैलेस टीकाकरण केन्द्र बनाया गया है।,1439614645036146688,False,इसके अलावा श्रीगंगानगर शहर में एसडी काॅलेज व एमडी काॅलेज में वर्कपैलेस टीकाकरण केन्द्र बनाया गया है।,2021-09-19T15:37:32.000Z,India,इसके अलावा श्रीगंगानगर शहर में एसडी काॅलेज व एमडी काॅलेज में वर्कपैलेस टीकाकरण केन्द्र बनाया गया है।,[],[],[],[],,
108,hi,1439609436889247758,982500265629814784, dmhoshangabad  healthminmp आदरणीय सर जी वर्षा के कारण मेरे पिताजी वैक्सीनशन सेन्टर तक नही पहुँच पा रहे तो क्या वैक्सीन उन तक नही पहुँच सकती   दूसरा डोज है उनका। पिछली बार मैंने समाचार पत्र में पढ़ा था घर पहुँच कर वैक्सीन लगायी।,1439895858527424513,False, dmhoshangabad  healthminmp आदरणीय सर जी वर्षा के कारण मेरे पिताजी वैक्सीनशन सेन्टर तक नही पहुँच पा रहे तो क्या वैक्सीन उन तक नही पहुँच सकती   दूसरा डोज है उनका। पिछली बार मैंने समाचार पत्र में पढ़ा था घर पहुँच कर वैक्सीन लगायी।,2021-09-20T10:14:59.000Z,India,@dmhoshangabad @healthminmp आदरणीय सर जी वर्षा के कारण मेरे पिताजी वैक्सीनशन सेन्टर तक नही पहुँच पा रहे तो क्या वैक्सीन उन तक नही पहुँच सकती ? दूसरा डोज है उनका। पिछली बार मैंने समाचार पत्र में पढ़ा था घर पहुँच कर वैक्सीन लगायी।,[],[],"['dmhoshangabad', 'healthminmp']",['https://t.co/DzOerBCSUa'],,
109,hi,1439602492904390659,1603263199, BabelePiyush जिस दिन हमारी vaccinated population अस्सी प्रतिशत हो जायेगी इंशा अल्लाह ये भी जरूर होगा पियुश भाई ,1439609171943456768,False, BabelePiyush जिस दिन हमारी vaccinated population अस्सी प्रतिशत हो जायेगी इंशा अल्लाह ये भी जरूर होगा पियुश भाई ,2021-09-19T15:15:47.000Z,India,@BabelePiyush जिस दिन हमारी vaccinated population अस्सी प्रतिशत हो जायेगी इंशा-अल्लाह ये भी जरूर होगा पियुश भाई 👍😊,"['😊', '👍']",[],['BabelePiyush'],[],,
110,hi,1439602492904390659,1603263199, BabelePiyush ये प्रश्न सरकार से है या BCCI से   बाकी टीकाकरण अभियान की सफलता के प्रति इतना निराशा भाव शोभा नहीं देता महोदय।,1439606081815146497,False, BabelePiyush ये प्रश्न सरकार से है या BCCI से   बाकी टीकाकरण अभियान की सफलता के प्रति इतना निराशा भाव शोभा नहीं देता महोदय।,2021-09-19T15:03:31.000Z,India,@BabelePiyush ये प्रश्न सरकार से है या BCCI से ? बाकी टीकाकरण अभियान की सफलता के प्रति इतना निराशा भाव शोभा नहीं देता महोदय।,[],[],['BabelePiyush'],[],,
111,hi,1439599283796250633,1116584129863147521,वर्ष से 44 तक के लोगों कोरोना के टीके का पहला डोज़  1284 18 वर्ष से 44 तक के लोगों कोरोना के टीके का दूसरा डोज़ एवं 530 45 वर्ष से अधिक  व्यक्तियों को कोरोना के टीके का दूसरा डोज़ दिया गया।  DC Ramgarh   RamgarhSdm   prdjharkhand,1439599285796950021,False,वर्ष से 44 तक के लोगों कोरोना के टीके का पहला डोज़  1284 18 वर्ष से 44 तक के लोगों कोरोना के टीके का दूसरा डोज़ एवं 530 45 वर्ष से अधिक  व्यक्तियों को कोरोना के टीके का दूसरा डोज़ दिया गया।  DC Ramgarh   RamgarhSdm   prdjharkhand,2021-09-19T14:36:30.000Z,India,"वर्ष से 44 तक के लोगों कोरोना के टीके का पहला डोज़, 1284 18 वर्ष से 44 तक के लोगों कोरोना के टीके का दूसरा डोज़ एवं 530 45 वर्ष से अधिक  व्यक्तियों को कोरोना के टीके का दूसरा डोज़ दिया गया। @DC_Ramgarh  @RamgarhSdm  @prdjharkhand",[],[],[],['https://t.co/NQUsbHnB18'],,
112,en,1439592433700851715,1285787647286185985, shobhaY1174 Good job,1439809542238326784,False,,2021-09-20T04:31:59.000Z,India,@shobhaY1174 Good job,[],[],['shobhaY1174'],[], shobhaY1174 Good job,
113,hi,1439568920827006981,1253930703814885378,संसाधनों  आवश्यकता के समय दवा उत्पादन वृद्धि की पूरी तैयारी और समय समय पर इनकी समीक्षा के साथ साथ वैकल्पिक जांच और उपचार प्रक्रियाओं का शीघ्रातिशीघ्र परीक्षण और मंजूरी पर ध्यान केंद्रित करना होगा  सुस्पष्ट जानकारी  संयम और बेहतर व्यवस्था ही त्रासदी को रोक पाएगी  5 5  MoHFW INDIA,1439568932168421377,False,संसाधनों  आवश्यकता के समय दवा उत्पादन वृद्धि की पूरी तैयारी और समय समय पर इनकी समीक्षा के साथ साथ वैकल्पिक जांच और उपचार प्रक्रियाओं का शीघ्रातिशीघ्र परीक्षण और मंजूरी पर ध्यान केंद्रित करना होगा  सुस्पष्ट जानकारी  संयम और बेहतर व्यवस्था ही त्रासदी को रोक पाएगी  5 5  MoHFW INDIA,2021-09-19T12:35:53.000Z,India,"संसाधनों, आवश्यकता के समय दवा उत्पादन वृद्धि की पूरी तैयारी और समय समय पर इनकी समीक्षा के साथ साथ वैकल्पिक जांच और उपचार प्रक्रियाओं का शीघ्रातिशीघ्र परीक्षण और मंजूरी पर ध्यान केंद्रित करना होगा. सुस्पष्ट जानकारी, संयम और बेहतर व्यवस्था ही त्रासदी को रोक पाएगी. 5/5 @MoHFW_INDIA",[],[],[],['https://t.co/t1Ayp85Ako'],,
114,hi,1439568920827006981,1253930703814885378,गंभीरता का आकलन दुरूह विषय है लेकिन अपनी पिछली गलतियों को सुधारते हुए हमें अधिक सक्रियता दिखानी होगी  वर्तमान में प्रभावित भारतीय राज्यों और अन्य देशों में सामान्य लक्षणों और चिकित्सीय संसाधनों की आवश्यकताओं का आकलन किया जा सकता है  बेड  वेंटिलेटर  ऑक्सीजन आपूर्ति से जुड़े  4 5,1439568929488310272,False,गंभीरता का आकलन दुरूह विषय है लेकिन अपनी पिछली गलतियों को सुधारते हुए हमें अधिक सक्रियता दिखानी होगी  वर्तमान में प्रभावित भारतीय राज्यों और अन्य देशों में सामान्य लक्षणों और चिकित्सीय संसाधनों की आवश्यकताओं का आकलन किया जा सकता है  बेड  वेंटिलेटर  ऑक्सीजन आपूर्ति से जुड़े  4 5,2021-09-19T12:35:53.000Z,India,"गंभीरता का आकलन दुरूह विषय है लेकिन अपनी पिछली गलतियों को सुधारते हुए हमें अधिक सक्रियता दिखानी होगी. वर्तमान में प्रभावित भारतीय राज्यों और अन्य देशों में सामान्य लक्षणों और चिकित्सीय संसाधनों की आवश्यकताओं का आकलन किया जा सकता है. बेड, वेंटिलेटर, ऑक्सीजन आपूर्ति से जुड़े..4/5",[],[],[],['https://t.co/BjlDo6ou2C'],,
115,hi,1439551433896968197,219940006, News18UP Superb प्रधानमंत्री  narendramodi जी और मुख्यमंत्री  myogiadityanath जी के   टीकाकरण अभियान की कमान बच्चों ने भीसंभाली   देश और प्रदेश का नेतृत्व बच्चों को भी अपनी ज़िम्मेदारियों का अहसास करा रहा है  हमें अपने नेतृत्व पर गर्व है   NewIndiahttps   t co GR3Cv8u7jG,1439554854813270021,False, News18UP Superb प्रधानमंत्री  narendramodi जी और मुख्यमंत्री  myogiadityanath जी के   टीकाकरण अभियान की कमान बच्चों ने भीसंभाली   देश और प्रदेश का नेतृत्व बच्चों को भी अपनी ज़िम्मेदारियों का अहसास करा रहा है  हमें अपने नेतृत्व पर गर्व है   NewIndiahttps   t co GR3Cv8u7jG,2021-09-19T11:39:57.000Z,India,"@News18UP Superb!👍🏿
प्रधानमंत्री @narendramodi जी और मुख्यमंत्री @myogiadityanath जी के  'टीकाकरण अभियान की कमान बच्चों ने भी
संभाली !!

देश और प्रदेश का नेतृत्व बच्चों को भी अपनी ज़िम्मेदारियों का अहसास करा रहा है!!

हमें अपने नेतृत्व पर गर्व है!!
#NewIndia

https://t.co/GR3Cv8u7jG",['👍🏿'],[],"['News18UP', 'narendramodi', 'myogiadityanath']",['https://t.co/BMh3wj5G7O'],,
116,hi,1439544633772560384,1107968048642838528, RamvirBidhuri  narendramodi जय हिंद जय भारत नमो नमो,1439625262035918853,False, RamvirBidhuri  narendramodi जय हिंद जय भारत नमो नमो,2021-09-19T16:19:44.000Z,India,@RamvirBidhuri @narendramodi जय हिंद जय भारत नमो नमो,[],[],"['RamvirBidhuri', 'narendramodi']",[],,
117,hi,1439536306745266179,993302897986224128,इस अवसर पर भाजपा जिला उपाध्यक्ष श्री  Pramod18587 जी जिला मंत्री सुश्री  pooja kushram जी व स्थानीय जन उपस्थित रहे।,1439536309161246720,False,इस अवसर पर भाजपा जिला उपाध्यक्ष श्री  Pramod18587 जी जिला मंत्री सुश्री  pooja kushram जी व स्थानीय जन उपस्थित रहे।,2021-09-19T10:26:16.000Z,India,इस अवसर पर भाजपा जिला उपाध्यक्ष श्री @Pramod18587 जी जिला मंत्री सुश्री @pooja_kushram जी व स्थानीय जन उपस्थित रहे।,[],[],"['Pramod18587', 'pooja_kushram']",[],,
118,hi,1439523202158325760,1063121879798403072, BJP4PBH जय भाजपा तय भाजपा,1439523456186392578,False, BJP4PBH जय भाजपा तय भाजपा,2021-09-19T09:35:11.000Z,India,@BJP4PBH जय भाजपा तय भाजपा,[],[],['BJP4PBH'],[],,
119,hi,1439499269879341061,1253930703814885378,कारण है  टीका कम्पनियां  भारत सरकार  विभिन्न राज्य सरकारें और स्वास्थ्यकर्मी सभी धन्यवाद के पात्र हैं  साथ ही आम भारतीय की भी प्रशंसा करनी चाहिए  जिसने भारतीय टीकों के प्रति तमाम दुष्प्रचार के बावजूद विश्वास जताया और संयम से अपनी बारी की प्रतीक्षा की  3 3  MoHFW INDIA   PMOIndia,1439499274719580165,False,कारण है  टीका कम्पनियां  भारत सरकार  विभिन्न राज्य सरकारें और स्वास्थ्यकर्मी सभी धन्यवाद के पात्र हैं  साथ ही आम भारतीय की भी प्रशंसा करनी चाहिए  जिसने भारतीय टीकों के प्रति तमाम दुष्प्रचार के बावजूद विश्वास जताया और संयम से अपनी बारी की प्रतीक्षा की  3 3  MoHFW INDIA   PMOIndia,2021-09-19T07:59:06.000Z,India,"कारण है. टीका कम्पनियां, भारत सरकार, विभिन्न राज्य सरकारें और स्वास्थ्यकर्मी सभी धन्यवाद के पात्र हैं, साथ ही आम भारतीय की भी प्रशंसा करनी चाहिए, जिसने भारतीय टीकों के प्रति तमाम दुष्प्रचार के बावजूद विश्वास जताया और संयम से अपनी बारी की प्रतीक्षा की. 3/3 @MoHFW_INDIA  @PMOIndia",[],[],[],['https://t.co/jEZOdIEwCX'],,
