,tweet_lang,replied_to_tweet_id,replied_to_user_id,reply_text,id,verified,text_hi,tweet_date,country,tweet_text,tweet_emoticons,hashtags,mentions,tweet_urls,text_en,text_es
52,hi,1439937389959413762,64639742, JagranNews  JPNadda कांग्रेस ने जिस हाल में भारत को छोड़ी  मोदी जी ने सात वर्षों में भारत को उससे भी पीछे ले गये अच्छे दिन आयेंगे इससे मोदी जी का अभियान शुरू हुआ था  क्या पूरा देश बेचकर अभियान खत्म होगा,1439940023382466563,False, JagranNews  JPNadda कांग्रेस ने जिस हाल में भारत को छोड़ी  मोदी जी ने सात वर्षों में भारत को उससे भी पीछे ले गये अच्छे दिन आयेंगे इससे मोदी जी का अभियान शुरू हुआ था  क्या पूरा देश बेचकर अभियान खत्म होगा,2021-09-20T13:10:29.000Z,India,"@JagranNews @JPNadda कांग्रेस ने जिस हाल में भारत को छोड़ी, मोदी जी ने सात वर्षों में भारत को उससे भी पीछे ले गये.
अच्छे दिन आयेंगे इससे मोदी जी का अभियान शुरू हुआ था, 

क्या पूरा देश बेचकर अभियान खत्म होगा❓",['❓'],[],"['JagranNews', 'JPNadda']",['https://t.co/iZtJdvO2RC'],,
53,hi,1439922790363279365,758215424622391296, BJP4Bihar माननीय प्रधानमंत्री जी  सब कुछ ठीक कर रहे हैं लेकिन युवा पीढ़ी के लिए आप कुछ नहीं किये  इससे युवा पीढ़ी को सड़क पर ला दिये इसलिए आपका साथ दिये रोजगार महगाई बेरोजगारी को दूर करेंगे,1439976888156389381,False, BJP4Bihar माननीय प्रधानमंत्री जी  सब कुछ ठीक कर रहे हैं लेकिन युवा पीढ़ी के लिए आप कुछ नहीं किये  इससे युवा पीढ़ी को सड़क पर ला दिये इसलिए आपका साथ दिये रोजगार महगाई बेरोजगारी को दूर करेंगे,2021-09-20T15:36:58.000Z,India,"@BJP4Bihar माननीय प्रधानमंत्री जी  सब कुछ ठीक कर रहे हैं लेकिन युवा पीढ़ी के लिए आप कुछ नहीं किये, इससे युवा पीढ़ी को सड़क पर ला दिये इसलिए आपका साथ दिये रोजगार महगाई बेरोजगारी को दूर करेंगे",[],[],['BJP4Bihar'],['https://t.co/7Z8qg0FHOu'],,
54,hi,1439920824320815113,982195425816920067, JaskaurBJP  BJP4India  BJP4Rajasthan  BJPLive माननीय मुख्यमंत्री  ashokgehlot51 जी राजस्थान JEN सिविल डिग्री पेपर की लीक की खबरें सबके सामने है अतः आपसे निवेदन है कि आप इस भर्ती की  SOG से निष्पक्ष जांच करवाइए    छात्र क्रांति  Cancel Raj JEN Exam,1439921306284134404,False, JaskaurBJP  BJP4India  BJP4Rajasthan  BJPLive माननीय मुख्यमंत्री  ashokgehlot51 जी राजस्थान JEN सिविल डिग्री पेपर की लीक की खबरें सबके सामने है अतः आपसे निवेदन है कि आप इस भर्ती की  SOG से निष्पक्ष जांच करवाइए    छात्र क्रांति  Cancel Raj JEN Exam,2021-09-20T11:56:06.000Z,India,"@JaskaurBJP @BJP4India @BJP4Rajasthan @BJPLive माननीय मुख्यमंत्री 
@ashokgehlot51

 जी राजस्थान JEN सिविल डिग्री पेपर की लीक की खबरें सबके सामने है अतः आपसे निवेदन है कि आप इस भर्ती की #SOG से निष्पक्ष जांच करवाइए!!!
#छात्र_क्रांति #Cancel_Raj_JEN_Exam",[],[],"['JaskaurBJP', 'BJP4India', 'BJP4Rajasthan', 'BJPLive', 'ashokgehlot51']",['https://t.co/Ayhyuflss9'],,
55,en,1439917249389731847,1378922970064711681, Pratima96304063 Good  job ,1439987630632955908,False,,2021-09-20T16:19:39.000Z,India,@Pratima96304063 Good  job 👍,['👍'],[],['Pratima96304063'],[], Pratima96304063 Good  job ,
56,hi,1439915998455296008,262219886, arjunrammeghwal जातिवादी वायरस की एक ही शर्तिया दवाई आती है जिसका नाम है  नोटा। पहले इस्तेमाल करें  फिर विश्वास करें। EWS,1439917005537042433,False, arjunrammeghwal जातिवादी वायरस की एक ही शर्तिया दवाई आती है जिसका नाम है  नोटा। पहले इस्तेमाल करें  फिर विश्वास करें। EWS,2021-09-20T11:39:01.000Z,India,@arjunrammeghwal जातिवादी वायरस की एक ही शर्तिया दवाई आती है जिसका नाम है- नोटा। पहले इस्तेमाल करें- फिर विश्वास करें।#EWS,[],['EWS'],['arjunrammeghwal'],[],,
57,hi,1439908643789414405,337065278, BJP4Delhi  JPNadda फिर इसे क्या कहोगे https   t co dbbYve6j28,1439955638088396800,False, BJP4Delhi  JPNadda फिर इसे क्या कहोगे https   t co dbbYve6j28,2021-09-20T14:12:31.000Z,India,@BJP4Delhi @JPNadda फिर इसे क्या कहोगे https://t.co/dbbYve6j28,[],[],"['BJP4Delhi', 'JPNadda']",[],,
58,en,1439908643789414405,337065278, BJP4Delhi  JPNadda Bjp fundamentalist party,1439934696792596480,False,,2021-09-20T12:49:19.000Z,India,@BJP4Delhi @JPNadda Bjp fundamentalist party,[],[],"['BJP4Delhi', 'JPNadda']",[], BJP4Delhi  JPNadda Bjp fundamentalist party,
59,hi,1439907645868052481,2266960309, visshnumittal जय भाजपा तय भाजपा narendramodi,1440212692183105538,False, visshnumittal जय भाजपा तय भाजपा narendramodi,2021-09-21T07:13:58.000Z,India,"@visshnumittal जय भाजपा तय भाजपा
@narendramodi",[],[],"['visshnumittal', 'narendramodi']",[],,
60,hi,1439907472374857738,2591161099, nstomar  BJP4India से एक सवाल हमारे परम् आदरणीय  ChouhanShivraj जी से कब स्तीफा ले रहा शीर्ष नेतृत्व कृपया जल्दी करें युवा वर्ग खासा नाराज है इनसे  बेरोजगारी चरम पर है अब हमें ही देख लो 10 15 साल से watershed के एम्प्लॉय है  अब उम्र के इस पड़ाव में बेरोजगार कर दिया इनकी सरकार ने ।,1440369264410591234,False, nstomar  BJP4India से एक सवाल हमारे परम् आदरणीय  ChouhanShivraj जी से कब स्तीफा ले रहा शीर्ष नेतृत्व कृपया जल्दी करें युवा वर्ग खासा नाराज है इनसे  बेरोजगारी चरम पर है अब हमें ही देख लो 10 15 साल से watershed के एम्प्लॉय है  अब उम्र के इस पड़ाव में बेरोजगार कर दिया इनकी सरकार ने ।,2021-09-21T17:36:08.000Z,India,"@nstomar @BJP4India से एक सवाल-

हमारे परम् आदरणीय @ChouhanShivraj जी से कब स्तीफा ले रहा शीर्ष नेतृत्व?
कृपया जल्दी करें,
युवा वर्ग खासा नाराज है इनसे, बेरोजगारी चरम पर है,

अब हमें ही देख लो 10-15 साल से watershed के एम्प्लॉय है, अब उम्र के इस पड़ाव में बेरोजगार कर दिया इनकी सरकार ने ।",[],[],"['nstomar', 'BJP4India', 'ChouhanShivraj']",['https://t.co/FwNgtCwCjS'],,
61,hi,1439907472374857738,2591161099, nstomar निरन्तर प्रगति पथ पर अग्रसर भारत,1439921812918341640,False, nstomar निरन्तर प्रगति पथ पर अग्रसर भारत,2021-09-20T11:58:07.000Z,India,@nstomar निरन्तर प्रगति पथ पर अग्रसर भारत,[],[],['nstomar'],[],,
62,hi,1439906339589746695,3098336425, nityanandraibjp श्री राजा दशरथ नंदन मर्यादा पुरुषोत्तम जय सियाराम जय सियाराम जय सियाराम जय सियाराम जय सियाराम जय सियाराम जय सियाराम सियाराम जय जय सीताराम जय सीताराम जय जय श्री सीताराम जय जय श्री सीताराम जय  धर्म की जीत अधर्म का नाश हो प्राणियों मे सद्भावना हो विश्व का कल्याण हो  PatnaKaChandan,1439956205078646792,False, nityanandraibjp श्री राजा दशरथ नंदन मर्यादा पुरुषोत्तम जय सियाराम जय सियाराम जय सियाराम जय सियाराम जय सियाराम जय सियाराम जय सियाराम सियाराम जय जय सीताराम जय सीताराम जय जय श्री सीताराम जय जय श्री सीताराम जय  धर्म की जीत अधर्म का नाश हो प्राणियों मे सद्भावना हो विश्व का कल्याण हो  PatnaKaChandan,2021-09-20T14:14:47.000Z,India,@nityanandraibjp श्री राजा दशरथ नंदन मर्यादा पुरुषोत्तम जय सियाराम जय सियाराम जय सियाराम जय सियाराम जय सियाराम जय सियाराम जय सियाराम सियाराम जय जय सीताराम जय सीताराम जय जय श्री सीताराम जय जय श्री सीताराम जय  धर्म की जीत अधर्म का नाश हो प्राणियों मे सद्भावना हो विश्व का कल्याण हो #PatnaKaChandan,[],[],['nityanandraibjp'],['https://t.co/4TnCfSs3ng'],,
63,hi,1439906339589746695,3098336425, nityanandraibjp जय भाजपा,1439908019555364864,False, nityanandraibjp जय भाजपा,2021-09-20T11:03:18.000Z,India,@nityanandraibjp जय भाजपा,[],[],['nityanandraibjp'],[],,
64,en,1439904549615980545,439154852, KailashOnline 75000 crore bihar stolen from different States arrest people from lalbigha village then Giriraj Singh become new cm for bihar state arrest Nitish Kumar immediately BJP make governance all over India 2017 2021 bihar stolen 75000 crore ,1440027373550796800,False,,2021-09-20T18:57:34.000Z,India,@KailashOnline 75000 crore bihar stolen from different States arrest people from lalbigha village then Giriraj Singh become new cm for bihar state arrest Nitish Kumar immediately BJP make governance all over India 2017 2021 bihar stolen 75000 crore 🇮🇳✌️,"['✌️', '🇮🇳']",[],['KailashOnline'],['https://t.co/h8dDb3VUUL'], KailashOnline 75000 crore bihar stolen from different States arrest people from lalbigha village then Giriraj Singh become new cm for bihar state arrest Nitish Kumar immediately BJP make governance all over India 2017 2021 bihar stolen 75000 crore ,
65,hi,1439904549615980545,439154852, KailashOnline Jai ho Sada Vijay ho Modi Ji ,1439991162161483779,False, KailashOnline Jai ho Sada Vijay ho Modi Ji ,2021-09-20T16:33:41.000Z,India,@KailashOnline 🙏💐Jai ho Sada Vijay ho Modi Ji 💐🙏,"['🙏', '💐']",[],['KailashOnline'],[],,
66,en,1439904286402510853,2617066206, DrRPNishank  narendramodi  PMOIndia  MyGovHindi  mygovindia  transformIndia  PIBHindi  PIB India  BJP4India  BJP4UK Education Minister  sir i dropped for JEE advance but now it is showing i am not eligible due to 12th completion year 2019 and result  declared in mar  19    Sir please do something  against this rule   My future will spoiled and perhaps we ll have suicide ,1440234750204014595,False,,2021-09-21T08:41:37.000Z,India,@DrRPNishank @narendramodi @PMOIndia @MyGovHindi @mygovindia @transformIndia @PIBHindi @PIB_India @BJP4India @BJP4UK Education Minister  sir i dropped for JEE advance but now it is showing i am not eligible due to 12th completion year 2019 and result  declared in mar. 19..  Sir please do something  against this rule.  My future will spoiled and perhaps we'll have suicide.,[],[],"['DrRPNishank', 'narendramodi', 'PMOIndia', 'MyGovHindi', 'mygovindia', 'transformIndia', 'PIBHindi', 'PIB_India', 'BJP4India']",['https://t.co/hMY8svvoWq'], DrRPNishank  narendramodi  PMOIndia  MyGovHindi  mygovindia  transformIndia  PIBHindi  PIB India  BJP4India  BJP4UK Education Minister  sir i dropped for JEE advance but now it is showing i am not eligible due to 12th completion year 2019 and result  declared in mar  19    Sir please do something  against this rule   My future will spoiled and perhaps we ll have suicide ,
67,en,1439904286402510853,2617066206, DrRPNishank  narendramodi  PMOIndia  MyGovHindi  mygovindia  transformIndia  PIBHindi  PIB India  BJP4India  BJP4UK Teachers are vaccinated  amp  students hv not been vaccinated yet  who s rspnsble for our life cancel nios October exam  It s very unfair that July has passed but Oct give paper why  We want justice cancelOctoberexam2021 NIOS  niostwit  ProfSarojSharma  anubha1812  abhishekbscllb,1440001036098277376,False,,2021-09-20T17:12:55.000Z,India,"@DrRPNishank @narendramodi @PMOIndia @MyGovHindi @mygovindia @transformIndia @PIBHindi @PIB_India @BJP4India @BJP4UK Teachers are vaccinated &amp; students hv not been vaccinated yet. who's rspnsble for our life cancel nios October exam. It's very unfair that July has passed but Oct give paper why? We want justice
#cancelOctoberexam2021
#NIOS @niostwit @ProfSarojSharma @anubha1812 @abhishekbscllb",[],[],"['DrRPNishank', 'narendramodi', 'PMOIndia', 'MyGovHindi', 'mygovindia', 'transformIndia', 'PIBHindi', 'PIB_India', 'BJP4India']",['https://t.co/qRd8EzdU29'], DrRPNishank  narendramodi  PMOIndia  MyGovHindi  mygovindia  transformIndia  PIBHindi  PIB India  BJP4India  BJP4UK Teachers are vaccinated  amp  students hv not been vaccinated yet  who s rspnsble for our life cancel nios October exam  It s very unfair that July has passed but Oct give paper why  We want justice cancelOctoberexam2021 NIOS  niostwit  ProfSarojSharma  anubha1812  abhishekbscllb,
68,en,1439903067856465920,3025447023, AKalraj   JPNadda  narendramodi  OfficeofJPNadda  narendramodi in  AmitShah  AmitShahOffice  myogiadityanath  myogioffice  swatantrabjp  AdityaTrivedi   kpmaurya1  sunilbansalbjp The positionHave some shame or sold it ,1439905632933404672,False,,2021-09-20T10:53:49.000Z,India,"@AKalraj_ @JPNadda @narendramodi @OfficeofJPNadda @narendramodi_in @AmitShah @AmitShahOffice @myogiadityanath @myogioffice @swatantrabjp @AdityaTrivedi_ @kpmaurya1 @sunilbansalbjp The position😡
Have some shame or sold it.",['😡'],[],"['AKalraj_', 'JPNadda', 'narendramodi', 'OfficeofJPNadda', 'narendramodi_in', 'AmitShah', 'AmitShahOffice', 'myogiadityanath']",['https://t.co/FHAuteoxTy'], AKalraj   JPNadda  narendramodi  OfficeofJPNadda  narendramodi in  AmitShah  AmitShahOffice  myogiadityanath  myogioffice  swatantrabjp  AdityaTrivedi   kpmaurya1  sunilbansalbjp The positionHave some shame or sold it ,
69,hi,1439900697718255618,781476689402482689, PurandeswariBJP  BJP4CGState  BJP4Odisha  BJP4Andhra देश के यशस्वी प्रधानमंत्री माननीय श्री नरेन्द्र मोदी जी का बहुत बहुत धन्यवाद,1440222166771908622,False, PurandeswariBJP  BJP4CGState  BJP4Odisha  BJP4Andhra देश के यशस्वी प्रधानमंत्री माननीय श्री नरेन्द्र मोदी जी का बहुत बहुत धन्यवाद,2021-09-21T07:51:37.000Z,India,@PurandeswariBJP @BJP4CGState @BJP4Odisha @BJP4Andhra देश के यशस्वी प्रधानमंत्री माननीय श्री नरेन्द्र मोदी जी का बहुत-बहुत धन्यवाद,[],[],"['PurandeswariBJP', 'BJP4CGState', 'BJP4Odisha', 'BJP4Andhra']",[],,
70,hi,1439900697718255618,781476689402482689, PurandeswariBJP  BJP4CGState  BJP4Odisha  BJP4Andhra मोदी है तो मुमकिन हैजय मोदी सरकार,1439932432757637131,False, PurandeswariBJP  BJP4CGState  BJP4Odisha  BJP4Andhra मोदी है तो मुमकिन हैजय मोदी सरकार,2021-09-20T12:40:19.000Z,India,"@PurandeswariBJP @BJP4CGState @BJP4Odisha @BJP4Andhra मोदी है तो मुमकिन है
जय मोदी सरकार",[],[],"['PurandeswariBJP', 'BJP4CGState', 'BJP4Odisha', 'BJP4Andhra']",[],,
71,hi,1439899639436693510,207809313, BJP4India  SushilModi Modi chacha hi sabko tika laga rahe hai,1440690943833690132,False, BJP4India  SushilModi Modi chacha hi sabko tika laga rahe hai,2021-09-22T14:54:22.000Z,India,@BJP4India @SushilModi Modi chacha hi sabko tika laga rahe hai,[],[],"['BJP4India', 'SushilModi']",[],,
72,hi,1439899639436693510,207809313, BJP4India सही बात तभी UK ने बन कर दिया India को   मोदी कैसा विश्व नेता हे   जुमला,1440578605994573833,False, BJP4India सही बात तभी UK ने बन कर दिया India को   मोदी कैसा विश्व नेता हे   जुमला,2021-09-22T07:27:58.000Z,India,@BJP4India सही बात तभी UK ने बन कर दिया India को ? मोदी कैसा विश्व नेता हे ! जुमला,[],[],['BJP4India'],[],,
73,hi,1439895821500223491,1367063252, AshokChoudhaary  jitanrmanjhi त्रिअस्त्रीय समिति  चौधरी कमिटी cwjc ओर lpa इन सभी मे होने के बाबजूद  हम सभी सांख्यिकी भाई बेरोजगार है। महाशय हम सभी सांख्यिकी भाई पर कृपा किया जाए  ताकि हम लोग का जीवन यापन हो सके। श्रीमान का हमलोग आजीवन आभारी रहेंगे। https   t co NLMLj8NVVV,1440004578062200834,False, AshokChoudhaary  jitanrmanjhi त्रिअस्त्रीय समिति  चौधरी कमिटी cwjc ओर lpa इन सभी मे होने के बाबजूद  हम सभी सांख्यिकी भाई बेरोजगार है। महाशय हम सभी सांख्यिकी भाई पर कृपा किया जाए  ताकि हम लोग का जीवन यापन हो सके। श्रीमान का हमलोग आजीवन आभारी रहेंगे। https   t co NLMLj8NVVV,2021-09-20T17:27:00.000Z,India,"@AshokChoudhaary @jitanrmanjhi त्रिअस्त्रीय समिति, चौधरी कमिटी,cwjc ओर lpa इन सभी मे होने के बाबजूद, हम सभी सांख्यिकी भाई बेरोजगार है। महाशय हम सभी सांख्यिकी भाई पर कृपा किया जाए, ताकि हम लोग का जीवन यापन हो सके। श्रीमान का हमलोग आजीवन आभारी रहेंगे।🙏🙏🙏🙏🙏🙏🙏🙏🙏🙏🙏 https://t.co/NLMLj8NVVV",['🙏'],[],"['AshokChoudhaary', 'jitanrmanjhi']",['https://t.co/MmCp3iBtGP'],,
74,hi,1439895821500223491,1367063252, AshokChoudhaary हम सभी सांख्यिकी भाई जो 9 साल बेरोजगार है।हमलोग की अर्जी सुन लीजिए महाशय। हमलोग2013 मे जो जनगणना किए थे उसके लिए मुख्यमंत्री साहब को पुरस्कृत किया था केंद्र सरकार कीओर से।लेकिन अभी तक रोजगार नहीं मिला उम्र और आर्थिक स्थिति को देखते हुए इसका समाधान जल्दी करे।,1440004003106983937,False, AshokChoudhaary हम सभी सांख्यिकी भाई जो 9 साल बेरोजगार है।हमलोग की अर्जी सुन लीजिए महाशय। हमलोग2013 मे जो जनगणना किए थे उसके लिए मुख्यमंत्री साहब को पुरस्कृत किया था केंद्र सरकार कीओर से।लेकिन अभी तक रोजगार नहीं मिला उम्र और आर्थिक स्थिति को देखते हुए इसका समाधान जल्दी करे।,2021-09-20T17:24:42.000Z,India,"@AshokChoudhaary हम सभी सांख्यिकी भाई जो 9 साल बेरोजगार है।हमलोग की अर्जी सुन लीजिए महाशय। हमलोग2013 मे जो जनगणना किए थे,उसके लिए मुख्यमंत्री साहब को पुरस्कृत किया था केंद्र सरकार कीओर से।लेकिन अभी तक रोजगार नहीं मिला,उम्र और आर्थिक स्थिति को देखते हुए इसका समाधान जल्दी करे।🙏🙏🙏",['🙏'],[],['AshokChoudhaary'],['https://t.co/UAWxFpVFcC'],,
75,hi,1439893095533801473,2544979140, sanjayjaiswalMP  BJP4Bihar श्रीमान ये सब फर्जी खबर मत प्रकाशित करे महोदय। बिना टीकाकरण के ही प्रकाशित ह हुआ प्रमाणपत्र। लाभार्थी गुजरात में टीकाकरण हुआ बिहार में वो भी ठोस आधार पर और प्रकाशित भी हुआ प्रमाणपत्र।,1439973707288506368,False, sanjayjaiswalMP  BJP4Bihar श्रीमान ये सब फर्जी खबर मत प्रकाशित करे महोदय। बिना टीकाकरण के ही प्रकाशित ह हुआ प्रमाणपत्र। लाभार्थी गुजरात में टीकाकरण हुआ बिहार में वो भी ठोस आधार पर और प्रकाशित भी हुआ प्रमाणपत्र।,2021-09-20T15:24:19.000Z,India,@sanjayjaiswalMP @BJP4Bihar श्रीमान ये सब फर्जी खबर मत प्रकाशित करे महोदय। बिना टीकाकरण के ही प्रकाशित ह हुआ प्रमाणपत्र। लाभार्थी गुजरात में टीकाकरण हुआ बिहार में वो भी ठोस आधार पर और प्रकाशित भी हुआ प्रमाणपत्र।,[],[],"['sanjayjaiswalMP', 'BJP4Bihar']",['https://t.co/C9lABmQ8hQ'],,
