,tweet_lang,replied_to_tweet_id,replied_to_user_id,reply_text,id,verified,text_hi,tweet_date,country,tweet_text,tweet_emoticons,hashtags,mentions,tweet_urls,text_en,text_es
0,hi,1440733627038326785,1212798914421673984, NewsJunctionTV  jairamthakurbjp Jai himachal,1440739150206959616,False, NewsJunctionTV  jairamthakurbjp Jai himachal,2021-09-22T18:05:55.000Z,India,@NewsJunctionTV @jairamthakurbjp Jai himachal,[],[],"['NewsJunctionTV', 'jairamthakurbjp']",[],,
1,hi,1440717794245369867,2231630149, MrAmanDeep  BJYMinCH  Tejasvi Surya  blsanthosh  KapilParmar  arunsoodbjp  vijayranabjp  tarunchughbjp  BJP4India  BJP4Chandigarh  dushyanttgautam  maheshsidhubjp Jai ho Vijay ho ,1440736744840724482,False, MrAmanDeep  BJYMinCH  Tejasvi Surya  blsanthosh  KapilParmar  arunsoodbjp  vijayranabjp  tarunchughbjp  BJP4India  BJP4Chandigarh  dushyanttgautam  maheshsidhubjp Jai ho Vijay ho ,2021-09-22T17:56:22.000Z,India,@MrAmanDeep @BJYMinCH @Tejasvi_Surya @blsanthosh @KapilParmar @arunsoodbjp @vijayranabjp @tarunchughbjp @BJP4India @BJP4Chandigarh @dushyanttgautam @maheshsidhubjp Jai ho Vijay ho 🙏,['🙏'],[],"['MrAmanDeep', 'BJYMinCH', 'Tejasvi_Surya', 'blsanthosh', 'KapilParmar', 'arunsoodbjp', 'vijayranabjp', 'tarunchughbjp', 'BJP4India']",['https://t.co/9PNNWjhkaZ'],,
2,en,1440717794245369867,2231630149, shahpuriz  BJYMinCH  Tejasvi Surya  blsanthosh  KapilParmar  arunsoodbjp  vijayranabjp  tarunchughbjp  BJP4India  BJP4Chandigarh  dushyanttgautam  maheshsidhubjp  iBhatt4India Thank you paaji,1440724225963163651,False,,2021-09-22T17:06:37.000Z,India,@shahpuriz @BJYMinCH @Tejasvi_Surya @blsanthosh @KapilParmar @arunsoodbjp @vijayranabjp @tarunchughbjp @BJP4India @BJP4Chandigarh @dushyanttgautam @maheshsidhubjp @iBhatt4India Thank you paaji,[],[],"['shahpuriz', 'BJYMinCH', 'Tejasvi_Surya', 'blsanthosh', 'KapilParmar', 'arunsoodbjp', 'vijayranabjp', 'tarunchughbjp', 'BJP4India']",['https://t.co/UbLaP0O9K3'], shahpuriz  BJYMinCH  Tejasvi Surya  blsanthosh  KapilParmar  arunsoodbjp  vijayranabjp  tarunchughbjp  BJP4India  BJP4Chandigarh  dushyanttgautam  maheshsidhubjp  iBhatt4India Thank you paaji,
3,hi,1440706213725966338,971984018580254720, projshoshangaba  healthminmp पिपरिया ,1440715590423834626,False, projshoshangaba  healthminmp पिपरिया ,2021-09-22T16:32:18.000Z,India,@projshoshangaba @healthminmp पिपरिया?,[],[],"['projshoshangaba', 'healthminmp']",[],,
4,hi,1440689432470777866,816930988169117696, DmMaharajganj  CMOfficeUP  myogioffice  UPGovt  InfoDeptUP  ChiefSecyUP जय हिन्द।,1440690013486805008,False, DmMaharajganj  CMOfficeUP  myogioffice  UPGovt  InfoDeptUP  ChiefSecyUP जय हिन्द।,2021-09-22T14:50:40.000Z,India,@DmMaharajganj @CMOfficeUP @myogioffice @UPGovt @InfoDeptUP @ChiefSecyUP जय हिन्द।,[],[],"['DmMaharajganj', 'CMOfficeUP', 'myogioffice', 'UPGovt', 'InfoDeptUP', 'ChiefSecyUP']",[],,
5,hi,1440649405611196428,1320141312, BJP4Rajasthan  RanjeetaKoliMP Good Regards Danish AbbasGo raksha vahini up mantri,1440659892470050822,False, BJP4Rajasthan  RanjeetaKoliMP Good Regards Danish AbbasGo raksha vahini up mantri,2021-09-22T12:50:59.000Z,India,"@BJP4Rajasthan @RanjeetaKoliMP Good 
Regards Danish Abbas
Go raksha vahini up mantri",[],[],"['BJP4Rajasthan', 'RanjeetaKoliMP']",[],,
6,hi,1440640355146235908,1384545808473755649,160 लोगों को कोवैक्सीन की डोज दी गयी।इन दोनों स्थानों पर टीका लगाने में जुटी एएनएम बहनों को सेवा सप्ताह के तहत शॉल देकर सम्मानित भी किया।  81 वर्ष की दादी नागी हांसदा जी समेत 10 ऐसे बुजुर्गों ने टीकाकरण कराया  जिनकी उम्र 70 वर्ष से अधिक है।,1440640357746704389,False,160 लोगों को कोवैक्सीन की डोज दी गयी।इन दोनों स्थानों पर टीका लगाने में जुटी एएनएम बहनों को सेवा सप्ताह के तहत शॉल देकर सम्मानित भी किया।  81 वर्ष की दादी नागी हांसदा जी समेत 10 ऐसे बुजुर्गों ने टीकाकरण कराया  जिनकी उम्र 70 वर्ष से अधिक है।,2021-09-22T11:33:21.000Z,India,"160 लोगों को कोवैक्सीन की डोज दी गयी।इन दोनों स्थानों पर टीका लगाने में जुटी एएनएम बहनों को सेवा सप्ताह के तहत शॉल देकर सम्मानित भी किया।  81 वर्ष की दादी नागी हांसदा जी समेत 10 ऐसे बुजुर्गों ने टीकाकरण कराया, जिनकी उम्र 70 वर्ष से अधिक है।",[],[],[],['https://t.co/KhQ11bE9S9'],,
7,hi,1440596592608772103,813345438908620801, MIB Hindi कहने को देश में इतने कानून है।फिर भी एक गधा टीवी पर नंगा नाच रहा है  घर में news देखना बंद हो गया है इस ऐड की बजह सेविज्ञापन में महिला की साड़ी उड़ते हुए दिखाया है लक्स अंडरवियर की power से  लक्स कम्पनी क्या बुरका उड़ते हुए दिखा सकती है  boycottLuxCozi,1440602893967446029,False, MIB Hindi कहने को देश में इतने कानून है।फिर भी एक गधा टीवी पर नंगा नाच रहा है  घर में news देखना बंद हो गया है इस ऐड की बजह सेविज्ञापन में महिला की साड़ी उड़ते हुए दिखाया है लक्स अंडरवियर की power से  लक्स कम्पनी क्या बुरका उड़ते हुए दिखा सकती है  boycottLuxCozi,2021-09-22T09:04:29.000Z,India,"@MIB_Hindi कहने को देश में इतने कानून है।फिर भी एक गधा टीवी पर नंगा नाच रहा है, घर में news देखना बंद हो गया है इस ऐड की बजह से
विज्ञापन में महिला की साड़ी उड़ते हुए दिखाया है लक्स अंडरवियर की power से! लक्स कम्पनी क्या बुरका उड़ते हुए दिखा सकती है?
#boycottLuxCozi",[],[],['MIB_Hindi'],['https://t.co/RPzXw2HUW0'],,
8,hi,1440596592608772103,813345438908620801, MIB Hindi  MIB Hindi सूचना प्रशारन मंत्रालय से हमारा निवेदन है कि थोडा ध्यान दें कि ये advertsiment  सीरियल और फ़िल्म बनाने वाले क्या परोस रहे हैंक्या प्रचार के नाम पर कुछ भी परोसा जा सकता है  क्या अश्लीलता की परिभाषा अलग है इनके लिएअंडरवियर का ऐड या महिलाओं का अपमान boycott lux cozy,1440601805709197320,False, MIB Hindi  MIB Hindi सूचना प्रशारन मंत्रालय से हमारा निवेदन है कि थोडा ध्यान दें कि ये advertsiment  सीरियल और फ़िल्म बनाने वाले क्या परोस रहे हैंक्या प्रचार के नाम पर कुछ भी परोसा जा सकता है  क्या अश्लीलता की परिभाषा अलग है इनके लिएअंडरवियर का ऐड या महिलाओं का अपमान boycott lux cozy,2021-09-22T09:00:10.000Z,India,"@MIB_Hindi @MIB_Hindi सूचना प्रशारन मंत्रालय से हमारा निवेदन है कि थोडा ध्यान दें कि ये advertsiment, सीरियल और फ़िल्म बनाने वाले क्या परोस रहे हैं

क्या प्रचार के नाम पर कुछ भी परोसा जा सकता है, क्या अश्लीलता की परिभाषा अलग है इनके लिए
अंडरवियर का ऐड या महिलाओं का अपमान
#boycott_lux_cozy",[],[],"['MIB_Hindi', 'MIB_Hindi']",['https://t.co/Axi2vzEUB3'],,
9,hi,1440592113930944513,978599721714487296,विद्यालय के प्रधानाचार्य हरविंद्र सिंह ने बताया कि कोरोना से बचने का एकमात्र उपाय टीकाकरण ही है  जो इसे मात दे सकता है क्योंकि टीकाकरण से हमारे शरीर में रोग प्रतिरोधकता बढ़ जाती है। उन्होंने विभाग की प्रशंसा करते हुए कहा कि ऐसे कार्यक्रम के आयोजन से ही लोगों में जागरूकता आएगी।,1440592210181832713,False,विद्यालय के प्रधानाचार्य हरविंद्र सिंह ने बताया कि कोरोना से बचने का एकमात्र उपाय टीकाकरण ही है  जो इसे मात दे सकता है क्योंकि टीकाकरण से हमारे शरीर में रोग प्रतिरोधकता बढ़ जाती है। उन्होंने विभाग की प्रशंसा करते हुए कहा कि ऐसे कार्यक्रम के आयोजन से ही लोगों में जागरूकता आएगी।,2021-09-22T08:22:02.000Z,India,"विद्यालय के प्रधानाचार्य हरविंद्र सिंह ने बताया कि कोरोना से बचने का एकमात्र उपाय टीकाकरण ही है, जो इसे मात दे सकता है क्योंकि टीकाकरण से हमारे शरीर में रोग प्रतिरोधकता बढ़ जाती है। उन्होंने विभाग की प्रशंसा करते हुए कहा कि ऐसे कार्यक्रम के आयोजन से ही लोगों में जागरूकता आएगी।",[],[],[],['https://t.co/RKC1rrvaIZ'],,
10,hi,1440556648167215106,2978598960, AIRNewsHindi  TruthOfShraadhपित्र पूजा  श्राद्ध क्रिया आदि करने से कोई लाभ नहीं होता।https   t co 3srd914RPsअधिक जानकारी के लिए Sant Rampal Ji Maharaj Youtube Channel पर Visit करें।   https   t co ype5M4IRDQ,1440557698056028171,False, AIRNewsHindi  TruthOfShraadhपित्र पूजा  श्राद्ध क्रिया आदि करने से कोई लाभ नहीं होता।https   t co 3srd914RPsअधिक जानकारी के लिए Sant Rampal Ji Maharaj Youtube Channel पर Visit करें।   https   t co ype5M4IRDQ,2021-09-22T06:04:54.000Z,India,"@AIRNewsHindi #TruthOfShraadh
पित्र पूजा, श्राद्ध क्रिया आदि करने से कोई लाभ नहीं होता।
https://t.co/3srd914RPs
📲अधिक जानकारी के लिए Sant Rampal Ji Maharaj Youtube Channel पर Visit करें। | https://t.co/ype5M4IRDQ",['📲'],['TruthOfShraadh'],['AIRNewsHindi'],"['https://t.co/3srd914RPs', 'https://t.co/vQkQ2SWYnH']",,
11,hi,1440550614853767171,921296037632868353, PIBDehradun क्या कभी आपके माधयम से इस बात पर भी आवाज उठ सकती है  https   t co 6EKWtPTW3q,1440550918076833797,False, PIBDehradun क्या कभी आपके माधयम से इस बात पर भी आवाज उठ सकती है  https   t co 6EKWtPTW3q,2021-09-22T05:37:57.000Z,India,@PIBDehradun क्या कभी आपके माधयम से इस बात पर भी आवाज उठ सकती है? https://t.co/6EKWtPTW3q,[],[],['PIBDehradun'],[],,
12,hi,1440548631325515784,3000838099, PIBHindi  MoHFW INDIA  COVIDNewsByMIB कोरोना से बचाव के लिए सामाजिक दूरी रखना जरूरी है।व्यक्तिगत स्वच्छताऔरशारीरिक दूरी बनाए रखें।छींकते और खांसते समय अपनी नाक मुंह को रूमाल या टिशू से ढंकें।लॉकडाउन का ईमानदारी से पालन करें।अपने इम्यून सिस्टम को मजबूत बनाएं।अपने तापमान और श्वसन लक्षणों की जांच नियमित रूप से करें।,1440554867966177281,False, PIBHindi  MoHFW INDIA  COVIDNewsByMIB कोरोना से बचाव के लिए सामाजिक दूरी रखना जरूरी है।व्यक्तिगत स्वच्छताऔरशारीरिक दूरी बनाए रखें।छींकते और खांसते समय अपनी नाक मुंह को रूमाल या टिशू से ढंकें।लॉकडाउन का ईमानदारी से पालन करें।अपने इम्यून सिस्टम को मजबूत बनाएं।अपने तापमान और श्वसन लक्षणों की जांच नियमित रूप से करें।,2021-09-22T05:53:39.000Z,India,"@PIBHindi @MoHFW_INDIA @COVIDNewsByMIB कोरोना से बचाव के लिए सामाजिक दूरी रखना जरूरी है।व्यक्तिगत स्वच्छताऔरशारीरिक दूरी बनाए रखें।
छींकते और खांसते समय अपनी नाक,मुंह को रूमाल या टिशू से ढंकें।
लॉकडाउन का ईमानदारी से पालन करें।
अपने इम्यून सिस्टम को मजबूत बनाएं।
अपने तापमान और श्वसन लक्षणों की जांच नियमित रूप से करें।",[],[],"['PIBHindi', 'MoHFW_INDIA', 'COVIDNewsByMIB']",['https://t.co/RKL9CCaPIu'],,
13,en,1440548631325515784,3000838099, PIBHindi  MoHFW INDIA  COVIDNewsByMIB  COVID19Update 82 65 Cr  vaccine doses administered so far under Nationwide Vaccination DriveActive cases account for less than 1  of total cases  currently at 0 90   lowest since March 2020Active caseload stands at 3 01 989  lowest in 186 days MoHFW INDIA COVIDNewsByMIB https   t co RU4LTZBxQ3,1440553524635443208,False,,2021-09-22T05:48:19.000Z,India,"@PIBHindi @MoHFW_INDIA @COVIDNewsByMIB #COVID19Update 
82.65 Cr. vaccine doses administered so far under Nationwide Vaccination Drive

Active cases account for less than 1% of total cases, currently at 0.90%; lowest since March 2020

Active caseload stands at 3,01,989; lowest in 186 days
@MoHFW_INDIA
@COVIDNewsByMIB https://t.co/RU4LTZBxQ3",[],['COVID19Update'],"['PIBHindi', 'MoHFW_INDIA', 'COVIDNewsByMIB']",['https://t.co/QmEYSif2IF'], PIBHindi  MoHFW INDIA  COVIDNewsByMIB  COVID19Update 82 65 Cr  vaccine doses administered so far under Nationwide Vaccination DriveActive cases account for less than 1  of total cases  currently at 0 90   lowest since March 2020Active caseload stands at 3 01 989  lowest in 186 days MoHFW INDIA COVIDNewsByMIB https   t co RU4LTZBxQ3,
14,hi,1440524288742748166,1397181380719611909, OfficeOfAdeshG  adeshguptabjp  narendramodi  JPNadda  AmitShah  PandaJay  alka gurjar  siddharthanbjp  RamvirBidhuri  hdmalhotra  dineshpratapbjp  kuljeetschahal मेरा अध्यक्ष मेरा अभिमान,1440545578467815428,False, OfficeOfAdeshG  adeshguptabjp  narendramodi  JPNadda  AmitShah  PandaJay  alka gurjar  siddharthanbjp  RamvirBidhuri  hdmalhotra  dineshpratapbjp  kuljeetschahal मेरा अध्यक्ष मेरा अभिमान,2021-09-22T05:16:44.000Z,India,@OfficeOfAdeshG @adeshguptabjp @narendramodi @JPNadda @AmitShah @PandaJay @alka_gurjar @siddharthanbjp @RamvirBidhuri @hdmalhotra @dineshpratapbjp @kuljeetschahal मेरा अध्यक्ष मेरा अभिमान,[],[],"['OfficeOfAdeshG', 'adeshguptabjp', 'narendramodi', 'JPNadda', 'AmitShah', 'PandaJay', 'alka_gurjar', 'siddharthanbjp']",['https://t.co/IjB1IvRuqg'],,
15,hi,1440518491338018821,337065278, BJP4Delhi  adeshguptabjp केजरीवाल भगाओ दिल्ली बचाओ अभियान जरूरी है,1440630554878042122,False, BJP4Delhi  adeshguptabjp केजरीवाल भगाओ दिल्ली बचाओ अभियान जरूरी है,2021-09-22T10:54:24.000Z,India,@BJP4Delhi @adeshguptabjp केजरीवाल भगाओ दिल्ली बचाओ अभियान जरूरी है,[],[],"['BJP4Delhi', 'adeshguptabjp']",[],,
16,en,1440434797776498699,1040176943818268672, TejpalRanaGzb Congratulations,1440519360720687107,False,,2021-09-22T03:32:33.000Z,India,@TejpalRanaGzb Congratulations,[],[],['TejpalRanaGzb'],[], TejpalRanaGzb Congratulations,
17,hi,1440373272562921478,918781224839032832, KanuDesai180 Pehle road bana vapi pardi Valsad Ke  Baad me bol bachchan de,1440374858953592833,False, KanuDesai180 Pehle road bana vapi pardi Valsad Ke  Baad me bol bachchan de,2021-09-21T17:58:21.000Z,India,@KanuDesai180 Pehle road bana vapi pardi Valsad Ke. Baad me bol bachchan de,[],[],['KanuDesai180'],[],,
18,hi,1440369568686301188,978941133383454726, jabalpurdm  karmveer2010 Sir aap panna se kya gaye  panna me sanghi hi sanghi chhaye huye hai ,1440371532727873544,False, jabalpurdm  karmveer2010 Sir aap panna se kya gaye  panna me sanghi hi sanghi chhaye huye hai ,2021-09-21T17:45:08.000Z,India,@jabalpurdm @karmveer2010 Sir aap panna se kya gaye #panna me sanghi hi sanghi chhaye huye hai.,[],['panna'],"['jabalpurdm', 'karmveer2010']",[],,
19,hi,1440349450447192076,1231898968352788481, Motisinghpate17  Nareshfiroda2  BertyThomas  JansamparkMP फेसबुक पर है  ,1440494165935067143,False, Motisinghpate17  Nareshfiroda2  BertyThomas  JansamparkMP फेसबुक पर है  ,2021-09-22T01:52:26.000Z,India,@Motisinghpate17 @Nareshfiroda2 @BertyThomas @JansamparkMP फेसबुक पर है||,[],[],"['Motisinghpate17', 'Nareshfiroda2', 'BertyThomas', 'JansamparkMP']",[],,
20,hi,1440349450447192076,1231898968352788481, Nareshfiroda2  BertyThomas  JansamparkMP नरसिंहपुर की लिस्ट भी डालिए न जी,1440350553389682701,False, Nareshfiroda2  BertyThomas  JansamparkMP नरसिंहपुर की लिस्ट भी डालिए न जी,2021-09-21T16:21:47.000Z,India,@Nareshfiroda2 @BertyThomas @JansamparkMP नरसिंहपुर की लिस्ट भी डालिए न जी,[],[],"['Nareshfiroda2', 'BertyThomas', 'JansamparkMP']",[],,
21,hi,1440345662248292354,1030007156, anujakapurindia  iAmritapandey   adeshguptabjp  OfficeOfAdeshG  siddharthanbjp  BJP4India  BJP4Delhi  kuljeetschahal  AshokGoelBJP  Rajan Tewari  alka gurjar बहुत बहुत बधाई,1440352547227639813,False, anujakapurindia  iAmritapandey   adeshguptabjp  OfficeOfAdeshG  siddharthanbjp  BJP4India  BJP4Delhi  kuljeetschahal  AshokGoelBJP  Rajan Tewari  alka gurjar बहुत बहुत बधाई,2021-09-21T16:29:42.000Z,India,@anujakapurindia @iAmritapandey_ @adeshguptabjp @OfficeOfAdeshG @siddharthanbjp @BJP4India @BJP4Delhi @kuljeetschahal @AshokGoelBJP @Rajan_Tewari @alka_gurjar बहुत-बहुत बधाई,[],[],"['anujakapurindia', 'iAmritapandey_', 'adeshguptabjp', 'OfficeOfAdeshG', 'siddharthanbjp', 'BJP4India', 'BJP4Delhi']",['https://t.co/xPtmgpOb23'],,
22,en,1440324216134328327,1248189719474663425, ChapraTak  nildeoreIAS  Saran dm  NitishKumar  mangalpandeybjp  KaushalAliKhan Congratulations Saran ,1440654796143271949,False,,2021-09-22T12:30:44.000Z,India,@ChapraTak @nildeoreIAS @Saran_dm @NitishKumar @mangalpandeybjp @KaushalAliKhan Congratulations Saran 👏👏🎉💐,"['🎉', '👏', '💐']",[],"['ChapraTak', 'nildeoreIAS', 'Saran_dm', 'NitishKumar', 'mangalpandeybjp', 'KaushalAliKhan']",[], ChapraTak  nildeoreIAS  Saran dm  NitishKumar  mangalpandeybjp  KaushalAliKhan Congratulations Saran ,
23,hi,1440324216134328327,1248189719474663425, ChapraTak  nildeoreIAS  Saran dm  NitishKumar  mangalpandeybjp  KaushalAliKhan बधाई हो आपको।,1440627077938442244,False, ChapraTak  nildeoreIAS  Saran dm  NitishKumar  mangalpandeybjp  KaushalAliKhan बधाई हो आपको।,2021-09-22T10:40:35.000Z,India,@ChapraTak @nildeoreIAS @Saran_dm @NitishKumar @mangalpandeybjp @KaushalAliKhan बधाई हो आपको।,[],[],"['ChapraTak', 'nildeoreIAS', 'Saran_dm', 'NitishKumar', 'mangalpandeybjp', 'KaushalAliKhan']",[],,
24,hi,1440278306805280780,1490828047, NsDewal गहलोत सरकार की कार्यप्रणाली तो देखिएचयनित छात्र 8महिने इंतजार के बाद 69दिन से  REET2018 धरनाप्रदर्शन बीकानेर धरना दे रहे है ओर मिल रही है तारीख पे तारीख REET2018 JOINING DO  NsDewalआपसे सहयोग की अपेक्षा है https   t co WxR5K6t8Rx,1440282148959768581,False, NsDewal गहलोत सरकार की कार्यप्रणाली तो देखिएचयनित छात्र 8महिने इंतजार के बाद 69दिन से  REET2018 धरनाप्रदर्शन बीकानेर धरना दे रहे है ओर मिल रही है तारीख पे तारीख REET2018 JOINING DO  NsDewalआपसे सहयोग की अपेक्षा है https   t co WxR5K6t8Rx,2021-09-21T11:49:58.000Z,India,"@NsDewal गहलोत सरकार की कार्यप्रणाली तो देखिए
चयनित छात्र 8महिने इंतजार के बाद 69दिन से #REET2018_धरनाप्रदर्शन_बीकानेर धरना दे रहे है ओर मिल रही है तारीख पे तारीख
#REET2018_JOINING_DO 

@NsDewal
आपसे सहयोग की अपेक्षा है🙏🙏
 https://t.co/WxR5K6t8Rx",['🙏'],[],['NsDewal'],['https://t.co/dC2CBVuCrS'],,
25,en,1440259319899983885,2596143056, MoHFW INDIA  PMOIndia  mansukhmandviya  ianuragthakur Abusing Female MBBS students in lecture by Haryana govt prof Sumit kumar show how concerned is  cmohry towards safety of women  Beti Bachao Beti Padhao  slogan is just for votes  Terminate sumitkumar  bpsgmc harassment  PMOIndia  EduMinOfIndia  IMAIndiaOrg  NMC INdHelp https   t co 0jl0UwJeY3,1440260454052368394,False,,2021-09-21T10:23:45.000Z,India,"@MoHFW_INDIA @PMOIndia @mansukhmandviya @ianuragthakur Abusing Female MBBS students in lecture by Haryana govt prof Sumit kumar show how concerned is @cmohry towards safety of women.""Beti Bachao Beti Padhao"" slogan is just for votes?

#Terminate_sumitkumar #bpsgmc_harassment @PMOIndia @EduMinOfIndia @IMAIndiaOrg @NMC_INd
Help https://t.co/0jl0UwJeY3",[],[],"['MoHFW_INDIA', 'PMOIndia', 'mansukhmandviya', 'ianuragthakur']",['https://t.co/SKo16O05oA'], MoHFW INDIA  PMOIndia  mansukhmandviya  ianuragthakur Abusing Female MBBS students in lecture by Haryana govt prof Sumit kumar show how concerned is  cmohry towards safety of women  Beti Bachao Beti Padhao  slogan is just for votes  Terminate sumitkumar  bpsgmc harassment  PMOIndia  EduMinOfIndia  IMAIndiaOrg  NMC INdHelp https   t co 0jl0UwJeY3,
