,tweet_lang,replied_to_tweet_id,replied_to_user_id,reply_text,id,verified,text_hi,tweet_date,country,tweet_text,tweet_emoticons,hashtags,mentions,tweet_urls,text_en,text_es
26,hi,1440255796005146625,375777758, vdsharmabjp धार जिला बहुत बड़ा जिला है मेडिकल कॉलेज खुलवाने की कृपा करें इसका लाभ अलीराजपुर झाबुआ  बड़वानी जिलों को भी मिलेगा,1440425831596052480,False, vdsharmabjp धार जिला बहुत बड़ा जिला है मेडिकल कॉलेज खुलवाने की कृपा करें इसका लाभ अलीराजपुर झाबुआ  बड़वानी जिलों को भी मिलेगा,2021-09-21T21:20:54.000Z,India,@vdsharmabjp धार जिला बहुत बड़ा जिला है मेडिकल कॉलेज खुलवाने की कृपा करें इसका लाभ अलीराजपुर/झाबुआ/ बड़वानी जिलों को भी मिलेगा,[],[],['vdsharmabjp'],[],,
27,hi,1440255796005146625,375777758, vdsharmabjp मोदी है तो मुमकिन है,1440376226867126272,False, vdsharmabjp मोदी है तो मुमकिन है,2021-09-21T18:03:48.000Z,India,@vdsharmabjp मोदी है तो मुमकिन है,[],[],['vdsharmabjp'],[],,
28,hi,1440239834488999941,1021250639769358339, bjpsanjaybhatia मोदी है तो मुमकिन है,1440308959965970443,False, bjpsanjaybhatia मोदी है तो मुमकिन है,2021-09-21T13:36:30.000Z,India,@bjpsanjaybhatia मोदी है तो मुमकिन है,[],[],['bjpsanjaybhatia'],[],,
29,hi,1440237538556272646,1077892500625473538, SantoshCbjp  schaurasiabjp  BJP4India  bhikhubhaidbjp  bjp4 patna  BJP4Bihar  JPNadda  narendramodi सक्षम नेतृत्व का परिणाम है,1440240496492695558,False, SantoshCbjp  schaurasiabjp  BJP4India  bhikhubhaidbjp  bjp4 patna  BJP4Bihar  JPNadda  narendramodi सक्षम नेतृत्व का परिणाम है,2021-09-21T09:04:27.000Z,India,@SantoshCbjp @schaurasiabjp @BJP4India @bhikhubhaidbjp @bjp4_patna @BJP4Bihar @JPNadda @narendramodi सक्षम नेतृत्व का परिणाम है,[],[],"['SantoshCbjp', 'schaurasiabjp', 'BJP4India', 'bhikhubhaidbjp', 'bjp4_patna', 'BJP4Bihar', 'JPNadda', 'narendramodi']",[],,
30,hi,1440233199494303748,1675401614, AkashVOnline  narendramodi जय हो,1440768334039957504,False, AkashVOnline  narendramodi जय हो,2021-09-22T20:01:53.000Z,India,@AkashVOnline @narendramodi जय हो,[],[],"['AkashVOnline', 'narendramodi']",[],,
31,hi,1440233199494303748,1675401614, AkashVOnline  narendramodi प्रधानसेवक आ   narendramodi जी जिंदाबाद  संवेदनशील विधायक श्री  AkashVOnline जिंदाबाद  ,1440764686488649736,False, AkashVOnline  narendramodi प्रधानसेवक आ   narendramodi जी जिंदाबाद  संवेदनशील विधायक श्री  AkashVOnline जिंदाबाद  ,2021-09-22T19:47:24.000Z,India,"@AkashVOnline @narendramodi प्रधानसेवक आ. @narendramodi जी जिंदाबाद..💪😊🚩
संवेदनशील विधायक श्री @AkashVOnline जिंदाबाद..✌️💐🙏","['🙏', '✌️', '💐', '💪', '😊', '🚩']",[],"['AkashVOnline', 'narendramodi', 'narendramodi', 'AkashVOnline']",[],,
32,hi,1440206889061474313,988665875686359040, dc garhwa  JharkhandCMO  prdjharkhand  iprd garhwa https   t co OvF4PxwLHB aapke kshetra ka case hai ise bhi dekhne ki kripa karein,1440227415083548672,False, dc garhwa  JharkhandCMO  prdjharkhand  iprd garhwa https   t co OvF4PxwLHB aapke kshetra ka case hai ise bhi dekhne ki kripa karein,2021-09-21T08:12:28.000Z,India,@dc_garhwa @JharkhandCMO @prdjharkhand @iprd_garhwa https://t.co/OvF4PxwLHB aapke kshetra ka case hai ise bhi dekhne ki kripa karein,[],[],"['dc_garhwa', 'JharkhandCMO', 'prdjharkhand', 'iprd_garhwa']",['https://t.co/OvF4PxwLHB'],,
33,hi,1440206889061474313,988665875686359040, dc garhwa  JharkhandCMO  prdjharkhand  iprd garhwa सर जी रपुरा गांव के ग्रामीण बहुत कष्ट भरी जिंदगी जी रहे अच्छी सड़क ना होने के कारण लोग कैसे जाएंगे नजदीकी टीकाकरण केन्द्र वैक्सीन लेने।।  https   t co wShy5mnGaT,1440212109179060224,False, dc garhwa  JharkhandCMO  prdjharkhand  iprd garhwa सर जी रपुरा गांव के ग्रामीण बहुत कष्ट भरी जिंदगी जी रहे अच्छी सड़क ना होने के कारण लोग कैसे जाएंगे नजदीकी टीकाकरण केन्द्र वैक्सीन लेने।।  https   t co wShy5mnGaT,2021-09-21T07:11:39.000Z,India,"@dc_garhwa @JharkhandCMO @prdjharkhand @iprd_garhwa सर जी,
रपुरा गांव के ग्रामीण बहुत कष्ट भरी जिंदगी जी रहे अच्छी सड़क ना होने के कारण लोग कैसे जाएंगे नजदीकी टीकाकरण केन्द्र वैक्सीन लेने।।,🙏🙏 https://t.co/wShy5mnGaT",['🙏'],[],"['dc_garhwa', 'JharkhandCMO', 'prdjharkhand', 'iprd_garhwa']",['https://t.co/lZKCVtNR2Z'],,
34,hi,1440187953095929860,874241422265769984, IPRD Bihar  PMOIndia  MoHFW INDIA  mangalpandeybjp  NanaPatekar Ek Machhar Aadmi ko Hizra bana deta hai  Oise Hni  Chor  CMBiharOffice System ko Chor bana Dia hai  Kya Sare hni  IASassociation  IPS Association Chor hai  NitishKumar Sarkar me 2008 se   bihar police  DGPBiharSKSinghal vi  ECISVEEP ka  dm vaishali Why,1440215981175894025,False, IPRD Bihar  PMOIndia  MoHFW INDIA  mangalpandeybjp  NanaPatekar Ek Machhar Aadmi ko Hizra bana deta hai  Oise Hni  Chor  CMBiharOffice System ko Chor bana Dia hai  Kya Sare hni  IASassociation  IPS Association Chor hai  NitishKumar Sarkar me 2008 se   bihar police  DGPBiharSKSinghal vi  ECISVEEP ka  dm vaishali Why,2021-09-21T07:27:02.000Z,India,"@IPRD_Bihar @PMOIndia @MoHFW_INDIA @mangalpandeybjp #NanaPatekar 

Ek Machhar Aadmi ko Hizra bana deta hai. 

Oise Hni #Chor @CMBiharOffice 

System ko Chor bana Dia hai. 

Kya Sare hni @IASassociation @IPS_Association Chor hai @NitishKumar Sarkar me 2008 se. 

@bihar_police 
#DGPBiharSKSinghal vi 

@ECISVEEP ka @dm_vaishali 
Why",[],['NanaPatekar'],"['IPRD_Bihar', 'PMOIndia', 'MoHFW_INDIA', 'mangalpandeybjp']",['https://t.co/eL4b3vJjOt'],,
35,en,1440187329377804294,1135503797025828864, BiharHealthDept  PMOIndia  MoHFW INDIA  mangalpandeybjp  MoHFW INDIA  mansukhmandviya I have not yet received the second dose of vaccine but the cowin portal is giving me the certificate that I am fully vaccinated what s this scam is   narendramodi   NitishKumar  mangalpandeybjp  yadavtejashwi  manojkjhadu  ajitanjum  nawal ias,1440343495269490695,False,,2021-09-21T15:53:44.000Z,India,@BiharHealthDept @PMOIndia @MoHFW_INDIA @mangalpandeybjp @MoHFW_INDIA @mansukhmandviya I have not yet received the second dose of vaccine but the cowin portal is giving me the certificate that I am fully vaccinated.what's this scam is? @narendramodi  @NitishKumar @mangalpandeybjp @yadavtejashwi @manojkjhadu @ajitanjum @nawal_ias,[],[],"['BiharHealthDept', 'PMOIndia', 'MoHFW_INDIA', 'mangalpandeybjp', 'MoHFW_INDIA', 'mansukhmandviya']",['https://t.co/gXepLbeW7N'], BiharHealthDept  PMOIndia  MoHFW INDIA  mangalpandeybjp  MoHFW INDIA  mansukhmandviya I have not yet received the second dose of vaccine but the cowin portal is giving me the certificate that I am fully vaccinated what s this scam is   narendramodi   NitishKumar  mangalpandeybjp  yadavtejashwi  manojkjhadu  ajitanjum  nawal ias,
36,hi,1440187329377804294,1135503797025828864, BiharHealthDept  PMOIndia  MoHFW INDIA  mangalpandeybjp  IPRD Bihar  NitishKumar  परिवार संख्या  9999901291120191368 है जिसकी तीन चार चरणों में सुनवाई होने के बाद DWO Madhepura को आज्ञा दिया के जल्द से जल्द इनकी समस्या का समाधान की जाए लेकिन 4 से 5 महीना होने के बावजूद भी कोई कार्रवाई नहीं हो पाई हैपोस्ट मैट्रिक स्कॉलरशिप 2015 16,1440190071173378048,False, BiharHealthDept  PMOIndia  MoHFW INDIA  mangalpandeybjp  IPRD Bihar  NitishKumar  परिवार संख्या  9999901291120191368 है जिसकी तीन चार चरणों में सुनवाई होने के बाद DWO Madhepura को आज्ञा दिया के जल्द से जल्द इनकी समस्या का समाधान की जाए लेकिन 4 से 5 महीना होने के बावजूद भी कोई कार्रवाई नहीं हो पाई हैपोस्ट मैट्रिक स्कॉलरशिप 2015 16,2021-09-21T05:44:05.000Z,India,"@BiharHealthDept @PMOIndia @MoHFW_INDIA @mangalpandeybjp @IPRD_Bihar @NitishKumar  परिवार संख्या- 9999901291120191368 है जिसकी तीन चार चरणों में सुनवाई होने के बाद DWO Madhepura को आज्ञा दिया के जल्द से जल्द इनकी समस्या का समाधान की जाए लेकिन 4 से 5 महीना होने के बावजूद भी कोई कार्रवाई नहीं हो पाई है
पोस्ट मैट्रिक स्कॉलरशिप 2015-16",[],[],"['BiharHealthDept', 'PMOIndia', 'MoHFW_INDIA', 'mangalpandeybjp', 'IPRD_Bihar', 'NitishKumar']",['https://t.co/jxEVhEwknY'],,
37,en,1440187281382408198,3000838099, PIBHindi  MoHFW INDIA  MIB Hindi  DDNewsHindi A war for the survival of Islam will happen  and this war will be the beginning of rise of Islam and Imam Al Mahdi will lead this  Pakistan will save Islam in the coming future  Many of Muhammad Qasim’s dreams are already coming true  Learn more at https   t co X1q1JyvvvH https   t co QyLKADljyS,1440200015117373440,False,,2021-09-21T06:23:35.000Z,India,"@PIBHindi @MoHFW_INDIA @MIB_Hindi @DDNewsHindi A war for the survival of Islam will happen, and this war will be the beginning of rise of Islam and Imam Al-Mahdi will lead this. Pakistan will save Islam in the coming future. Many of Muhammad Qasim’s dreams are already coming true. Learn more at https://t.co/X1q1JyvvvH https://t.co/QyLKADljyS",[],[],"['PIBHindi', 'MoHFW_INDIA', 'MIB_Hindi', 'DDNewsHindi']",['https://t.co/vM1HoR5rcm'], PIBHindi  MoHFW INDIA  MIB Hindi  DDNewsHindi A war for the survival of Islam will happen  and this war will be the beginning of rise of Islam and Imam Al Mahdi will lead this  Pakistan will save Islam in the coming future  Many of Muhammad Qasim’s dreams are already coming true  Learn more at https   t co X1q1JyvvvH https   t co QyLKADljyS,
38,hi,1440176968511594502,989167155454197760, LaxmiGiriBJP  BJP4MP  BJP4India  PMOIndia  narendramodi मोदी जी है तो मुमकिन है,1440193011082661891,False, LaxmiGiriBJP  BJP4MP  BJP4India  PMOIndia  narendramodi मोदी जी है तो मुमकिन है,2021-09-21T05:55:45.000Z,India,@LaxmiGiriBJP @BJP4MP @BJP4India @PMOIndia @narendramodi मोदी जी है तो मुमकिन है,[],[],"['LaxmiGiriBJP', 'BJP4MP', 'BJP4India', 'PMOIndia', 'narendramodi']",[],,
39,hi,1440173734115962892,42606652, aajtak दोनों में छत्तीसगढ़ का पहले और दूसरे डोज का  parcent कहा है ,1440193610717143042,False, aajtak दोनों में छत्तीसगढ़ का पहले और दूसरे डोज का  parcent कहा है ,2021-09-21T05:58:08.000Z,India,@aajtak दोनों में छत्तीसगढ़ का पहले और दूसरे डोज का  parcent कहा है?,[],[],['aajtak'],[],,
40,hi,1440022281732820993,1280386575793340417, JaivirRanaBJP  JPNadda  mansukhmandviya  adeshguptabjp  narendramodi  AmitShah  BJP4India  BJP4Delhi  siddharthanbjp  OfficeofJPNadda  OfficeOfAdeshG Jai shri ram,1440281631391031299,False, JaivirRanaBJP  JPNadda  mansukhmandviya  adeshguptabjp  narendramodi  AmitShah  BJP4India  BJP4Delhi  siddharthanbjp  OfficeofJPNadda  OfficeOfAdeshG Jai shri ram,2021-09-21T11:47:54.000Z,India,@JaivirRanaBJP @JPNadda @mansukhmandviya @adeshguptabjp @narendramodi @AmitShah @BJP4India @BJP4Delhi @siddharthanbjp @OfficeofJPNadda @OfficeOfAdeshG Jai shri ram,[],[],"['JaivirRanaBJP', 'JPNadda', 'mansukhmandviya', 'adeshguptabjp', 'narendramodi', 'AmitShah', 'BJP4India', 'BJP4Delhi']",['https://t.co/aEMnsa1Wwg'],,
41,hi,1440022281732820993,1280386575793340417, JaivirRanaBJP  JPNadda  mansukhmandviya  adeshguptabjp  narendramodi  AmitShah  BJP4India  BJP4Delhi  siddharthanbjp  OfficeofJPNadda  OfficeOfAdeshG मोदी है तो मुमकिन हैभारतीय जनता पार्टी जिंदाबाद,1440215756256395265,False, JaivirRanaBJP  JPNadda  mansukhmandviya  adeshguptabjp  narendramodi  AmitShah  BJP4India  BJP4Delhi  siddharthanbjp  OfficeofJPNadda  OfficeOfAdeshG मोदी है तो मुमकिन हैभारतीय जनता पार्टी जिंदाबाद,2021-09-21T07:26:08.000Z,India,@JaivirRanaBJP @JPNadda @mansukhmandviya @adeshguptabjp @narendramodi @AmitShah @BJP4India @BJP4Delhi @siddharthanbjp @OfficeofJPNadda @OfficeOfAdeshG मोदी है तो मुमकिन हैभारतीय जनता पार्टी जिंदाबाद,[],[],"['JaivirRanaBJP', 'JPNadda', 'mansukhmandviya', 'adeshguptabjp', 'narendramodi', 'AmitShah', 'BJP4India', 'BJP4Delhi']",['https://t.co/xtGvyJd0u5'],,
42,en,1439997375972405256,1346482930596495361, DmJamui Thankyou sir,1440000963754934277,False,,2021-09-20T17:12:38.000Z,India,@DmJamui Thankyou sir,[],[],['DmJamui'],[], DmJamui Thankyou sir,
43,hi,1439997375972405256,1346482930596495361, DmJamui   जमुई में  जच्चा   बच्चा की  मौत डॉ पर  लापरवाही का  आरोप  लगाकर  परिजनों ने  घंटों  काटा  बबाल https   t co PZqdJFFLvt अगर आपने अभी तक हमारा यूट्यूब चैनल को सब्सक्राइब नहीं किया है तो कर ले और वीडियो अच्छी लगे तो दोस्तों के साथ खूब शेयर करें धन्यवाद ,1439998990041321478,False, DmJamui   जमुई में  जच्चा   बच्चा की  मौत डॉ पर  लापरवाही का  आरोप  लगाकर  परिजनों ने  घंटों  काटा  बबाल https   t co PZqdJFFLvt अगर आपने अभी तक हमारा यूट्यूब चैनल को सब्सक्राइब नहीं किया है तो कर ले और वीडियो अच्छी लगे तो दोस्तों के साथ खूब शेयर करें धन्यवाद ,2021-09-20T17:04:47.000Z,India,"@DmJamui *#जमुई में #जच्चा - बच्चा की #मौत डॉ पर #लापरवाही का #आरोप #लगाकर #परिजनों ने #घंटों #काटा #बबाल*

https://t.co/PZqdJFFLvt

*अगर आपने अभी तक हमारा यूट्यूब चैनल को सब्सक्राइब नहीं किया है तो कर ले और वीडियो अच्छी लगे तो दोस्तों के साथ खूब शेयर करें धन्यवाद*",[],"['जमुई', 'जच्चा', 'मौत', 'लापरवाही', 'आरोप', 'लगाकर', 'परिजनों', 'घंटों', 'काटा', 'बबाल']",['DmJamui'],['https://t.co/xGiJbb3dG1'],,
44,hi,1439985653907812355,4849020680,बधाई देता हूं। https   t co CQRwPHd2Xc  BhargavBhatt9,1439985656831234051,False,बधाई देता हूं। https   t co CQRwPHd2Xc  BhargavBhatt9,2021-09-20T16:11:48.000Z,India,बधाई देता हूं। https://t.co/CQRwPHd2Xc @BhargavBhatt9,[],[],['BhargavBhatt9'],[],,
45,hi,1439982166008422405,1065509007996014592, DmAraria  BiharHealthDept  IPRD Bihar  NitishKumar जिला स्तर पर अनियोजित कार्यपालक सहायक का मामला है। जिसमे महोदय जिला स्तर पर आदेश जारी करने को कह रहे है लेकिन अधिकारी मुख्यमंत्री के आदेश को भी नही सुन रहे है https   t co DC5ywvTT9t  अनियोजित कार्यपालक सहायक  yadavtejashwi  activistritu  Sandeep Saurav   BEASA BIHAR,1439988734368251905,False, DmAraria  BiharHealthDept  IPRD Bihar  NitishKumar जिला स्तर पर अनियोजित कार्यपालक सहायक का मामला है। जिसमे महोदय जिला स्तर पर आदेश जारी करने को कह रहे है लेकिन अधिकारी मुख्यमंत्री के आदेश को भी नही सुन रहे है https   t co DC5ywvTT9t  अनियोजित कार्यपालक सहायक  yadavtejashwi  activistritu  Sandeep Saurav   BEASA BIHAR,2021-09-20T16:24:02.000Z,India,@DmAraria @BiharHealthDept @IPRD_Bihar @NitishKumar जिला स्तर पर अनियोजित कार्यपालक सहायक का मामला है। जिसमे महोदय जिला स्तर पर आदेश जारी करने को कह रहे है लेकिन अधिकारी मुख्यमंत्री के आदेश को भी नही सुन रहे है https://t.co/DC5ywvTT9t #अनियोजित_कार्यपालक_सहायक @yadavtejashwi @activistritu @Sandeep_Saurav_ @BEASA_BIHAR,[],[],"['DmAraria', 'BiharHealthDept', 'IPRD_Bihar', 'NitishKumar']",['https://t.co/kwSoLTM5SX'],,
46,hi,1439958314230575106,1151008746098663425, mp rohtak  narendramodi जय श्री राम,1440252970025635844,False, mp rohtak  narendramodi जय श्री राम,2021-09-21T09:54:01.000Z,India,@mp_rohtak @narendramodi जय श्री राम,[],[],"['mp_rohtak', 'narendramodi']",[],,
47,hi,1439958314230575106,1151008746098663425, mp rohtak  narendramodi मोदी है तो मुमकिन है,1439961413271711747,False, mp rohtak  narendramodi मोदी है तो मुमकिन है,2021-09-20T14:35:28.000Z,India,@mp_rohtak @narendramodi मोदी है तो मुमकिन है,[],[],"['mp_rohtak', 'narendramodi']",[],,
48,hi,1439958242679922688,886595120488992773,जिसमें से 379042 लोगों को प्रथम डोज तथा 91240 को द्वितीय डोज लगाया जा चुका है। मुख्य चिकित्सा अधिकारी डॉ  सुधीर जैसानी ने बताया कि जिले में 18 वर्ष से अधिक आयु के नागरिकों की संख्या 420435 है।,1439958244999323650,True,जिसमें से 379042 लोगों को प्रथम डोज तथा 91240 को द्वितीय डोज लगाया जा चुका है। मुख्य चिकित्सा अधिकारी डॉ  सुधीर जैसानी ने बताया कि जिले में 18 वर्ष से अधिक आयु के नागरिकों की संख्या 420435 है।,2021-09-20T14:22:53.000Z,India,जिसमें से 379042 लोगों को प्रथम डोज तथा 91240 को द्वितीय डोज लगाया जा चुका है। मुख्य चिकित्सा अधिकारी डॉ. सुधीर जैसानी ने बताया कि जिले में 18 वर्ष से अधिक आयु के नागरिकों की संख्या 420435 है।,[],[],[],['https://t.co/HBG6w8NqNd'],,
49,hi,1439949773625196551,3025447023, AKalraj   narendramodi  AmitShah  JPNadda  myogiadityanath  myogioffice  swatantrabjp  mansukhmandviya  kpmaurya1  drdineshbjp  sunilbansalbjp मोदी हैं तो मुमकिन है।नमो नमो ,1439950832502390790,False, AKalraj   narendramodi  AmitShah  JPNadda  myogiadityanath  myogioffice  swatantrabjp  mansukhmandviya  kpmaurya1  drdineshbjp  sunilbansalbjp मोदी हैं तो मुमकिन है।नमो नमो ,2021-09-20T13:53:26.000Z,India,"@AKalraj_ @narendramodi @AmitShah @JPNadda @myogiadityanath @myogioffice @swatantrabjp @mansukhmandviya @kpmaurya1 @drdineshbjp @sunilbansalbjp मोदी हैं तो मुमकिन है।

नमो नमो 🇮🇳🙏","['🙏', '🇮🇳']",[],"['AKalraj_', 'narendramodi', 'AmitShah', 'JPNadda', 'myogiadityanath', 'myogioffice', 'swatantrabjp', 'mansukhmandviya', 'kpmaurya1']",['https://t.co/3WqqruK8wy'],,
50,hi,1439938843822546949,3123339037, TRUTHANDMIRRORR आपकी तकलीफ एकदम जायज है,1439950927423631365,False, TRUTHANDMIRRORR आपकी तकलीफ एकदम जायज है,2021-09-20T13:53:48.000Z,India,@TRUTHANDMIRRORR आपकी तकलीफ एकदम जायज है,[],[],['TRUTHANDMIRRORR'],[],,
51,hi,1439937389959413762,64639742, JagranNews  JPNadda नड्डा जी टीका करण बाला आंकरा क्या सही है दिन रात करौना टीकाकरण की बात छोड़िए मंहगाई भ्रष्टाचार अराजकता आर्थिक अराजकता बेरोजगारी वगैरह वगैरह पर ध्यान दिजिए,1439985059650437123,False, JagranNews  JPNadda नड्डा जी टीका करण बाला आंकरा क्या सही है दिन रात करौना टीकाकरण की बात छोड़िए मंहगाई भ्रष्टाचार अराजकता आर्थिक अराजकता बेरोजगारी वगैरह वगैरह पर ध्यान दिजिए,2021-09-20T16:09:26.000Z,India,"@JagranNews @JPNadda नड्डा जी टीका करण बाला आंकरा 
क्या सही है 
दिन रात करौना टीकाकरण की बात छोड़िए 
मंहगाई भ्रष्टाचार अराजकता आर्थिक अराजकता बेरोजगारी वगैरह-वगैरह पर ध्यान 
दिजिए",[],[],"['JagranNews', 'JPNadda']",['https://t.co/JbWo4eznjV'],,
