,tweet_lang,poi_name,poi_id,verified,id,tweet_text,tweet_emoticons,hashtags,mentions,tweet_urls,country,text_es,tweet_date
53,es,tatclouthier,33937794,True,1415917180147970050,Felicidades @M_OlgaSCordero . Por muchos años saludables más. https://t.co/sSfdifPPwk,[],[],['M_OlgaSCordero'],[],Mexico,Felicidades  M OlgaSCordero   Por muchos años saludables más  https   t co sSfdifPPwk,2021-07-16 06:00:00
54,es,tatclouthier,33937794,True,1415874326864306184,"Muy content@s en @SE_mx con el lanzamiento de la plataforma “Habilidades Digitales para las Mexicanas del Siglo XXI”, en conjunto con @CiscoNetAcad y @JovConFuturo. El programa va desde alfabetización digital hasta capacidades avanzadas. Inscríbete aquí 👇🏼
https://t.co/m7RrMUkEeM https://t.co/YWChU4SiFl",['👇🏼'],[],"['SE_mx', 'CiscoNetAcad', 'JovConFuturo']",['https://t.co/m7RrMUkEeM'],Mexico,Muy content s en  SE mx con el lanzamiento de la plataforma “Habilidades Digitales para las Mexicanas del Siglo XXI”  en conjunto con  CiscoNetAcad y  JovConFuturo  El programa va desde alfabetización digital hasta capacidades avanzadas  Inscríbete aquí https   t co m7RrMUkEeM https   t co YWChU4SiFl,2021-07-16 03:00:00
55,es,tatclouthier,33937794,True,1415666614448525317,Comenzamos el día participando en la reunión Ministerial sobre negociaciones de las subvenciones a la pesca en la @OMC_es.  Reiteramos nuestro compromiso de concluir estas negociaciones a la mayor brevedad y en cumplimiento al Objetivo de Desarrollo Sostenible 14.6. https://t.co/2dMtww1kLk,[],[],['OMC_es'],[],Mexico,Comenzamos el día participando en la reunión Ministerial sobre negociaciones de las subvenciones a la pesca en la  OMC es   Reiteramos nuestro compromiso de concluir estas negociaciones a la mayor brevedad y en cumplimiento al Objetivo de Desarrollo Sostenible 14 6  https   t co 2dMtww1kLk,2021-07-15 14:00:00
56,es,tatclouthier,33937794,True,1415533912500187137,Despedimos y recibimos a responsable del @el_BID en MX. Gracias x la cooperación y trabajo futuro. https://t.co/dOlQdxTLE5,[],[],['el_BID'],[],Mexico,Despedimos y recibimos a responsable del  el BID en MX  Gracias x la cooperación y trabajo futuro  https   t co dOlQdxTLE5,2021-07-15 05:00:00
57,es,tatclouthier,33937794,True,1415363495575556099,"Hoy nos reunimos los líderes sindicales y de recursos humanos y administrativos de la @SE_mx para revisar la estrategia de los regresos del personal, para fortalecer la reactivación económica. https://t.co/04Uz0eJrJ9",[],[],['SE_mx'],[],Mexico,Hoy nos reunimos los líderes sindicales y de recursos humanos y administrativos de la  SE mx para revisar la estrategia de los regresos del personal  para fortalecer la reactivación económica  https   t co 04Uz0eJrJ9,2021-07-14 18:00:00
58,es,tatclouthier,33937794,True,1414576657374060552,Buena semana...,[],[],[],[],Mexico,Buena semana   ,2021-07-12 13:00:00
59,es,tatclouthier,33937794,True,1414248814467223555,Con gusto felicitamos en su día a l@s mineros. Gran trabajo y  compromiso. Un abrazo grande a cada un@.,[],[],[],[],Mexico,Con gusto felicitamos en su día a l s mineros  Gran trabajo y  compromiso  Un abrazo grande a cada un  ,2021-07-11 16:00:00
60,es,tatclouthier,33937794,True,1413490522346373123,Gran reto: https://t.co/uzKOw2r0fE,[],[],[],['https://t.co/uzKOw2r0fE'],Mexico,Gran reto  https   t co uzKOw2r0fE,2021-07-09 13:00:00
61,es,tatclouthier,33937794,True,1412764475141365763,"Hoy con alegría recibimos a @AmbassadorTai y @mary_ng, para celebrar, evaluar y crear agendas en favor del comercio entre la región a un año del  #TMEC. Gracias a los equipos y en especial al de la @SE_mx por su trabajo cotidiano y compromiso a favor del país.",[],['TMEC'],"['AmbassadorTai', 'mary_ng', 'SE_mx']",[],Mexico,Hoy con alegría recibimos a  AmbassadorTai y  mary ng  para celebrar  evaluar y crear agendas en favor del comercio entre la región a un año del   TMEC  Gracias a los equipos y en especial al de la  SE mx por su trabajo cotidiano y compromiso a favor del país ,2021-07-07 13:00:00
62,es,tatclouthier,33937794,True,1412540843941056512,"Gracias al compromiso de la empresa, del sindicato y el gran trabajo de los equipos  de la @STPS_mx, @SEGOB_mx y @SE_mx, logramos caminar a este gran acuerdo para una comunidad. https://t.co/SsG5aR515c",[],[],"['STPS_mx', 'SEGOB_mx', 'SE_mx']",[],Mexico,Gracias al compromiso de la empresa  del sindicato y el gran trabajo de los equipos  de la  STPS mx   SEGOB mx y  SE mx  logramos caminar a este gran acuerdo para una comunidad  https   t co SsG5aR515c,2021-07-06 23:00:00
63,es,tatclouthier,33937794,True,1412095595221823488,Hoy nos reunimos para agradecer y revisar los avances con Inglaterra vía nuestra querida @CorinRobertson. Revisamos avances de @Agenda2030MX vinculados a género y medio ambiente. https://t.co/jb8KjxDSvP,['xD'],[],"['CorinRobertson', 'Agenda2030MX']",[],Mexico,Hoy nos reunimos para agradecer y revisar los avances con Inglaterra vía nuestra querida  CorinRobertson  Revisamos avances de  Agenda2030MX vinculados a género y medio ambiente  https   t co jb8KjSvP,2021-07-05 17:00:00
64,es,tatclouthier,33937794,True,1411064060737724416,Te esperamos: https://t.co/hvi5KaNglm,[],[],[],[],Mexico,Te esperamos  https   t co hvi5KaNglm,2021-07-02 21:00:00
65,es,tatclouthier,33937794,True,1410616234425470992,"Hoy es un día muy especial para 🇲🇽: hace 3 años se decidió un cambio importante en democracia; y comercialmente, hace un año entró en vigor el #TMEC. Gracias a quienes trabajaron desde sus rincones para estos dos grandes pasos.",['🇲🇽'],['TMEC'],[],[],Mexico,Hoy es un día muy especial para   hace 3 años se decidió un cambio importante en democracia  y comercialmente  hace un año entró en vigor el  TMEC  Gracias a quienes trabajaron desde sus rincones para estos dos grandes pasos ,2021-07-01 15:00:00
66,es,tatclouthier,33937794,True,1410598489344512003,"El primer aniversario del #TMEC🇲🇽🇺🇸🇨🇦nos encuentra a los países miembros como vecinos, socios y aliados; trabajando en una integración económica y productiva para mejorar la calidad de vida de nuestros ciudadan@s. Mi colaboración en @ElFinanciero_Mx

https://t.co/eSlL5urCYO","['🇺🇸', '🇨🇦', '🇲🇽']",['TMEC'],['ElFinanciero_Mx'],['https://t.co/eSlL5urCYO'],Mexico,El primer aniversario del  TMECnos encuentra a los países miembros como vecinos  socios y aliados  trabajando en una integración económica y productiva para mejorar la calidad de vida de nuestros ciudadan s  Mi colaboración en  ElFinanciero Mxhttps   t co eSlL5urCYO,2021-07-01 14:00:00
67,es,tatclouthier,33937794,True,1410364265052217351,"Encantada de reunirme con @AmbassadorTai y @mary_ng, para conversar sobre el primer año de implementación del #TMEC; herramienta fundamental para fortalecer nuestra relación comercial y enfrentar los efectos económicos de la pandemia por COVID-19. Gracias a @TheWilsonCenter.",[],['TMEC'],"['AmbassadorTai', 'mary_ng', 'TheWilsonCenter']",[],Mexico,Encantada de reunirme con  AmbassadorTai y  mary ng  para conversar sobre el primer año de implementación del  TMEC  herramienta fundamental para fortalecer nuestra relación comercial y enfrentar los efectos económicos de la pandemia por COVID 19  Gracias a  TheWilsonCenter ,2021-06-30 22:00:00
68,es,tatclouthier,33937794,True,1406239199133679616,Anoche me reuní con un grupo empresarial de #Tlaxcala. Presentaron áreas de oportunidad  para crecer y presumieron su talento en TI y compromiso por fortalecer la economía circular y el turismo con historia y ligado a la  gastronomía.,[],['Tlaxcala'],[],[],Mexico,Anoche me reuní con un grupo empresarial de  Tlaxcala  Presentaron áreas de oportunidad  para crecer y presumieron su talento en TI y compromiso por fortalecer la economía circular y el turismo con historia y ligado a la  gastronomía ,2021-06-19 13:00:00
69,es,tatclouthier,33937794,True,1405558775768137729,Prueba México https://t.co/ptYMuRASoB,[],[],[],[],Mexico,Prueba México https   t co ptYMuRASoB,2021-06-17 16:00:00
70,es,tatclouthier,33937794,True,1404061152091557893,"Un día como hoy, nace  #Maquío, quien dio paso a este esfuerzo @lacasadelmaquio, de formación de liderazgos para la reflexión y acción x una sociedad más justa, respetuosa, sana y productiva. @AmayaDucru @mariajosemtzc @CarmenClou @fernandaclou @lorenaclouthier @RebecaClouthier",[],['Maquío'],"['lacasadelmaquio', 'AmayaDucru', 'mariajosemtzc', 'CarmenClou', 'fernandaclou', 'lorenaclouthier', 'RebecaClouthier']",[],Mexico,Un día como hoy  nace   Maquío  quien dio paso a este esfuerzo  lacasadelmaquio  de formación de liderazgos para la reflexión y acción x una sociedad más justa  respetuosa  sana y productiva   AmayaDucru  mariajosemtzc  CarmenClou  fernandaclou  lorenaclouthier  RebecaClouthier,2021-06-13 13:00:00
71,es,tatclouthier,33937794,True,1403743194681118723,"Interesante de ver este giro:
https://t.co/efn3RAdc7C",[],[],[],['https://t.co/efn3RAdc7C'],Mexico,Interesante de ver este giro https   t co efn3RAdc7C,2021-06-12 16:00:00
72,es,tatclouthier,33937794,True,1403157806803521540,"Después de firmar un Memorando de Entendimiento con el Ministro de Economía de #Guatemala, @MaloufTony, pasamos al evento de Cambio de La Rosa de la Paz. Seguimos trabajando para promover y crecer el intercambio comercial entre ambas naciones. https://t.co/slflZ7Sc8c",[],['Guatemala'],['MaloufTony'],[],Mexico,Después de firmar un Memorando de Entendimiento con el Ministro de Economía de  Guatemala   MaloufTony  pasamos al evento de Cambio de La Rosa de la Paz  Seguimos trabajando para promover y crecer el intercambio comercial entre ambas naciones  https   t co slflZ7Sc8c,2021-06-11 01:00:00
73,es,tatclouthier,33937794,True,1402726820378726409,"Estimado @ArturoHerrera_G, te felicito. Estoy segura que seguirás aportando tu mejor esfuerzo para el bien de nuestro país como lo has hecho en @Hacienda_Mexico. 
Gracias por tus atenciones y firme colaboración con @SE_mx.",[],[],"['ArturoHerrera_G', 'Hacienda_Mexico', 'SE_mx']",[],Mexico,Estimado  ArturoHerrera G  te felicito  Estoy segura que seguirás aportando tu mejor esfuerzo para el bien de nuestro país como lo has hecho en  Hacienda Mexico  Gracias por tus atenciones y firme colaboración con  SE mx ,2021-06-09 21:00:00
74,es,tatclouthier,33937794,True,1402631819158331394,"Que orden, coordinación y sobre todo atención de parte del personal que apoya para vacunación. Gracias a #Salud federal  y al gobierno de @Claudiashein x este trabajo https://t.co/qRpAzPxwcK",[],['Salud'],['Claudiashein'],[],Mexico,Que orden  coordinación y sobre todo atención de parte del personal que apoya para vacunación  Gracias a  Salud federal  y al gobierno de  Claudiashein x este trabajo https   t co qRpAzPxwcK,2021-06-09 14:00:00
75,es,tatclouthier,33937794,True,1401902063651594248,"Buen día, iniciamos nuestra primera visita virtual a Canadá que contempla, entre otras reuniones, un importante encuentro con mi homóloga, la ministra @mary_ng, en el que abordaremos temas  relacionados al #TMEC.

Otro diálogo relevante con @FP_Champagne, Ministro de Innovación,",[],['TMEC'],"['mary_ng', 'FP_Champagne']",[],Mexico,Buen día  iniciamos nuestra primera visita virtual a Canadá que contempla  entre otras reuniones  un importante encuentro con mi homóloga  la ministra  mary ng  en el que abordaremos temas  relacionados al  TMEC Otro diálogo relevante con  FP Champagne  Ministro de Innovación ,2021-06-07 14:00:00
76,es,tatclouthier,33937794,True,1401590688689659912,Misión cumplida. #VotoLibre https://t.co/wcpU6TBf2m,[],['VotoLibre'],[],[],Mexico,Misión cumplida   VotoLibre https   t co wcpU6TBf2m,2021-06-06 17:00:00
77,es,tatclouthier,33937794,True,1401581764976517124,Ya en fila para ejercer mi derecho!!!,[],[],[],[],Mexico,Ya en fila para ejercer mi derecho   ,2021-06-06 17:00:00
78,es,tatclouthier,33937794,True,1401162080657494019,"Finalizamos segundo día de participación en la Reunión Virtual de Ministros Responsables de Comercio de @APEC 

Junto con 21 homólogos de la región Asia-Pacífico compartimos vías para estimular la inversión y cooperación económica entre nuestros países. https://t.co/DmGMYmhPSK",[],[],['APEC'],[],Mexico,Finalizamos segundo día de participación en la Reunión Virtual de Ministros Responsables de Comercio de  APEC Junto con 21 homólogos de la región Asia Pacífico compartimos vías para estimular la inversión y cooperación económica entre nuestros países  https   t co DmGMYmhPSK,2021-06-05 13:00:00
79,es,tatclouthier,33937794,True,1401145639329742848,"Nuestro segundo día del Foro @APEC. La inclusión, el comercio justo y abierto así como la digitalización son temas centrales. Todo esto de la mano de la colaboración entre naciones, especialmente poniendo la salud al centro. https://t.co/vXkoKvWXrf",[],[],['APEC'],[],Mexico,Nuestro segundo día del Foro  APEC  La inclusión  el comercio justo y abierto así como la digitalización son temas centrales  Todo esto de la mano de la colaboración entre naciones  especialmente poniendo la salud al centro  https   t co vXkoKvWXrf,2021-06-05 12:00:00
80,es,tatclouthier,33937794,True,1400781738863955972,"Iniciamos nuestra participación en la Reunión Virtual de Ministros Responsables de Comercio de @APEC.

A propósito de nuestra intervención en este relevante foro de cooperación económica comparto mi colaboración en el periódico @eleconomista 
https://t.co/oLDRriPK2t https://t.co/uUGGO5CjdV",[],[],"['APEC', 'eleconomista']",['https://t.co/oLDRriPK2t'],Mexico,Iniciamos nuestra participación en la Reunión Virtual de Ministros Responsables de Comercio de  APEC A propósito de nuestra intervención en este relevante foro de cooperación económica comparto mi colaboración en el periódico  eleconomista https   t co oLDRriPK2t https   t co uUGGO5CjdV,2021-06-04 12:00:00
81,es,tatclouthier,33937794,True,1399676966253600768,"Damos la bienvenida al nuevo Secretario General de la #OCDE, Mathias Cormann de Australia. Listos para trabajar y  construir puentes entre naciones, como se comentó en la reunión. https://t.co/jbw1SEaJKW",[],['OCDE'],[],[],Mexico,Damos la bienvenida al nuevo Secretario General de la  OCDE  Mathias Cormann de Australia  Listos para trabajar y  construir puentes entre naciones  como se comentó en la reunión  https   t co jbw1SEaJKW,2021-06-01 11:00:00
82,es,tatclouthier,33937794,True,1399002085086093312,"Bellos lugares de nuestro país que invitan a conocerlo, cuidarlo y consumir local. Buen domingo #Sinaloa #Topolobampo https://t.co/YhwIP55Sgs",[],"['Sinaloa', 'Topolobampo']",[],[],Mexico,Bellos lugares de nuestro país que invitan a conocerlo  cuidarlo y consumir local  Buen domingo  Sinaloa  Topolobampo https   t co YhwIP55Sgs,2021-05-30 14:00:00
83,es,tatclouthier,33937794,True,1398295394195546112,Felicitaciones al secretario @guerrajaime por su elección como nuevo presidente de @amsdemex y mi  reconocimiento a Gustavo Puente por la  labor realizada. Le deseo el mayor de los éxitos a ambos.,[],[],"['guerrajaime', 'amsdemex']",[],Mexico,Felicitaciones al secretario  guerrajaime por su elección como nuevo presidente de  amsdemex y mi  reconocimiento a Gustavo Puente por la  labor realizada  Le deseo el mayor de los éxitos a ambos ,2021-05-28 15:00:00
84,es,tatclouthier,33937794,True,1397529591011594243,Iniciamos temprano con el Grupo Ottawa para hablar sobre comercio y salud y la reforma de la OMC. https://t.co/ppUKOhCDBX,[],[],[],[],Mexico,Iniciamos temprano con el Grupo Ottawa para hablar sobre comercio y salud y la reforma de la OMC  https   t co ppUKOhCDBX,2021-05-26 12:00:00
85,es,tatclouthier,33937794,True,1396534216972804096,Buen momento para compartir la invitación a la jornada de cine europeo que hacen nuestros amigos de @UnionEuropeaRD. Comparte y disfruta. Ccp. @luzmadelamora @yorimtz @AmayaDucru https://t.co/fpfGD8gQhw,[],[],"['UnionEuropeaRD', 'luzmadelamora', 'yorimtz', 'AmayaDucru']",[],Mexico,Buen momento para compartir la invitación a la jornada de cine europeo que hacen nuestros amigos de  UnionEuropeaRD  Comparte y disfruta  Ccp   luzmadelamora  yorimtz  AmayaDucru https   t co fpfGD8gQhw,2021-05-23 19:00:00
86,es,tatclouthier,33937794,True,1395799689941995521,"La ONU declaró en 1945 , el 21 de mayo ""Día de la Mujer Empresaria"", como apoyo a las mujeres se hicieron cargo de las empresas  durante la 2nda GM. Las felicitamos por sacar el trabajo adelante y seguir colaborando en la mejora de los trabajos y el bienestar de la sociedad.",[],[],[],[],Mexico,La ONU declaró en 1945   el 21 de mayo  Día de la Mujer Empresaria   como apoyo a las mujeres se hicieron cargo de las empresas  durante la 2nda GM  Las felicitamos por sacar el trabajo adelante y seguir colaborando en la mejora de los trabajos y el bienestar de la sociedad ,2021-05-21 18:00:00
87,es,tatclouthier,33937794,True,1394840063251464195,"De forma exitosa concluimos los trabajos de la Primera Reunión de la Comisión de Libre Comercio del 
#TMEC con una visión clara y compartida con @mary_ng y @AmbassadorTai de mantener el compromiso por crear una región comercial incluyente, justa y productiva para sus habitantes. https://t.co/O0gmtKh8xJ",[],['TMEC'],"['mary_ng', 'AmbassadorTai']",[],Mexico,De forma exitosa concluimos los trabajos de la Primera Reunión de la Comisión de Libre Comercio del  TMEC con una visión clara y compartida con  mary ng y  AmbassadorTai de mantener el compromiso por crear una región comercial incluyente  justa y productiva para sus habitantes  https   t co O0gmtKh8xJ,2021-05-19 02:00:00
88,es,tatclouthier,33937794,True,1394641722232213506,"#BuenMartes. Hoy es el segundo y último día de la Comisión de Libre Comercio.

Continuaremos el diálogo y discutiremos los informes de todos los Comités que han sesionado desde la entrada en vigor del #TMEC

L@s invito a estar pendientes de @SE_mx para conocer los resultados.",[],"['BuenMartes', 'TMEC']",['SE_mx'],[],Mexico, BuenMartes  Hoy es el segundo y último día de la Comisión de Libre Comercio Continuaremos el diálogo y discutiremos los informes de todos los Comités que han sesionado desde la entrada en vigor del  TMECL s invito a estar pendientes de  SE mx para conocer los resultados ,2021-05-18 13:00:00
89,es,tatclouthier,33937794,True,1394419283439071233,"Concluimos el 1er día de la Comisión de Libre Comercio después de sostener encuentros francos y constructivos con EE.UU y Canadá. 

Reiteramos el interés de México por construir una #AméricaDelNorte competitiva, incluyente y sostenible a través de un diálogo abierto y permanente.",[],['AméricaDelNorte'],[],[],Mexico,Concluimos el 1er día de la Comisión de Libre Comercio después de sostener encuentros francos y constructivos con EE UU y Canadá  Reiteramos el interés de México por construir una  AméricaDelNorte competitiva  incluyente y sostenible a través de un diálogo abierto y permanente ,2021-05-17 22:00:00
90,es,tatclouthier,33937794,True,1394326111761338372,"En conjunto con mis contrapartes de EE.UU. y Canadá, @AmbassadorTai y @mary_ng , tengo el gusto de presidir la 1a Comisión de Libre Comercio. Dicho comité nos permitirá evaluar los avances del #TMEC alcanzados en casi 12 meses de su entrada en vigor.",[],['TMEC'],"['AmbassadorTai', 'mary_ng']",[],Mexico,En conjunto con mis contrapartes de EE UU  y Canadá   AmbassadorTai y  mary ng   tengo el gusto de presidir la 1a Comisión de Libre Comercio  Dicho comité nos permitirá evaluar los avances del  TMEC alcanzados en casi 12 meses de su entrada en vigor ,2021-05-17 16:00:00
91,es,tatclouthier,33937794,True,1394270946492657666,"#BuenLunes, comparto mi colaboración en @ElFinanciero_Mx: La Comisión de Libre Comercio: un diálogo constructivo para fortalecer América del Norte https://t.co/182tn0DLjz",[],['BuenLunes'],['ElFinanciero_Mx'],['https://t.co/182tn0DLjz'],Mexico, BuenLunes  comparto mi colaboración en  ElFinanciero Mx  La Comisión de Libre Comercio  un diálogo constructivo para fortalecer América del Norte https   t co 182tn0DLjz,2021-05-17 13:00:00
92,es,tatclouthier,33937794,True,1394087092167249924,"Gracias al Alcalde de #Torreón  x  las atenciones hacia el Embajador de #China  y a una servidora en el ""Foro Económico"" de ambos países. https://t.co/0bf49OVOHt",[],"['Torreón', 'China']",[],[],Mexico,Gracias al Alcalde de  Torreón  x  las atenciones hacia el Embajador de  China  y a una servidora en el  Foro Económico  de ambos países  https   t co 0bf49OVOHt,2021-05-17 00:00:00
93,es,tatclouthier,33937794,True,1393574047661928454,"La educación está vinculada al desarrollo económico y comunitario de las naciones. Educar es sinónimo de generosidad y de gran vocación social. 

“Los profesores se desprenden de cuanto tienen y de cuanto saben, porque su misión es esa: dar”. E. Poniatowska.

#FelizDíaDelMaestro https://t.co/MuK2PjdfCj",[],['FelizDíaDelMaestro'],[],[],Mexico,La educación está vinculada al desarrollo económico y comunitario de las naciones  Educar es sinónimo de generosidad y de gran vocación social  “Los profesores se desprenden de cuanto tienen y de cuanto saben  porque su misión es esa  dar”  E  Poniatowska  FelizDíaDelMaestro https   t co MuK2PjdfCj,2021-05-15 14:00:00
94,es,tatclouthier,33937794,True,1392887106276577281,"Agradezco a @Hacienda_Mexico y a @ASCOA la invitación para hablar sobre las nuevas oportunidades de inversión, la relevancia de la transición tecnológica y digital, así como las prioridades a atender en los próximos meses.",[],[],"['Hacienda_Mexico', 'ASCOA']",[],Mexico,Agradezco a  Hacienda Mexico y a  ASCOA la invitación para hablar sobre las nuevas oportunidades de inversión  la relevancia de la transición tecnológica y digital  así como las prioridades a atender en los próximos meses ,2021-05-13 17:00:00
95,es,tatclouthier,33937794,True,1392845286599544834,"Celebramos que el fondo de inversión inmobiliario, Meor, esté listo para construir ocho parques industriales con una inversión de 3 mil millones de pesos durante los siguientes 12 a 18 meses.",[],[],[],[],Mexico,Celebramos que el fondo de inversión inmobiliario  Meor  esté listo para construir ocho parques industriales con una inversión de 3 mil millones de pesos durante los siguientes 12 a 18 meses ,2021-05-13 14:00:00
96,es,tatclouthier,33937794,True,1392169562435620867,Súmate para cumplir la meta: 3 millones de mujeres comercializando sus productos en el exterior y así lograr mejor futuro para las mujeres empresarias mexicanas. https://t.co/YH3p1RObg8,[],[],[],['https://t.co/YH3p1RObg8'],Mexico,Súmate para cumplir la meta  3 millones de mujeres comercializando sus productos en el exterior y así lograr mejor futuro para las mujeres empresarias mexicanas  https   t co YH3p1RObg8,2021-05-11 17:00:00
97,es,tatclouthier,33937794,True,1392138054115151880,Iniciando la 2nda Edición de E-Rueda Negocios para Mujeres. Nuestra primera conferencia será de @luzmadelamora. Seguimos trabajando para que las mujeres se capaciten y exporten. https://t.co/iTGggyrCc2,['xp'],[],['luzmadelamora'],[],Mexico,Iniciando la 2nda Edición de E Rueda Negocios para Mujeres  Nuestra primera conferencia será de  luzmadelamora  Seguimos trabajando para que las mujeres se capaciten y eorten  https   t co iTGggyrCc2,2021-05-11 15:00:00
98,es,tatclouthier,33937794,True,1391804860157231106,Para quien por amor nada es imposible y lo entrega todo. #FelizDíaDeLasMadres❤️ https://t.co/v3G4OrRyaB,['❤️'],['FelizDíaDeLasMadres'],[],[],Mexico,Para quien por amor nada es imposible y lo entrega todo   FelizDíaDeLasMadres https   t co v3G4OrRyaB,2021-05-10 17:00:00
99,es,tatclouthier,33937794,True,1391541885005705216,"Asamblea Comunitaria otorga x unanimidad  autorización para implementar en su territorio el Polo de Desarrollo para el Bienestar, que forma parte del Programa para el Desarrollo del Istmo de Tehuantepec

https://t.co/YOCdk0TpI6",[],[],[],['https://t.co/YOCdk0TpI6'],Mexico,Asamblea Comunitaria otorga x unanimidad  autorización para implementar en su territorio el Polo de Desarrollo para el Bienestar  que forma parte del Programa para el Desarrollo del Istmo de Tehuantepechttps   t co YOCdk0TpI6,2021-05-10 00:00:00
100,es,tatclouthier,33937794,True,1391411626570665993,Esta mañana salí a hacer ejercicio en bicicleta; paso reporte a @AyD_ParaTi y @SanPedroNL: faltas 2 tapas de agua y drenaje en Calzada del Valle y Balsas y Calzada casi llegando a Vinoteca de rotonda. Bache en Calzada y Suchiate lado sur.,[],[],"['AyD_ParaTi', 'SanPedroNL']",[],Mexico,Esta mañana salí a hacer ejercicio en bicicleta  paso reporte a  AyD ParaTi y  SanPedroNL  faltas 2 tapas de agua y drenaje en Calzada del Valle y Balsas y Calzada casi llegando a Vinoteca de rotonda  Bache en Calzada y Suchiate lado sur ,2021-05-09 15:00:00
101,es,tatclouthier,33937794,True,1391176038328250375,"Con  acciones coordinadas del Gobierno de México y productores, avanzamos para garantizar el  acceso a la exportación de productos emblemáticos como el Tequila y Mezcal, hacia los mercados de la Unión Económica Eurasiática.  🇷🇺🇰🇿🇧🇾🇦🇲🇰🇬","['🇰🇬', '🇦🇲', '🇧🇾', '🇷🇺', '🇰🇿', 'xp']",[],[],[],Mexico,Con  acciones coordinadas del Gobierno de México y productores  avanzamos para garantizar el  acceso a la eortación de productos emblemáticos como el Tequila y Mezcal  hacia los mercados de la Unión Económica Eurasiática   ,2021-05-09 00:00:00
