,tweet_lang,poi_name,poi_id,verified,id,tweet_text,tweet_emoticons,hashtags,mentions,tweet_urls,country,text_es,tweet_date
0,es,tatclouthier,33937794,True,1440481151508881418,Que gusto recibir al gobernador de Sonora @AlfonsoDurazo para promocionar proyectos conjuntos con gobernadores del área del Mar de Cortés https://t.co/2ktIt1THic,[],[],['AlfonsoDurazo'],[],Mexico,Que gusto recibir al gobernador de Sonora  AlfonsoDurazo para promocionar proyectos conjuntos con gobernadores del área del Mar de Cortés https   t co 2ktIt1THic,2021-09-22 01:00:00
1,es,tatclouthier,33937794,True,1440363591530528770,"Con el objetivo de que las #mipymes se sumen a la creciente #digitalización, de contribuir a su fortalecimiento y muestren una mejor participación en el mercado interno y en el comercio exterior, firmamos un convenio de colaboración, a través de @Economia_UDP, con @MastercardMex. https://t.co/xorRUW0z1L",[],"['mipymes', 'digitalización']","['Economia_UDP', 'MastercardMex']",[],Mexico,Con el objetivo de que las  mipymes se sumen a la creciente  digitalización  de contribuir a su fortalecimiento y muestren una mejor participación en el mercado interno y en el comercio exterior  firmamos un convenio de colaboración  a través de  Economia UDP  con  MastercardMex  https   t co xorRUW0z1L,2021-09-21 17:00:00
2,es,tatclouthier,33937794,True,1440293130163539975,Felicidades @mary_ng ! Lista para seguir trabajando a favor de nuestro comercio y de las  #mujeres en la economía.,[],['mujeres'],['mary_ng'],[],Mexico,Felicidades  mary ng   Lista para seguir trabajando a favor de nuestro comercio y de las   mujeres en la economía ,2021-09-21 13:00:00
3,es,tatclouthier,33937794,True,1440292939414999061,Quiero felicitar a @FP_Champagne por su reelección. Contenta de seguir haciendo equipo para fortalecer nuestra economía regional a través de la innovación.,[],[],['FP_Champagne'],[],Mexico,Quiero felicitar a  FP Champagne por su reelección  Contenta de seguir haciendo equipo para fortalecer nuestra economía regional a través de la innovación ,2021-09-21 13:00:00
4,es,tatclouthier,33937794,True,1439963604795674628,Estaremos al tanto y trabajando con nuestros socios del TIPAT para definir las acciones derivadas de la solicitud de adhesión de la República Popular China. https://t.co/OasLZH4821,[],[],[],['https://t.co/OasLZH4821'],Mexico,Estaremos al tanto y trabajando con nuestros socios del TIPAT para definir las acciones derivadas de la solicitud de adhesión de la República Popular China  https   t co OasLZH4821,2021-09-20 15:00:00
5,es,tatclouthier,33937794,True,1439930616313749510,No te lo pierdas si andas en el mundo del turismo. Bella semana. https://t.co/pQu5fuM6lf,[],[],[],[],Mexico,No te lo pierdas si andas en el mundo del turismo  Bella semana  https   t co pQu5fuM6lf,2021-09-20 13:00:00
6,es,tatclouthier,33937794,True,1439696585085050881,"Despedimos al Dr. Jerome Walcott de #Barbados 🇧🇧. Se va contento con los resultados de #CELAC, buen trabajo @SRE_mx.",['🇧🇧'],"['Barbados', 'CELAC']",['SRE_mx'],[],Mexico,Despedimos al Dr  Jerome Walcott de  Barbados   Se va contento con los resultados de  CELAC  buen trabajo  SRE mx ,2021-09-19 21:00:00
7,es,tatclouthier,33937794,True,1439617264861462529,"#19DeSeptiembre, 1985 y 2017; hueco en el corazón de nuestro país, aprendizajes en sector público y sociedad organizada. 

Reconocimiento a la solidaridad de quienes dejan todo para ayudar en momentos difíciles. 

Abrazo a quien perdió familia o amig🖤s en aquellos trágicos días.",['🖤'],['19DeSeptiembre'],[],[],Mexico, 19DeSeptiembre  1985 y 2017  hueco en el corazón de nuestro país  aprendizajes en sector público y sociedad organizada  Reconocimiento a la solidaridad de quienes dejan todo para ayudar en momentos difíciles  Abrazo a quien perdió familia o amigs en aquellos trágicos días ,2021-09-19 16:00:00
8,es,tatclouthier,33937794,True,1438881948055875584,"Mejoren ésta...
La presencia de las mujeres en México como una realidad. #informe @Claudiashein https://t.co/rzlz0SP6V6",[],['informe'],['Claudiashein'],[],Mexico,Mejoren ésta   La presencia de las mujeres en México como una realidad   informe  Claudiashein https   t co rzlz0SP6V6,2021-09-17 15:00:00
9,es,tatclouthier,33937794,True,1438636601853284358,"Con gusto les comparto que, gracias al arduo trabajo de las y los abogados de la subsecretaría de comercio exterior de la @SE_mx, hemos ganado en un tribunal internacional un caso inversionista-Estado.",[],[],['SE_mx'],[],Mexico,Con gusto les comparto que  gracias al arduo trabajo de las y los abogados de la subsecretaría de comercio exterior de la  SE mx  hemos ganado en un tribunal internacional un caso inversionista Estado ,2021-09-16 23:00:00
10,es,tatclouthier,33937794,True,1438544588600451072,Es un honor acompañar al presidente @lopezobrador_ en el #DesfileMilitar2021 #IndependenciaDeMéxico 🇲🇽 https://t.co/t0YFeVNaHT,['🇲🇽'],"['DesfileMilitar2021', 'IndependenciaDeMéxico']",['lopezobrador_'],[],Mexico,Es un honor acompañar al presidente  lopezobrador  en el  DesfileMilitar2021  IndependenciaDeMéxico  https   t co t0YFeVNaHT,2021-09-16 17:00:00
11,es,tatclouthier,33937794,True,1438203102331613186,"Felicitamos a @annietrev, nueva secretaria de Comercio Exterior del #ReinoUnido. 

Continuaremos fortaleciendo los lazos comerciales y de inversión entre nuestras naciones. 🇲🇽🤝🇬🇧","['🇬🇧', '🤝', '🇲🇽']",['ReinoUnido'],['annietrev'],[],Mexico,Felicitamos a  annietrev  nueva secretaria de Comercio Exterior del  ReinoUnido  Continuaremos fortaleciendo los lazos comerciales y de inversión entre nuestras naciones  ,2021-09-15 18:00:00
12,es,tatclouthier,33937794,True,1438178137532088328,Felicidades gobernadora #Campeche. @LaydaSansores https://t.co/X7307bibfj,[],['Campeche'],['LaydaSansores'],[],Mexico,Felicidades gobernadora  Campeche   LaydaSansores https   t co X7307bibfj,2021-09-15 16:00:00
13,es,tatclouthier,33937794,True,1437380235058716672,Excelente inicio de semana. #13deseptiembre 🇲🇽,['🇲🇽'],['13deseptiembre'],[],[],Mexico,Excelente inicio de semana   13deseptiembre ,2021-09-13 12:00:00
14,es,tatclouthier,33937794,True,1436796389430857731,Felicidades al @Tu_IMSS  y a #ESSA: https://t.co/W4FhHxJEw9,[],['ESSA'],['Tu_IMSS'],['https://t.co/W4FhHxJEw9'],Mexico,Felicidades al  Tu IMSS  y a  ESSA  https   t co W4FhHxJEw9,2021-09-11 21:00:00
15,es,tatclouthier,33937794,True,1436349204662607873,"Me reuní con estudiantes de políticas públicas de @Georgetown, una de las universidades más prestigiadas de Estados Unidos. Conversamos sobre la relación comercial #Mx-#EEUU, su relevancia, su complejidad y la integración productiva que compartimos. 🇲🇽🤝🇺🇸 https://t.co/QPXuiHV89V","['🇺🇸', '🤝', '🇲🇽']","['Mx', 'EEUU']",['Georgetown'],[],Mexico,Me reuní con estudiantes de políticas públicas de  Georgetown  una de las universidades más prestigiadas de Estados Unidos  Conversamos sobre la relación comercial  Mx  EEUU  su relevancia  su complejidad y la integración productiva que compartimos   https   t co QPXuiHV89V,2021-09-10 15:00:00
16,es,tatclouthier,33937794,True,1435972020303540224,"Terminando productiva reunión con Allen Thompson, VP de Relaciones Gubernamentales de @intel; list@s para el #DEAN 🇲🇽🤝🇺🇸 ¡Vamos para allá! https://t.co/19C6R6xDwZ","['🇺🇸', '🤝', '🇲🇽', 'xD']",['DEAN'],['intel'],[],Mexico,Terminando productiva reunión con Allen Thompson  VP de Relaciones Gubernamentales de  intel  list s para el  DEAN  ¡Vamos para allá  https   t co 19C6R6wZ,2021-09-09 14:00:00
17,es,tatclouthier,33937794,True,1435660149973204994,"Me reuní con la @SIAAmerica para expresar el interés de #México en participar en el segmento de Ensamble, Prueba y Empaque Avanzado de la cadena de suministro de #semiconductores en #AméricaDelNorte y, por supuesto, promover las #inversiones en nuestro país. 🇲🇽🤝🇺🇸 https://t.co/Q1MIUzyfD7","['🇺🇸', '🤝', '🇲🇽', 'xp']","['México', 'semiconductores', 'AméricaDelNorte', 'inversiones']",['SIAAmerica'],[],Mexico,Me reuní con la  SIAAmerica para eresar el interés de  México en participar en el segmento de Ensamble  Prueba y Empaque Avanzado de la cadena de suministro de  semiconductores en  AméricaDelNorte y  por supuesto  promover las  inversiones en nuestro país   https   t co Q1MIUzyfD7,2021-09-08 18:00:00
18,es,tatclouthier,33937794,True,1435351343389151232,"Que gusto nos da escuchar la llegada de esta inversión:
https://t.co/omF8KkkNFm",[],[],[],['https://t.co/omF8KkkNFm'],Mexico,Que gusto nos da escuchar la llegada de esta inversión https   t co omF8KkkNFm,2021-09-07 21:00:00
19,es,tatclouthier,33937794,True,1433120661862506496,"Un profundo y emotivo Informe, donde queda plasmada la transformación iniciada por un hombre que ama entrañablemente a la Patria y está firmemente comprometido con nuestras raíces y con l@s que menos tienen. #3erInformeDeGobierno https://t.co/wtIG5DGSWR",[],['3erInformeDeGobierno'],[],[],Mexico,Un profundo y emotivo Informe  donde queda plasmada la transformación iniciada por un hombre que ama entrañablemente a la Patria y está firmemente comprometido con nuestras raíces y con l s que menos tienen   3erInformeDeGobierno https   t co wtIG5DGSWR,2021-09-01 18:00:00
20,es,tatclouthier,33937794,True,1432306614749601792,"#BuenosDiasATodos
Inicia la semana y  medalla 100 para  #Mexico en Olimpiada;  escuela presencial para quien lo decida y en @SE_mx, la Semana  Sur-Sureste, en busca de oportunidades de negocio.",[],"['BuenosDiasATodos', 'Mexico']",['SE_mx'],[],Mexico, BuenosDiasATodosInicia la semana y  medalla 100 para   Mexico en Olimpiada   escuela presencial para quien lo decida y en  SE mx  la Semana  Sur Sureste  en busca de oportunidades de negocio ,2021-08-30 12:00:00
21,es,tatclouthier,33937794,True,1431369455808954372,"Nos da gusto que Canadá ha decidido sumarse a la solicitud de consultas, que solicitamos el pasado 20 de agosto, en relación a la interpretación que EE.UU. hace sobre las Reglas de Origen del sector automotriz contenidas en el #TMEC.",[],['TMEC'],[],[],Mexico,Nos da gusto que Canadá ha decidido sumarse a la solicitud de consultas  que solicitamos el pasado 20 de agosto  en relación a la interpretación que EE UU  hace sobre las Reglas de Origen del sector automotriz contenidas en el  TMEC ,2021-08-27 22:00:00
22,es,tatclouthier,33937794,True,1431263643740557315,Gran mensaje de nuestro presidente @lopezobrador_ 👏🏼👏🏼👏🏼 https://t.co/xpfD4II7q7,"['👏🏼', 'xp']",[],['lopezobrador_'],['https://t.co/xpfD4II7q7'],Mexico,Gran mensaje de nuestro presidente  lopezobrador   https   t co fD4II7q7,2021-08-27 15:00:00
23,es,tatclouthier,33937794,True,1430919880052781066,Buen ambiente plural en favor de las mujeres. Gracias al @inmujeres por reunirnos a favor de la causa. https://t.co/mng1R0F1Sj,[],[],['inmujeres'],[],Mexico,Buen ambiente plural en favor de las mujeres  Gracias al  inmujeres por reunirnos a favor de la causa  https   t co mng1R0F1Sj,2021-08-26 16:00:00
24,es,tatclouthier,33937794,True,1430575351864852486,"Gracias a @IndexNuevoLeon por la invitación al Foro IMMEX 2021. En la @SE_mx trabajamos para acelerar la automatización y facilitación de trámites que agilicen el comercio exterior, uno de los principales motores de nuestra #economía. https://t.co/ONQiLDjmrI",[],['economía'],"['IndexNuevoLeon', 'SE_mx']",[],Mexico,Gracias a  IndexNuevoLeon por la invitación al Foro IMMEX 2021  En la  SE mx trabajamos para acelerar la automatización y facilitación de trámites que agilicen el comercio exterior  uno de los principales motores de nuestra  economía  https   t co ONQiLDjmrI,2021-08-25 17:00:00
25,es,tatclouthier,33937794,True,1430293034210529281,"Un gusto encontrarme en Córdoba, Veracruz, con el presidente de #Ecuador, @LassoGuillermo y su equipo. Compartimos oportunidades comerciales entre nuestras naciones, además de retomar las negociaciones para que pronto 🇪🇨 se integre a la @A_delPacifico. https://t.co/xYDmOROZ2c",['🇪🇨'],['Ecuador'],"['LassoGuillermo', 'A_delPacifico']",[],Mexico,Un gusto encontrarme en Córdoba  Veracruz  con el presidente de  Ecuador   LassoGuillermo y su equipo  Compartimos oportunidades comerciales entre nuestras naciones  además de retomar las negociaciones para que pronto  se integre a la  A delPacifico  https   t co xYDmOROZ2c,2021-08-24 22:00:00
26,es,tatclouthier,33937794,True,1429850047890472961,"¡Arrancando semana! Muy contentas de haber firmado el convenio con @UPSMexico para impulsar el crecimiento de las #MiPyMes mexicanas del sector artesanal a través de capacitación para exportar sus productos.

Ingresen a https://t.co/0FcTenZBj7 para registrarse. https://t.co/4Aja45oqIp",['xp'],['MiPyMes'],['UPSMexico'],['https://t.co/0FcTenZBj7'],Mexico,¡Arrancando semana  Muy contentas de haber firmado el convenio con  UPSMexico para impulsar el crecimiento de las  MiPyMes mexicanas del sector artesanal a través de capacitación para eortar sus productos Ingresen a https   t co 0FcTenZBj7 para registrarse  https   t co 4Aja45oqIp,2021-08-23 17:00:00
27,es,tatclouthier,33937794,True,1429436057758666754,Que gusto trabajar con mujeres tan comprometidas. @paolagzzcas #Domingo https://t.co/SRILBhjc19,[],['Domingo'],['paolagzzcas'],[],Mexico,Que gusto trabajar con mujeres tan comprometidas   paolagzzcas  Domingo https   t co SRILBhjc19,2021-08-22 14:00:00
28,es,tatclouthier,33937794,True,1428801184807014413,El trabajo en conjunto es más sólido y llega más lejos. Gracias a la disposición de l@s gobernador@s electos para sumarse a los programas de apoyo a #MiPYMes en sus estados por el desarrollo económico de #México🇲🇽#EconomíaParaTodos https://t.co/q9mwWCdAch,['🇲🇽'],"['MiPYMes', 'México', 'EconomíaParaTodos']",[],[],Mexico,El trabajo en conjunto es más sólido y llega más lejos  Gracias a la disposición de l s gobernador s electos para sumarse a los programas de apoyo a  MiPYMes en sus estados por el desarrollo económico de  México EconomíaParaTodos https   t co q9mwWCdAch,2021-08-20 19:00:00
29,es,tatclouthier,33937794,True,1428549918902390788,Ya está apoyando #BBVA también. Súper. @Agenda2030MX https://t.co/KBAlTxgWdO https://t.co/VErwbh3UCz,[],['BBVA'],['Agenda2030MX'],['https://t.co/KBAlTxgWdO'],Mexico,Ya está apoyando  BBVA también  Súper   Agenda2030MX https   t co KBAlTxgWdO https   t co VErwbh3UCz,2021-08-20 03:00:00
30,es,tatclouthier,33937794,True,1428548832812470273,Que gusto nos da el ver que los trabajadores de GM sacaron adelante un proceso tan importante. Buen paso. @LuisaAlcalde,[],[],['LuisaAlcalde'],[],Mexico,Que gusto nos da el ver que los trabajadores de GM sacaron adelante un proceso tan importante  Buen paso   LuisaAlcalde,2021-08-20 03:00:00
31,es,tatclouthier,33937794,True,1428144564909522947,Promovemos la participación de las Pymes y la industria mexicana:  https://t.co/dwdnm3JOWg,[],[],[],['https://t.co/dwdnm3JOWg'],Mexico,Promovemos la participación de las Pymes y la industria mexicana   https   t co dwdnm3JOWg,2021-08-19 00:00:00
32,es,tatclouthier,33937794,True,1427622327190269959,"Información sobre la Norma en proceso, vinculada a servicios educativos: https://t.co/ZiJMzpXGEf",[],[],[],['https://t.co/ZiJMzpXGEf'],Mexico,Información sobre la Norma en proceso  vinculada a servicios educativos  https   t co ZiJMzpXGEf,2021-08-17 13:00:00
33,es,tatclouthier,33937794,True,1425156200333815811,"Acabo de visitar #Cd.Modelo en #Puebla. Gran potencial de desarrollo para la región. 
Este equipo mantiene las áreas en excelencia. https://t.co/AEJ4CGkPMb",[],"['Cd', 'Puebla']",[],[],Mexico,Acabo de visitar  Cd Modelo en  Puebla  Gran potencial de desarrollo para la región  Este equipo mantiene las áreas en excelencia  https   t co AEJ4CGkPMb,2021-08-10 18:00:00
34,es,tatclouthier,33937794,True,1424724568149725186,"Se adelanta María Elena Chapa. Agradecida con ella y su generación, como mujer, por haber abierto puertas a generaciones, haciendo visible el techo de cristal y la paridad.",[],[],[],[],Mexico,Se adelanta María Elena Chapa  Agradecida con ella y su generación  como mujer  por haber abierto puertas a generaciones  haciendo visible el techo de cristal y la paridad ,2021-08-09 13:00:00
35,es,tatclouthier,33937794,True,1424398293648486401,Convocatoria para estudiar en la UnADM. https://t.co/Fk83VzzCkI Vía @desde_izquierda #DesdeLaIzquierda,[],['DesdeLaIzquierda'],['Desde_Izquierda'],['https://t.co/Fk83VzzCkI'],Mexico,Convocatoria para estudiar en la UnADM  https   t co Fk83VzzCkI Vía  desde izquierda  DesdeLaIzquierda,2021-08-08 16:00:00
36,es,tatclouthier,33937794,True,1423390916572848128,"Estimada @DeniseMaerker, mi más sentido pésame a por la partida física de su padre; un abrazo solidario.",[],[],['DeniseMaerker'],[],Mexico,Estimada  DeniseMaerker  mi más sentido pésame a por la partida física de su padre  un abrazo solidario ,2021-08-05 21:00:00
37,es,tatclouthier,33937794,True,1423329930721509384,"Lamentamos el fallecimiento de Richard Trumka, quien fuera presidente de @AFLCIO y gran defensor de los derechos laborales en EE.UU..  Se le recordará como un luchador.",[],[],['AFLCIO'],[],Mexico,Lamentamos el fallecimiento de Richard Trumka  quien fuera presidente de  AFLCIO y gran defensor de los derechos laborales en EE UU    Se le recordará como un luchador ,2021-08-05 17:00:00
38,es,tatclouthier,33937794,True,1423048830380019726,"Hoy pudimos constatar que en las dificultades algunos se animan.  Deseamos el mejor de los éxitos a @epigmenioibarra y Verónica, así como al gran equipo de Casa Azul por promover las industrias creativas. https://t.co/90BA1LKhBT",[],[],['epigmenioibarra'],[],Mexico,Hoy pudimos constatar que en las dificultades algunos se animan   Deseamos el mejor de los éxitos a  epigmenioibarra y Verónica  así como al gran equipo de Casa Azul por promover las industrias creativas  https   t co 90BA1LKhBT,2021-08-04 23:00:00
39,es,tatclouthier,33937794,True,1422182116620742656,Buen día. Comparto entrevista en @eleconomista. https://t.co/qlSgGESCHW,[],[],['eleconomista'],['https://t.co/qlSgGESCHW'],Mexico,Buen día  Comparto entrevista en  eleconomista  https   t co qlSgGESCHW,2021-08-02 13:00:00
40,es,tatclouthier,33937794,True,1420761669928509448,Que gusto nos dio recibir al Senador Ben Hueso de California. Lo vinculamos con proyectos aeroespaciales  y exploramos trabajos conjuntos  en ciudades fronterizas. https://t.co/Y1wmrJGoiR,['xp'],[],[],[],Mexico,Que gusto nos dio recibir al Senador Ben Hueso de California  Lo vinculamos con proyectos aeroespaciales  y eloramos trabajos conjuntos  en ciudades fronterizas  https   t co Y1wmrJGoiR,2021-07-29 15:00:00
41,es,tatclouthier,33937794,True,1420487394093150213,"En la @SE_mx estamos listos para  analizar  las reglas de ""Buy American"" y su compatibilidad con las reglas del #TMEC.",[],['TMEC'],['SE_mx'],[],Mexico,En la  SE mx estamos listos para  analizar  las reglas de  Buy American  y su compatibilidad con las reglas del  TMEC ,2021-07-28 21:00:00
42,es,tatclouthier,33937794,True,1419766324956368897,En la @SE_mx reanudamos la operación física de las Oficinas de Representación en entidades federativas con medidas sanitarias para servidores públicos y personas que acudan a realizar algún trámite o soliciten asesoría. Domicilio y contacto de las 49 Ofic: https://t.co/8o5m1MRH6m https://t.co/ESb5hp2ZqM,[],[],['SE_mx'],['https://t.co/8o5m1MRH6m'],Mexico,En la  SE mx reanudamos la operación física de las Oficinas de Representación en entidades federativas con medidas sanitarias para servidores públicos y personas que acudan a realizar algún trámite o soliciten asesoría  Domicilio y contacto de las 49 Ofic  https   t co 8o5m1MRH6m https   t co ESb5hp2ZqM,2021-07-26 21:00:00
43,es,tatclouthier,33937794,True,1419637783371603968,"Con respeto,  una muestra de solidaridad a mis ex  compañeros legisladores de la bancada del  PRI, ante la partida de su líder en el Congreso: René Juárez C.. Igualmente, nuestras muestras de cariño a sus familiares.",[],[],[],[],Mexico,Con respeto   una muestra de solidaridad a mis ex  compañeros legisladores de la bancada del  PRI  ante la partida de su líder en el Congreso  René Juárez C   Igualmente  nuestras muestras de cariño a sus familiares ,2021-07-26 13:00:00
44,es,tatclouthier,33937794,True,1418675351249690631,"Desde la @EmbamexEUA🇲🇽🇺🇸, doy gracias a los equipos de la @SE_mx y al del Embajador @emoctezumab, por su valioso apoyo en nuestra primera gira presencial en #WashingtonDC. Regresamos a casa. https://t.co/VQ19QGp7j5","['🇺🇸', '🇲🇽']",['WashingtonDC'],"['EmbamexEUA', 'SE_mx', 'emoctezumab']",[],Mexico,Desde la  EmbamexEUA  doy gracias a los equipos de la  SE mx y al del Embajador  emoctezumab  por su valioso apoyo en nuestra primera gira presencial en  WashingtonDC  Regresamos a casa  https   t co VQ19QGp7j5,2021-07-23 21:00:00
45,es,tatclouthier,33937794,True,1418390555722125315,"Hoy se concluyó la Semana de los ODS, @Agenda2030MX. Gracias por contribuir todos los días a una recuperación sostenible e incluyente, para no dejar a nadie atrás. https://t.co/Uq6w3lLgVj",[],[],['Agenda2030MX'],[],Mexico,Hoy se concluyó la Semana de los ODS   Agenda2030MX  Gracias por contribuir todos los días a una recuperación sostenible e incluyente  para no dejar a nadie atrás  https   t co Uq6w3lLgVj,2021-07-23 02:00:00
46,es,tatclouthier,33937794,True,1418326808131522566,Me dio mucho gusto reunirme con @AmbassadorTai a quien agradezco nos haya recibido para continuar el diálogo que favorezca la implementación del #TMEC https://t.co/eX8wt9qhWP,[],['TMEC'],['AmbassadorTai'],[],Mexico,Me dio mucho gusto reunirme con  AmbassadorTai a quien agradezco nos haya recibido para continuar el diálogo que favorezca la implementación del  TMEC https   t co eX8wt9qhWP,2021-07-22 22:00:00
47,es,tatclouthier,33937794,True,1418187365722492929,"¡Buen día! Iniciamos temprano en reunión con los 13 Ministros del Grupo Ottawa y la Directora de @OMC_es , @NOIweala, para continuar las discusiones sobre la reforma de la organización en preparación a la 12ª Conferencia Ministerial así como la negociación de subsidios a la pesca https://t.co/Sr19RiwdHU",[],[],"['OMC_es', 'NOIweala']",[],Mexico,¡Buen día  Iniciamos temprano en reunión con los 13 Ministros del Grupo Ottawa y la Directora de  OMC es    NOIweala  para continuar las discusiones sobre la reforma de la organización en preparación a la 12ª Conferencia Ministerial así como la negociación de subsidios a la pesca https   t co Sr19RiwdHU,2021-07-22 13:00:00
48,es,tatclouthier,33937794,True,1418031918197653508,Bienvenido #Singapur a la @A_delPacifico nuevas oportunidades para fortalecer lazos comerciales e inversiones con una de las regiones más dinámicas e innovadoras del mundo. https://t.co/Lpqj9K3pkv,[],['Singapur'],['A_delPacifico'],[],Mexico,Bienvenido  Singapur a la  A delPacifico nuevas oportunidades para fortalecer lazos comerciales e inversiones con una de las regiones más dinámicas e innovadoras del mundo  https   t co Lpqj9K3pkv,2021-07-22 02:00:00
49,es,tatclouthier,33937794,True,1417863286842961925,"Iniciamos en DC una reunión con @SecRaimondo de @CommerceGov con quien comentamos temas de tomate, estacionalidad, azúcar, y cadenas de suministro, así como el relanzamiento del DEAN. https://t.co/jJujwVancW",[],[],"['SecRaimondo', 'CommerceGov']",[],Mexico,Iniciamos en DC una reunión con  SecRaimondo de  CommerceGov con quien comentamos temas de tomate  estacionalidad  azúcar  y cadenas de suministro  así como el relanzamiento del DEAN  https   t co jJujwVancW,2021-07-21 15:00:00
50,es,tatclouthier,33937794,True,1417651045568745473,"Gracias Emb. @emoctezumab por la bienvenida en Washington, D.C. a nuestra primera gira de trabajo presencial por la capital estadounidense en la que sostendremos encuentros con autoridades, organizaciones y empresarios norteamericanos en el marco de la implementación del #TMEC https://t.co/OGokFZSNUv",[],['TMEC'],['emoctezumab'],[],Mexico,Gracias Emb   emoctezumab por la bienvenida en Washington  D C  a nuestra primera gira de trabajo presencial por la capital estadounidense en la que sostendremos encuentros con autoridades  organizaciones y empresarios norteamericanos en el marco de la implementación del  TMEC https   t co OGokFZSNUv,2021-07-21 01:00:00
51,es,tatclouthier,33937794,True,1417278194496032768,"Presentamos el Informe Nacional Voluntario 2021 sobre la #Agenda2030 en 🇲🇽

Repasamos diversas acciones ya realizadas por el @GobiernoMX a favor de los distintos Objetivos de #DesarrolloSostenible, también reconocimos retos y oportunidades sobre los que seguiremos trabajando. https://t.co/QcdwuzLWBO",['🇲🇽'],"['Agenda2030', 'DesarrolloSostenible']",['GobiernoMX'],[],Mexico,Presentamos el Informe Nacional Voluntario 2021 sobre la  Agenda2030 en Repasamos diversas acciones ya realizadas por el  GobiernoMX a favor de los distintos Objetivos de  DesarrolloSostenible  también reconocimos retos y oportunidades sobre los que seguiremos trabajando  https   t co QcdwuzLWBO,2021-07-20 00:00:00
52,es,tatclouthier,33937794,True,1416003706978504708,"Desde temprano en el Retiro Informal de Líderes Económicos de @APEC sobre COVID-19, en representación del señor Presidente @lopezobrador_. https://t.co/FwXd7KwER0",[],[],"['APEC', 'lopezobrador_']",[],Mexico,Desde temprano en el Retiro Informal de Líderes Económicos de  APEC sobre COVID 19  en representación del señor Presidente  lopezobrador   https   t co FwXd7KwER0,2021-07-16 12:00:00
