,tweet_lang,poi_name,poi_id,verified,id,tweet_text,tweet_emoticons,hashtags,mentions,tweet_urls,country,text_es,tweet_date
102,es,tatclouthier,33937794,True,1391013549368127490,"La #CruzRojaMexicana es y ha sido elemental en momentos difíciles de muchas personas y de la sociedad. Hoy,  regresemos algo para que siga esta gran cadena de ayuda. https://t.co/DP2VQMQUPk",[],['CruzRojaMexicana'],[],[],Mexico,La  CruzRojaMexicana es y ha sido elemental en momentos difíciles de muchas personas y de la sociedad  Hoy   regresemos algo para que siga esta gran cadena de ayuda  https   t co DP2VQMQUPk,2021-05-08 13:00:00
103,es,tatclouthier,33937794,True,1390484187304677382,"Hoy me reuní con el @SenatorHagerty, subrayo de tan productiva conversación, nuestra coincidencia en la necesidad de fortalecer las cadenas de suministro en #AméricaDelNorte para elevar la competitividad de nuestra región. https://t.co/xf7idwitA6",[],['AméricaDelNorte'],['SenatorHagerty'],[],Mexico,Hoy me reuní con el  SenatorHagerty  subrayo de tan productiva conversación  nuestra coincidencia en la necesidad de fortalecer las cadenas de suministro en  AméricaDelNorte para elevar la competitividad de nuestra región  https   t co xf7idwitA6,2021-05-07 02:00:00
104,es,tatclouthier,33937794,True,1390393239828566022,A apoyar a quienes se auto emplean y producen alegría al alma. https://t.co/yUtD6n8I1e,[],[],[],['https://t.co/yUtD6n8I1e'],Mexico,A apoyar a quienes se auto emplean y producen alegría al alma  https   t co yUtD6n8I1e,2021-05-06 20:00:00
105,es,tatclouthier,33937794,True,1390392540252286978,"Nos da gusto el anuncio de inversión de Bosch, fabricante de autopartes, quien invertirá en 2021 entre 90 y 100 millones de dólares, principalmente en líneas de producción y proyectos de industria 4.0.",[],[],[],[],Mexico,Nos da gusto el anuncio de inversión de Bosch  fabricante de autopartes  quien invertirá en 2021 entre 90 y 100 millones de dólares  principalmente en líneas de producción y proyectos de industria 4 0 ,2021-05-06 20:00:00
106,es,tatclouthier,33937794,True,1389589038294704134,"Mis oraciones y condolencias más sentidas para víctimas, herid@s y familiares de la tragedia en el #MetroCDMX",[],['MetroCDMX'],[],[],Mexico,Mis oraciones y condolencias más sentidas para víctimas  herid s y familiares de la tragedia en el  MetroCDMX,2021-05-04 15:00:00
107,es,tatclouthier,33937794,True,1389062949382221828,L@s invito a leer la entrevista que nuestra @Eponiatowska me realizó para la @lajornadaonline https://t.co/UmS1iTTwJe,[],[],"['Eponiatowska', 'lajornadaonline']",['https://t.co/UmS1iTTwJe'],Mexico,L s invito a leer la entrevista que nuestra  Eponiatowska me realizó para la  lajornadaonline https   t co UmS1iTTwJe,2021-05-03 04:00:00
108,es,tatclouthier,33937794,True,1388823531371237376,Gobierno federal anuncia que en #SPGG y #StaCatarina #NL inicia registro para vacunación 50-59. @dordaz @guerravaleria @EilianaOlivo @vivesenlaluna @RebecaClouthier @supermaela @loreniacanavati  @mariajosemtzc @fm_alberto https://t.co/5AExE3cXj6,[],"['SPGG', 'StaCatarina', 'NL']","['dordaz', 'guerravaleria', 'EilianaOlivo', 'vivesenlaluna', 'RebecaClouthier', 'supermaela', 'loreniacanavati', 'mariajosemtzc', 'fm_alberto']",[],Mexico,Gobierno federal anuncia que en  SPGG y  StaCatarina  NL inicia registro para vacunación 50 59   dordaz  guerravaleria  EilianaOlivo  vivesenlaluna  RebecaClouthier  supermaela  loreniacanavati   mariajosemtzc  fm alberto https   t co 5AExE3cXj6,2021-05-02 12:00:00
109,es,tatclouthier,33937794,True,1388518193614970880,"#DiaDelTrabajo mi reconocimiento a los trabajador@s del país que día a día sacan lo mejor de cada un@, en favor de nuestra sociedad y economía.",[],['DiaDelTrabajo'],[],[],Mexico, DiaDelTrabajo mi reconocimiento a los trabajador s del país que día a día sacan lo mejor de cada un   en favor de nuestra sociedad y economía ,2021-05-01 16:00:00
110,es,tatclouthier,33937794,True,1388213178023170054,"Con mucho gusto participé con los Ministros de #Chile, #Colombia y #Perú en la Comisión Administradora del Acuerdo Comercial de la @A_delPacifico, en la que firmamos la Decisión No. 11 de la misma con respecto a Productos de Aseo Doméstico para impulsar su comercialización. https://t.co/rAHYLv5CMG",[],"['Chile', 'Colombia', 'Perú']",['A_delPacifico'],[],Mexico,Con mucho gusto participé con los Ministros de  Chile   Colombia y  Perú en la Comisión Administradora del Acuerdo Comercial de la  A delPacifico  en la que firmamos la Decisión No  11 de la misma con respecto a Productos de Aseo Doméstico para impulsar su comercialización  https   t co rAHYLv5CMG,2021-04-30 19:00:00
111,es,tatclouthier,33937794,True,1386126368010768386,Tod@s podemos contribuir desde un pequeño rincón con @Agenda2030MX https://t.co/PacWT6Ge8T,[],[],['Agenda2030MX'],[],Mexico,Tod s podemos contribuir desde un pequeño rincón con  Agenda2030MX https   t co PacWT6Ge8T,2021-04-25 01:00:00
112,es,tatclouthier,33937794,True,1385240094450151427,Vamos a crear futuro a partir de actuar en el presente. https://t.co/paUklpXBG3,[],[],[],[],Mexico,Vamos a crear futuro a partir de actuar en el presente  https   t co paUklpXBG3,2021-04-22 15:00:00
113,es,tatclouthier,33937794,True,1384932406336106498,"En 2020 @GaelGarciaB y @YasnayaEG visitaron Mty para grabar un episodio sobre calidad del aire para #ElTemaMX, documental que aborda la #CrisisClimática en nuestro país. 

Ayer se estrenó el capítulo, comparto liga: https://t.co/5hAjqeDCF0 https://t.co/oaau8GmmUH",[],"['ElTemaMX', 'CrisisClimática']","['GaelGarciaB', 'YasnayaEG']",['https://t.co/5hAjqeDCF0'],Mexico,En 2020  GaelGarciaB y  YasnayaEG visitaron Mty para grabar un episodio sobre calidad del aire para  ElTemaMX  documental que aborda la  CrisisClimática en nuestro país  Ayer se estrenó el capítulo  comparto liga  https   t co 5hAjqeDCF0 https   t co oaau8GmmUH,2021-04-21 18:00:00
114,es,tatclouthier,33937794,True,1384678204997201920,"Esta mañana visité la empresa Lego, me compartieron su plan de inversión y sus planes de expansión en nuestro país. 

También revisamos inquietudes y soluciones a Ley de Subcontratación.

Por cierto, muy bien sus protocolos de seguridad sanitaria y avances en uso de tecnología. https://t.co/iMHYCoVOwo",['xp'],[],[],[],Mexico,Esta mañana visité la empresa Lego  me compartieron su plan de inversión y sus planes de eansión en nuestro país  También revisamos inquietudes y soluciones a Ley de Subcontratación Por cierto  muy bien sus protocolos de seguridad sanitaria y avances en uso de tecnología  https   t co iMHYCoVOwo,2021-04-21 01:00:00
115,es,tatclouthier,33937794,True,1384536752010850310,Presidente @lopezobrador_ vacunado (1a dosis) vs #COVID19 ¡enhorabuena! https://t.co/5Ppi0dG3UQ,[],['COVID19'],['lopezobrador_'],[],Mexico,Presidente  lopezobrador  vacunado  1a dosis  vs  COVID19 ¡enhorabuena  https   t co 5Ppi0dG3UQ,2021-04-20 16:00:00
116,es,tatclouthier,33937794,True,1383223231650230282,Así se despide nuestro sol #Gto https://t.co/PWyXPNkihJ,['XP'],['Gto'],[],[],Mexico,Así se despide nuestro sol  Gto https   t co PWyNkihJ,2021-04-17 01:00:00
117,es,tatclouthier,33937794,True,1382791056568184833,Felicitamos a Carlos Salazar L. por la continuación de su presidencia an frente del @cceoficialmx,[],[],['cceoficialmx'],[],Mexico,Felicitamos a Carlos Salazar L  por la continuación de su presidencia an frente del  cceoficialmx,2021-04-15 20:00:00
118,es,tatclouthier,33937794,True,1382414320085049345,"Envío una felicitación al Embajador de @UEenMexico, Excmo. Gautier Mignot, quien asumió hoy oficialmente el cargo y reitero también nuestro compromiso de seguir trabajando para fortalecer nuestra fructífera relación con la UE.",[],[],['UEenMexico'],[],Mexico,Envío una felicitación al Embajador de  UEenMexico  Excmo  Gautier Mignot  quien asumió hoy oficialmente el cargo y reitero también nuestro compromiso de seguir trabajando para fortalecer nuestra fructífera relación con la UE ,2021-04-14 19:00:00
119,es,tatclouthier,33937794,True,1382124181920358411,"En relación a la expropiación de un terreno de propiedad colectiva en Tijuana, rechazamos medidas de esta naturaleza, recordando que deudas tributarias no ameritan expropiación.",['xp'],[],[],[],Mexico,En relación a la eropiación de un terreno de propiedad colectiva en Tijuana  rechazamos medidas de esta naturaleza  recordando que deudas tributarias no ameritan eropiación ,2021-04-14 00:00:00
120,es,tatclouthier,33937794,True,1380670109732245508,"Proyecto para reducir basura. @Agenda2030MX
Participa:
https://t.co/0XZDilQuMT",[],[],['Agenda2030MX'],['https://t.co/0XZDilQuMT'],Mexico,Proyecto para reducir basura   Agenda2030MXParticipa https   t co 0XZDilQuMT,2021-04-10 00:00:00
121,es,tatclouthier,33937794,True,1380372220254547968,"Hoy tuve el gusto de compartir reflexiones c Katia, Tania y Norma sobre brecha salarial, acoso, aportación de mujeres a la economía. Un gusto. Gracias @Womerang",[],[],['Womerang'],[],Mexico,Hoy tuve el gusto de compartir reflexiones c Katia  Tania y Norma sobre brecha salarial  acoso  aportación de mujeres a la economía  Un gusto  Gracias  Womerang,2021-04-09 04:00:00
122,es,tatclouthier,33937794,True,1379829002282668040,"#DiaMundialDeLaSalud, agradecemos su entrega, cuidados y protección desde los ámbitos públicos y privados. https://t.co/DyWC0rZgQN",[],['DiaMundialDeLaSalud'],[],[],Mexico, DiaMundialDeLaSalud  agradecemos su entrega  cuidados y protección desde los ámbitos públicos y privados  https   t co DyWC0rZgQN,2021-04-07 16:00:00
123,es,tatclouthier,33937794,True,1379222198209159174,"Desafío @DataMexico_ reconoce los proyectos finalistas con perspectiva de género: análisis sobre brecha salarial y digital, desempleo, y motivos de muerte de las mujeres. Extraordinario análisis.",[],[],['DataMexico_'],[],Mexico,Desafío  DataMexico  reconoce los proyectos finalistas con perspectiva de género  análisis sobre brecha salarial y digital  desempleo  y motivos de muerte de las mujeres  Extraordinario análisis ,2021-04-06 00:00:00
124,es,tatclouthier,33937794,True,1376955670763819009,"Hoy es el día de la Trabajadora del Hogar. En el país hemos avanzado gracias a la lucha de ligislador@s, SCJN,  organizaciones de mujeres para lograr derechos junto con el #IMSS https://t.co/AWioDoySYY",[],['IMSS'],[],[],Mexico,Hoy es el día de la Trabajadora del Hogar  En el país hemos avanzado gracias a la lucha de ligislador s  SCJN   organizaciones de mujeres para lograr derechos junto con el  IMSS https   t co AWioDoySYY,2021-03-30 18:00:00
125,es,tatclouthier,33937794,True,1376931578136395783,La @SRE_mx y el @inmujeres nos reúnen para un  diálogo con la Directora Ejecutiva de @ONU_es Mujeres. https://t.co/Jr12Dd4aKF,[],[],"['SRE_mx', 'inmujeres', 'ONU_es']",[],Mexico,La  SRE mx y el  inmujeres nos reúnen para un  diálogo con la Directora Ejecutiva de  ONU es Mujeres  https   t co Jr12Dd4aKF,2021-03-30 16:00:00
126,es,tatclouthier,33937794,True,1376225393192099845,"Continúa Programa de Vacunación VS #COVID19, para personas de 60 y + años en:  Á. Obregón, B. Juárez y Cuauhtémoc, a partir del 30/03. Gustavo A. Madero e Iztapalapa*
A partir del 2/04. Si te registraste, recibirás notificación SMS c día y hora q te toca. Acreditar residencia.",[],['COVID19'],[],[],Mexico,Continúa Programa de Vacunación VS  COVID19  para personas de 60 y   años en   Á  Obregón  B  Juárez y Cuauhtémoc  a partir del 30 03  Gustavo A  Madero e Iztapalapa A partir del 2 04  Si te registraste  recibirás notificación SMS c día y hora q te toca  Acreditar residencia ,2021-03-28 18:00:00
127,es,tatclouthier,33937794,True,1375634852410720260,"Misma luna y hora, desde rincones distintos. #LindoViernesATodos https://t.co/sCbbHwiddk",[],['LindoViernesATodos'],[],[],Mexico,Misma luna y hora  desde rincones distintos   LindoViernesATodos https   t co sCbbHwiddk,2021-03-27 02:00:00
128,es,tatclouthier,33937794,True,1375428245169000450,"Importante información para leer y compartir el fin de semana
https://t.co/rtrqFZN5R2",[],[],[],['https://t.co/rtrqFZN5R2'],Mexico,Importante información para leer y compartir el fin de semanahttps   t co rtrqFZN5R2,2021-03-26 13:00:00
129,es,tatclouthier,33937794,True,1375135336108597257,"En estos momentos están tomando curso ""Emprendedores Digitales, con la SE 1,150 personas. Importante acompañamiento que sustenta la tarea de los negocios hoy en día.",[],[],[],[],Mexico,En estos momentos están tomando curso  Emprendedores Digitales  con la SE 1 150 personas  Importante acompañamiento que sustenta la tarea de los negocios hoy en día ,2021-03-25 17:00:00
130,es,tatclouthier,33937794,True,1374409574275420167,"Muy contenta de reafirmar  una nueva etapa en América del Norte con tres mujeres comprometidas al frente del #TMEC, hecho histórico en sí. Gracias Emb. Katherine Tai por tan productiva reunión. https://t.co/ovotA63GQe",[],['TMEC'],[],[],Mexico,Muy contenta de reafirmar  una nueva etapa en América del Norte con tres mujeres comprometidas al frente del  TMEC  hecho histórico en sí  Gracias Emb  Katherine Tai por tan productiva reunión  https   t co ovotA63GQe,2021-03-23 17:00:00
131,es,tatclouthier,33937794,True,1373976911974645768,"Iniciamos la semana y el día en Reunión Virtual de Ministros del Grupo Ottawa.  Temas tratados: acceso a vacuna, subsidios a pesca y agricultura y la necesidad de avanzar  para atender inequidades y crecimiento crecimiento así como comercio electrónico.",[],[],[],[],Mexico,Iniciamos la semana y el día en Reunión Virtual de Ministros del Grupo Ottawa   Temas tratados  acceso a vacuna  subsidios a pesca y agricultura y la necesidad de avanzar  para atender inequidades y crecimiento crecimiento así como comercio electrónico ,2021-03-22 13:00:00
132,es,tatclouthier,33937794,True,1373433841499656196,Gracias al equipo @SE_mx por su compromiso en trabajo de planeación e integración. https://t.co/vkU7oCzzlW,[],[],['SE_mx'],[],Mexico,Gracias al equipo  SE mx por su compromiso en trabajo de planeación e integración  https   t co vkU7oCzzlW,2021-03-21 01:00:00
133,es,tatclouthier,33937794,True,1372923784257232899,"Recordamos que en las instalaciones de la Secretaria está una Exposición de Maestros, además de venta exposición artesanal. Te esperamos con los cuidados necesarios. #Felicidades https://t.co/sQBZJuNQoO",['xp'],['Felicidades'],[],['https://t.co/sQBZJuNQoO'],Mexico,Recordamos que en las instalaciones de la Secretaria está una Eosición de Maestros  además de venta eosición artesanal  Te esperamos con los cuidados necesarios   Felicidades https   t co sQBZJuNQoO,2021-03-19 15:00:00
134,es,tatclouthier,33937794,True,1372665295635103750,"Siempre un aprendizaje leer a @jorgezepedap. A dar el paso..
https://t.co/uYPgjwjr9Z",[],[],['jorgezepedap'],['https://t.co/uYPgjwjr9Z'],Mexico,Siempre un aprendizaje leer a  jorgezepedap  A dar el paso  https   t co uYPgjwjr9Z,2021-03-18 22:00:00
135,es,tatclouthier,33937794,True,1372617472948469774,"""La administración anterior terminó importando crudo ligero y hoy exportamos"" dice Octavio Romero al tiempo que da a conocer la publicación de proveedores y fechas de pagos programadas en su página a partir de hoy #Pemex",['xp'],['Pemex'],[],[],Mexico, La administración anterior terminó importando crudo ligero y hoy eortamos  dice Octavio Romero al tiempo que da a conocer la publicación de proveedores y fechas de pagos programadas en su página a partir de hoy  Pemex,2021-03-18 19:00:00
136,es,tatclouthier,33937794,True,1371868440605175810,Con motivo del día del artesano hemos montado una exposición-venta en la explanada de la Secretaria de Economía. Ven esta semana y apoya a nuestros artesanos-artistas. @cultura_mx @TurismoCDMX @TorrucoTurismo https://t.co/AGuCwslvUO,['xp'],[],"['cultura_mx', 'TurismoCDMX', 'TorrucoTurismo']",[],Mexico,Con motivo del día del artesano hemos montado una eosición venta en la elanada de la Secretaria de Economía  Ven esta semana y apoya a nuestros artesanos artistas   cultura mx  TurismoCDMX  TorrucoTurismo https   t co AGuCwslvUO,2021-03-16 17:00:00
137,es,tatclouthier,33937794,True,1371089704154771461,Buen domingo y ojo con el  cambio de hora. ⏰🕰⏰,"['🕰', '⏰']",[],[],[],Mexico,Buen domingo y ojo con el  cambio de hora  ,2021-03-14 13:00:00
138,es,tatclouthier,33937794,True,1369729097862164481,"Agradecemos al @senadomexicano
Por haber aprobado por unanimidad el ACC MX-UK. 
#AcuerdoDeContinuidad",[],['AcuerdoDeContinuidad'],['senadomexicano'],[],Mexico,Agradecemos al  senadomexicanoPor haber aprobado por unanimidad el ACC MX UK   AcuerdoDeContinuidad,2021-03-10 19:00:00
139,es,tatclouthier,33937794,True,1369687460683386884,"Con enorme gusto informamos que estamos presentando y poniendo a disposición la liga de Alertadores de la Corrupción: https://t.co/SdxadI3c6D
Invitamos a que se utilice de forma responsable.",[],[],[],['https://t.co/SdxadI3c6D'],Mexico,Con enorme gusto informamos que estamos presentando y poniendo a disposición la liga de Alertadores de la Corrupción  https   t co SdxadI3c6DInvitamos a que se utilice de forma responsable ,2021-03-10 17:00:00
140,es,tatclouthier,33937794,True,1367624102224293894,Nuestro embajador en OMC fue seleccionado para dirigir los trabajos del Consejo del Comercio de Servicios. En reconocimiento al trabajo de la Misión y a las aportaciones a las discusiones. Orgullos@s.,[],[],[],[],Mexico,Nuestro embajador en OMC fue seleccionado para dirigir los trabajos del Consejo del Comercio de Servicios  En reconocimiento al trabajo de la Misión y a las aportaciones a las discusiones  Orgullos s ,2021-03-05 00:00:00
141,es,tatclouthier,33937794,True,1367170488171171841,"En estos momentos estamos presentando la plataforma ""ComerciaMx"" que apoyará a las empresas pequeñas y medianas para poder exportar. Para ello hay que 3 pasos: Registro, Capacitación y Financiamiento. Gracias al @el_BID por su apoyo.
#EnEconomíaTodosSomosUno",['xp'],['EnEconomíaTodosSomosUno'],['el_BID'],[],Mexico,En estos momentos estamos presentando la plataforma  ComerciaMx  que apoyará a las empresas pequeñas y medianas para poder eortar  Para ello hay que 3 pasos  Registro  Capacitación y Financiamiento  Gracias al  el BID por su apoyo  EnEconomíaTodosSomosUno,2021-03-03 18:00:00
142,es,tatclouthier,33937794,True,1366537914121912321,"Vamos saliendo de la reunión con el presidente @lopezobrador_ y el presidente @JoeBiden, que sin duda fue muy productiva y nos permitió reafirmar lazos de amistad entre nuestros países.",[],[],"['lopezobrador_', 'JoeBiden']",[],Mexico,Vamos saliendo de la reunión con el presidente  lopezobrador  y el presidente  JoeBiden  que sin duda fue muy productiva y nos permitió reafirmar lazos de amistad entre nuestros países ,2021-03-02 00:00:00
143,es,tatclouthier,33937794,True,1366367295367446528,Buen inicio de semana y de mes #Marzo2021.,[],['Marzo2021'],[],[],Mexico,Buen inicio de semana y de mes  Marzo2021 ,2021-03-01 13:00:00
144,es,tatclouthier,33937794,True,1366118939558895617,Un gusto escuchar que se abren las puertas a un nuevo centro psiquiátrico en NL. Esperamos cumpla con los retos y no sea una repetición del modelo viejo del espacio suplido. #LeyDeSaludMental,[],['LeyDeSaludMental'],[],[],Mexico,Un gusto escuchar que se abren las puertas a un nuevo centro psiquiátrico en NL  Esperamos cumpla con los retos y no sea una repetición del modelo viejo del espacio suplido   LeyDeSaludMental,2021-02-28 20:00:00
145,es,tatclouthier,33937794,True,1365352110133555203,"Venimos saliendo de la reunión muy relevante y sobre todo productiva con el Secretario @SecBlinken, a quien agradezco su visita virtual para charlar e intercambiar puntos de vista para profundizar la integración productiva y el fortalecimiento de la competitividad de la región.",[],[],['SecBlinken'],[],Mexico,Venimos saliendo de la reunión muy relevante y sobre todo productiva con el Secretario  SecBlinken  a quien agradezco su visita virtual para charlar e intercambiar puntos de vista para profundizar la integración productiva y el fortalecimiento de la competitividad de la región ,2021-02-26 17:00:00
146,es,tatclouthier,33937794,True,1365351533446062083,Con gusto recibimos al Secretario de Estado de EE.UU. Antony Blinken y su equipo. Platicamos sobre las áreas de oportunidad para hacer crecer nuestra relación económica con el TMEC. Las mujeres y grupos minoritarios juegan papel importante. https://t.co/ybM6qCUsFO,[],[],[],[],Mexico,Con gusto recibimos al Secretario de Estado de EE UU  Antony Blinken y su equipo  Platicamos sobre las áreas de oportunidad para hacer crecer nuestra relación económica con el TMEC  Las mujeres y grupos minoritarios juegan papel importante  https   t co ybM6qCUsFO,2021-02-26 17:00:00
147,es,tatclouthier,33937794,True,1365004393683238913,"Excelente esfuerzo de reunir a Gobierno, IP y Academia en Pacto Oaxaca. Felicitamos a @CONCAMIN, #Unam, #EmbajadaFrancesa, @CNAgropecuario, @CIDE_MX y @GobiernoMX https://t.co/i0BvaRzQUX",[],"['Unam', 'EmbajadaFrancesa']","['CONCAMIN', 'CNAgropecuario', 'CIDE_MX', 'GobiernoMX']",[],Mexico,Excelente esfuerzo de reunir a Gobierno  IP y Academia en Pacto Oaxaca  Felicitamos a  CONCAMIN   Unam   EmbajadaFrancesa   CNAgropecuario   CIDE MX y  GobiernoMX https   t co i0BvaRzQUX,2021-02-25 18:00:00
148,es,tatclouthier,33937794,True,1364254100414550022,En el 108 Aniversario Luctuoso de Madero. Extraordinarias palabras del pasado que suenan como presente en relación a actuar de la prensa con Madero: atacado y abonaron terreno para la traición. https://t.co/QGktEWOtdO,[],[],[],[],Mexico,En el 108 Aniversario Luctuoso de Madero  Extraordinarias palabras del pasado que suenan como presente en relación a actuar de la prensa con Madero  atacado y abonaron terreno para la traición  https   t co QGktEWOtdO,2021-02-23 17:00:00
149,es,tatclouthier,33937794,True,1362475476531339265,"Platicamos con @Jacobson_RS Coordinadora de Frontera Sur del Consejo Económico Nacional de la Casa Blanca, sobre las afectaciones que estamos teniendo tanto México como EE.UU. por la situación de emergencia que enfrenta Texas y buscamos de la mano soluciones inmediatas.",[],[],['Jacobson_RS'],[],Mexico,Platicamos con  Jacobson RS Coordinadora de Frontera Sur del Consejo Económico Nacional de la Casa Blanca  sobre las afectaciones que estamos teniendo tanto México como EE UU  por la situación de emergencia que enfrenta Texas y buscamos de la mano soluciones inmediatas ,2021-02-18 19:00:00
150,es,tatclouthier,33937794,True,1362194732009484290,"Acabamos de contactar al representante del Gobierno de EE.UU. en México,  buscando la no afectación a la industria y garantizar el abasto de gas natural en México. Sabemos los momentos que viven también allá, más de no actuar en conju los resultados podrían ser más complicados.",[],[],[],[],Mexico,Acabamos de contactar al representante del Gobierno de EE UU  en México   buscando la no afectación a la industria y garantizar el abasto de gas natural en México  Sabemos los momentos que viven también allá  más de no actuar en conju los resultados podrían ser más complicados ,2021-02-18 00:00:00
151,es,tatclouthier,33937794,True,1362127121108320259,Esta mañana tuve el gusto de acudir al 114 Aniversario del Palacio Postal. Estuvo presente la voz del Palacio: Héctor Bonilla. Felicito a Rocío por su trabajo iniciado. https://t.co/FEapa22bhU,[],[],[],[],Mexico,Esta mañana tuve el gusto de acudir al 114 Aniversario del Palacio Postal  Estuvo presente la voz del Palacio  Héctor Bonilla  Felicito a Rocío por su trabajo iniciado  https   t co FEapa22bhU,2021-02-17 20:00:00
152,es,tatclouthier,33937794,True,1361334981147172869,".@OMC_es ha elegido por consenso a la Dra. Ngozi Okonjo-Iweala como nueva Directora General, la primera mujer en ocupar este cargo.  México le  envía nuestras felicitaciones.  
¡Enhorabuena!",[],[],['OMC_es'],[],Mexico,  OMC es ha elegido por consenso a la Dra  Ngozi Okonjo Iweala como nueva Directora General  la primera mujer en ocupar este cargo   México le  envía nuestras felicitaciones   ¡Enhorabuena ,2021-02-15 15:00:00
153,es,tatclouthier,33937794,True,1359906328181952515,Sin duda un gran trabajo coordinado entre todas las áreas de gobietno y la @CNAgropecuario. 😉 https://t.co/Dq8qitI9Xw,['😉'],[],['CNAgropecuario'],['https://t.co/Dq8qitI9Xw'],Mexico,Sin duda un gran trabajo coordinado entre todas las áreas de gobietno y la  CNAgropecuario   https   t co Dq8qitI9Xw,2021-02-11 17:00:00
154,es,tatclouthier,33937794,True,1359893581830455297,"La ciencia y la igualdad de género son fundamentales para el desarrollo. Sin embargo, menos del 30% de investigador@s científicos en el mundo son mujeres. Tenemos gran reto para promover desde la edad temprana a que más niñas estén expuestas a estas áreas.",['xp'],[],[],[],Mexico,La ciencia y la igualdad de género son fundamentales para el desarrollo  Sin embargo  menos del 30  de investigador s científicos en el mundo son mujeres  Tenemos gran reto para promover desde la edad temprana a que más niñas estén euestas a estas áreas ,2021-02-11 16:00:00
155,es,tatclouthier,33937794,True,1359129652506329089,Excelente martes. Aprovecho para compartir nuestra invitación.  https://t.co/Jm6iRjyxN7,[],[],[],['https://t.co/Jm6iRjyxN7'],Mexico,Excelente martes  Aprovecho para compartir nuestra invitación   https   t co Jm6iRjyxN7,2021-02-09 13:00:00
156,es,tatclouthier,33937794,True,1358191523658158080,SUERTE CCP. @gemhsm https://t.co/8HXMFOsrzx,[],[],['gemhsm'],['https://t.co/8HXMFOsrzx'],Mexico,SUERTE CCP   gemhsm https   t co 8HXMFOsrzx,2021-02-06 23:00:00
