,tweet_lang,verified,id,tweet_text,tweet_emoticons,hashtags,mentions,tweet_urls,country,text_hi,tweet_date
0,hi,False,1440868278184787974,"कोरोना के खिलाफ मिल सकता है नया इलाज, पशुओं की एंटीबॉडी हो सकती मददगार: रिसर्च https://t.co/V2OLT1rV1r",[],[],[],['https://t.co/V2OLT1rV1r'],India,कोरोना के खिलाफ मिल सकता है नया इलाज  पशुओं की एंटीबॉडी हो सकती मददगार  रिसर्च https   t co V2OLT1rV1r,2021-09-23 03:00:00
1,hi,False,1440719725164580864,@Joydas अगर सर्दी बुखार य अन्य कोइ लक्षण होते हैं तो संभावना व्यक्ति क़ी जा सकती हैं क्योकि एंटीबॉडी क़ा समय 28 दिन होता है शेष पूर्ववत,[],[],['Joydas'],[],India, Joydas अगर सर्दी बुखार य अन्य कोइ लक्षण होते हैं तो संभावना व्यक्ति क़ी जा सकती हैं क्योकि एंटीबॉडी क़ा समय 28 दिन होता है शेष पूर्ववत,2021-09-22 17:00:00
2,hi,False,1440712112054046725,कोरोना के ओरिजनल स्ट्रेन से बनी एंटीबॉडी वेरिएंट से लड़ाई में मददगार नहीं – रिसर्च https://t.co/URXNtOdbxD,['xD'],[],[],['https://t.co/URXNtOdbxD'],India,कोरोना के ओरिजनल स्ट्रेन से बनी एंटीबॉडी वेरिएंट से लड़ाई में मददगार नहीं – रिसर्च https   t co URXNtOdb,2021-09-22 16:00:00
3,hi,False,1440705192257732611,"कोरोना वायरस के इलाज में इस पशु की एंटीबॉडी हो सकती है कारगर, नेजल स्‍प्रे से इस्‍तेमाल संभव
https://t.co/3bCZPEcnOt",[],[],[],['https://t.co/3bCZPEcnOt'],India,कोरोना वायरस के इलाज में इस पशु की एंटीबॉडी हो सकती है कारगर  नेजल स्‍प्रे से इस्‍तेमाल संभवhttps   t co 3bCZPEcnOt,2021-09-22 16:00:00
4,hi,False,1440550705962516482,"@asifabdullah175 @Shahnaw51044382 @BiharHealthDept भाई तुम्हारी जानकारी के लिए बता दू की नॉर्थ इंडिया और सेंट्रल इंडिया में corona के मामले उतने ही आ रहे है जितना बिहार में, और एंटीबॉडी सर्वे में 75% बिहार के लोगों में एंटीबॉडी मिली है और vecine अलग लग रही है इसलिए केस कम हों रहे हैं, लॉजिक से बात कहो और समझो,",[],[],"['asifabdullah175', 'Shahnaw51044382', 'BiharHealthDept']",[],India, asifabdullah175  Shahnaw51044382  BiharHealthDept भाई तुम्हारी जानकारी के लिए बता दू की नॉर्थ इंडिया और सेंट्रल इंडिया में corona के मामले उतने ही आ रहे है जितना बिहार में  और एंटीबॉडी सर्वे में 75  बिहार के लोगों में एंटीबॉडी मिली है और vecine अलग लग रही है इसलिए केस कम हों रहे हैं  लॉजिक से बात कहो और समझो ,2021-09-22 06:00:00
5,hi,False,1440466057102118913,"मुंबई: पवई का एलएच हीरानंदानी अस्पताल शहर का पहला अस्पताल है जिसने स्वास्थ्य कर्मियों के लिए बूस्टर शॉट की मांग को लेकर निगम और राज्य सरकार को पत्र लिखा है.  टीओआई ने पिछले हफ्ते रिपोर्ट किया था कि कितने स्वास्थ्य कार्यकर्ता और राजनेता अपने एंटीबॉडी के

https://t.co/hUlq58SHUG https://t.co/iRkkrZhnTu",[],[],[],['https://t.co/hUlq58SHUG'],India,मुंबई  पवई का एलएच हीरानंदानी अस्पताल शहर का पहला अस्पताल है जिसने स्वास्थ्य कर्मियों के लिए बूस्टर शॉट की मांग को लेकर निगम और राज्य सरकार को पत्र लिखा है   टीओआई ने पिछले हफ्ते रिपोर्ट किया था कि कितने स्वास्थ्य कार्यकर्ता और राजनेता अपने एंटीबॉडी केhttps   t co hUlq58SHUG https   t co iRkkrZhnTu,2021-09-22 00:00:00
6,hi,False,1439995117159399428,वैश्विक दवा कंपनियों फाइजर और बायोएनटेक एसई ने सोमवार को कहा कि कोविड-19 टीकों के परीक्षण के नतीजों से पता चला है कि ये पांच से11साल की उम्र के बच्चों के लिये सुरक्षित है और उनमें मजबूत एंटीबॉडी पैदा करते हैं।उन्होंने कहा कि वे जल्द से जल्द नियामक मंजूरी लेने की योजना बना रही हैं,[],[],[],[],India,वैश्विक दवा कंपनियों फाइजर और बायोएनटेक एसई ने सोमवार को कहा कि कोविड 19 टीकों के परीक्षण के नतीजों से पता चला है कि ये पांच से11साल की उम्र के बच्चों के लिये सुरक्षित है और उनमें मजबूत एंटीबॉडी पैदा करते हैं।उन्होंने कहा कि वे जल्द से जल्द नियामक मंजूरी लेने की योजना बना रही हैं,2021-09-20 17:00:00
7,hi,True,1439922659010117633,#LIVE। सीरो सर्वे में आई राहत की खबर । 86% लोगों में कोरोना की एंटीबॉडी । #ConsumerAdda में देखिए सीरो सर्वे - कितनी राहत? @vipinbhatt के साथ। https://t.co/ngXISgXdmc,[],"['LIVE', 'ConsumerAdda']",['vipinbhatt'],['https://t.co/ngXISgXdmc'],India, LIVE। सीरो सर्वे में आई राहत की खबर । 86  लोगों में कोरोना की एंटीबॉडी ।  ConsumerAdda में देखिए सीरो सर्वे   कितनी राहत   vipinbhatt के साथ। https   t co ngXISgXdmc,2021-09-20 12:00:00
8,hi,True,1439916500253437955,#ComingUp। सीरो सर्वे में आई राहत की खबर । 86% लोगों में कोरोना की एंटीबॉडी । कोरोना से लड़ाई में होगा फायदा। आज #ConsumerAdda में देखिए सीरो सर्वे - कितनी राहत? @vipinbhatt के साथ। https://t.co/SC2WG6DezP,[],"['ComingUp', 'ConsumerAdda']",['vipinbhatt'],[],India, ComingUp। सीरो सर्वे में आई राहत की खबर । 86  लोगों में कोरोना की एंटीबॉडी । कोरोना से लड़ाई में होगा फायदा। आज  ConsumerAdda में देखिए सीरो सर्वे   कितनी राहत   vipinbhatt के साथ। https   t co SC2WG6DezP,2021-09-20 12:00:00
9,hi,False,1439865663619694592,"मुंबई में लगभग 90% लोगों में कोविड -19 एंटीबॉडी हैं: सर्वेक्षण

#MUMBAI #Antibodies #covid19 

https://t.co/pXqL6tWVrD",[],"['MUMBAI', 'Antibodies', 'covid19']",[],['https://t.co/pXqL6tWVrD'],India,मुंबई में लगभग 90  लोगों में कोविड  19 एंटीबॉडी हैं  सर्वेक्षण MUMBAI  Antibodies  covid19 https   t co pXqL6tWVrD,2021-09-20 08:00:00
10,hi,False,1439861330094313477,"सिनोफार्म का कोविड बूस्टर एंटीबॉडी की कमी को करता है दूर, जानिए तीसरी खुराक के और फायदे https://t.co/RdTDwtGfa9",[],[],[],['https://t.co/RdTDwtGfa9'],India,सिनोफार्म का कोविड बूस्टर एंटीबॉडी की कमी को करता है दूर  जानिए तीसरी खुराक के और फायदे https   t co RdTDwtGfa9,2021-09-20 08:00:00
11,hi,False,1439855465379164163,"राजधानी के बच्चों में मिली 79 प्रतिशत एंटीबॉडी, 10 से आठ बच्चों को छू कर निकल गया कोरोना : https://t.co/u9jp983L1m

#MadhyaPradesh",[],['MadhyaPradesh'],[],['https://t.co/u9jp983L1m'],India,राजधानी के बच्चों में मिली 79 प्रतिशत एंटीबॉडी  10 से आठ बच्चों को छू कर निकल गया कोरोना   https   t co u9jp983L1m MadhyaPradesh,2021-09-20 08:00:00
12,hi,False,1439853697828229124,"कोरोना वायरस के खिलाफ मुंबई की 86 प्रतिशत से ज्यादा आबादी में एंटबॉडी विकसित:सर्वे
लैंगिक तुलना के संबंध में 88.29 प्रतिशत महिलाओं में जबकि 85.07 फीसदी पुरुषों में एंटीबॉडी मिला। सर्वे में 8,674 नमूनों की जांच की गई, जिनमें से 20 फीसदी नमूने स्वास्थ्य कर्मियों के थे।
#vaccine 1/2 https://t.co/PPKQBk9QpV",[],['vaccine'],[],[],India,कोरोना वायरस के खिलाफ मुंबई की 86 प्रतिशत से ज्यादा आबादी में एंटबॉडी विकसित सर्वेलैंगिक तुलना के संबंध में 88 29 प्रतिशत महिलाओं में जबकि 85 07 फीसदी पुरुषों में एंटीबॉडी मिला। सर्वे में 8 674 नमूनों की जांच की गई  जिनमें से 20 फीसदी नमूने स्वास्थ्य कर्मियों के थे। vaccine 1 2 https   t co PPKQBk9QpV,2021-09-20 07:00:00
13,hi,False,1439849248363712516,"अमेरिका में कोरोना के इलाज में मोनोक्लोनल एंटीबॉडी की मांग में 20 गुना वृद्धि
@MedhajNewsApp 
#America 
https://t.co/5ixCK1Ingv",[],['America'],['MedhajNewsApp'],['https://t.co/5ixCK1Ingv'],India,अमेरिका में कोरोना के इलाज में मोनोक्लोनल एंटीबॉडी की मांग में 20 गुना वृद्धि MedhajNewsApp  America https   t co 5ixCK1Ingv,2021-09-20 07:00:00
14,hi,False,1439824516377497601,"एंटीबॉडी कॉकटेल ‘कोरोना की दवा’से अब होगा कोविड मरीजों का इलाज
https://t.co/DXGv8IWzTx https://t.co/2zPcIamMee",[],[],[],['https://t.co/DXGv8IWzTx'],India,एंटीबॉडी कॉकटेल ‘कोरोना की दवा’से अब होगा कोविड मरीजों का इलाजhttps   t co DXGv8IWzTx https   t co 2zPcIamMee,2021-09-20 06:00:00
15,hi,True,1439800937703477248,"कश्मीरियों में कोरोना एंटीबॉडी के आंकड़े ने चौंकाया, राष्ट्रीय औसत से ज्यादा मिली एंटीबॉडी

#COVID19 https://t.co/gJcYlIxskn",[],['COVID19'],[],[],India,कश्मीरियों में कोरोना एंटीबॉडी के आंकड़े ने चौंकाया  राष्ट्रीय औसत से ज्यादा मिली एंटीबॉडी COVID19 https   t co gJcYlIxskn,2021-09-20 04:00:00
16,hi,False,1439700574585294849,"गुजरात मे एक नया नियम बनाया गया है सरकार की तरफ से अगर आप ने वेक्सीन नही करवाई तो आप BRTS या AMTS (पब्लिक ट्रांसपोर्ट बस) में नही बैठ शकते। गार्डन या सरकरि ऑफिस में नही जा शकते।  आम लोगो को परेशान करने वाली सरकार । कोरोना की एंटीबॉडी बच्चो ,युवाओ ओर स्व्स्थ लोगो मे अपने आप बनती।",[],[],[],[],India,गुजरात मे एक नया नियम बनाया गया है सरकार की तरफ से अगर आप ने वेक्सीन नही करवाई तो आप BRTS या AMTS  पब्लिक ट्रांसपोर्ट बस  में नही बैठ शकते। गार्डन या सरकरि ऑफिस में नही जा शकते।  आम लोगो को परेशान करने वाली सरकार । कोरोना की एंटीबॉडी बच्चो  युवाओ ओर स्व्स्थ लोगो मे अपने आप बनती।,2021-09-19 21:00:00
17,hi,False,1439594722335539203,New post: अमेरिका में कोविड के इलाज के लिए मोनोक्लोनल एंटीबॉडी की मांग में वृद्धि https://t.co/sXbz9jAgCG,[],[],[],['https://t.co/sXbz9jAgCG'],India,New post  अमेरिका में कोविड के इलाज के लिए मोनोक्लोनल एंटीबॉडी की मांग में वृद्धि https   t co sXbz9jAgCG,2021-09-19 14:00:00
18,hi,False,1439496516201222148,"मुंबई के 87% लोगों में कोरोना एंटीबॉडी बनी:85% पुरुष और 88% महिलाओं में रोग प्रतिरोधक क्षमता डेवलप हुई, पांचवें सीरो सर्वे ने पिछले सभी रिकॉर्ड तोड़े 
             https://t.co/4ZtFBCojxS https://t.co/r9h1alnV3O",[],[],[],['https://t.co/4ZtFBCojxS'],India,मुंबई के 87  लोगों में कोरोना एंटीबॉडी बनी 85  पुरुष और 88  महिलाओं में रोग प्रतिरोधक क्षमता डेवलप हुई  पांचवें सीरो सर्वे ने पिछले सभी रिकॉर्ड तोड़े              https   t co 4ZtFBCojxS https   t co r9h1alnV3O,2021-09-19 08:00:00
19,hi,True,1439476861067694084,"ब्रिटेन में एंटीबॉडी दवा रोनाप्रेव से होगा कोविड मरीजों का इलाज
#Britain | #DonaldTrump | #Ronapreve
https://t.co/EvLGwwYtlq",[],"['Britain', 'DonaldTrump', 'Ronapreve']",[],['https://t.co/EvLGwwYtlq'],India,ब्रिटेन में एंटीबॉडी दवा रोनाप्रेव से होगा कोविड मरीजों का इलाज Britain    DonaldTrump    Ronaprevehttps   t co EvLGwwYtlq,2021-09-19 07:00:00
20,hi,False,1439225685021704195,"मुंबई की 87 फीसदी आबादी के अंदर है एंटीबॉडी, पांचवे सीरो सर्वे की रिपोर्ट में सामने आए नतीजे https://t.co/rW6PeVouYr",[],[],[],['https://t.co/rW6PeVouYr'],India,मुंबई की 87 फीसदी आबादी के अंदर है एंटीबॉडी  पांचवे सीरो सर्वे की रिपोर्ट में सामने आए नतीजे https   t co rW6PeVouYr,2021-09-18 14:00:00
21,hi,False,1439220664775286789,"@pbhushan1 शेंर के आगे रोजाना गोश्त डालोगे तो वो शिकार करके खाने की मेहनत नहि करेगा.. आलसी बनेगा ठीक वैसे.. वेक्सीन से आसानी से शरीर को इम्यूनीटी मिल जाती है तो ऐसा शरीर एंटीबॉडी बनाने की कोशिश नहि करेगा.. आलसी बनेगा
वैसे वेक्सीन से प्राप्त इम्यूनीटी से बेहतर शरीर ने खुद बनाई एंटीबॉडी है",[],[],['pbhushan1'],[],India, pbhushan1 शेंर के आगे रोजाना गोश्त डालोगे तो वो शिकार करके खाने की मेहनत नहि करेगा   आलसी बनेगा ठीक वैसे   वेक्सीन से आसानी से शरीर को इम्यूनीटी मिल जाती है तो ऐसा शरीर एंटीबॉडी बनाने की कोशिश नहि करेगा   आलसी बनेगावैसे वेक्सीन से प्राप्त इम्यूनीटी से बेहतर शरीर ने खुद बनाई एंटीबॉडी है,2021-09-18 14:00:00
22,hi,True,1439180146473381892,"मुंबई के 87% लोगों में कोरोना एंटीबॉडी बनी: 85% पुरुष और 88% महिलाओं में रोग प्रतिरोधक क्षमता डेवलप हुई, पांचवे सीरो सर्वे ने पिछले सभी रिकॉर्ड तोड़े
https://t.co/8ixKMsBMTj
#fifthserosurvey #CoronavirusUpdates @CMOMaharashtra #Mumbai",[],"['fifthserosurvey', 'CoronavirusUpdates', 'Mumbai']",['CMOMaharashtra'],['https://t.co/8ixKMsBMTj'],India,मुंबई के 87  लोगों में कोरोना एंटीबॉडी बनी  85  पुरुष और 88  महिलाओं में रोग प्रतिरोधक क्षमता डेवलप हुई  पांचवे सीरो सर्वे ने पिछले सभी रिकॉर्ड तोड़ेhttps   t co 8ixKMsBMTj fifthserosurvey  CoronavirusUpdates  CMOMaharashtra  Mumbai,2021-09-18 11:00:00
23,hi,False,1439178415899217929,"मुंबई के 86.64% लोगों में कोरोना संक्रमण के खिलाफ लड़ाई लड़ने वाली एंटीबॉडी मिली हैं। इस आबादी में 85.07% पुरुष और 88.29% महिलाएं शामिल हैं। यह जानकारी सायन अस्पताल, ATI चंद्रा फाउंडेशन और IDFC इंस्टीट्यूट के सीरो सर्वे में सामने आई है। 
#viralvideo #corona #covid19 #mumbainews https://t.co/KfmxymXLf6",[],"['viralvideo', 'corona', 'covid19', 'mumbainews']",[],[],India,मुंबई के 86 64  लोगों में कोरोना संक्रमण के खिलाफ लड़ाई लड़ने वाली एंटीबॉडी मिली हैं। इस आबादी में 85 07  पुरुष और 88 29  महिलाएं शामिल हैं। यह जानकारी सायन अस्पताल  ATI चंद्रा फाउंडेशन और IDFC इंस्टीट्यूट के सीरो सर्वे में सामने आई है।  viralvideo  corona  covid19  mumbainews https   t co KfmxymXLf6,2021-09-18 11:00:00
24,hi,False,1439167589578592260,"मुंबई के 87% लोगों में कोरोना एंटीबॉडी बनी:85% पुरुष और 88% महिलाओं में रोग प्रतिरोधक क्षमता डेवलप हुई, पांचवे सीरो सर्वे ने पिछले सभी रिकॉर्ड तोड़े https://t.co/yB0WvLrXqC",[],[],[],['https://t.co/yB0WvLrXqC'],India,मुंबई के 87  लोगों में कोरोना एंटीबॉडी बनी 85  पुरुष और 88  महिलाओं में रोग प्रतिरोधक क्षमता डेवलप हुई  पांचवे सीरो सर्वे ने पिछले सभी रिकॉर्ड तोड़े https   t co yB0WvLrXqC,2021-09-18 10:00:00
25,hi,False,1439139380921126917,"कोरोना: सीरो सर्वे में मुंबई की 86 फीसदी आबादी में एंटीबॉडी मिली, टीकाकरण के आए अच्छे नतीजे",[],[],[],[],India,कोरोना  सीरो सर्वे में मुंबई की 86 फीसदी आबादी में एंटीबॉडी मिली  टीकाकरण के आए अच्छे नतीजे,2021-09-18 08:00:00
26,hi,False,1439130134431375360,"मुंबई के लगभग 90 प्रतिशत में COVID-19 एंटीबॉडी हैं: सर्वेक्षण
#mumbai #coronavirus #covid19 https://t.co/tuMvaCtfIY",[],"['mumbai', 'coronavirus', 'covid19']",[],['https://t.co/tuMvaCtfIY'],India,मुंबई के लगभग 90 प्रतिशत में COVID 19 एंटीबॉडी हैं  सर्वेक्षण mumbai  coronavirus  covid19 https   t co tuMvaCtfIY,2021-09-18 08:00:00
27,hi,False,1439125088712937472,"शेंर के आगे रोजाना गोश्त डालोगे तो वो शिकार करके खाने की मेहनत नहि करेगा.. आलसी बनेगा ठीक वैसे.. वेक्सीन से आसानी से शरीर को इम्यूनीटी मिल जाती है तो ऐसा शरीर एंटीबॉडी बनाने की कोशिश नहि करेगा.. आलसी बनेगा
वैसे वेक्सीन से प्राप्त इम्यूनीटी से बेहतर शरीर ने खुद बनाई एंटीबॉडी है",[],[],[],[],India,शेंर के आगे रोजाना गोश्त डालोगे तो वो शिकार करके खाने की मेहनत नहि करेगा   आलसी बनेगा ठीक वैसे   वेक्सीन से आसानी से शरीर को इम्यूनीटी मिल जाती है तो ऐसा शरीर एंटीबॉडी बनाने की कोशिश नहि करेगा   आलसी बनेगावैसे वेक्सीन से प्राप्त इम्यूनीटी से बेहतर शरीर ने खुद बनाई एंटीबॉडी है,2021-09-18 07:00:00
