,tweet_lang,replied_to_tweet_id,replied_to_user_id,reply_text,id,verified,text_es,tweet_date,country,tweet_text,tweet_emoticons,hashtags,mentions,tweet_urls,text_en
746,es,1439964677438533635,2844946777,La  NuevaNormalidad  Desescalada  YoMeVacuno y  COVID19 en viñetas  20 09 2021  Cierro hilo con  a sciammarella y el flamante Premio Nacional de Cinematográfica  José Sacristán ¡Enhorabuena  https   t co Y1TsuqL7rb,1439967562289324035,False,La  NuevaNormalidad  Desescalada  YoMeVacuno y  COVID19 en viñetas  20 09 2021  Cierro hilo con  a sciammarella y el flamante Premio Nacional de Cinematográfica  José Sacristán ¡Enhorabuena  https   t co Y1TsuqL7rb,2021-09-20T14:59:54.000Z,Mexico,"La #NuevaNormalidad #Desescalada #YoMeVacuno y #COVID19 en viñetas, 20.09.2021. Cierro hilo con @a_sciammarella y el flamante Premio Nacional de Cinematográfica, José Sacristán ¡Enhorabuena! https://t.co/Y1TsuqL7rb",[],"['NuevaNormalidad', 'Desescalada', 'YoMeVacuno', 'COVID19']",['a_sciammarella'],['https://t.co/7UsXfF2fUE'],
747,es,1439964677438533635,2844946777,La  NuevaNormalidad  Desescalada  YoMeVacuno y  COVID19 en viñetas  20 09 2021   EnekoHumor  Elkokoparrilla  asiersanznieto  LPOdibuja https   t co OWcVReR2Vz,1439967170809761797,False,La  NuevaNormalidad  Desescalada  YoMeVacuno y  COVID19 en viñetas  20 09 2021   EnekoHumor  Elkokoparrilla  asiersanznieto  LPOdibuja https   t co OWcVReR2Vz,2021-09-20T14:58:21.000Z,Mexico,"La #NuevaNormalidad #Desescalada #YoMeVacuno y #COVID19 en viñetas, 20.09.2021. @EnekoHumor @Elkokoparrilla @asiersanznieto @LPOdibuja https://t.co/OWcVReR2Vz",[],"['NuevaNormalidad', 'Desescalada', 'YoMeVacuno', 'COVID19']","['EnekoHumor', 'Elkokoparrilla']",['https://t.co/9OJc6HQ4JD'],
748,es,1439964677438533635,2844946777,La  NuevaNormalidad  Desescalada  YoMeVacuno y  COVID19 en viñetas  20 09 2021   Pachi Idigoras  ElRoto  Peridis  JLJLMartin https   t co Uz88GqWk3b,1439966813207547904,False,La  NuevaNormalidad  Desescalada  YoMeVacuno y  COVID19 en viñetas  20 09 2021   Pachi Idigoras  ElRoto  Peridis  JLJLMartin https   t co Uz88GqWk3b,2021-09-20T14:56:56.000Z,Mexico,"La #NuevaNormalidad #Desescalada #YoMeVacuno y #COVID19 en viñetas, 20.09.2021. @Pachi_Idigoras #ElRoto #Peridis @JLJLMartin https://t.co/Uz88GqWk3b",[],"['NuevaNormalidad', 'Desescalada', 'YoMeVacuno', 'COVID19', 'ElRoto', 'Peridis']",['Pachi_Idigoras'],['https://t.co/PYNqEGsSt7'],
749,es,1439964677438533635,2844946777,La  NuevaNormalidad  Desescalada  YoMeVacuno y  COVID19 en viñetas  20 09 2021   BeVergara  malagonhumor  Dani Gove  HUMORJMNIETO https   t co btLlcx7aUH,1439966126180638728,False,La  NuevaNormalidad  Desescalada  YoMeVacuno y  COVID19 en viñetas  20 09 2021   BeVergara  malagonhumor  Dani Gove  HUMORJMNIETO https   t co btLlcx7aUH,2021-09-20T14:54:12.000Z,Mexico,"La #NuevaNormalidad #Desescalada #YoMeVacuno y #COVID19 en viñetas, 20.09.2021. @BeVergara @malagonhumor @Dani_Gove @HUMORJMNIETO https://t.co/btLlcx7aUH",[],"['NuevaNormalidad', 'Desescalada', 'YoMeVacuno', 'COVID19']","['BeVergara', 'malagonhumor', 'Dani_Gove']",['https://t.co/6MdIMzgsmE'],
750,es,1439964677438533635,2844946777,La  NuevaNormalidad  Desescalada  YoMeVacuno y  COVID19 en viñetas  20 09 2021   gallegoy rey  donTomasSerrano  MikiyDuarte  ferranmartin https   t co YjhfSluQ1l,1439965424427409410,False,La  NuevaNormalidad  Desescalada  YoMeVacuno y  COVID19 en viñetas  20 09 2021   gallegoy rey  donTomasSerrano  MikiyDuarte  ferranmartin https   t co YjhfSluQ1l,2021-09-20T14:51:25.000Z,Mexico,"La #NuevaNormalidad #Desescalada #YoMeVacuno y #COVID19 en viñetas, 20.09.2021. @gallegoy_rey @donTomasSerrano @MikiyDuarte @ferranmartin https://t.co/YjhfSluQ1l",[],"['NuevaNormalidad', 'Desescalada', 'YoMeVacuno', 'COVID19']","['gallegoy_rey', 'donTomasSerrano']",['https://t.co/IIiro85A8F'],
751,es,1439964677438533635,2844946777,La  NuevaNormalidad  Desescalada  YoMeVacuno y  COVID19 en viñetas  20 09 2021   Sanson    JaviSaladoo  carlesponsi  latiradePostigo https   t co nFKYYzpBEp,1439965113407184899,False,La  NuevaNormalidad  Desescalada  YoMeVacuno y  COVID19 en viñetas  20 09 2021   Sanson    JaviSaladoo  carlesponsi  latiradePostigo https   t co nFKYYzpBEp,2021-09-20T14:50:10.000Z,Mexico,"La #NuevaNormalidad #Desescalada #YoMeVacuno y #COVID19 en viñetas, 20.09.2021. @Sanson__ @JaviSaladoo @carlesponsi @latiradePostigo https://t.co/nFKYYzpBEp",[],"['NuevaNormalidad', 'Desescalada', 'YoMeVacuno', 'COVID19']","['Sanson__', 'JaviSaladoo', 'carlesponsi']",['https://t.co/Oyghm5FVhT'],
752,es,1439959422395158533,180686357, No seas tan cruelNo busques más pretextosNo seas tan cruelSiempre seremos prófugos https   t co 3VdynjI61q,1439962492566966274,False, No seas tan cruelNo busques más pretextosNo seas tan cruelSiempre seremos prófugos https   t co 3VdynjI61q,2021-09-20T14:39:46.000Z,Mexico,"🎶 No seas tan cruel
No busques más pretextos
No seas tan cruel
Siempre seremos prófugos https://t.co/3VdynjI61q",['🎶'],[],[],[],
753,es,1439959422395158533,180686357,Solo así yo te veré a través de mi persiana americana  ExcelenteServicio  VacunaCOVID19  JovenesDe40,1439961418850316291,False,Solo así yo te veré a través de mi persiana americana  ExcelenteServicio  VacunaCOVID19  JovenesDe40,2021-09-20T14:35:30.000Z,Mexico,"Solo así yo te veré a través de mi persiana americana 🙌🏼🎶

#ExcelenteServicio ⭐⭐⭐⭐⭐
#VacunaCOVID19 #JovenesDe40","['🎶', '🙌🏼', '⭐']","['ExcelenteServicio', 'VacunaCOVID19', 'JovenesDe40']",[],[],
754,es,1439955456630341633,35541975, MVSNoticias Lopez  ¿cómo pa cuando vas a aplicar la vacuna a LOS ADOLESCENTES ,1439960757072969731,False, MVSNoticias Lopez  ¿cómo pa cuando vas a aplicar la vacuna a LOS ADOLESCENTES ,2021-09-20T14:32:52.000Z,Mexico,"@MVSNoticias Lopez, ¿cómo pa'cuando vas a aplicar la vacuna a LOS ADOLESCENTES?",[],[],['MVSNoticias'],[],
755,es,1439955332827070474,1287950908417101829, JAguirre 26 Felicidades mano,1440006420250849283,False, JAguirre 26 Felicidades mano,2021-09-20T17:34:19.000Z,Mexico,@JAguirre_26 Felicidades mano,[],[],['JAguirre_26'],[],
756,es,1439953660562350082,82050536, NancyVir Tóxicos no declarados entre los componentes de la  vacuna https   t co KkS4wXE1ah,1441047465151631366,False, NancyVir Tóxicos no declarados entre los componentes de la  vacuna https   t co KkS4wXE1ah,2021-09-23T14:31:03.000Z,Mexico,"@NancyVir Tóxicos no declarados entre los componentes de la ""vacuna""
https://t.co/KkS4wXE1ah",[],[],['NancyVir'],['https://t.co/KkS4wXE1ah'],
757,es,1439953660562350082,82050536, NancyVir Excelente    ,1440131020561555457,False, NancyVir Excelente    ,2021-09-21T01:49:26.000Z,Mexico,@NancyVir Excelente!!!!,[],[],['NancyVir'],[],
758,es,1439953660562350082,82050536, NancyVir gracias  me  quedado claro  ,1440127174531436546,False, NancyVir gracias  me  quedado claro  ,2021-09-21T01:34:09.000Z,Mexico,@NancyVir gracias. me. quedado claro. ✌️,['✌️'],[],['NancyVir'],[],
759,es,1439953660562350082,82050536, y entonces  No  las vacunas se transportan con cadena de frío desde siempre ,1440124733182431233,False, y entonces  No  las vacunas se transportan con cadena de frío desde siempre ,2021-09-21T01:24:27.000Z,Mexico,"@y_entonces_ No, las vacunas se transportan con cadena de frío desde siempre.",[],[],['y_entonces_'],[],
760,es,1439953660562350082,82050536, NancyVir Recién ví esta foto de Costa Rica y me pareció acertada la estrategia  que bueno que acá en Guate también se busque llegar a la población de las áreas rurales  https   t co JrdelANUUH,1440040435318091779,False, NancyVir Recién ví esta foto de Costa Rica y me pareció acertada la estrategia  que bueno que acá en Guate también se busque llegar a la población de las áreas rurales  https   t co JrdelANUUH,2021-09-20T19:49:29.000Z,Mexico,"@NancyVir Recién ví esta foto de Costa Rica y me pareció acertada la estrategia, que bueno que acá en Guate también se busque llegar a la población de las áreas rurales. https://t.co/JrdelANUUH",[],[],['NancyVir'],['https://t.co/xp90gZCcxu'],
761,es,1439953660562350082,82050536, NancyVir Todo bien  lo que hace falta es que alguien les dé una elicación lo más clara posible y así quitarles los miedos que han generado los antivacunas,1440009361473036297,False, NancyVir Todo bien  lo que hace falta es que alguien les dé una elicación lo más clara posible y así quitarles los miedos que han generado los antivacunas,2021-09-20T17:46:00.000Z,Mexico,"@NancyVir Todo bien, lo que hace falta es que alguien les dé una explicación lo más clara posible y así quitarles los miedos que han generado los antivacunas",['xp'],[],['NancyVir'],['https://t.co/jaGOVAzjuc'],
762,es,1439953660562350082,82050536, y entonces   NancyVir Se está poniendo la Asta Zeneca  que es como una vacuna normal  puede ir con baterías y aguanta bien  Ahora el que lleva la toalla encima es que la está protegiendo más ,1439976208201027591,False, y entonces   NancyVir Se está poniendo la Asta Zeneca  que es como una vacuna normal  puede ir con baterías y aguanta bien  Ahora el que lleva la toalla encima es que la está protegiendo más ,2021-09-20T15:34:16.000Z,Mexico,"@y_entonces_ @NancyVir Se está poniendo la Asta Zeneca, que es como una vacuna normal, puede ir con baterías y aguanta bien. Ahora el que lleva la toalla encima es que la está protegiendo más.",[],[],"['y_entonces_', 'NancyVir']",['https://t.co/zRCnL31bZm'],
763,es,1439953660562350082,82050536, NancyVir pero me queda una duda si no se arruina las vacunas en ese termito  q llevan    q tanto aguanta la vacuna asi,1439960889122242562,False, NancyVir pero me queda una duda si no se arruina las vacunas en ese termito  q llevan    q tanto aguanta la vacuna asi,2021-09-20T14:33:23.000Z,Mexico,@NancyVir pero me queda una duda si no se arruina las vacunas en ese termito  q llevan. ? q tanto aguanta la vacuna asi,[],[],['NancyVir'],[],
764,es,1439953660562350082,82050536, NancyVir Los auxiliares de enfermería comunitarios siempre sacando la casta y son tan poco valorados   ,1439957251725332480,False, NancyVir Los auxiliares de enfermería comunitarios siempre sacando la casta y son tan poco valorados   ,2021-09-20T14:18:56.000Z,Mexico,@NancyVir Los auxiliares de enfermería comunitarios siempre sacando la casta y son tan poco valorados...,[],[],['NancyVir'],[],
765,es,1439950096762867717,1367127898482688004, xennials505 Y en ambos casos ha sido con vacunas donadas  nada que agradecerle a  OrtegaIlegitimo,1439973023721852931,False, xennials505 Y en ambos casos ha sido con vacunas donadas  nada que agradecerle a  OrtegaIlegitimo,2021-09-20T15:21:36.000Z,Mexico,"@xennials505 Y en ambos casos ha sido con vacunas donadas, nada que agradecerle a #OrtegaIlegitimo",[],['OrtegaIlegitimo'],['xennials505'],[],
766,es,1439933050088009730,1252243937080815620, ValdesL2 El problema es ese  q no se están salvando vidas,1440613061191077900,False, ValdesL2 El problema es ese  q no se están salvando vidas,2021-09-22T09:44:53.000Z,Mexico,"@ValdesL2 El problema es ese, q no se están salvando vidas",[],[],['ValdesL2'],[],
767,es,1439933050088009730,1252243937080815620, ImTheResistance Darte pena a ti no es problema si se salva 1 sola vida,1440589409896722443,False, ImTheResistance Darte pena a ti no es problema si se salva 1 sola vida,2021-09-22T08:10:54.000Z,Mexico,@ImTheResistance Darte pena a ti no es problema si se salva 1 sola vida,[],[],['ImTheResistance'],[],
768,es,1439933050088009730,1252243937080815620, ImTheResistance A las 8 de la mañana te cuentan el problema y al mediodía la solución  qué grandes,1440021299447873536,False, ImTheResistance A las 8 de la mañana te cuentan el problema y al mediodía la solución  qué grandes,2021-09-20T18:33:26.000Z,Mexico,"@ImTheResistance A las 8 de la mañana te cuentan el problema y al mediodía la solución, qué grandes🤮",['🤮'],[],['ImTheResistance'],[],
769,es,1439933050088009730,1252243937080815620, ImTheResistance Ja será pues bien me preguntó aunque los niños no sean vacu    Que pasará cuando sus padres que si lo están empiezen a caer en unos meses quien se ara cargo de los niños el estado reuniendo los en masa y educando los a su antojo en el marxismo un lavado total,1439989443583217669,False, ImTheResistance Ja será pues bien me preguntó aunque los niños no sean vacu    Que pasará cuando sus padres que si lo están empiezen a caer en unos meses quien se ara cargo de los niños el estado reuniendo los en masa y educando los a su antojo en el marxismo un lavado total,2021-09-20T16:26:51.000Z,Mexico,@ImTheResistance Ja será pues bien me preguntó aunque los niños no sean vacu... Que pasará cuando sus padres que si lo están empiezen a caer en unos meses quien se ara cargo de los niños el estado reuniendo los en masa y educando los a su antojo en el marxismo un lavado total,[],[],['ImTheResistance'],['https://t.co/rFHPgmIPbB'],
770,es,1439933050088009730,1252243937080815620, ImTheResistance No lo entienden ni así https   t co qZ6bQPUIYn,1439975276335796230,False, ImTheResistance No lo entienden ni así https   t co qZ6bQPUIYn,2021-09-20T15:30:33.000Z,Mexico,"@ImTheResistance No lo entienden ni así:
https://t.co/qZ6bQPUIYn",[],[],['ImTheResistance'],['https://t.co/qZ6bQPUIYn'],
771,es,1439933050088009730,1252243937080815620, ImTheResistance Son unos sinvergüenzas  Ojalá algún día paguen por esto ,1439968453859987459,False, ImTheResistance Son unos sinvergüenzas  Ojalá algún día paguen por esto ,2021-09-20T15:03:27.000Z,Mexico,@ImTheResistance Son unos sinvergüenzas. Ojalá algún día paguen por esto.,[],[],['ImTheResistance'],[],
772,es,1439933050088009730,1252243937080815620, ImTheResistance No puedo escribir lo que pienso de estos hijos de la grandísima puta  porque podría verme implicado en algún problema social ,1439966692831113224,False, ImTheResistance No puedo escribir lo que pienso de estos hijos de la grandísima puta  porque podría verme implicado en algún problema social ,2021-09-20T14:56:27.000Z,Mexico,"@ImTheResistance No puedo escribir lo que pienso de estos hijos de la grandísima puta, porque podría verme implicado en algún problema social!",[],[],['ImTheResistance'],['https://t.co/vSouAblHea'],
773,es,1439933050088009730,1252243937080815620, ImTheResistance  SUSTOREX Esto es insoportable ya  Han ido acoplando “la incidencia” por edad en la medida en que esta respondía a sus planes de inoculación ,1439965342810484739,False, ImTheResistance  SUSTOREX Esto es insoportable ya  Han ido acoplando “la incidencia” por edad en la medida en que esta respondía a sus planes de inoculación ,2021-09-20T14:51:05.000Z,Mexico,@ImTheResistance @SUSTOREX Esto es insoportable ya. Han ido acoplando “la incidencia” por edad en la medida en que esta respondía a sus planes de inoculación.,[],[],"['ImTheResistance', 'SUSTOREX']",['https://t.co/bWQm7IDlKb'],
774,es,1439933050088009730,1252243937080815620, ImTheResistance Es de vergüenza  cada grupo no vacunado es el foco  En nada bajan de los 5 años  Menos mal que no ha venido el ebola  sino alguno ya tiraba de pistola,1439934220265271296,False, ImTheResistance Es de vergüenza  cada grupo no vacunado es el foco  En nada bajan de los 5 años  Menos mal que no ha venido el ebola  sino alguno ya tiraba de pistola,2021-09-20T12:47:25.000Z,Mexico,"@ImTheResistance Es de vergüenza, cada grupo no vacunado es el foco. En nada bajan de los 5 años. Menos mal que no ha venido el ebola, sino alguno ya tiraba de pistola",[],[],['ImTheResistance'],['https://t.co/32EHJj9w67'],
775,es,1439931483016384512,1252243937080815620, ImTheResistance La pandemia se acabó en la primavera de 2020 ,1440013824145428485,False, ImTheResistance La pandemia se acabó en la primavera de 2020 ,2021-09-20T18:03:44.000Z,Mexico,@ImTheResistance La pandemia se acabó en la primavera de 2020.,[],[],['ImTheResistance'],[],
776,es,1439931483016384512,1252243937080815620, ImTheResistance Soy acupuntor y en medicina tradicional se estudia todo este tipo de enfermedades como de  viento frio  Este invierno van a caer como moscas  ya que les han debilitado lo único que sirve para combatirlas  el sistema inmunitario ,1439967198592765953,False, ImTheResistance Soy acupuntor y en medicina tradicional se estudia todo este tipo de enfermedades como de  viento frio  Este invierno van a caer como moscas  ya que les han debilitado lo único que sirve para combatirlas  el sistema inmunitario ,2021-09-20T14:58:28.000Z,Mexico,"@ImTheResistance Soy acupuntor y en medicina tradicional se estudia todo este tipo de enfermedades como de ""viento frio"".
Este invierno van a caer como moscas, ya que les han debilitado lo único que sirve para combatirlas: el sistema inmunitario.",[],[],['ImTheResistance'],['https://t.co/XGAyr1GrDW'],
777,es,1439925827341271043,67039054, canarias7 Que si  Que la borregada se lo cree  Pero no tod s son la borregada ,1439941997276635138,False, canarias7 Que si  Que la borregada se lo cree  Pero no tod s son la borregada ,2021-09-20T13:18:19.000Z,Mexico,@canarias7 Que si. Que la borregada se lo cree. Pero no tod@s son la borregada.,[],[],['canarias7'],[],
778,es,1439925827341271043,67039054, canarias7 Señoras y señores esto es lo que les cuesta el alma de nuestros hijos e hijas  300 000€ https   t co dYOjsNxs3B,1439941119228485636,False, canarias7 Señoras y señores esto es lo que les cuesta el alma de nuestros hijos e hijas  300 000€ https   t co dYOjsNxs3B,2021-09-20T13:14:50.000Z,Mexico,@canarias7 Señoras y señores esto es lo que les cuesta el alma de nuestros hijos e hijas. 300.000€ https://t.co/dYOjsNxs3B,[],[],['canarias7'],[],
779,es,1439925827341271043,67039054, canarias7 Periodismo 2021 https   t co LwPg3zzrPz,1439940892253638656,False, canarias7 Periodismo 2021 https   t co LwPg3zzrPz,2021-09-20T13:13:56.000Z,Mexico,@canarias7 Periodismo 2021 https://t.co/LwPg3zzrPz,[],[],['canarias7'],[],
780,es,1439925827341271043,67039054, canarias7 Miocarditis  ictus  trombos  os vais a cargar a esta generación y sois cómplices,1439940692403425288,False, canarias7 Miocarditis  ictus  trombos  os vais a cargar a esta generación y sois cómplices,2021-09-20T13:13:08.000Z,Mexico,"@canarias7 Miocarditis, ictus, trombos, os vais a cargar a esta generación y sois cómplices",[],[],['canarias7'],[],
781,es,1439925827341271043,67039054, canarias7 En 18 meses se ha demostrado que más efectiva y segura es su inmunidad natural  y además garantiza que es sin efectos adversos a corto  medio o largo plazo ,1439938576377171970,False, canarias7 En 18 meses se ha demostrado que más efectiva y segura es su inmunidad natural  y además garantiza que es sin efectos adversos a corto  medio o largo plazo ,2021-09-20T13:04:44.000Z,Mexico,"@canarias7 En 18 meses se ha demostrado que más efectiva y segura es su inmunidad natural, y además garantiza que es sin efectos adversos a corto, medio o largo plazo.",[],[],['canarias7'],['https://t.co/B6PJuAd8g6'],
782,es,1439925827341271043,67039054, canarias7 Vaya competición de hijos de puta Farmacéuticas políticos medios de comunicación    ,1439927643026206720,False, canarias7 Vaya competición de hijos de puta Farmacéuticas políticos medios de comunicación    ,2021-09-20T12:21:17.000Z,Mexico,"@canarias7 Vaya competición de hijos de puta.
Farmacéuticas/políticos/medios de comunicación....",[],[],['canarias7'],[],
783,es,1439925544741523459,211723058, easturia  pfizer Es muy importante vacunar a los niños comprendidos en este rango  pero es más importante que el gobierno tenga en stock la cantidad suficiente para cubrirlos  easturia,1439985765916807177,False, easturia  pfizer Es muy importante vacunar a los niños comprendidos en este rango  pero es más importante que el gobierno tenga en stock la cantidad suficiente para cubrirlos  easturia,2021-09-20T16:12:14.000Z,Mexico,"@easturia @pfizer Es muy importante vacunar a los niños comprendidos en este rango, pero es más importante que el gobierno tenga en stock la cantidad suficiente para cubrirlos @easturia",[],[],"['easturia', 'pfizer']",['https://t.co/WsClh63HLV'],
784,es,1439925544741523459,211723058, easturia  pfizer Jajajajajaja  Y el riesgo beneficio es  100  riesgo  0 beneficio  Casualmente sacan esto después que la FDA dijo nai nai a la tercera dosis a menores de 65 años  Matasanos son ,1439930671817019401,False, easturia  pfizer Jajajajajaja  Y el riesgo beneficio es  100  riesgo  0 beneficio  Casualmente sacan esto después que la FDA dijo nai nai a la tercera dosis a menores de 65 años  Matasanos son ,2021-09-20T12:33:19.000Z,Mexico,@easturia @pfizer Jajajajajaja. Y el riesgo/beneficio es: 100% riesgo/ 0%beneficio. Casualmente sacan esto después que la FDA dijo nai nai a la tercera dosis a menores de 65 años. Matasanos son.,[],[],"['easturia', 'pfizer']",['https://t.co/ESjiSEjlPd'],
785,es,1439925544741523459,211723058, easturia  pfizer Dr Asturias  esa vacuna cree usted que llegará pronto al corredor seco ,1439926152668270597,False, easturia  pfizer Dr Asturias  esa vacuna cree usted que llegará pronto al corredor seco ,2021-09-20T12:15:21.000Z,Mexico,"@easturia @pfizer Dr Asturias, esa vacuna cree usted que llegará pronto al corredor seco 🤔🤓","['🤔', '🤓']",[],"['easturia', 'pfizer']",[],
786,es,1439895361410174977,192593369, AlbertoArcosWeb Gracias a ti  a vosotros ,1439896413425610754,False, AlbertoArcosWeb Gracias a ti  a vosotros ,2021-09-20T10:17:11.000Z,Mexico,"@AlbertoArcosWeb Gracias a ti, a vosotros.",[],[],['AlbertoArcosWeb'],[],
787,es,1439884985259986944,228443183, Damorpaz Que bueno Excelente jornada ,1439925583035645961,False, Damorpaz Que bueno Excelente jornada ,2021-09-20T12:13:06.000Z,Mexico,"@Damorpaz Que bueno!
Excelente jornada!",[],[],['Damorpaz'],[],
788,es,1439884985259986944,228443183, nellinica A las 30 empezaron a vacunar yo fui la número 164 y a las 40 am ya estaba vacunada  ,1439925168634224640,False, nellinica A las 30 empezaron a vacunar yo fui la número 164 y a las 40 am ya estaba vacunada  ,2021-09-20T12:11:27.000Z,Mexico,@nellinica A las 3:30 empezaron a vacunar yo fui la número 164 y a las 4:30 am ya estaba vacunada .,[':3'],[],['nellinica'],[],
789,es,1439884985259986944,228443183, Damorpaz ¿Empezaron de madrugada ,1439923674811965448,False, Damorpaz ¿Empezaron de madrugada ,2021-09-20T12:05:31.000Z,Mexico,@Damorpaz ¿Empezaron de madrugada?,[],[],['Damorpaz'],[],
790,es,1439884985259986944,228443183, Damorpaz Em nombre de Dios que todo salga Bien ,1439898969803427843,False, Damorpaz Em nombre de Dios que todo salga Bien ,2021-09-20T10:27:21.000Z,Mexico,@Damorpaz Em nombre de Dios que todo salga Bien 🙌🏻🙏🏻🙌🏻,"['🙌🏻', '🙏🏻']",[],['Damorpaz'],[],
791,es,1439864189829451776,232124120, sanidadgob ¿ Que hacemos  Eerimentais con la población  Os caerá grande  Eritema multiforme  glomerulonefritis  Síndrome nefrítico  síndrome inflamatorio multisistémico  Trombosis de senos cerebrales  Tromboembolismo venoso  https   t co Of6XZadatL  VacunaCOVID19,1439920536176447491,False, sanidadgob ¿ Que hacemos  Eerimentais con la población  Os caerá grande  Eritema multiforme  glomerulonefritis  Síndrome nefrítico  síndrome inflamatorio multisistémico  Trombosis de senos cerebrales  Tromboembolismo venoso  https   t co Of6XZadatL  VacunaCOVID19,2021-09-20T11:53:02.000Z,Mexico,@sanidadgob ¿ Que hacemos? Experimentais con la población. Os caerá grande. Eritema multiforme -glomerulonefritis -Síndrome nefrítico -síndrome inflamatorio multisistémico -Trombosis de senos cerebrales -Tromboembolismo venoso. https://t.co/Of6XZadatL #VacunaCOVID19,['xp'],[],['sanidadgob'],['https://t.co/MMJjDpa8wp'],
792,es,1439864189829451776,232124120, sanidadgob Ruinas económicas  parados  ertes  colas del hambre    Todos los partidos apoyando al gobierno  A quien se piden responsabilidades Deberían dimitir todos  el pais  abc es  informativost5  informativost5  DirectoresHotel  HosteleriaR  HostGipuzkoa  PrensaCE  PoderJudicialEs https   t co ASvKkIthj5,1439911317645799426,False, sanidadgob Ruinas económicas  parados  ertes  colas del hambre    Todos los partidos apoyando al gobierno  A quien se piden responsabilidades Deberían dimitir todos  el pais  abc es  informativost5  informativost5  DirectoresHotel  HosteleriaR  HostGipuzkoa  PrensaCE  PoderJudicialEs https   t co ASvKkIthj5,2021-09-20T11:16:25.000Z,Mexico,"@sanidadgob Ruinas económicas, parados, ertes, colas del hambre... Todos los partidos apoyando al gobierno. 
A quien se piden responsabilidades?
Deberían dimitir todos.
@el_pais @abc_es @informativost5 @informativost5 @DirectoresHotel @HosteleriaR @HostGipuzkoa 
@PrensaCE @PoderJudicialEs https://t.co/ASvKkIthj5",[],[],['sanidadgob'],['https://t.co/auIqareJvt'],
793,es,1439864189829451776,232124120, sanidadgob Para 750 000 personas pauta completa es ahora 3 dosis Ergo es FALSO que el 75  de la población cuente ya con pauta completa ,1439903202682540032,False, sanidadgob Para 750 000 personas pauta completa es ahora 3 dosis Ergo es FALSO que el 75  de la población cuente ya con pauta completa ,2021-09-20T10:44:10.000Z,Mexico,"@sanidadgob Para 750.000 personas pauta completa es ahora 3 dosis.
Ergo es FALSO que el 75% de la población cuente ya con pauta completa.",[],[],['sanidadgob'],[],
