,tweet_lang,replied_to_tweet_id,replied_to_user_id,reply_text,id,verified,text_es,tweet_date,country,tweet_text,tweet_emoticons,hashtags,mentions,tweet_urls,text_en
366,es,1440675480294739970,128143764, marimarher Mariló si es un herpes se quién puede ayudarle Otra cosa importante no consuma huevos niNada de lácteos esos alimenta el herpes,1440738530603388932,False, marimarher Mariló si es un herpes se quién puede ayudarle Otra cosa importante no consuma huevos niNada de lácteos esos alimenta el herpes,2021-09-22T18:03:27.000Z,Mexico,"@marimarher Mariló si es un herpes se quién puede ayudarle.
Otra cosa importante no consuma huevos ni
Nada de lácteos esos alimenta el herpes",[],[],['marimarher'],['https://t.co/zSpZHXpqM9'],
367,es,1440675480294739970,128143764, marimarher ¡Guapísima  Mucho ánimo ,1440734227864035333,False, marimarher ¡Guapísima  Mucho ánimo ,2021-09-22T17:46:22.000Z,Mexico,@marimarher ¡Guapísima! Mucho ánimo.,[],[],['marimarher'],[],
368,es,1440675480294739970,128143764, marimarher Esto te puede ser muy útil para dexintosicarte de  se llama Zeolita y elimina metales pesados del organismo  es un dexintosicante natural  hay un estudio hecho por una farmacéutica que dice que no solo servirá para las sino también para tratar covidhttps   t co nCIZuGeRSD,1440732763603148801,False, marimarher Esto te puede ser muy útil para dexintosicarte de  se llama Zeolita y elimina metales pesados del organismo  es un dexintosicante natural  hay un estudio hecho por una farmacéutica que dice que no solo servirá para las sino también para tratar covidhttps   t co nCIZuGeRSD,2021-09-22T17:40:33.000Z,Mexico,"@marimarher Esto te puede ser muy útil para dexintosicarte de 💉 se llama Zeolita y elimina metales pesados del organismo, es un dexintosicante natural, hay un estudio hecho por una farmacéutica que dice que no solo servirá para las 💉sino también para tratar covid
https://t.co/nCIZuGeRSD",['💉'],[],['marimarher'],['https://t.co/Sd7AWrKgZd'],
369,es,1440675480294739970,128143764, marimarher Siento mucho tu sufrimiento  si no te molesta la pregunta que efectos secundarios ha producido en ti ,1440730860643184645,False, marimarher Siento mucho tu sufrimiento  si no te molesta la pregunta que efectos secundarios ha producido en ti ,2021-09-22T17:32:59.000Z,Mexico,"@marimarher Siento mucho tu sufrimiento, si no te molesta la pregunta que efectos secundarios ha producido en ti?",[],[],['marimarher'],[],
370,es,1440675480294739970,128143764, marimarher ¿Sigues malita ,1440720600515842050,False, marimarher ¿Sigues malita ,2021-09-22T16:52:13.000Z,Mexico,@marimarher ¿Sigues malita?,[],[],['marimarher'],[],
371,es,1440675480294739970,128143764, marimarher Lo conseguirás  reconocerlo y seguir las indicaciones seguro te hacen fuerte     Un fuerte abrazo ,1440718138564218883,False, marimarher Lo conseguirás  reconocerlo y seguir las indicaciones seguro te hacen fuerte     Un fuerte abrazo ,2021-09-22T16:42:26.000Z,Mexico,"@marimarher Lo conseguirás, reconocerlo y seguir las indicaciones seguro te hacen fuerte!!!. Un fuerte abrazo.",[],[],['marimarher'],[],
372,es,1440675480294739970,128143764, marimarher  Pedroalfacentau Mucho ánimo  Eres muy valiente denunciando tu caso  Saldrás de ésta  y más fuerte y guapa todavía  Seguro ,1440716432568844298,False, marimarher  Pedroalfacentau Mucho ánimo  Eres muy valiente denunciando tu caso  Saldrás de ésta  y más fuerte y guapa todavía  Seguro ,2021-09-22T16:35:39.000Z,Mexico,"@marimarher @Pedroalfacentau Mucho ánimo. Eres muy valiente denunciando tu caso. Saldrás de ésta, y más fuerte y guapa todavía. Seguro.😘",['😘'],[],"['marimarher', 'Pedroalfacentau']",[],
373,es,1440675480294739970,128143764, marimarher Volverás a serlo  sigue la pauta de medicamentos para los ya vacunados para revertir los daños  y algo muy importante  salir de ese estado de depresión que se ve claramente en la foto  Es difícil  Lo es  pero el estado de ánimo es muy importante para la sanación  adelante ,1440706834550038534,False, marimarher Volverás a serlo  sigue la pauta de medicamentos para los ya vacunados para revertir los daños  y algo muy importante  salir de ese estado de depresión que se ve claramente en la foto  Es difícil  Lo es  pero el estado de ánimo es muy importante para la sanación  adelante ,2021-09-22T15:57:31.000Z,Mexico,"@marimarher Volverás a serlo, sigue la pauta de medicamentos para los ya vacunados para revertir los daños, y algo muy importante, salir de ese estado de depresión que se ve claramente en la foto. Es difícil? Lo es, pero el estado de ánimo es muy importante para la sanación, adelante!",[],[],['marimarher'],['https://t.co/VwEgnaJher'],
374,es,1440675480294739970,128143764, marimarher ¿Y cómo eres ahora ,1440677341038985220,False, marimarher ¿Y cómo eres ahora ,2021-09-22T14:00:19.000Z,Mexico,@marimarher ¿Y cómo eres ahora?,[],[],['marimarher'],[],
375,es,1440674425150398468,316145104, SuarezGabs Voy a esperar también entonces al fds  si llegas a saber de algún punto te agradecería mucho,1441119375965052929,False, SuarezGabs Voy a esperar también entonces al fds  si llegas a saber de algún punto te agradecería mucho,2021-09-23T19:16:48.000Z,Mexico,"@SuarezGabs Voy a esperar también entonces al fds, si llegas a saber de algún punto te agradecería mucho🙌",['🙌'],[],['SuarezGabs'],[],
376,es,1440674425150398468,316145104, Darwin Kings Holaa En varios puntos me dijeron que esperara al viernes y de pronto podría conseguir Pfizer,1441069335489957893,False, Darwin Kings Holaa En varios puntos me dijeron que esperara al viernes y de pronto podría conseguir Pfizer,2021-09-23T15:57:58.000Z,Mexico,"@Darwin_Kings Holaa 
En varios puntos me dijeron que esperara al viernes y de pronto podría conseguir Pfizer",[],[],['Darwin_Kings'],[],
377,es,1440674425150398468,316145104, SuarezGabs Hola  disculpa tienes información ya sobre tu pregunta  Te agradecería tengo la misma duda ,1441058900283953158,False, SuarezGabs Hola  disculpa tienes información ya sobre tu pregunta  Te agradecería tengo la misma duda ,2021-09-23T15:16:30.000Z,Mexico,"@SuarezGabs Hola, disculpa tienes información ya sobre tu pregunta? Te agradecería tengo la misma duda.",[],[],['SuarezGabs'],[],
378,es,1440674425150398468,316145104, SuarezGabs  RonnySuarez  Con las buenas tardes  que pena no saludar   ,1440807442481176578,False, SuarezGabs  RonnySuarez  Con las buenas tardes  que pena no saludar   ,2021-09-22T22:37:17.000Z,Mexico,"@SuarezGabs @RonnySuarez_ Con las buenas tardes, que pena no saludar...",[],[],"['SuarezGabs', 'RonnySuarez_']",[],
379,es,1440674425150398468,316145104, SuarezGabs  JulianSabogal1 Igualmente   dónde   Hacia el sur    gracias ,1440685248166068228,False, SuarezGabs  JulianSabogal1 Igualmente   dónde   Hacia el sur    gracias ,2021-09-22T14:31:44.000Z,Mexico,@SuarezGabs @JulianSabogal1 Igualmente.. dónde ? Hacia el sur... gracias 🙏,['🙏'],[],"['SuarezGabs', 'JulianSabogal1']",[],
380,es,1440674425150398468,316145104, SuarezGabs  Nat garzon A un compañero de trabajo le aplicaron ayer la 1era dosis de Pfizer en el CC Bulevar Niza,1440679317923500032,False, SuarezGabs  Nat garzon A un compañero de trabajo le aplicaron ayer la 1era dosis de Pfizer en el CC Bulevar Niza,2021-09-22T14:08:10.000Z,Mexico,@SuarezGabs @Nat_garzon A un compañero de trabajo le aplicaron ayer la 1era dosis de Pfizer en el CC Bulevar Niza,[],[],"['SuarezGabs', 'Nat_garzon']",[],
381,es,1440674425150398468,316145104, SuarezGabs También estoy en esa búsqueda  ,1440674825224134666,False, SuarezGabs También estoy en esa búsqueda  ,2021-09-22T13:50:19.000Z,Mexico,@SuarezGabs También estoy en esa búsqueda. 🙄,['🙄'],[],['SuarezGabs'],[],
382,en,1440654001960210437,52878788, Univision23 USA in danger Communists at the Door,1440654354961231875,False,,2021-09-22T12:28:58.000Z,Mexico,@Univision23 USA in danger Communists at the Door,[],[],['Univision23'],[], Univision23 USA in danger Communists at the Door
383,es,1440581379310428160,232124120, carmenfa7  sanidadgob En edad reproductiva  los muertos por covid son menos del 1  de los infectados ,1441097551403315211,False, carmenfa7  sanidadgob En edad reproductiva  los muertos por covid son menos del 1  de los infectados ,2021-09-23T17:50:05.000Z,Mexico,"@carmenfa7 @sanidadgob En edad reproductiva, los muertos por covid son menos del 1% de los infectados.",[],[],"['carmenfa7', 'sanidadgob']",[],
384,es,1440581379310428160,232124120, sanidadgob  farmaceuticoac1 Ahora con la vacuna se tiene bien  era antes cuando estaba mal  https   t co QnPGw0C1HH,1441074205609627649,False, sanidadgob  farmaceuticoac1 Ahora con la vacuna se tiene bien  era antes cuando estaba mal  https   t co QnPGw0C1HH,2021-09-23T16:17:19.000Z,Mexico,"@sanidadgob @farmaceuticoac1 Ahora con la vacuna se tiene bien, era antes cuando estaba mal. https://t.co/QnPGw0C1HH",[],[],"['sanidadgob', 'farmaceuticoac1']",[],
385,es,1440581379310428160,232124120, JorgeNani1  sanidadgob Los vacunados morirán de gripe  van a cambiar la causa ,1441073879556964355,False, JorgeNani1  sanidadgob Los vacunados morirán de gripe  van a cambiar la causa ,2021-09-23T16:16:01.000Z,Mexico,"@JorgeNani1 @sanidadgob Los vacunados morirán de gripe, van a cambiar la causa.",[],[],"['JorgeNani1', 'sanidadgob']",[],
386,es,1440581379310428160,232124120, LauraMvd  sanidadgob  farmaceuticoac1 Las  industrias farmacéuticas financian los principales partidos políticos  y x ende luego que llegan al poder les tienen que devolver los favores  Inventando leyes sanitarias y aprobando estos venenos ,1441070666711814145,False, LauraMvd  sanidadgob  farmaceuticoac1 Las  industrias farmacéuticas financian los principales partidos políticos  y x ende luego que llegan al poder les tienen que devolver los favores  Inventando leyes sanitarias y aprobando estos venenos ,2021-09-23T16:03:15.000Z,Mexico,"@LauraMvd @sanidadgob @farmaceuticoac1 Las  industrias farmacéuticas financian los principales partidos políticos, y x ende luego que llegan al poder les tienen que devolver los favores! Inventando leyes sanitarias y aprobando estos venenos.",[],[],"['LauraMvd', 'sanidadgob', 'farmaceuticoac1']",['https://t.co/Gn1LfHj1Lm'],
387,es,1440581379310428160,232124120, sanidadgob  farmaceuticoac1 Que  es veneno     y no le den más vueltas  Algo con muerte por efecto secundario pierde inmediatamente la autorización de venta y el registro Porque este veneno no ,1441068849755869185,False, sanidadgob  farmaceuticoac1 Que  es veneno     y no le den más vueltas  Algo con muerte por efecto secundario pierde inmediatamente la autorización de venta y el registro Porque este veneno no ,2021-09-23T15:56:02.000Z,Mexico,"@sanidadgob @farmaceuticoac1 Que  es veneno ... y no le den más vueltas .
Algo con muerte por efecto secundario pierde inmediatamente la autorización de venta y el registro 
Porque este veneno no?",[],[],"['sanidadgob', 'farmaceuticoac1']",['https://t.co/Z4NefDFa3X'],
388,es,1440581379310428160,232124120, sanidadgob El hashtag de  voceseertas  no será por casualidad el mismo consejo de eertos de pandemia que resulta que no existía no ,1441041323260145669,False, sanidadgob El hashtag de  voceseertas  no será por casualidad el mismo consejo de eertos de pandemia que resulta que no existía no ,2021-09-23T14:06:39.000Z,Mexico,"@sanidadgob El hashtag de #vocesexpertas, no será por casualidad el mismo consejo de expertos de pandemia que resulta que no existía no?",['xp'],['vocesexpertas'],['sanidadgob'],[],
389,es,1440581379310428160,232124120, sanidadgob Os resumo  que si te pasa algo será por otras patologías   que el covid es muy malo y q igual es por el covid q lo pasaste pero no te diste cuenta  que os sigáis pinchando que necesitan más gente para el eerimento,1441040884326359043,False, sanidadgob Os resumo  que si te pasa algo será por otras patologías   que el covid es muy malo y q igual es por el covid q lo pasaste pero no te diste cuenta  que os sigáis pinchando que necesitan más gente para el eerimento,2021-09-23T14:04:54.000Z,Mexico,"@sanidadgob Os resumo; que si te pasa algo será por otras patologías , que el covid es muy malo y q igual es por el covid q lo pasaste pero no te diste cuenta, que os sigáis pinchando que necesitan más gente para el experimento",['xp'],[],['sanidadgob'],['https://t.co/246QzMQ2zn'],
390,es,1440581379310428160,232124120, sanidadgob  farmaceuticoac1 Ten cuidado con el 5G que fríe neuronas  Adiós BOT,1440942025294106626,False, sanidadgob  farmaceuticoac1 Ten cuidado con el 5G que fríe neuronas  Adiós BOT,2021-09-23T07:32:04.000Z,Mexico,@sanidadgob @farmaceuticoac1 Ten cuidado con el 5G que fríe neuronas. Adiós BOT,[],[],"['sanidadgob', 'farmaceuticoac1']",[],
391,es,1440581379310428160,232124120, nitemolestes   sanidadgob La oficialidad ya no puede ocultar el problema en menstruación que están teniendo miles de mujeres vacunadas  Le están restando importancia aunque dicen q van a investigar  en otros lados dice que es normal  una muestra de q la vacuna funciona   https   t co jdxWqndv9t,1440933239540129794,False, nitemolestes   sanidadgob La oficialidad ya no puede ocultar el problema en menstruación que están teniendo miles de mujeres vacunadas  Le están restando importancia aunque dicen q van a investigar  en otros lados dice que es normal  una muestra de q la vacuna funciona   https   t co jdxWqndv9t,2021-09-23T06:57:10.000Z,Mexico,"@nitemolestes_ @sanidadgob La oficialidad ya no puede ocultar el problema en menstruación que están teniendo miles de mujeres vacunadas. Le están restando importancia aunque dicen q van a investigar, en otros lados dice que es normal, una muestra de q la vacuna funciona 🙃. https://t.co/jdxWqndv9t",['🙃'],[],"['nitemolestes_', 'sanidadgob']",['https://t.co/FC5ZEPDJpu'],
392,es,1440581379310428160,232124120, Lurlancelot  sanidadgob  farmaceuticoac1 la bakuna no se  la vacuna no es veneno Deberias informarte bien y mejor jajajaaj,1440930834232532992,False, Lurlancelot  sanidadgob  farmaceuticoac1 la bakuna no se  la vacuna no es veneno Deberias informarte bien y mejor jajajaaj,2021-09-23T06:47:36.000Z,Mexico,"@Lurlancelot @sanidadgob @farmaceuticoac1 la bakuna no se. la vacuna no es veneno.
Deberias informarte bien y mejor jajajaaj",[],[],"['Lurlancelot', 'sanidadgob', 'farmaceuticoac1']",[],
393,es,1440581379310428160,232124120, sanidadgob Que prefieren tener hijos o morir de COVID… ,1440847421018279936,False, sanidadgob Que prefieren tener hijos o morir de COVID… ,2021-09-23T01:16:09.000Z,Mexico,@sanidadgob Que prefieren tener hijos o morir de COVID….,[],[],['sanidadgob'],[],
394,es,1440581379310428160,232124120, sanidadgob Yo me puse la vacuna y he tenido un retraso de 96 días  ,1440838877875367943,False, sanidadgob Yo me puse la vacuna y he tenido un retraso de 96 días  ,2021-09-23T00:42:12.000Z,Mexico,@sanidadgob Yo me puse la vacuna y he tenido un retraso de 96 días .,[],[],['sanidadgob'],[],
395,es,1440581379310428160,232124120, sanidadgob A mi me bajó 4 horas después de ponerme la vacuna y me faltaban 12 días para que me tocase ,1440797674723151872,False, sanidadgob A mi me bajó 4 horas después de ponerme la vacuna y me faltaban 12 días para que me tocase ,2021-09-22T21:58:29.000Z,Mexico,@sanidadgob A mi me bajó 4 horas después de ponerme la vacuna y me faltaban 12 días para que me tocase 🤷‍♀️,['🤷\u200d♀️'],[],['sanidadgob'],[],
396,es,1440581379310428160,232124120, sanidadgob O que yo sé  e q cuando he intentado comentar este tema con mi médico me trató como una loca  Sin embargo se q l a vacuna me generó muchos problemas hormonales  inflamación de ganglios incluídos ,1440683233159507977,False, sanidadgob O que yo sé  e q cuando he intentado comentar este tema con mi médico me trató como una loca  Sin embargo se q l a vacuna me generó muchos problemas hormonales  inflamación de ganglios incluídos ,2021-09-22T14:23:44.000Z,Mexico,"@sanidadgob O que yo sé, e q cuando he intentado comentar este tema con mi médico me trató como una loca. Sin embargo se q l a vacuna me generó muchos problemas hormonales, inflamación de ganglios incluídos.",[],[],['sanidadgob'],['https://t.co/00q1pBRCe5'],
397,es,1440581379310428160,232124120, sanidadgob Recién van a realizar los estudios sobre éste tema ,1440640475585662977,False, sanidadgob Recién van a realizar los estudios sobre éste tema ,2021-09-22T11:33:49.000Z,Mexico,@sanidadgob Recién van a realizar los estudios sobre éste tema.,[],[],['sanidadgob'],[],
398,es,1440581379310428160,232124120, sanidadgob Qué sinvergüenzas para decir que no hay relación con la vacuna y lavarse las manos olimpicamente ,1440639913838329858,False, sanidadgob Qué sinvergüenzas para decir que no hay relación con la vacuna y lavarse las manos olimpicamente ,2021-09-22T11:31:35.000Z,Mexico,@sanidadgob Qué sinvergüenzas para decir que no hay relación con la vacuna y lavarse las manos olimpicamente.,[],[],['sanidadgob'],[],
399,es,1440581379310428160,232124120, nebelwerk  sanidadgob Y ahora quieren vacunar a los niños pequeños ,1440620892946526209,False, nebelwerk  sanidadgob Y ahora quieren vacunar a los niños pequeños ,2021-09-22T10:16:00.000Z,Mexico,@nebelwerk @sanidadgob Y ahora quieren vacunar a los niños pequeños.,[],[],"['nebelwerk', 'sanidadgob']",[],
400,es,1440581379310428160,232124120, sanidadgob Aquí algunos ejemplos para quien quiera tener hijos y quiere vacunarse  No olviden de que en los primeros ensayos clínicos no estaba incluido el grupo de las embarazadas… GobiernoDeLaMentira  GobiernoGenocida  YoNoMeVacuno https   t co 4u6K1Jpfa2,1440588489020510212,False, sanidadgob Aquí algunos ejemplos para quien quiera tener hijos y quiere vacunarse  No olviden de que en los primeros ensayos clínicos no estaba incluido el grupo de las embarazadas… GobiernoDeLaMentira  GobiernoGenocida  YoNoMeVacuno https   t co 4u6K1Jpfa2,2021-09-22T08:07:15.000Z,Mexico,"@sanidadgob Aquí algunos ejemplos para quien quiera tener hijos y quiere vacunarse. No olviden de que en los primeros ensayos clínicos no estaba incluido el grupo de las embarazadas…

#GobiernoDeLaMentira 

#GobiernoGenocida 

#YoNoMeVacuno https://t.co/4u6K1Jpfa2",[],[],['sanidadgob'],['https://t.co/TReSlI1X1C'],
401,es,1440542477350432780,586634902, SoleMujicaOk vamo nena,1440550729396088841,False, SoleMujicaOk vamo nena,2021-09-22T05:37:12.000Z,Mexico,@SoleMujicaOk vamo nena,[],[],['SoleMujicaOk'],[],
402,es,1440488617118298116,128143764, TalCual20648392  marimarher  Rossai13 Ella hizo el trabajo precisamente para eso  para ayudar a todos lo q lo necesiten  Esta muy bien detallado y es fácil de entender  ,1440900075916566533,False, TalCual20648392  marimarher  Rossai13 Ella hizo el trabajo precisamente para eso  para ayudar a todos lo q lo necesiten  Esta muy bien detallado y es fácil de entender  ,2021-09-23T04:45:23.000Z,Mexico,"@TalCual20648392 @marimarher @Rossai13 Ella hizo el trabajo precisamente para eso, para ayudar a todos lo q lo necesiten. Esta muy bien detallado y es fácil de entender! 😘",['😘'],[],"['TalCual20648392', 'marimarher', 'Rossai13']",['https://t.co/7JXTZdLkao'],
403,es,1440488617118298116,128143764, Marinapruna  marimarher  Rossai13 Lo sé    no quise ser simplista    sólo mostrar un primer paso  y que la gente busque opciones  Que no se estanquen  Gracias de todos modos  He visto que hay mucho ya en la vuelta  Igual voy por  Rossai13,1440863809548128264,False, Marinapruna  marimarher  Rossai13 Lo sé    no quise ser simplista    sólo mostrar un primer paso  y que la gente busque opciones  Que no se estanquen  Gracias de todos modos  He visto que hay mucho ya en la vuelta  Igual voy por  Rossai13,2021-09-23T02:21:16.000Z,Mexico,"@Marinapruna @marimarher @Rossai13 Lo sé... no quise ser simplista... sólo mostrar un primer paso, y que la gente busque opciones. Que no se estanquen. Gracias de todos modos. He visto que hay mucho ya en la vuelta. Igual voy por @Rossai13",[],[],"['Marinapruna', 'marimarher', 'Rossai13']",['https://t.co/qX6Fj6z4VX'],
404,es,1440488617118298116,128143764, marimarher Mejórate  Como se te ocurrió ,1440748795629764612,False, marimarher Mejórate  Como se te ocurrió ,2021-09-22T18:44:15.000Z,Mexico,@marimarher Mejórate. Como se te ocurrió?,[],[],['marimarher'],[],
405,es,1440488617118298116,128143764, marimarher Que se mejore,1440711093148520449,False, marimarher Que se mejore,2021-09-22T16:14:26.000Z,Mexico,@marimarher Que se mejore,[],[],['marimarher'],[],
406,es,1440488617118298116,128143764, Pupone14 No puedo moverme dd la cama,1440605413976645633,False, Pupone14 No puedo moverme dd la cama,2021-09-22T09:14:30.000Z,Mexico,@Pupone14 No puedo moverme dd la cama,[],[],['Pupone14'],[],
407,es,1440488617118298116,128143764, marimarher Ya sabes  ya estás tardando en poner demanda por responsabilidad civil subsidiaria por los dañosHay que empezar ya a demandar que si la impunidad les dará alas para seguir con su agenda,1440599640018018307,False, marimarher Ya sabes  ya estás tardando en poner demanda por responsabilidad civil subsidiaria por los dañosHay que empezar ya a demandar que si la impunidad les dará alas para seguir con su agenda,2021-09-22T08:51:33.000Z,Mexico,"@marimarher Ya sabes, ya estás tardando en poner demanda por responsabilidad civil subsidiaria por los daños
Hay que empezar ya a demandar que si la impunidad les dará alas para seguir con su agenda",[],[],['marimarher'],['https://t.co/lL80nzPbDI'],
408,es,1440488617118298116,128143764, marimarher Me rompe el corazón  lo siento mucho,1440549112273797134,False, marimarher Me rompe el corazón  lo siento mucho,2021-09-22T05:30:47.000Z,Mexico,"@marimarher 😖Me rompe el corazón, lo siento mucho",['😖'],[],['marimarher'],[],
409,es,1440488617118298116,128143764, TalCual20648392  marimarher Ayuda  pero no afirmes q limpia de las VAC    Te invito a q busques en el perfil de  Rossai13  ella ha hecho un buen trabajo sobre el tema buscando alimentos  plantas  vutaminas  suplementos para reducir los efectos  Espero te sirva de ayuda para poder ayudar a otras personas ,1440547392105766918,False, TalCual20648392  marimarher Ayuda  pero no afirmes q limpia de las VAC    Te invito a q busques en el perfil de  Rossai13  ella ha hecho un buen trabajo sobre el tema buscando alimentos  plantas  vutaminas  suplementos para reducir los efectos  Espero te sirva de ayuda para poder ayudar a otras personas ,2021-09-22T05:23:57.000Z,Mexico,"@TalCual20648392 @marimarher Ayuda, pero no afirmes q limpia de las VAC... Te invito a q busques en el perfil de @Rossai13, ella ha hecho un buen trabajo sobre el tema buscando alimentos, plantas, vutaminas, suplementos para reducir los efectos! Espero te sirva de ayuda para poder ayudar a otras personas!",[],[],"['TalCual20648392', 'marimarher']",['https://t.co/AO3tGjNquZ'],
410,es,1440488617118298116,128143764, marimarher Mija  pruebe con el CDS  No pierda más tiempo y diluya así el trombo  Ya ,1440538666879705095,False, marimarher Mija  pruebe con el CDS  No pierda más tiempo y diluya así el trombo  Ya ,2021-09-22T04:49:16.000Z,Mexico,@marimarher Mija: pruebe con el CDS. No pierda más tiempo y diluya así el trombo. Ya!,[],[],['marimarher'],[],
411,es,1440488617118298116,128143764, marimarher Qué pena que estés pasando por esto  Y qué rabia al mismo tiempo  Deseo que pronto empieces a recuperar  Un abrazo ,1440497430672277511,False, marimarher Qué pena que estés pasando por esto  Y qué rabia al mismo tiempo  Deseo que pronto empieces a recuperar  Un abrazo ,2021-09-22T02:05:25.000Z,Mexico,@marimarher Qué pena que estés pasando por esto. Y qué rabia al mismo tiempo. Deseo que pronto empieces a recuperar. Un abrazo 🤗,['🤗'],[],['marimarher'],[],
412,es,1440488617118298116,128143764, marimarher Lo siento muchísimo https   t co M16ozXeFJO,1440491578603175948,False, marimarher Lo siento muchísimo https   t co M16ozXeFJO,2021-09-22T01:42:10.000Z,Mexico,@marimarher Lo siento muchísimo https://t.co/M16ozXeFJO,[],[],['marimarher'],[],
413,es,1440488617118298116,128143764, marimarher Te de agujas de Pino  la vieja y querida pinocha  Te limpia de la vacuna  Tres tazas por día  no más ,1440489830006198275,False, marimarher Te de agujas de Pino  la vieja y querida pinocha  Te limpia de la vacuna  Tres tazas por día  no más ,2021-09-22T01:35:13.000Z,Mexico,"@marimarher Te de agujas de Pino (la vieja y querida pinocha) Te limpia de la vacuna. Tres tazas por día, no más.",[],[],['marimarher'],[],
414,es,1440466860810510344,1319306448, juank23 7 Buena información y sobre todo optimista  Así da ganas de empezar el día ,1440696216317136897,False, juank23 7 Buena información y sobre todo optimista  Así da ganas de empezar el día ,2021-09-22T15:15:19.000Z,Mexico,@juank23_7 Buena información y sobre todo optimista. Así da ganas de empezar el día.,[],[],['juank23_7'],[],
415,es,1440466860810510344,1319306448, juank23 7 Hola Juan  ¿crees que 15 86  de los 18 03  que tienen una dosis tengan su segunda dosis antes de fin de mes para así lograr la meta del gobierno de vacunar a la mitad de la población objetivo ,1440666070499557389,False, juank23 7 Hola Juan  ¿crees que 15 86  de los 18 03  que tienen una dosis tengan su segunda dosis antes de fin de mes para así lograr la meta del gobierno de vacunar a la mitad de la población objetivo ,2021-09-22T13:15:32.000Z,Mexico,"@juank23_7 Hola Juan, ¿crees que 15.86% de los 18.03% que tienen una dosis tengan su segunda dosis antes de fin de mes para así lograr la meta del gobierno de vacunar a la mitad de la población objetivo?",[],[],['juank23_7'],['https://t.co/6QFDJ2tE5R'],
