,tweet_lang,replied_to_tweet_id,replied_to_user_id,reply_text,id,verified,text_es,tweet_date,country,tweet_text,tweet_emoticons,hashtags,mentions,tweet_urls,text_en
1109,es,1439042447712075776,1319306448, juank23 7 Excelente por Tacna  en Lambayeque estábamos retrasados  felizmente  GeresaLamb avanzó y ahora estamos en 20   pronto deben llamar a los menores  en todo el Perú la vacunación está yendo bien  gracias  Minsa Peru  EsSaludPeru,1439195730779025411,False, juank23 7 Excelente por Tacna  en Lambayeque estábamos retrasados  felizmente  GeresaLamb avanzó y ahora estamos en 20   pronto deben llamar a los menores  en todo el Perú la vacunación está yendo bien  gracias  Minsa Peru  EsSaludPeru,2021-09-18T11:52:55.000Z,Mexico,"@juank23_7 Excelente por Tacna, en Lambayeque estábamos retrasados, felizmente @GeresaLamb avanzó y ahora estamos en 20+ 💪 pronto deben llamar a los menores, en todo el Perú la vacunación está yendo bien, gracias @Minsa_Peru @EsSaludPeru",['💪'],[],"['juank23_7', 'GeresaLamb']",['https://t.co/724qmnEg5R'],
1110,es,1439042447712075776,1319306448, juank23 7 Tumbes siendo también punto fronterizo va bien  Tal vez eso los incentiva,1439045635202748419,False, juank23 7 Tumbes siendo también punto fronterizo va bien  Tal vez eso los incentiva,2021-09-18T01:56:30.000Z,Mexico,@juank23_7 Tumbes siendo también punto fronterizo va bien? Tal vez eso los incentiva,[],[],['juank23_7'],[],
1111,es,1439042447712075776,1319306448, MilyFrankie71 Es el fruto de la buena gestión y avance de la vacunación de sus autoridades en Tacna  así como la buena respuesta de su población a vacunarse ,1439044711092793346,False, MilyFrankie71 Es el fruto de la buena gestión y avance de la vacunación de sus autoridades en Tacna  así como la buena respuesta de su población a vacunarse ,2021-09-18T01:52:49.000Z,Mexico,"@MilyFrankie71 Es el fruto de la buena gestión y avance de la vacunación de sus autoridades en Tacna, así como la buena respuesta de su población a vacunarse.",[],[],['MilyFrankie71'],['https://t.co/iY5bRoRsVY'],
1112,es,1439042447712075776,1319306448, juank23 7 Les enviaron más vacunas o gestionaron mejor ,1439043184424886275,False, juank23 7 Les enviaron más vacunas o gestionaron mejor ,2021-09-18T01:46:45.000Z,Mexico,@juank23_7 Les enviaron más vacunas o gestionaron mejor?,[],[],['juank23_7'],[],
1113,es,1439030135118868492,1400247742522441728,A Puebla le va a dar el patatús,1439031736772476930,False,A Puebla le va a dar el patatús,2021-09-18T01:01:16.000Z,Mexico,A Puebla le va a dar el patatús,[],[],[],[],
1114,es,1439022646159626249,891132755181838337,Para más información visita mi sitio web  https   t co Ge0zQSGAmCGracias  siganme en twitter y activa la campanita para recibir mas informes ,1439022650337210371,False,Para más información visita mi sitio web  https   t co Ge0zQSGAmCGracias  siganme en twitter y activa la campanita para recibir mas informes ,2021-09-18T00:25:10.000Z,Mexico,"Para más información visita mi sitio web: https://t.co/Ge0zQSGAmC
Gracias, siganme en twitter y activa la campanita para recibir mas informes.",[],[],[],"['https://t.co/Ge0zQSGAmC', 'https://t.co/fhPiFFtp1V']",
1115,es,1439022646159626249,891132755181838337,Los invito a que accesen mi documento de investigación de logística para vacunación en México https   t co 4uU5lLXKHD,1439022648302964744,False,Los invito a que accesen mi documento de investigación de logística para vacunación en México https   t co 4uU5lLXKHD,2021-09-18T00:25:09.000Z,Mexico,"Los invito a que accesen mi documento de investigación de logística para vacunación en México.
https://t.co/4uU5lLXKHD",[],[],[],['https://t.co/4uU5lLXKHD'],
1116,es,1439017200715800576,450753390, gobdecordoba Acabo de ir al autovac del kempes y está cerrado  no se continúa la campaña ahí  ,1440436862905028613,False, gobdecordoba Acabo de ir al autovac del kempes y está cerrado  no se continúa la campaña ahí  ,2021-09-21T22:04:44.000Z,Mexico,"@gobdecordoba Acabo de ir al autovac del kempes y está cerrado, no se continúa la campaña ahí ?",[],[],['gobdecordoba'],[],
1117,es,1439017200715800576,450753390, gobdecordoba  minsaludcba Cientos de policías y bomberos de Los Ángeles unen fuerzas para luchar contra el mandato de vacunas de la ciudad gt https   t co aUaIH6iPFP,1439074381746016259,False, gobdecordoba  minsaludcba Cientos de policías y bomberos de Los Ángeles unen fuerzas para luchar contra el mandato de vacunas de la ciudad gt https   t co aUaIH6iPFP,2021-09-18T03:50:43.000Z,Mexico,"@gobdecordoba @minsaludcba Cientos de policías y bomberos de Los Ángeles unen fuerzas para luchar contra el mandato de vacunas de la ciudad

&gt;
https://t.co/aUaIH6iPFP",[],[],"['gobdecordoba', 'minsaludcba']",['https://t.co/IA6BpmWQxX'],
1118,es,1439017200715800576,450753390, gobdecordoba  minsaludcba Discúlpame la ignorancia pero como vacunas al 106  ,1439055569168609281,False, gobdecordoba  minsaludcba Discúlpame la ignorancia pero como vacunas al 106  ,2021-09-18T02:35:58.000Z,Mexico,@gobdecordoba @minsaludcba Discúlpame la ignorancia pero como vacunas al 106%?,[],[],"['gobdecordoba', 'minsaludcba']",[],
1119,es,1439017200715800576,450753390, En tanto  las personas con dificultades de movilidad serán vacunadas con el esquema Autovac en el Comedor Universitario  de 8 a 18   En el interior provincial  la vacunación continuará con su cronograma habitual ,1439017205337923585,True, En tanto  las personas con dificultades de movilidad serán vacunadas con el esquema Autovac en el Comedor Universitario  de 8 a 18   En el interior provincial  la vacunación continuará con su cronograma habitual ,2021-09-18T00:03:32.000Z,Mexico,"➡️ En tanto, las personas con dificultades de movilidad serán vacunadas con el esquema Autovac en el Comedor Universitario, de 8 a 18. ➡️ En el interior provincial, la vacunación continuará con su cronograma habitual.",['➡️'],[],[],['https://t.co/NBrqd4jpyG'],
1120,es,1439017200715800576,450753390,En Capital  la campaña de vacunación continuará mañana en los puntos habilitados  Centro de Convenciones  Pabellón Argentina  Comedor Universitario  Orfeo  Sheraton y Autovac del Kempes de 8 a 20 ,1439017203580477443,True,En Capital  la campaña de vacunación continuará mañana en los puntos habilitados  Centro de Convenciones  Pabellón Argentina  Comedor Universitario  Orfeo  Sheraton y Autovac del Kempes de 8 a 20 ,2021-09-18T00:03:31.000Z,Mexico,"📍En Capital, la campaña de vacunación continuará mañana en los puntos habilitados: Centro de Convenciones, Pabellón Argentina, Comedor Universitario, Orfeo, Sheraton y Autovac del Kempes de 8 a 20.",['📍'],[],[],['https://t.co/nMawn3QC7E'],
1121,es,1439009511814094854,1319306448, juank23 7 ya casi al 50  ,1439012635580710912,False, juank23 7 ya casi al 50  ,2021-09-17T23:45:22.000Z,Mexico,@juank23_7 ya casi al 50%.,[],[],['juank23_7'],[],
1122,es,1439002390766686210,353282673, rlopeztwiter Abrazo Robert    ,1439046192550326282,False, rlopeztwiter Abrazo Robert    ,2021-09-18T01:58:43.000Z,Mexico,@rlopeztwiter Abrazo Robert!!! 🤗,['🤗'],[],['rlopeztwiter'],[],
1123,es,1439002390766686210,353282673, Mrqz3  espero no la pases tan mal   un abrazo  ,1439016517073620996,False, Mrqz3  espero no la pases tan mal   un abrazo  ,2021-09-18T00:00:47.000Z,Mexico,"@Mrqz3 🙌 espero no la pases tan mal , un abrazo !",['🙌'],[],['Mrqz3'],[],
1124,es,1438992251171090434,45444320, culturacr Ese tipo en vez de un respirador  debería tener un pene en la boca     Le tengo tanta empatia como a  PastorMelvincr,1438992951405858816,False, culturacr Ese tipo en vez de un respirador  debería tener un pene en la boca     Le tengo tanta empatia como a  PastorMelvincr,2021-09-17T22:27:09.000Z,Mexico,"@culturacr Ese tipo en vez de un respirador, debería tener un pene en la boca...  Le tengo tanta empatia como a @PastorMelvincr",[],[],"['culturacr', 'PastorMelvincr']",[],
1125,es,1438987315326689284,75878058, psimoneasp  WHO Yo hare objeción aninguna dosis mientras tenga anticuerpos tras haberla pasado ,1439178285301239812,False, psimoneasp  WHO Yo hare objeción aninguna dosis mientras tenga anticuerpos tras haberla pasado ,2021-09-18T10:43:36.000Z,Mexico,"@psimoneasp @WHO Yo hare objeción a
ninguna dosis mientras tenga anticuerpos tras haberla pasado.",[],[],"['psimoneasp', 'WHO']",[],
1126,es,1438981357154312196,150408743, Lobita de Paz Mil gracias amiwita linda  https   t co jgOcSgTeVq,1439031405275537409,False, Lobita de Paz Mil gracias amiwita linda  https   t co jgOcSgTeVq,2021-09-18T00:59:57.000Z,Mexico,@Lobita_de_Paz Mil gracias amiwita linda 😁😘😘😘 https://t.co/jgOcSgTeVq,"['😘', '😁']",[],['Lobita_de_Paz'],[],
1127,es,1438981357154312196,150408743, Estrellitanew Y seguirás así sin ningún tipo de reacción ,1439025269629718531,False, Estrellitanew Y seguirás así sin ningún tipo de reacción ,2021-09-18T00:35:34.000Z,Mexico,@Estrellitanew Y seguirás así sin ningún tipo de reacción 👍😁,"['👍', '😁']",[],['Estrellitanew'],[],
1128,es,1438981357154312196,150408743, Lobita de Paz Sii amiwis muchas gracias  todo bien hasta ahorita jiji,1439001132093878273,False, Lobita de Paz Sii amiwis muchas gracias  todo bien hasta ahorita jiji,2021-09-17T22:59:39.000Z,Mexico,"@Lobita_de_Paz Sii amiwis muchas gracias, todo bien hasta ahorita jiji🤭🤭",['🤭'],[],['Lobita_de_Paz'],[],
1129,es,1438981357154312196,150408743, Estrellitanew Me alegra mucho yo tampoco tuve ninguna reacción cuando me coloque la segunda dosis ,1438998082818093063,False, Estrellitanew Me alegra mucho yo tampoco tuve ninguna reacción cuando me coloque la segunda dosis ,2021-09-17T22:47:32.000Z,Mexico,@Estrellitanew Me alegra mucho yo tampoco tuve ninguna reacción cuando me coloque la segunda dosis 😁👍,"['👍', '😁']",[],['Estrellitanew'],[],
1130,es,1438981134495453188,1949220937, JkSandoval   Bea Colmenares Sí  escuché al final  Buena iniciativa  hay que ir a vacunar    Hora15,1438985871798247426,False, JkSandoval   Bea Colmenares Sí  escuché al final  Buena iniciativa  hay que ir a vacunar    Hora15,2021-09-17T21:59:01.000Z,Mexico,"@JkSandoval_ @Bea_Colmenares Sí, escuché al final. 
Buena iniciativa, hay que ir a vacunar. 👍 #Hora15",['👍'],['Hora15'],"['JkSandoval_', 'Bea_Colmenares']",[],
1131,es,1438981134495453188,1949220937, Gaz77Gz  Bea Colmenares Eso están haciendo mi señor,1438985013555499011,False, Gaz77Gz  Bea Colmenares Eso están haciendo mi señor,2021-09-17T21:55:36.000Z,Mexico,@Gaz77Gz @Bea_Colmenares Eso están haciendo mi señor,[],[],"['Gaz77Gz', 'Bea_Colmenares']",[],
1132,es,1438979334262378500,1240079361480499202, cingolani oscar  ZinClaudio  Marianaarias  dr rdebbag  masaludlanacion  lanacionmas La inmunidad depende del individuo  Y su estado general  Los virus mutan constantemente  por eso han aparecido distintas variantes  Y la vacuna no siempre responde a esa mutación,1439412340642955264,False, cingolani oscar  ZinClaudio  Marianaarias  dr rdebbag  masaludlanacion  lanacionmas La inmunidad depende del individuo  Y su estado general  Los virus mutan constantemente  por eso han aparecido distintas variantes  Y la vacuna no siempre responde a esa mutación,2021-09-19T02:13:39.000Z,Mexico,"@cingolani_oscar @ZinClaudio @Marianaarias @dr_rdebbag @masaludlanacion @lanacionmas La inmunidad depende del individuo. Y su estado general. Los virus mutan constantemente, por eso han aparecido distintas variantes. Y la vacuna no siempre responde a esa mutación",[],[],"['cingolani_oscar', 'ZinClaudio', 'Marianaarias', 'dr_rdebbag', 'masaludlanacion', 'lanacionmas']",['https://t.co/qCCh0zojMe'],
1133,es,1438979334262378500,1240079361480499202, cingolani oscar  ZinClaudio  Marianaarias  dr rdebbag  masaludlanacion  lanacionmas No haber tenido covid  sin vacuna  es porque seguramente se tiene un muy buen sistema inmunológico y se han extremado los cuidados  Haber tenido covid con las vacunas es que a pesar de la inmunización nuestro sistema inmunológico no logró crear buenos anticuerpos ,1439411964648775681,False, cingolani oscar  ZinClaudio  Marianaarias  dr rdebbag  masaludlanacion  lanacionmas No haber tenido covid  sin vacuna  es porque seguramente se tiene un muy buen sistema inmunológico y se han extremado los cuidados  Haber tenido covid con las vacunas es que a pesar de la inmunización nuestro sistema inmunológico no logró crear buenos anticuerpos ,2021-09-19T02:12:10.000Z,Mexico,"@cingolani_oscar @ZinClaudio @Marianaarias @dr_rdebbag @masaludlanacion @lanacionmas No haber tenido covid, sin vacuna, es porque seguramente se tiene un muy buen sistema inmunológico y se han extremado los cuidados. Haber tenido covid con las vacunas es que a pesar de la inmunización nuestro sistema inmunológico no logró crear buenos anticuerpos.",[],[],"['cingolani_oscar', 'ZinClaudio', 'Marianaarias', 'dr_rdebbag', 'masaludlanacion', 'lanacionmas']",['https://t.co/muJfSvTwnV'],
1134,es,1438979334262378500,1240079361480499202, cingolani oscar  Marianaarias  ZinClaudio  dr rdebbag  masaludlanacion  lanacionmas Sra infórmese  a cerca del contenido de las Va Q unas     O promueven un genocidio    Está al tanto de las consecuencias que están ocasionando  en la salud  y  muertes en el mundo     ,1439393903388635139,False, cingolani oscar  Marianaarias  ZinClaudio  dr rdebbag  masaludlanacion  lanacionmas Sra infórmese  a cerca del contenido de las Va Q unas     O promueven un genocidio    Está al tanto de las consecuencias que están ocasionando  en la salud  y  muertes en el mundo     ,2021-09-19T01:00:23.000Z,Mexico,"@cingolani_oscar @Marianaarias @ZinClaudio @dr_rdebbag @masaludlanacion @lanacionmas Sra infórmese  a cerca del contenido de las Va Q unas ... 
O promueven un genocidio ?. Está al tanto de las consecuencias que están ocasionando  en la salud  y  muertes en el mundo ...?",[],[],"['cingolani_oscar', 'Marianaarias', 'ZinClaudio', 'dr_rdebbag', 'masaludlanacion', 'lanacionmas']",['https://t.co/hrUnia9kip'],
1135,es,1438979334262378500,1240079361480499202, cingolani oscar  ZinClaudio  Marianaarias  dr rdebbag  masaludlanacion  lanacionmas Hola tuve covid hace tres meses y me bajó mucho la presión hay días que tengo  7  4 y bajé de peso perdí 5 kilos y solo recuperé 2  y ningún médico me a dicho nada soy de Gral Belgrano Buenos Aires,1439389955407634433,False, cingolani oscar  ZinClaudio  Marianaarias  dr rdebbag  masaludlanacion  lanacionmas Hola tuve covid hace tres meses y me bajó mucho la presión hay días que tengo  7  4 y bajé de peso perdí 5 kilos y solo recuperé 2  y ningún médico me a dicho nada soy de Gral Belgrano Buenos Aires,2021-09-19T00:44:42.000Z,Mexico,"@cingolani_oscar @ZinClaudio @Marianaarias @dr_rdebbag @masaludlanacion @lanacionmas Hola,tuve covid hace tres meses y me bajó mucho la presión,hay días que tengo  7, 4 y bajé de peso perdí 5 kilos y solo recuperé 2, y ningún médico me a dicho nada,soy de Gral Belgrano Buenos Aires",[],[],"['cingolani_oscar', 'ZinClaudio', 'Marianaarias', 'dr_rdebbag', 'masaludlanacion', 'lanacionmas']",['https://t.co/PNwuioxE8S'],
1136,es,1438979334262378500,1240079361480499202, cingolani oscar  ZinClaudio  Marianaarias  dr rdebbag  masaludlanacion  lanacionmas Cuando se sabra si la vacunacion fue efectiva o no  En eeuu e israel aparecio la variante delta  x la gente vacunado  O esto es un nunca acabar   ,1439325582261633024,False, cingolani oscar  ZinClaudio  Marianaarias  dr rdebbag  masaludlanacion  lanacionmas Cuando se sabra si la vacunacion fue efectiva o no  En eeuu e israel aparecio la variante delta  x la gente vacunado  O esto es un nunca acabar   ,2021-09-18T20:28:54.000Z,Mexico,"@cingolani_oscar @ZinClaudio @Marianaarias @dr_rdebbag @masaludlanacion @lanacionmas Cuando se sabra si la vacunacion fue efectiva o no. En eeuu e israel aparecio la variante delta, x la gente vacunado. O esto es un nunca acabar???",[],[],"['cingolani_oscar', 'ZinClaudio', 'Marianaarias', 'dr_rdebbag', 'masaludlanacion', 'lanacionmas']",['https://t.co/zXopI5F1QG'],
1137,es,1438979334262378500,1240079361480499202, cingolani oscar  ZinClaudio  Marianaarias  dr rdebbag  masaludlanacion  lanacionmas Me parece a mí o desde que arrancó la vacunacion en 2021  elotaron los contagios x variantes en todo el mundo A mas vacunados   mas contagios y mas muertes  Y q me dicen de los q no habiendo recibido ni una dosis venimos invictos desde hace casi dos años con una salud perfecta ,1439040962790100997,False, cingolani oscar  ZinClaudio  Marianaarias  dr rdebbag  masaludlanacion  lanacionmas Me parece a mí o desde que arrancó la vacunacion en 2021  elotaron los contagios x variantes en todo el mundo A mas vacunados   mas contagios y mas muertes  Y q me dicen de los q no habiendo recibido ni una dosis venimos invictos desde hace casi dos años con una salud perfecta ,2021-09-18T01:37:56.000Z,Mexico,"@cingolani_oscar @ZinClaudio @Marianaarias @dr_rdebbag @masaludlanacion @lanacionmas Me parece a mí o desde que arrancó la vacunacion en 2021, explotaron los contagios x variantes en todo el mundo.A mas vacunados , mas contagios y mas muertes? Y q me dicen de los q no habiendo recibido ni una dosis venimos invictos desde hace casi dos años con una salud perfecta?",['xp'],[],"['cingolani_oscar', 'ZinClaudio', 'Marianaarias', 'dr_rdebbag', 'masaludlanacion', 'lanacionmas']",['https://t.co/lCQ04mLazD'],
1138,es,1438979334262378500,1240079361480499202, cingolani oscar  ZinClaudio  Marianaarias  dr rdebbag  masaludlanacion  lanacionmas Gracias Dr ,1439011321694113792,False, cingolani oscar  ZinClaudio  Marianaarias  dr rdebbag  masaludlanacion  lanacionmas Gracias Dr ,2021-09-17T23:40:09.000Z,Mexico,@cingolani_oscar @ZinClaudio @Marianaarias @dr_rdebbag @masaludlanacion @lanacionmas Gracias Dr.,[],[],"['cingolani_oscar', 'ZinClaudio', 'Marianaarias', 'dr_rdebbag', 'masaludlanacion', 'lanacionmas']",[],
1139,es,1438979334262378500,1240079361480499202, cingolani oscar  ZinClaudio  Marianaarias  dr rdebbag  masaludlanacion  lanacionmas Mañana los veo     Y pregunta   se dice que se dieron vacunas vencidas  saben algo de esta noticia ,1438988850781687810,False, cingolani oscar  ZinClaudio  Marianaarias  dr rdebbag  masaludlanacion  lanacionmas Mañana los veo     Y pregunta   se dice que se dieron vacunas vencidas  saben algo de esta noticia ,2021-09-17T22:10:51.000Z,Mexico,"@cingolani_oscar @ZinClaudio @Marianaarias @dr_rdebbag @masaludlanacion @lanacionmas Mañana los veo!!!! Y pregunta , se dice que se dieron vacunas vencidas, saben algo de esta noticia?",[],[],"['cingolani_oscar', 'ZinClaudio', 'Marianaarias', 'dr_rdebbag', 'masaludlanacion', 'lanacionmas']",['https://t.co/1h6oKU74pP'],
1140,es,1438979334262378500,1240079361480499202, cingolani oscar  ZinClaudio  Marianaarias  dr rdebbag  masaludlanacion  lanacionmas Hola doc  Hija menor de 11 con prescripción de su pediatra  puede vacunarse en EEUU  ,1438980946687107072,False, cingolani oscar  ZinClaudio  Marianaarias  dr rdebbag  masaludlanacion  lanacionmas Hola doc  Hija menor de 11 con prescripción de su pediatra  puede vacunarse en EEUU  ,2021-09-17T21:39:27.000Z,Mexico,"@cingolani_oscar @ZinClaudio @Marianaarias @dr_rdebbag @masaludlanacion @lanacionmas Hola doc, Hija menor de 11 con prescripción de su pediatra, puede vacunarse en EEUU ?",[],[],"['cingolani_oscar', 'ZinClaudio', 'Marianaarias', 'dr_rdebbag', 'masaludlanacion', 'lanacionmas']",['https://t.co/5bimTewcsn'],
1141,es,1438976649224232965,1153810906138238976, RedLopezDiaz Ahh el negocio por delante,1439054575760297984,False, RedLopezDiaz Ahh el negocio por delante,2021-09-18T02:32:01.000Z,Mexico,@RedLopezDiaz Ahh el negocio por delante,[],[],['RedLopezDiaz'],[],
1142,es,1438976649224232965,1153810906138238976, RedLopezDiaz Ya tienes con que comenzar a golpetear al gobierno federal el día de mañana  Aunque te vas a ridiculizar como ya es costumbre ,1439051631967023109,False, RedLopezDiaz Ya tienes con que comenzar a golpetear al gobierno federal el día de mañana  Aunque te vas a ridiculizar como ya es costumbre ,2021-09-18T02:20:20.000Z,Mexico,@RedLopezDiaz Ya tienes con que comenzar a golpetear al gobierno federal el día de mañana. Aunque te vas a ridiculizar como ya es costumbre.,[],[],['RedLopezDiaz'],[],
1143,es,1438976649224232965,1153810906138238976, RedLopezDiaz A chinga  ya todos se sienten epidemiólogos,1438997417911795715,False, RedLopezDiaz A chinga  ya todos se sienten epidemiólogos,2021-09-17T22:44:54.000Z,Mexico,"@RedLopezDiaz A chinga, ya todos se sienten epidemiólogos",[],[],['RedLopezDiaz'],[],
1144,es,1438976649224232965,1153810906138238976, RedLopezDiaz Ya siéntese Sr ,1438977703340912646,False, RedLopezDiaz Ya siéntese Sr ,2021-09-17T21:26:34.000Z,Mexico,@RedLopezDiaz Ya siéntese Sr!,[],[],['RedLopezDiaz'],[],
1145,es,1438975763106222082,1146507454424989696,  axelandrade   Apodaca News  cesargarzav  ApodacaOficial Gracias a nuestros impuestos,1439024402142740480,False,  axelandrade   Apodaca News  cesargarzav  ApodacaOficial Gracias a nuestros impuestos,2021-09-18T00:32:07.000Z,Mexico,@_axelandrade_ @Apodaca_News @cesargarzav @ApodacaOficial Gracias a nuestros impuestos,[],[],"['_axelandrade_', 'Apodaca_News', 'cesargarzav', 'ApodacaOficial']",[],
1146,es,1438962717637976066,1277632595040272385, infodemiaMex  jenarovillamil Ah si  eficacia absoluta  Con estudios de dos meses  Porque no publicar también los testimonios de los efectos ,1439085500267180034,False, infodemiaMex  jenarovillamil Ah si  eficacia absoluta  Con estudios de dos meses  Porque no publicar también los testimonios de los efectos ,2021-09-18T04:34:54.000Z,Mexico,"@infodemiaMex @jenarovillamil Ah si, eficacia absoluta? Con estudios de dos meses? Porque no publicar también los testimonios de los efectos?",[],[],"['infodemiaMex', 'jenarovillamil']",['https://t.co/lhaD8TwJU3'],
1147,es,1438958105891680264,857303965, AcordeDiscorde  crismartinj pero la publicidad de los accidentes de tráfico se redujo después de incorporar el carné por puntos  ahora la publicidad va dirigida al carné por puntos chino el fin de la vida como la conocemos https   t co AOIqa1KB9e,1439207671895400449,False, AcordeDiscorde  crismartinj pero la publicidad de los accidentes de tráfico se redujo después de incorporar el carné por puntos  ahora la publicidad va dirigida al carné por puntos chino el fin de la vida como la conocemos https   t co AOIqa1KB9e,2021-09-18T12:40:22.000Z,Mexico,"@AcordeDiscorde @crismartinj pero la publicidad de los accidentes de tráfico se redujo después de incorporar el carné por puntos; ahora la publicidad va dirigida al carné por puntos chino el fin de la vida como la conocemos.
https://t.co/AOIqa1KB9e",[],[],"['AcordeDiscorde', 'crismartinj']",['https://t.co/8QGHuldhEt'],
1148,es,1438958105891680264,857303965, crismartinj  elquehavistoels acabará pasando y se echarán las manos a la cabeza,1439187347573248000,False, crismartinj  elquehavistoels acabará pasando y se echarán las manos a la cabeza,2021-09-18T11:19:37.000Z,Mexico,@crismartinj @elquehavistoels acabará pasando y se echarán las manos a la cabeza,[],[],"['crismartinj', 'elquehavistoels']",[],
1149,es,1438958105891680264,857303965, crismartinj Será mucho peor,1439181478059986951,False, crismartinj Será mucho peor,2021-09-18T10:56:17.000Z,Mexico,@crismartinj Será mucho peor,[],[],['crismartinj'],[],
1150,es,1438958105891680264,857303965, crismartinj Ya está pasando el Dr Ryan Cole aprecia aumento muy llamativo del cáncer de endometrio   seguimos ,1439128829944123397,False, crismartinj Ya está pasando el Dr Ryan Cole aprecia aumento muy llamativo del cáncer de endometrio   seguimos ,2021-09-18T07:27:05.000Z,Mexico,@crismartinj Ya está pasando el Dr.Ryan Cole aprecia aumento muy llamativo del cáncer de endometrio...seguimos?,[],[],['crismartinj'],[],
1151,es,1438958105891680264,857303965, crismartinj Lo que va a pasar es que dentro de unos años todos los efectos adversos o fallecimientos causados por la vacuna van a ser achacados a otra cosa y la gente se lo creerá  A no ser que cualquier secuela sea denunciada desde ya y se exijan autopsias en los juzgados ,1439107878196072450,False, crismartinj Lo que va a pasar es que dentro de unos años todos los efectos adversos o fallecimientos causados por la vacuna van a ser achacados a otra cosa y la gente se lo creerá  A no ser que cualquier secuela sea denunciada desde ya y se exijan autopsias en los juzgados ,2021-09-18T06:03:50.000Z,Mexico,@crismartinj Lo que va a pasar es que dentro de unos años todos los efectos adversos o fallecimientos causados por la vacuna van a ser achacados a otra cosa y la gente se lo creerá. A no ser que cualquier secuela sea denunciada desde ya y se exijan autopsias en los juzgados.,[],[],['crismartinj'],['https://t.co/zK86dpvtdT'],
1152,es,1438958105891680264,857303965, crismartinj lo que dudo es cuantas personas van a ser capaz de atravesar la disonancia cognitiva cuando se enteren de la magnitud del engaño  no serán pocos los que no reconocerán la mentira ni aunque los causantes de la misma la develen  muchos están arrancados de la realidad,1439073102764331012,False, crismartinj lo que dudo es cuantas personas van a ser capaz de atravesar la disonancia cognitiva cuando se enteren de la magnitud del engaño  no serán pocos los que no reconocerán la mentira ni aunque los causantes de la misma la develen  muchos están arrancados de la realidad,2021-09-18T03:45:39.000Z,Mexico,@crismartinj lo que dudo es cuantas personas van a ser capaz de atravesar la disonancia cognitiva cuando se enteren de la magnitud del engaño. no serán pocos los que no reconocerán la mentira ni aunque los causantes de la misma la develen. muchos están arrancados de la realidad,[],[],['crismartinj'],['https://t.co/wTXmnqonmw'],
