,tweet_lang,verified,id,tweet_text,tweet_emoticons,hashtags,mentions,tweet_urls,country,text_en,tweet_date
1102,en,False,1440695373341728770,"Hospitals, nursing homes worried Sept. 27 #vaccine mandate could affect staffing. #MSSNY President #DrJosephSellers comments in @Newsday https://t.co/2uP9XYOiRs #COVID19 #coronavirus #GetVaxxed https://t.co/fWhJaMgphf",[],"['vaccine', 'MSSNY', 'DrJosephSellers', 'COVID19', 'coronavirus', 'GetVaxxed']",['Newsday'],['https://t.co/2uP9XYOiRs'],USA,Hospitals  nursing homes worried Sept  27  vaccine mandate could affect staffing   MSSNY President  DrJosephSellers comments in  Newsday https   t co 2uP9XYOiRs  COVID19  coronavirus  GetVaxxed https   t co fWhJaMgphf,2021-09-22 15:00:00
1103,en,False,1440695236842254337,Let’s see if the officers of police will alter their behaviour.  Queensland Police given ultimatum over COVID vaccine mandate | 7NEWS - YouTube https://t.co/3GEy5kfZKl,[],[],[],['https://t.co/3GEy5kfZKl'],USA,Let’s see if the officers of police will alter their behaviour   Queensland Police given ultimatum over COVID vaccine mandate   7NEWS   YouTube https   t co 3GEy5kfZKl,2021-09-22 15:00:00
1104,en,False,1440695225794523146,Is it true members of Congress are exempt from getting the vaccine mandate? Because that’s absurd that my fiancé was forced to get it and Biden’s homies are not forced? But is this true?,[],[],[],[],USA,Is it true members of Congress are exempt from getting the vaccine mandate  Because that’s absurd that my fiancé was forced to get it and Biden’s homies are not forced  But is this true ,2021-09-22 15:00:00
1105,en,False,1440695198699311110,@AGoldsmithEsq @JohnRad15 @Resist4Humanity @DGladwich @herd_not @figgdimension New Zealand doesn't have a vaccine mandate. Neither does Sweden. Even China overturned theirs in some counties. It really feels like Americans are so laser-focused on that one solution that they're giving into authoritarian impulses and ignoring alternative response options.,[],[],"['AGoldsmithEsq', 'JohnRad15', 'Resist4Humanity', 'DGladwich', 'herd_not', 'figgdimension']",[],USA, AGoldsmithEsq  JohnRad15  Resist4Humanity  DGladwich  herd not  figgdimension New Zealand doesn t have a vaccine mandate  Neither does Sweden  Even China overturned theirs in some counties  It really feels like Americans are so laser focused on that one solution that they re giving into authoritarian impulses and ignoring alternative response options ,2021-09-22 15:00:00
1106,en,False,1440695171734073346,"@wayneRu56 @the_crowening @thehill There IS a vaccine mandate...just because it has other intrusive caveats doesn't take the mandate away.
And comparing that to killing the innocent unborn shows just how serious a hard heart can be.",[],[],"['wayneRu56', 'the_crowening', 'thehill']",[],USA, wayneRu56  the crowening  thehill There IS a vaccine mandate   just because it has other intrusive caveats doesn t take the mandate away And comparing that to killing the innocent unborn shows just how serious a hard heart can be ,2021-09-22 15:00:00
1107,en,False,1440694932885233670,"@karlbykarlsmith @NateSilver538 @DKThomp @robbysoave Against the Biden mandate, OK w/ employers requiring it. But l don’t see a very strong case for exceptions either way. The vaccine does still boost immunity even for those who’ve already had covid. The goal is boosting collective immunity, so it still helps and at very low cost.",[],[],"['karlbykarlsmith', 'NateSilver538', 'DKThomp', 'robbysoave']",[],USA, karlbykarlsmith  NateSilver538  DKThomp  robbysoave Against the Biden mandate  OK w  employers requiring it  But l don’t see a very strong case for exceptions either way  The vaccine does still boost immunity even for those who’ve already had covid  The goal is boosting collective immunity  so it still helps and at very low cost ,2021-09-22 15:00:00
1108,en,False,1440694836953116679,@soledadobrien Some folks get angry when I tell them that no one is quitting over a vaccine mandate at my hospital. The narrative has been accepted as fact.,[],[],['soledadobrien'],[],USA, soledadobrien Some folks get angry when I tell them that no one is quitting over a vaccine mandate at my hospital  The narrative has been accepted as fact ,2021-09-22 15:00:00
1109,en,False,1440694781357686802,Basically this: https://t.co/bfPrgebiUs and super not this: https://t.co/8c74FeFJdP,[],[],[],"['https://t.co/bfPrgebiUs', 'https://t.co/8c74FeFJdP']",USA,Basically this  https   t co bfPrgebiUs and super not this  https   t co 8c74FeFJdP,2021-09-22 15:00:00
1110,en,False,1440694680065232909,"Starting TODAY, all patrons at a number of categories of businesses &amp; orgs MUST present proof of vaccination. This list includes many arts and culture orgs.

Read our recent Bulletin with more details and guidance for organizations and for the public. https://t.co/5Rg2BTqa7i",[],[],[],['https://t.co/5Rg2BTqa7i'],USA,Starting TODAY  all patrons at a number of categories of businesses  amp  orgs MUST present proof of vaccination  This list includes many arts and culture orgs Read our recent Bulletin with more details and guidance for organizations and for the public  https   t co 5Rg2BTqa7i,2021-09-22 15:00:00
1111,en,False,1440694673056567305,"@leogane1026 The point is if we were in such a deadly pandemic that we should now implement an unprecedented vaccine mandate worldwide, we wouldn’t be leaving our houses at all. The government would have provided everyone with basic income &amp; necessities. Instead y’all packed superstores 🤣",['🤣'],[],['leogane1026'],[],USA, leogane1026 The point is if we were in such a deadly pandemic that we should now implement an unprecedented vaccine mandate worldwide  we wouldn’t be leaving our houses at all  The government would have provided everyone with basic income  amp  necessities  Instead y’all packed superstores ,2021-09-22 15:00:00
1112,en,False,1440694611618324483,"B.C.'s largest Indigenous government announces vaccine mandate
The Métis Nation of British Columbia supports over 90,000 self-declared Métis people in the province through several regional offices.
https://t.co/ESYAepJlBL",[],[],[],['https://t.co/ESYAepJlBL'],USA,B C  s largest Indigenous government announces vaccine mandateThe Métis Nation of British Columbia supports over 90 000 self declared Métis people in the province through several regional offices https   t co ESYAepJlBL,2021-09-22 15:00:00
1113,en,False,1440694578407886853,"Vaccine mandates are becoming the norm for workplaces, but executing and enforcing them is leaving employers and employees with questions and concerns.
https://t.co/XmhdK6myY1",[],[],[],['https://t.co/XmhdK6myY1'],USA,Vaccine mandates are becoming the norm for workplaces  but executing and enforcing them is leaving employers and employees with questions and concerns https   t co XmhdK6myY1,2021-09-22 15:00:00
1114,en,False,1440694538792701962,"@robbysoave @NateSilver538 @DKThomp i have some philosophical issues with the nyc vaccine mandate but given we'd either have that or a mask mandate, the vaccine mandate is so much better to live through.",[],[],"['robbysoave', 'NateSilver538', 'DKThomp']",[],USA, robbysoave  NateSilver538  DKThomp i have some philosophical issues with the nyc vaccine mandate but given we d either have that or a mask mandate  the vaccine mandate is so much better to live through ,2021-09-22 15:00:00
1115,en,False,1440694520656457738,.@NYCMayor announces that 87% of New York City teachers have received at least one dose of covid vaccine. (Mandate goes into effect Monday 9/27.),[],[],['NYCMayor'],[],USA,  NYCMayor announces that 87  of New York City teachers have received at least one dose of covid vaccine   Mandate goes into effect Monday 9 27  ,2021-09-22 15:00:00
1116,en,False,1440694503686369299,"Biden wants to force Americans to get the jab, but it’s optional for 600K migrants that have been released.

It’s only a pandemic in certain situations. For some reason the pandemic doesn’t seem to apply to celebrities, politicians and illegal immigrants.

https://t.co/wnwD5YRVUL https://t.co/cd8mQpsP3k",[],[],[],"['https://t.co/wnwD5YRVUL', 'https://t.co/cd8mQpsP3k']",USA,Biden wants to force Americans to get the jab  but it’s optional for 600K migrants that have been released It’s only a pandemic in certain situations  For some reason the pandemic doesn’t seem to apply to celebrities  politicians and illegal immigrants https   t co wnwD5YRVUL https   t co cd8mQpsP3k,2021-09-22 15:00:00
1117,en,False,1440694501324967936,@DACDAC4DAC @olliemilman Gross. Anti Covid vaccine mandate is NOT Anti-vax.,[],[],"['DACDAC4DAC', 'olliemilman']",[],USA, DACDAC4DAC  olliemilman Gross  Anti Covid vaccine mandate is NOT Anti vax ,2021-09-22 15:00:00
1118,en,False,1440694480504381446,"@divamonroe2uhoe @sickofSaasha It’s unfortunate but until federal makes it unlawful, employers have the right to mandate the vaccine for their employees",[],[],"['divamonroe2uhoe', 'sickofSaasha']",[],USA, divamonroe2uhoe  sickofSaasha It’s unfortunate but until federal makes it unlawful  employers have the right to mandate the vaccine for their employees,2021-09-22 15:00:00
1119,en,False,1440694428415389698,@ShawUniversity are dropping students classes due to a forced vaccine mandate. It was originally told they would only take the face to face classes. Now they are taking all classes from the students which affects the students FA and loans. @ChrisClark_ @ABC11_WTVD @WNCN @thecw22,[],[],"['ShawUniversity', 'ChrisClark_', 'ABC11_WTVD', 'WNCN', 'thecw22']",[],USA, ShawUniversity are dropping students classes due to a forced vaccine mandate  It was originally told they would only take the face to face classes  Now they are taking all classes from the students which affects the students FA and loans   ChrisClark   ABC11 WTVD  WNCN  thecw22,2021-09-22 15:00:00
1120,en,False,1440694293983731712,@Patrick63117986 @the_crowening @thehill I believe in the woman having the right to chose just like you believe that people have the right to chose to get vaccinated or not. Because I believe in the rights of everyone. Before you say I agree with a vaccine mandate I never once said I did. I just said there isn’t one.,[],[],"['Patrick63117986', 'the_crowening', 'thehill']",[],USA, Patrick63117986  the crowening  thehill I believe in the woman having the right to chose just like you believe that people have the right to chose to get vaccinated or not  Because I believe in the rights of everyone  Before you say I agree with a vaccine mandate I never once said I did  I just said there isn’t one ,2021-09-22 15:00:00
1121,en,False,1440694245115846674,"Here's a recipe for recovery, @POTUS @DNC @SenateDems @HouseDems @SpeakerPelosi @SenSchumer 

- DROP THE #FILIBUSTER
- Pass promised legislation (see above)
- Stop catering to ill-faith centrists and ""bipartisanship"" 
- Enact #vaccine mandate (see above)
Easy! https://t.co/xHt9tMG9iQ",[],"['FILIBUSTER', 'vaccine']","['POTUS', 'DNC', 'SenateDems', 'HouseDems', 'SpeakerPelosi', 'SenSchumer']",['https://t.co/xHt9tMG9iQ'],USA,Here s a recipe for recovery   POTUS  DNC  SenateDems  HouseDems  SpeakerPelosi  SenSchumer   DROP THE  FILIBUSTER  Pass promised legislation  see above   Stop catering to ill faith centrists and  bipartisanship    Enact  vaccine mandate  see above Easy  https   t co xHt9tMG9iQ,2021-09-22 15:00:00
1122,en,False,1440694236270116873,"The Ultra-Secret and Diabolical Agenda Behind the COVID-19 Vaccine | SOTN: Alternative News, Analysis &amp; Commentary #vaccine #mandate #covid19   https://t.co/bDQwI4YCJv",[],"['vaccine', 'mandate', 'covid19']",[],['https://t.co/bDQwI4YCJv'],USA,The Ultra Secret and Diabolical Agenda Behind the COVID 19 Vaccine   SOTN  Alternative News  Analysis  amp  Commentary  vaccine  mandate  covid19   https   t co bDQwI4YCJv,2021-09-22 15:00:00
1123,en,False,1440694132549160966,United Airlines employees sue company over its 'draconian' COVID vaccine mandate https://t.co/MroFiuE9aY #FoxBusiness,[],['FoxBusiness'],[],['https://t.co/MroFiuE9aY'],USA,United Airlines employees sue company over its  draconian  COVID vaccine mandate https   t co MroFiuE9aY  FoxBusiness,2021-09-22 15:00:00
1124,en,False,1440694115121840129,"A vaccine mandate hides an ID mandate: ""undocumented"" does not mean ""unvaccinated"". Adverse effects of @SF_DPH ""health"" order would be felt primarily by vaccinated but undocumented people, not by unvaccinated people:  https://t.co/8mNYKGBAZc",[],[],['SF_DPH'],['https://t.co/8mNYKGBAZc'],USA,A vaccine mandate hides an ID mandate   undocumented  does not mean  unvaccinated   Adverse effects of  SF DPH  health  order would be felt primarily by vaccinated but undocumented people  not by unvaccinated people   https   t co 8mNYKGBAZc,2021-09-22 15:00:00
1125,en,False,1440694113494462464,"Natural immunity to covid is powerful. Policymakers seem afraid to say so.

https://t.co/hzzov3PUOR",[],[],[],['https://t.co/hzzov3PUOR'],USA,Natural immunity to covid is powerful  Policymakers seem afraid to say so https   t co hzzov3PUOR,2021-09-22 15:00:00
1126,en,False,1440694087175192576,"The #IDleg Committee on Federalism is meeting today. Idaho in Session, with @IdahoPTV is streaming it. Among other issues, the agenda discusses Biden's vaccine mandate for some employees. 

Watch live: https://t.co/Ny7C8TyYWP",[],['IDleg'],['IdahoPTV'],['https://t.co/Ny7C8TyYWP'],USA,The  IDleg Committee on Federalism is meeting today  Idaho in Session  with  IdahoPTV is streaming it  Among other issues  the agenda discusses Biden s vaccine mandate for some employees  Watch live  https   t co Ny7C8TyYWP,2021-09-22 15:00:00
1127,en,False,1440694056842002432,Apparently it’s his body and religion belief. Okay these people are all idiots - Officer of nearly 30 years resigns over COVID-19 vaccine mandate https://t.co/srImeSJhbf,[],[],[],['https://t.co/srImeSJhbf'],USA,Apparently it’s his body and religion belief  Okay these people are all idiots   Officer of nearly 30 years resigns over COVID 19 vaccine mandate https   t co srImeSJhbf,2021-09-22 15:00:00
1128,en,False,1440694055256559625,Australian Union construction workers destroy the HQ of  champagne socialist CFMEU for not standing up for them and representing them against the vaccine mandate 😎 https://t.co/edpccXMn8j,['😎'],[],[],[],USA,Australian Union construction workers destroy the HQ of  champagne socialist CFMEU for not standing up for them and representing them against the vaccine mandate  https   t co edpccXMn8j,2021-09-22 15:00:00
1129,en,False,1440694042493263875,"North Carolina Hospital System Suspends Hundreds of Employees After COVID-19 Vaccine Mandate
..... And many operations in Wilmington, NC suspended indefinitely due to staffing shortages   https://t.co/IyAnNTBlxb",[],[],[],['https://t.co/IyAnNTBlxb'],USA,North Carolina Hospital System Suspends Hundreds of Employees After COVID 19 Vaccine Mandate      And many operations in Wilmington  NC suspended indefinitely due to staffing shortages   https   t co IyAnNTBlxb,2021-09-22 15:00:00
1130,en,False,1440694039200763904,Tucker Carlson has a bonkers new Covid vaccine conspiracy theory https://t.co/awFxQoC2sj via @msnbc,[],[],['MSNBC'],['https://t.co/awFxQoC2sj'],USA,Tucker Carlson has a bonkers new Covid vaccine conspiracy theory https   t co awFxQoC2sj via  msnbc,2021-09-22 15:00:00
1131,en,False,1440694025376260105,"Newberg School Staffer Shows Up for Class in Blackface, Calls Herself Rosa Parks to Protest Vaccine Mandate https://t.co/jExvBJmAHG #press #feedly",[],"['press', 'feedly']",[],['https://t.co/jExvBJmAHG'],USA,Newberg School Staffer Shows Up for Class in Blackface  Calls Herself Rosa Parks to Protest Vaccine Mandate https   t co jExvBJmAHG  press  feedly,2021-09-22 15:00:00
1132,en,False,1440693960037396485,GOP #mayor of #Tennessee county vows to defy Biden’s #vaccine #mandate despite high 'COVID-19 rates' - https://t.co/k2MbyEq1Qt https://t.co/4B4CpFN3Su,[],"['mayor', 'Tennessee', 'vaccine', 'mandate']",[],"['https://t.co/k2MbyEq1Qt', 'https://t.co/4B4CpFN3Su']",USA,GOP  mayor of  Tennessee county vows to defy Biden’s  vaccine  mandate despite high  COVID 19 rates    https   t co k2MbyEq1Qt https   t co 4B4CpFN3Su,2021-09-22 15:00:00
1133,en,False,1440693950289825804,@catturd2 I wonder if he’s thought about what a vaccine mandate will do to the labor market,[],[],['catturd2'],[],USA, catturd2 I wonder if he’s thought about what a vaccine mandate will do to the labor market,2021-09-22 15:00:00
1134,en,False,1440693921726619659,"@DrVivianS @fordnation @RodPhillips01 @fordnation Are you waiting to see what a 4th, 5th and 6th wave looks like in LTC? ENOUGH! It is time for a REAL vaccine mandate in LTC, where there is no option to test instead. Testing does NOT replace vaccination!",[],[],"['DrVivianS', 'fordnation', 'RodPhillips01', 'fordnation']",[],USA, DrVivianS  fordnation  RodPhillips01  fordnation Are you waiting to see what a 4th  5th and 6th wave looks like in LTC  ENOUGH  It is time for a REAL vaccine mandate in LTC  where there is no option to test instead  Testing does NOT replace vaccination ,2021-09-22 15:00:00
1135,en,False,1440693886993649671,"5 Small Business Stories, Trends, and Tips for Today

1- Three #Tax Moves #SmallBusinessOwners Need To Know
2- #SmallBusiness Group to Sue #BidenAdministration Over #Vaccine Mandate
3- A new program aims to help small businesses recover

Read more at - https://t.co/zwz6tiguM0 https://t.co/Lqcza1ZUX9",[],"['Tax', 'SmallBusinessOwners', 'SmallBusiness', 'BidenAdministration', 'Vaccine']",[],['https://t.co/zwz6tiguM0'],USA,5 Small Business Stories  Trends  and Tips for Today1  Three  Tax Moves  SmallBusinessOwners Need To Know2   SmallBusiness Group to Sue  BidenAdministration Over  Vaccine Mandate3  A new program aims to help small businesses recoverRead more at   https   t co zwz6tiguM0 https   t co Lqcza1ZUX9,2021-09-22 15:00:00
1136,en,True,1440693853342765064,How's the mass campaign of civil disobedience to vaccine mandates going? Kentucky hospitals that have imposed vaccination requirements report that fewer than 1% of employees have been terminated for refusal. https://t.co/6ahB9yoNU5,[],[],[],['https://t.co/6ahB9yoNU5'],USA,How s the mass campaign of civil disobedience to vaccine mandates going  Kentucky hospitals that have imposed vaccination requirements report that fewer than 1  of employees have been terminated for refusal  https   t co 6ahB9yoNU5,2021-09-22 15:00:00
1137,en,False,1440693842190090253,Colleague Dr. Rich Rothenberg at @PHGSU is quoted in this article analyzing and helping to explain COVID-19 county data behind school mask mandates in Georgia. https://t.co/HHfmeLFZCv,['xp'],[],['PHGSU'],['https://t.co/HHfmeLFZCv'],USA,Colleague Dr  Rich Rothenberg at  PHGSU is quoted in this article analyzing and helping to elain COVID 19 county data behind school mask mandates in Georgia  https   t co HHfmeLFZCv,2021-09-22 15:00:00
1138,en,False,1440693830378876932,@jkenney just mandate the vaccine passport already. Leaving the onus on small business to pry into the private lives of our employees to comply with the restriction protocols put in place by you is absurd and unfair. Stop letting your pride get in the way of doing what’s right.,[],[],['jkenney'],[],USA, jkenney just mandate the vaccine passport already  Leaving the onus on small business to pry into the private lives of our employees to comply with the restriction protocols put in place by you is absurd and unfair  Stop letting your pride get in the way of doing what’s right ,2021-09-22 15:00:00
1139,en,False,1440693794446331920,why’d they let him in if he violated the vaccine mandate??? and now they’re worried abt the un being a superspreader event oh lord,[],[],[],[],USA,why’d they let him in if he violated the vaccine mandate    and now they’re worried abt the un being a superspreader event oh lord,2021-09-22 15:00:00
1140,en,False,1440693778919018496,I really have 0 empathy for people losing their jobs over the vaccine mandate. https://t.co/3biKmZPh7a,[],[],[],[],USA,I really have 0 empathy for people losing their jobs over the vaccine mandate  https   t co 3biKmZPh7a,2021-09-22 15:00:00
1141,en,False,1440693683179843597,"[4K] New York City Protest of COVID Vaccine Mandate/Passport, Anti-Vax R... https://t.co/cgIHycA4Gh via @YouTube THIS IS GREAT!",[],[],['YouTube'],['https://t.co/cgIHycA4Gh'],USA, 4K  New York City Protest of COVID Vaccine Mandate Passport  Anti Vax R    https   t co cgIHycA4Gh via  YouTube THIS IS GREAT ,2021-09-22 15:00:00
1142,en,False,1440693671368617999,"BREAKING: Biden Now Becoming Less Popular With Black Voters After Vaccine Mandate Rollout

https://t.co/1UVEgHSr1T",[],[],[],['https://t.co/1UVEgHSr1T'],USA,BREAKING  Biden Now Becoming Less Popular With Black Voters After Vaccine Mandate Rollouthttps   t co 1UVEgHSr1T,2021-09-22 15:00:00
1143,en,False,1440693632978194439,"United Accused of Religious, Disability Bias in Vaccine Mandate - Bloomberg Law https://t.co/NX3ZSrfFMw",[],[],[],['https://t.co/NX3ZSrfFMw'],USA,United Accused of Religious  Disability Bias in Vaccine Mandate   Bloomberg Law https   t co NX3ZSrfFMw,2021-09-22 15:00:00
1144,en,False,1440693632613318666,"United Accused of Religious, Disability Bias in Vaccine Mandate - Bloomberg Law https://t.co/G2WGDnZpze",[],[],[],['https://t.co/G2WGDnZpze'],USA,United Accused of Religious  Disability Bias in Vaccine Mandate   Bloomberg Law https   t co G2WGDnZpze,2021-09-22 15:00:00
1145,en,False,1440693632521015300,"United Accused of Religious, Disability Bias in Vaccine Mandate - Bloomberg Law https://t.co/2nHUyyxDW7",['xD'],[],[],['https://t.co/2nHUyyxDW7'],USA,United Accused of Religious  Disability Bias in Vaccine Mandate   Bloomberg Law https   t co 2nHUyyW7,2021-09-22 15:00:00
1146,en,False,1440693632407797767,"UNITED AIRLINES EMPLOYEES SUE COMPANY OVER ITS 'DRACONIAN' COVID VACCINE MANDATE

Fox Business",[],[],[],[],USA,UNITED AIRLINES EMPLOYEES SUE COMPANY OVER ITS  DRACONIAN  COVID VACCINE MANDATEFox Business,2021-09-22 15:00:00
1147,en,False,1440693630130221067,SI Filings - How should Christians think about Biden’s vaccine mandate? https://t.co/6blMj36J63,[],[],[],['https://t.co/6blMj36J63'],USA,SI Filings   How should Christians think about Biden’s vaccine mandate  https   t co 6blMj36J63,2021-09-22 15:00:00
1148,en,False,1440693575398821898,It damn near blows my mind the amount of ppl that are walking away from their jobs cause of vaccine mandate.,[],[],[],[],USA,It damn near blows my mind the amount of ppl that are walking away from their jobs cause of vaccine mandate ,2021-09-22 15:00:00
1149,en,False,1440693564896268288,"@GOP What is the GOP going to do about this bullshit ""vaccine"" mandate?",[],[],['GOP'],[],USA, GOP What is the GOP going to do about this bullshit  vaccine  mandate ,2021-09-22 15:00:00
1150,en,False,1440693430905028610,"Good I hope everyone sues for Illegal Mandate
https://t.co/gkWF2aKUT1",[],[],[],['https://t.co/gkWF2aKUT1'],USA,Good I hope everyone sues for Illegal Mandatehttps   t co gkWF2aKUT1,2021-09-22 15:00:00
1151,en,False,1440693395442176001,@DonaldJTrumpJr  @RandPaul  United Airlines employees sue company over its 'draconian' COVID vaccine mandate https://t.co/jh7mxR3jgh #FoxBusiness,[],['FoxBusiness'],"['DonaldJTrumpJr', 'RandPaul']",['https://t.co/jh7mxR3jgh'],USA, DonaldJTrumpJr   RandPaul  United Airlines employees sue company over its  draconian  COVID vaccine mandate https   t co jh7mxR3jgh  FoxBusiness,2021-09-22 15:00:00
1152,en,False,1440693191464783875,"@CraigDMauger OSHA still hasn't issued their vaccine mandate. I have a suspicion that COVID policy is becoming politically untenable. There's a lot of normal life out there, away from Twitter.  The cognitive dissonance of COVID policy is a huge risk to re-election.",[],[],['CraigDMauger'],[],USA, CraigDMauger OSHA still hasn t issued their vaccine mandate  I have a suspicion that COVID policy is becoming politically untenable  There s a lot of normal life out there  away from Twitter   The cognitive dissonance of COVID policy is a huge risk to re election ,2021-09-22 15:00:00
1153,en,False,1440693186431635465,Biden announces a Vaccine Mandate or weekly Covid testing for all private employers https://t.co/PpU83eSrzl,[],[],[],[],USA,Biden announces a Vaccine Mandate or weekly Covid testing for all private employers https   t co PpU83eSrzl,2021-09-22 15:00:00
1154,en,False,1440693153850294272,"@EffieGib Wait til the vaccine nazis see that this is not going away, it will get worse… Do you think they quadruple down on the vaccine mandate mistake then?",[],[],['EffieGib'],[],USA, EffieGib Wait til the vaccine nazis see that this is not going away  it will get worse… Do you think they quadruple down on the vaccine mandate mistake then ,2021-09-22 15:00:00
1155,en,False,1440693066554232846,"There’s no doubt members of the infusion nurse community are heroes. At SPNN, that’s just the way we treat them. Which means respecting the personal choices of our members. Read more https://t.co/YOdoNKzPL9

#nurselife #nursesrock https://t.co/vxtu8VH0hS",[],"['nurselife', 'nursesrock']",[],['https://t.co/YOdoNKzPL9'],USA,There’s no doubt members of the infusion nurse community are heroes  At SPNN  that’s just the way we treat them  Which means respecting the personal choices of our members  Read more https   t co YOdoNKzPL9 nurselife  nursesrock https   t co vxtu8VH0hS,2021-09-22 15:00:00
