,tweet_lang,verified,id,tweet_text,tweet_emoticons,hashtags,mentions,tweet_urls,country,text_en,tweet_date
763,en,True,1440711732926709760,She said she was dressing up as Rosa Parks... to protest a vaccine mandate.  What could possibly go wrong? https://t.co/rZ9CHPgA1r,[],[],[],['https://t.co/rZ9CHPgA1r'],USA,She said she was dressing up as Rosa Parks    to protest a vaccine mandate   What could possibly go wrong  https   t co rZ9CHPgA1r,2021-09-22 16:00:00
764,en,False,1440711722503790596,"Is it mandatory for all Health Care Workers and hospital staff to be vaccinated in South Africa?

I cannot think of a more suited vaccine mandate than hospitals and their staff.

@kznhealth @HealthZA",[],[],"['kznhealth', 'HealthZA']",[],USA,Is it mandatory for all Health Care Workers and hospital staff to be vaccinated in South Africa I cannot think of a more suited vaccine mandate than hospitals and their staff  kznhealth  HealthZA,2021-09-22 16:00:00
765,en,False,1440711704950702089,@Dupe1970 @KTenpas @_celia_bedelia_ @nwoupdate @radiokeller @DKThomp That’s fair. So you would also object to a pure vaccine mandate?,[],[],"['Dupe1970', 'KTenpas', '_celia_bedelia_', 'nwoupdate', 'radiokeller', 'DKThomp']",[],USA, Dupe1970  KTenpas   celia bedelia   nwoupdate  radiokeller  DKThomp That’s fair  So you would also object to a pure vaccine mandate ,2021-09-22 16:00:00
766,en,False,1440711697245753345,"@LittleKeegs0 Based on the conservative response to covid restrictions and vaccine mandate, I don’t think this is true",[],[],['LittleKeegs0'],[],USA, LittleKeegs0 Based on the conservative response to covid restrictions and vaccine mandate  I don’t think this is true,2021-09-22 16:00:00
767,en,False,1440711567553622016,"@io_nathaniel @KTenpas @_celia_bedelia_ @nwoupdate @radiokeller @DKThomp Pregnancy isn't contagious. Additionally, this isn't a vaccine mandate. It's a testing mandate with an opt out if you are vaccinated.",[],[],"['io_nathaniel', 'KTenpas', '_celia_bedelia_', 'nwoupdate', 'radiokeller', 'DKThomp']",[],USA, io nathaniel  KTenpas   celia bedelia   nwoupdate  radiokeller  DKThomp Pregnancy isn t contagious  Additionally  this isn t a vaccine mandate  It s a testing mandate with an opt out if you are vaccinated ,2021-09-22 16:00:00
768,en,False,1440711565494210562,"""Brooklyn Nets GM says some of his players aren't yet in compliance with New York City vaccine mandate"" https://t.co/viSqLL0GLH",[],[],[],['https://t.co/viSqLL0GLH'],USA, Brooklyn Nets GM says some of his players aren t yet in compliance with New York City vaccine mandate  https   t co viSqLL0GLH,2021-09-22 16:00:00
769,en,False,1440711475346096138,@MrAndyNgo @CarminesNYC This is not the hostesses fault. They should go after New York City for creating the vaccine mandate.,[],[],"['MrAndyNgo', 'CarminesNYC']",[],USA, MrAndyNgo  CarminesNYC This is not the hostesses fault  They should go after New York City for creating the vaccine mandate ,2021-09-22 16:00:00
770,en,False,1440711413765345283,"@CNN After reading some of these comments, I feel it necessary to remind people that you can be pro vaccine yet anti mandate (both gov and or private).",[],[],['CNN'],[],USA, CNN After reading some of these comments  I feel it necessary to remind people that you can be pro vaccine yet anti mandate  both gov and or private  ,2021-09-22 16:00:00
771,en,False,1440711360636067852,"Health-care and nursing home workers could face vaccine mandate, says Ontario’s chief medical officer https://t.co/J3plmasBbR",[],[],[],['https://t.co/J3plmasBbR'],USA,Health care and nursing home workers could face vaccine mandate  says Ontario’s chief medical officer https   t co J3plmasBbR,2021-09-22 16:00:00
772,en,False,1440711300560998406,125 Indiana Hospital Employees Quit Over COVID-19 Vaccine Mandate  https://t.co/YSU1V7saEd,[],[],[],['https://t.co/YSU1V7saEd'],USA,125 Indiana Hospital Employees Quit Over COVID 19 Vaccine Mandate  https   t co YSU1V7saEd,2021-09-22 16:00:00
773,en,False,1440711290633162756,@MISenDems What’s happening with the budget in regards to language about vaccine requirements and mask mandates? My kids are in person for school this year and healthy thanks to our county mask mandate. Will the HD continue to be able to mandate masks in schools?,[],[],['MISenDems'],[],USA, MISenDems What’s happening with the budget in regards to language about vaccine requirements and mask mandates  My kids are in person for school this year and healthy thanks to our county mask mandate  Will the HD continue to be able to mandate masks in schools ,2021-09-22 16:00:00
774,en,False,1440711289928437772,"Exactly what are we waiting for? Exactly how many more LTC residents must die first?
#VoteFordOut2022
#FordVaccineFailure
#FordLiedPeopleDied
Health-care &amp; nursing home workers could face vaccine mandate, Ontario’s chief medical officer https://t.co/l2y7qU46Kh via @torontostar",[],"['VoteFordOut2022', 'FordVaccineFailure', 'FordLiedPeopleDied']",['TorontoStar'],['https://t.co/l2y7qU46Kh'],USA,Exactly what are we waiting for  Exactly how many more LTC residents must die first  VoteFordOut2022 FordVaccineFailure FordLiedPeopleDiedHealth care  amp  nursing home workers could face vaccine mandate  Ontario’s chief medical officer https   t co l2y7qU46Kh via  torontostar,2021-09-22 16:00:00
775,en,True,1440711288968015880,There is a lot more that OSHA could do to prevent Covid transmission at work. https://t.co/uyw8LdUSEN,[],[],[],['https://t.co/uyw8LdUSEN'],USA,There is a lot more that OSHA could do to prevent Covid transmission at work  https   t co uyw8LdUSEN,2021-09-22 16:00:00
776,en,False,1440711255468085258,There is no room for mental health considerations under Biden’s vaccine mandate?,[],[],[],[],USA,There is no room for mental health considerations under Biden’s vaccine mandate ,2021-09-22 16:00:00
777,en,True,1440711242142740491,"Leaving aside the merits of a vaccine mandate, such decisions properly belong to the states, not the federal government. https://t.co/8QXGAAa8Ui via Adam Freedman",[],[],[],['https://t.co/8QXGAAa8Ui'],USA,Leaving aside the merits of a vaccine mandate  such decisions properly belong to the states  not the federal government  https   t co 8QXGAAa8Ui via Adam Freedman,2021-09-22 16:00:00
778,en,False,1440711228330889226,"America is finally  waking up!

Trafalgar Group Poll: Biden Approval Hits New Low After Vaccine Mandate https://t.co/9nAPQM5Vln via @BreitbartNews",[],[],['BreitbartNews'],['https://t.co/9nAPQM5Vln'],USA,America is finally  waking up Trafalgar Group Poll  Biden Approval Hits New Low After Vaccine Mandate https   t co 9nAPQM5Vln via  BreitbartNews,2021-09-22 16:00:00
779,en,False,1440711133673910274,#TMA21's weekly E-News Bulletin headlines with this story this week: Illinois OSHA awaits vaccine mandate details  https://t.co/nWByfIpWBS #manufacturing #news #OSHA https://t.co/IxvXHTEHKg,[],"['TMA21', 'manufacturing', 'news', 'OSHA']",[],['https://t.co/nWByfIpWBS'],USA, TMA21 s weekly E News Bulletin headlines with this story this week  Illinois OSHA awaits vaccine mandate details  https   t co nWByfIpWBS  manufacturing  news  OSHA https   t co IxvXHTEHKg,2021-09-22 16:00:00
780,en,True,1440711036479295505,"Rhode Island health officials are allowing a little leeway to a state mandate that requires health care workers to receive a coronavirus vaccine by Oct. 1.
https://t.co/FUynF2st8X",[],[],[],['https://t.co/FUynF2st8X'],USA,Rhode Island health officials are allowing a little leeway to a state mandate that requires health care workers to receive a coronavirus vaccine by Oct  1 https   t co FUynF2st8X,2021-09-22 16:00:00
781,en,True,1440711029688729606,"#PTVNewsTonight | Biden says US not seeking a cold war with China; Hundreds march to protest against Melbourne's vaccine mandate; Damaged buildings in Melbourne after rare quake; US VP Kamala Harris condemns border agents' treatment of migrants

https://t.co/5LUV4Pbacb",[],['PTVNewsTonight'],[],['https://t.co/5LUV4Pbacb'],USA, PTVNewsTonight   Biden says US not seeking a cold war with China  Hundreds march to protest against Melbourne s vaccine mandate  Damaged buildings in Melbourne after rare quake  US VP Kamala Harris condemns border agents  treatment of migrantshttps   t co 5LUV4Pbacb,2021-09-22 16:00:00
782,en,False,1440710903389822992,Equating rape to a vaccine mandate. I really need cis-men to learn that every random thought in their head doesn’t need to be voiced and isn’t a legitimate topic for discussion. https://t.co/tzRLWKe7L1,[],[],[],['https://t.co/tzRLWKe7L1'],USA,Equating rape to a vaccine mandate  I really need cis men to learn that every random thought in their head doesn’t need to be voiced and isn’t a legitimate topic for discussion  https   t co tzRLWKe7L1,2021-09-22 16:00:00
783,en,False,1440710837547585547,"Biden Admin: Don’t Worry, We’d Never Impose a Vaccine Mandate! [Supercut] https://t.co/elSeBbeHJY",[],[],[],['https://t.co/elSeBbeHJY'],USA,Biden Admin  Don’t Worry  We’d Never Impose a Vaccine Mandate   Supercut  https   t co elSeBbeHJY,2021-09-22 16:00:00
784,en,True,1440710744681582597,"Rep McKinley (R) uses his time to go off on an unproductive rant about the lack of clarity regarding vaccine mandate exemptions. After finishing his rambled thoughts, he asks no questions of the witnesses, including the president of the AAP, and yields the rest of his time.",[],[],[],[],USA,Rep McKinley  R  uses his time to go off on an unproductive rant about the lack of clarity regarding vaccine mandate exemptions  After finishing his rambled thoughts  he asks no questions of the witnesses  including the president of the AAP  and yields the rest of his time ,2021-09-22 16:00:00
785,en,False,1440710742848593931,"Natural immunity  trumps the vax  
If any rules mandate the vax for those recovered it’s definitely not about safety  https://t.co/dsTGcmfS90",[],[],[],['https://t.co/dsTGcmfS90'],USA,Natural immunity  trumps the vax  If any rules mandate the vax for those recovered it’s definitely not about safety  https   t co dsTGcmfS90,2021-09-22 16:00:00
786,en,False,1440710702361034754,"Arizona is leading the charge on election integrity and vaccine mandates. Let us never give up our freedom to choose what we place in our bodies. It is the essence of being American, @nickiminaj #arizona #freedom #nickiminaj #electionintegrity 
https://t.co/LetORqKrRX",[],"['arizona', 'freedom', 'nickiminaj', 'electionintegrity']",['NICKIMINAJ'],['https://t.co/LetORqKrRX'],USA,Arizona is leading the charge on election integrity and vaccine mandates  Let us never give up our freedom to choose what we place in our bodies  It is the essence of being American   nickiminaj  arizona  freedom  nickiminaj  electionintegrity https   t co LetORqKrRX,2021-09-22 16:00:00
787,en,False,1440710633427668995,"AHA concerned federal #vaccinemandate could exacerbate severe worker shortage #COVID
—via @FierceHealth 
https://t.co/qHC8Fy9eZS https://t.co/UfwVVzgAKY",[],"['vaccinemandate', 'COVID']",['FierceHealth'],['https://t.co/qHC8Fy9eZS'],USA,AHA concerned federal  vaccinemandate could exacerbate severe worker shortage  COVID—via  FierceHealth https   t co qHC8Fy9eZS https   t co UfwVVzgAKY,2021-09-22 16:00:00
788,en,False,1440710540016316431,"@PinesLisa @NYCMayor Because he wants to jab the kids - so let’s relax, no remote, cases go up with testing- MANDATE VACCINE",[],[],"['PinesLisa', 'NYCMayor']",[],USA, PinesLisa  NYCMayor Because he wants to jab the kids   so let’s relax  no remote  cases go up with testing  MANDATE VACCINE,2021-09-22 16:00:00
789,en,False,1440710528377049094,"[VIDEO] Vaccine Mandate Requirement, First COVID-19 Remote Work Suit, Whistleblower Awards Top $1 Billion - Employment Law This Week® https://t.co/RL3tLJcjh3 | by @ebglaw",['®'],[],['ebglaw'],['https://t.co/RL3tLJcjh3'],USA, VIDEO  Vaccine Mandate Requirement  First COVID 19 Remote Work Suit  Whistleblower Awards Top  1 Billion   Employment Law This Week https   t co RL3tLJcjh3   by  ebglaw,2021-09-22 16:00:00
790,en,False,1440710517752930312,"North Carolina Hospital System Suspends Hundreds of Employees After COVID-19 Vaccine Mandate

https://t.co/dFm5z72Vtu",[],[],[],['https://t.co/dFm5z72Vtu'],USA,North Carolina Hospital System Suspends Hundreds of Employees After COVID 19 Vaccine Mandatehttps   t co dFm5z72Vtu,2021-09-22 16:00:00
791,en,False,1440710406255702025,@KeithLa86019918 There is no federal mask mandate or federal vaccine mandate. It’s the governments fault for all this confusing information,[],[],['KeithLa86019918'],[],USA, KeithLa86019918 There is no federal mask mandate or federal vaccine mandate  It’s the governments fault for all this confusing information,2021-09-22 16:00:00
792,en,False,1440710402128506888,Natural Immunity that has worked for billions of years is better than a 6 month Vax? The heck you say... Someone is about to get suicided at The Washington Post... https://t.co/Rmql7FK83V,[],[],[],['https://t.co/Rmql7FK83V'],USA,Natural Immunity that has worked for billions of years is better than a 6 month Vax  The heck you say    Someone is about to get suicided at The Washington Post    https   t co Rmql7FK83V,2021-09-22 16:00:00
793,en,False,1440710348248522757,"@capitolwatch Remember that time when there was a state mask mandate in place, and hundreds of maskless people rallied against vaccine mandates outside the state Capitol?",[],[],['capitolwatch'],[],USA, capitolwatch Remember that time when there was a state mask mandate in place  and hundreds of maskless people rallied against vaccine mandates outside the state Capitol ,2021-09-22 16:00:00
794,en,False,1440710343555121167,"A staff member at a Portland, Oregon high school has been suspended after wearing blackface in protest of a vaccine mandate for all school district employees, as reported by The Newberg Graphic’s Ryan Clarke. 

https://t.co/UlOmLDdIPp",[],[],[],['https://t.co/UlOmLDdIPp'],USA,A staff member at a Portland  Oregon high school has been suspended after wearing blackface in protest of a vaccine mandate for all school district employees  as reported by The Newberg Graphic’s Ryan Clarke  https   t co UlOmLDdIPp,2021-09-22 16:00:00
795,en,False,1440710264303673355,"Here is CNN's loser comparing sea belts to vaccines. Not the same, Don. You are delusional. 
https://t.co/4AcSjcQnqC",[],[],[],['https://t.co/4AcSjcQnqC'],USA,Here is CNN s loser comparing sea belts to vaccines  Not the same  Don  You are delusional  https   t co 4AcSjcQnqC,2021-09-22 16:00:00
796,en,True,1440710242052935680,Coronavirus Roundup: HHS Watchdog Nominee Testifies; Union Calls For Vaccine Mandate at All Points of Entry https://t.co/9RocD5yAmI https://t.co/zaxNsAtnN5,[],[],[],['https://t.co/9RocD5yAmI'],USA,Coronavirus Roundup  HHS Watchdog Nominee Testifies  Union Calls For Vaccine Mandate at All Points of Entry https   t co 9RocD5yAmI https   t co zaxNsAtnN5,2021-09-22 16:00:00
797,en,False,1440710056807333893,I love how my province waited two days after the election to mandate vaccine passports when others did it over a month ago. Totally not politically motivated.,[],[],[],[],USA,I love how my province waited two days after the election to mandate vaccine passports when others did it over a month ago  Totally not politically motivated ,2021-09-22 16:00:00
798,en,False,1440710027631685633,"Joe Biden’s COVID vaccine mandate completely ignores the science and is an attack on Americans’ right to privacy. 

The feds have NO AUTHORITY to force employers make their employees get vaccinated.

Follow: @TedCruzChanneI",[],[],[],[],USA,Joe Biden’s COVID vaccine mandate completely ignores the science and is an attack on Americans’ right to privacy  The feds have NO AUTHORITY to force employers make their employees get vaccinated Follow   TedCruzChanneI,2021-09-22 16:00:00
799,en,True,1440710014222569478,#ICYMI More Than 500 @LAFD Staffers File Lawsuit Over COVID Vaccine Mandate https://t.co/4TYCRHz1Z1 #covid #vaccination #mandate,[],"['ICYMI', 'covid', 'vaccination', 'mandate']",['LAFD'],['https://t.co/4TYCRHz1Z1'],USA, ICYMI More Than 500  LAFD Staffers File Lawsuit Over COVID Vaccine Mandate https   t co 4TYCRHz1Z1  covid  vaccination  mandate,2021-09-22 16:00:00
800,en,False,1440710008199520275,The governor said state law bans a public mandate vaccine for any purpose and demographic. https://t.co/I8GpcKyl06,[],[],[],['https://t.co/I8GpcKyl06'],USA,The governor said state law bans a public mandate vaccine for any purpose and demographic  https   t co I8GpcKyl06,2021-09-22 16:00:00
801,en,True,1440709977019019268,"Gov. Brian Kemp has invoked a nonexistent vaccine mandate in his recent arguments against mandates for COVID-19 vaccinations.

Twice this month, Kemp cited a supposed failed AIDS vaccine mandate in support of his stance. 

GPB's @Grant_Blank_ reports.

https://t.co/KkYu1JSkQl",[],[],['Grant_Blank_'],['https://t.co/KkYu1JSkQl'],USA,Gov  Brian Kemp has invoked a nonexistent vaccine mandate in his recent arguments against mandates for COVID 19 vaccinations Twice this month  Kemp cited a supposed failed AIDS vaccine mandate in support of his stance  GPB s  Grant Blank  reports https   t co KkYu1JSkQl,2021-09-22 16:00:00
802,en,False,1440709928893648906,"@willamtheblind @bariweiss @ggreenwald That's the result from these policies. Vaccine mandate supporters radicalize further where they believe the ""unvaxxed"" deserve less rights while the unvaccinated become even more suspicious and certain in their beliefs.

Next to that, it creates more distance between both groups.",[],[],"['willamtheblind', 'bariweiss', 'ggreenwald']",[],USA, willamtheblind  bariweiss  ggreenwald That s the result from these policies  Vaccine mandate supporters radicalize further where they believe the  unvaxxed  deserve less rights while the unvaccinated become even more suspicious and certain in their beliefs Next to that  it creates more distance between both groups ,2021-09-22 16:00:00
803,en,False,1440709894944870409,Good Morning. I pray that all of your senior leadership in your work place refuse the vaccine mandate and lose their role so you can move up in life and prosper…. Because we know they aren’t better than you… they just been there for longer 👌🏿👌🏿👌🏿👌🏿,['👌🏿'],[],[],[],USA,Good Morning  I pray that all of your senior leadership in your work place refuse the vaccine mandate and lose their role so you can move up in life and prosper…  Because we know they aren’t better than you… they just been there for longer ,2021-09-22 16:00:00
804,en,True,1440709892713562118,A controversial sign spotted in Tennessee that appears to threaten gun violence on those attempting to enforce a vaccine mandate has sparked outrage.  https://t.co/QoNx4bOpk8,[],[],[],['https://t.co/QoNx4bOpk8'],USA,A controversial sign spotted in Tennessee that appears to threaten gun violence on those attempting to enforce a vaccine mandate has sparked outrage   https   t co QoNx4bOpk8,2021-09-22 16:00:00
805,en,False,1440709868046848006,"A political aspirant wants to shut down the government but the big, empty headed people around him screaming ""no vaccine"". 

Mandate it. We'll never make it otherwise. https://t.co/Cq6bn1QJrR",[],[],[],['https://t.co/Cq6bn1QJrR'],USA,A political aspirant wants to shut down the government but the big  empty headed people around him screaming  no vaccine   Mandate it  We ll never make it otherwise  https   t co Cq6bn1QJrR,2021-09-22 16:00:00
806,en,False,1440709603872837648,Tucker Carlson claims US military vaccine mandate a ‘purity test’ for ‘men with high testosterone’ https://t.co/JefCtOQxXo,[],[],[],['https://t.co/JefCtOQxXo'],USA,Tucker Carlson claims US military vaccine mandate a ‘purity test’ for ‘men with high testosterone’ https   t co JefCtOQxXo,2021-09-22 16:00:00
807,en,False,1440709601251368964,United Airlines employees sue company over its 'draconian' COVID vaccine mandate | Fox Business 👏👏👏 https://t.co/CuMRVEmkq1,['👏'],[],[],['https://t.co/CuMRVEmkq1'],USA,United Airlines employees sue company over its  draconian  COVID vaccine mandate   Fox Business  https   t co CuMRVEmkq1,2021-09-22 16:00:00
808,en,False,1440709579243864064,"Eric Clapton 😳💔

https://t.co/tDPfftQwSd https://t.co/b61EJY8RCg","['😳', '💔']",[],[],['https://t.co/tDPfftQwSd'],USA,Eric Clapton https   t co tDPfftQwSd https   t co b61EJY8RCg,2021-09-22 16:00:00
809,en,True,1440709554182885397,Sponsor of controversial Ohio anti-vaccine mandate bill says she was kicked off House Health Committee https://t.co/9hlgSSmU8C via @DispatchAlerts,[],[],['DispatchAlerts'],['https://t.co/9hlgSSmU8C'],USA,Sponsor of controversial Ohio anti vaccine mandate bill says she was kicked off House Health Committee https   t co 9hlgSSmU8C via  DispatchAlerts,2021-09-22 16:00:00
810,en,False,1440709523564466187,"READ.
https://t.co/Q5RDhzh4I9",[],[],[],['https://t.co/Q5RDhzh4I9'],USA,READ https   t co Q5RDhzh4I9,2021-09-22 16:00:00
811,en,False,1440709499875061768,Tucker Carlson Says Military Vaccine Mandate Meant to Weed Out Men with High Testosterone https://t.co/UmzNldbs6P via @NicoleJames,[],[],['nicolejames'],['https://t.co/UmzNldbs6P'],USA,Tucker Carlson Says Military Vaccine Mandate Meant to Weed Out Men with High Testosterone https   t co UmzNldbs6P via  NicoleJames,2021-09-22 16:00:00
812,en,True,1440709473585098764,"United Airlines employees sue company over its 'draconian' COVID vaccine mandate

https://t.co/XcKwxuuXfX",[],[],[],['https://t.co/XcKwxuuXfX'],USA,United Airlines employees sue company over its  draconian  COVID vaccine mandatehttps   t co XcKwxuuXfX,2021-09-22 16:00:00
813,en,False,1440709430404739082,@washingtonpost Because of this money they mandate vaccine. They should let doctors doing their job freely.,[],[],['washingtonpost'],[],USA, washingtonpost Because of this money they mandate vaccine  They should let doctors doing their job freely ,2021-09-22 16:00:00
814,en,False,1440709343159066630,Shared post https://t.co/y3Ad38MYag,[],[],[],['https://t.co/y3Ad38MYag'],USA,Shared post https   t co y3Ad38MYag,2021-09-22 16:00:00
815,en,False,1440709250431401991,"[VIDEO] Vaccine Mandate Requirement, First COVID-19 Remote Work Suit, Whistleblower Awards Top $1 Billion - Employment Law This Week® https://t.co/YMysLbFHOj | by @ebglaw",['®'],[],['ebglaw'],['https://t.co/YMysLbFHOj'],USA, VIDEO  Vaccine Mandate Requirement  First COVID 19 Remote Work Suit  Whistleblower Awards Top  1 Billion   Employment Law This Week https   t co YMysLbFHOj   by  ebglaw,2021-09-22 16:00:00
816,en,False,1440709211592167444,"How is this mandate working out? 
North Carolina Hospital System Suspends Hundreds of Employees After COVID-19 Vaccine Mandate.  https://t.co/pQjmZaBPFD",[],[],[],['https://t.co/pQjmZaBPFD'],USA,How is this mandate working out  North Carolina Hospital System Suspends Hundreds of Employees After COVID 19 Vaccine Mandate   https   t co pQjmZaBPFD,2021-09-22 16:00:00
817,en,False,1440709122685427719,"Troubling fact: The anti-vaccine-mandate People's Party of Canada got over 800,000 votes across the country. https://t.co/2KZTjwADGo",[],[],[],['https://t.co/2KZTjwADGo'],USA,Troubling fact  The anti vaccine mandate People s Party of Canada got over 800 000 votes across the country  https   t co 2KZTjwADGo,2021-09-22 16:00:00
818,en,False,1440709071351410698,If Biden’s vaccine mandate doesn’t apply to the Congress because it’s a different branch of covenant then it doesn’t apply to me because I’m not in any branch of government.,[],[],[],[],USA,If Biden’s vaccine mandate doesn’t apply to the Congress because it’s a different branch of covenant then it doesn’t apply to me because I’m not in any branch of government ,2021-09-22 16:00:00
819,en,False,1440709062589489165,@SusanStJames3_ Gretchen announced that she will not mandate the vaccine in Michigan....she knows voters are upset with her and are looking hard at other candidates beside her,[],[],['SusanStJames3_'],[],USA, SusanStJames3  Gretchen announced that she will not mandate the vaccine in Michigan    she knows voters are upset with her and are looking hard at other candidates beside her,2021-09-22 16:00:00
820,en,False,1440709010357817355,"With the U.S. Food and Drug Administration granting full approval to Pfizer-BioNTech’s COVID-19 vaccine on Aug. 23, the pressure is on businesses to mandate their employees receive a coronavirus shot.
https://t.co/qrHM23xOQC #Vaccine #HumanResources #Employees #Employment",[],"['Vaccine', 'HumanResources', 'Employees', 'Employment']",[],['https://t.co/qrHM23xOQC'],USA,With the U S  Food and Drug Administration granting full approval to Pfizer BioNTech’s COVID 19 vaccine on Aug  23  the pressure is on businesses to mandate their employees receive a coronavirus shot https   t co qrHM23xOQC  Vaccine  HumanResources  Employees  Employment,2021-09-22 16:00:00
821,en,False,1440709010206773251,The @PSC_CUNY should absolutely support a vaccine mandate and it’s an embarrassment that we haven’t yet. https://t.co/HQHp27ca7T,[],[],['PSC_CUNY'],['https://t.co/HQHp27ca7T'],USA,The  PSC CUNY should absolutely support a vaccine mandate and it’s an embarrassment that we haven’t yet  https   t co HQHp27ca7T,2021-09-22 16:00:00
822,en,False,1440709001382006787,Perspective | Natural immunity to covid is powerful. Policymakers seem afraid to say so. https://t.co/4KW1PcL2yd,[],[],[],['https://t.co/4KW1PcL2yd'],USA,Perspective   Natural immunity to covid is powerful  Policymakers seem afraid to say so  https   t co 4KW1PcL2yd,2021-09-22 16:00:00
