,tweet_lang,verified,id,tweet_text,tweet_emoticons,hashtags,mentions,tweet_urls,country,text_en,tweet_date
0,en,True,1440748447682883585,"Because of that, ""The court is required to find that the City failed to meet its burden of proving that the Vaccine Mandate furthers a compelling interest in the least restrictive way,"" the judge ruled.",[],[],[],[],USA,Because of that   The court is required to find that the City failed to meet its burden of proving that the Vaccine Mandate furthers a compelling interest in the least restrictive way   the judge ruled ,2021-09-22 19:00:00
1,en,False,1440748441567592449,"And then BdB will say something like ""we've decided to hold off to give staff a few more weeks to prepare for the vaccine mandate"", when in reality he's grasping at straws, having boxed himself into a corner; trying to find away out of a coming Titanic-sized-disaster.",[],[],[],[],USA,And then BdB will say something like  we ve decided to hold off to give staff a few more weeks to prepare for the vaccine mandate   when in reality he s grasping at straws  having boxed himself into a corner  trying to find away out of a coming Titanic sized disaster ,2021-09-22 19:00:00
2,en,False,1440748435796234240,@mayorcantrell If 81% is vaccinated why do we have a draconian vaccine mandate. Can’t wait to vote you out,[],[],['mayorcantrell'],[],USA, mayorcantrell If 81  is vaccinated why do we have a draconian vaccine mandate  Can’t wait to vote you out,2021-09-22 19:00:00
3,en,False,1440748329168617473,"@bhrenton This pisses me off to no end. I'm a healthcare worker, and to have nurses and doctors not take the vaccine and pedal in conspiracy theories when you literally use science to do your job burns me up. And despite the groans w/the mandate they all got the shots.",[],[],['bhrenton'],[],USA, bhrenton This pisses me off to no end  I m a healthcare worker  and to have nurses and doctors not take the vaccine and pedal in conspiracy theories when you literally use science to do your job burns me up  And despite the groans w the mandate they all got the shots ,2021-09-22 19:00:00
4,en,False,1440748322130522113,"REACTION: To today's global COVID summit hosted by @POTUS  ""Today’s summit was full of speeches but tragically lacking in action..now is the time to waive intellectual property barriers, end vaccine monopolies, &amp; mandate sharing vaccine tech @Oxfam #UNGA https://t.co/5jGcLCphab",[],['UNGA'],"['POTUS', 'Oxfam']",['https://t.co/5jGcLCphab'],USA,REACTION  To today s global COVID summit hosted by  POTUS   Today’s summit was full of speeches but tragically lacking in action  now is the time to waive intellectual property barriers  end vaccine monopolies   amp  mandate sharing vaccine tech  Oxfam  UNGA https   t co 5jGcLCphab,2021-09-22 19:00:00
5,en,False,1440748305948889095,Small Business Group to Sue Biden Administration Over Vaccine Mandate https://t.co/CV93THIefN,[],[],[],['https://t.co/CV93THIefN'],USA,Small Business Group to Sue Biden Administration Over Vaccine Mandate https   t co CV93THIefN,2021-09-22 19:00:00
6,en,True,1440748222641688579,BREAKING NEWS: A judge says the City of Gainesville must not enforce its vaccine mandate and must not discipline any employees who do not get vaccinated. https://t.co/v7O3UwKbBg,[],[],[],['https://t.co/v7O3UwKbBg'],USA,BREAKING NEWS  A judge says the City of Gainesville must not enforce its vaccine mandate and must not discipline any employees who do not get vaccinated  https   t co v7O3UwKbBg,2021-09-22 19:00:00
7,en,False,1440748212256600073,"In Syosset nurses' lawsuit, judge refuses to suspend state's COVID vaccine mandate https://t.co/IsseuSg3LW Case You Missed It via @Newsday",[],[],['Newsday'],['https://t.co/IsseuSg3LW'],USA,In Syosset nurses  lawsuit  judge refuses to suspend state s COVID vaccine mandate https   t co IsseuSg3LW Case You Missed It via  Newsday,2021-09-22 19:00:00
8,en,False,1440748156140994566,"@Fr33domIsntFr33 @Zigmanfreud There are also people who wont take it to ""Own the libs"". The vast majority of Americans support Bidens vaccine mandate.",[],[],"['Fr33domIsntFr33', 'Zigmanfreud']",[],USA, Fr33domIsntFr33  Zigmanfreud There are also people who wont take it to  Own the libs   The vast majority of Americans support Bidens vaccine mandate ,2021-09-22 19:00:00
9,en,False,1440748031171719169,"I can't find a single hospital where staff quit en masse over a vaccine mandate.
Anyone?",[],[],[],[],USA,I can t find a single hospital where staff quit en masse over a vaccine mandate Anyone ,2021-09-22 19:00:00
10,en,False,1440747974032715785,"@_wunderwood_ @CoryMote @TheRightMelissa @NICKIMINAJ The mandate the vaccine for all STAFF, not patients. The staff mandate was due to COVID, it’s never happened before.",[],[],"['_wunderwood_', 'CoryMote', 'TheRightMelissa', 'NICKIMINAJ']",[],USA,  wunderwood   CoryMote  TheRightMelissa  NICKIMINAJ The mandate the vaccine for all STAFF  not patients  The staff mandate was due to COVID  it’s never happened before ,2021-09-22 19:00:00
11,en,False,1440747929463967753,United Airlines accused of refusing employee exemptions to vaccine mandate - Reuters https://t.co/nhsfWUnIO7,[],[],[],['https://t.co/nhsfWUnIO7'],USA,United Airlines accused of refusing employee exemptions to vaccine mandate   Reuters https   t co nhsfWUnIO7,2021-09-22 19:00:00
12,en,False,1440747840880341002,North Carolina Hospital System Suspends Hundreds of Employees After COVID-19 Vaccine Mandate https://t.co/5SpbHj0RVM,[],[],[],['https://t.co/5SpbHj0RVM'],USA,North Carolina Hospital System Suspends Hundreds of Employees After COVID 19 Vaccine Mandate https   t co 5SpbHj0RVM,2021-09-22 19:00:00
13,en,False,1440747837055135744,"VACCINE MANDATE: Germany to end quarantine pay for those without vaccinations

HIGHLIGHTS
- Health Minister Jens Spahn, will stop paying compensation to unvaccinated workers who are forced into quarantine by coronavirus measures -…https://t.co/Sas0KvvpCI https://t.co/tqOoNulh1L",[],[],[],"['https://t.co/Sas0KvvpCI', 'https://t.co/tqOoNulh1L']",USA,VACCINE MANDATE  Germany to end quarantine pay for those without vaccinationsHIGHLIGHTS  Health Minister Jens Spahn  will stop paying compensation to unvaccinated workers who are forced into quarantine by coronavirus measures  …https   t co Sas0KvvpCI https   t co tqOoNulh1L,2021-09-22 19:00:00
14,en,False,1440747769057058821,How should Christians think about Biden's vaccine mandate? https://t.co/nuRS3EoDBG,[],[],[],['https://t.co/nuRS3EoDBG'],USA,How should Christians think about Biden s vaccine mandate  https   t co nuRS3EoDBG,2021-09-22 19:00:00
15,en,True,1440747749243174920,"ICYMI: Board members for the School District of Lancaster unanimously voted to require a testing mandate for all teachers and staff. The decision will affect approximately 1,600 staff members.
https://t.co/neEGyql4Oi",[],[],[],['https://t.co/neEGyql4Oi'],USA,ICYMI  Board members for the School District of Lancaster unanimously voted to require a testing mandate for all teachers and staff  The decision will affect approximately 1 600 staff members https   t co neEGyql4Oi,2021-09-22 19:00:00
16,en,False,1440747706398298123,Oregon School Staffer Lauren Pefferle Awarded Donkey Of The Day For Wearing Blackface To Protest Vaccine Mandate » VannDigital https://t.co/ynqffXyeGi,[],[],[],['https://t.co/ynqffXyeGi'],USA,Oregon School Staffer Lauren Pefferle Awarded Donkey Of The Day For Wearing Blackface To Protest Vaccine Mandate » VannDigital https   t co ynqffXyeGi,2021-09-22 19:00:00
17,en,False,1440747558054154246,@POTUS @CarminesNYC The fact that over 60% of the Black community in NYC   can’t eat inside Carmine discrimination @CarminesNYC  do what other restaurants are doing put signs up we do not discriminate not follow the stupid  rule stand up BLM is protesting NY vaccine mandate It's racist https://t.co/cZf3mxrLGc,[],[],"['POTUS', 'CarminesNYC', 'CarminesNYC']",[],USA, POTUS  CarminesNYC The fact that over 60  of the Black community in NYC   can’t eat inside Carmine discrimination  CarminesNYC  do what other restaurants are doing put signs up we do not discriminate not follow the stupid  rule stand up BLM is protesting NY vaccine mandate It s racist https   t co cZf3mxrLGc,2021-09-22 19:00:00
18,en,False,1440747482166693891,@Vermeullarmine @ANNVYSHINSKY What about CDF guidance that practical reason holds that vaccines must be voluntary?  Or the principle that we do not mandate medical interventions on mentally competent adults?  Is Covid analogous to a wildfire if the vaccine protects those who want it?,[],[],"['Vermeullarmine', 'ANNVYSHINSKY']",[],USA, Vermeullarmine  ANNVYSHINSKY What about CDF guidance that practical reason holds that vaccines must be voluntary   Or the principle that we do not mandate medical interventions on mentally competent adults   Is Covid analogous to a wildfire if the vaccine protects those who want it ,2021-09-22 19:00:00
19,en,False,1440747451938271235,Biden’s authoritarian vaccine mandate overreach https://t.co/92r2DOQ2K8,[],[],[],['https://t.co/92r2DOQ2K8'],USA,Biden’s authoritarian vaccine mandate overreach https   t co 92r2DOQ2K8,2021-09-22 19:00:00
20,en,False,1440747363409170440,"🚨🚨Texas and 25 other states prepare to fight the unconstitutional mandates. #COVID19 #Texas 
 https://t.co/n6D7Fv7Kdv",['🚨'],"['COVID19', 'Texas']",[],['https://t.co/n6D7Fv7Kdv'],USA,Texas and 25 other states prepare to fight the unconstitutional mandates   COVID19  Texas  https   t co n6D7Fv7Kdv,2021-09-22 19:00:00
21,en,False,1440747319968735238,Merit Systems Protection Board nominees hope to triage massive backlog of cases -- and they face the prospect of deciding appeals from feds disciplined or discharged for non-compliance with the COVID vaccine mandate. https://t.co/DlzsPFCD4n https://t.co/Bs5T0AXPX3,['XP'],[],[],['https://t.co/DlzsPFCD4n'],USA,Merit Systems Protection Board nominees hope to triage massive backlog of cases    and they face the prospect of deciding appeals from feds disciplined or discharged for non compliance with the COVID vaccine mandate  https   t co DlzsPFCD4n https   t co Bs5T0AX3,2021-09-22 19:00:00
22,en,True,1440747282157084676,"Jacob’s amendment outrightly bans any and all COVID-19 vaccine mandates, including by private businesses. 

Lucas’s amendment would remove the liability immunity given to businesses this year for COVID issues if a business imposes a COVID-19 vaccine mandate.",[],[],[],[],USA,Jacob’s amendment outrightly bans any and all COVID 19 vaccine mandates  including by private businesses  Lucas’s amendment would remove the liability immunity given to businesses this year for COVID issues if a business imposes a COVID 19 vaccine mandate ,2021-09-22 19:00:00
23,en,False,1440747266340376583,#Vaccine #Mandate Free Job Board Launched For Freedom Loving People https://t.co/LtvGANo5TB,[],"['Vaccine', 'Mandate']",[],['https://t.co/LtvGANo5TB'],USA, Vaccine  Mandate Free Job Board Launched For Freedom Loving People https   t co LtvGANo5TB,2021-09-22 19:00:00
24,en,False,1440747252260040706,"@SpeaksAngie But to smear it as nazi would be like declaring a demo communist because a trot group shows up. Aka brainlet. 

This is primarily about a vaccine mandate and while I'm pro vaccination ""no jab no job"" should be opposed. Rioting against forced idleness nothing new.",[],[],['SpeaksAngie'],[],USA, SpeaksAngie But to smear it as nazi would be like declaring a demo communist because a trot group shows up  Aka brainlet  This is primarily about a vaccine mandate and while I m pro vaccination  no jab no job  should be opposed  Rioting against forced idleness nothing new ,2021-09-22 19:00:00
25,en,False,1440747238708314116,"@thePelto @ShaneCHarding @R_K_Zenn @themouthmatusow Oh for sure, there are many was to “mandate” without actually mandating and we will see it globally … want to travel / visit … the please show proof you’ve had the vaccine …",[],[],"['thePelto', 'ShaneCHarding', 'R_K_Zenn', 'themouthmatusow']",[],USA, thePelto  ShaneCHarding  R K Zenn  themouthmatusow Oh for sure  there are many was to “mandate” without actually mandating and we will see it globally … want to travel   visit … the please show proof you’ve had the vaccine …,2021-09-22 19:00:00
26,en,False,1440747229149425669,"@rrsbiggdogg @RealRawNews1 @waikikibeech Not to worry, none of this happened. Multiple US military spokesmen have stated that zero USAF pilots have walked off the job over the vaccine mandate. They can't even 'walk off the job' in the military anyways, that is called going AWOL.

https://t.co/e8AUkQliW0",[],[],"['rrsbiggdogg', 'RealRawNews1', 'waikikibeech']",['https://t.co/e8AUkQliW0'],USA, rrsbiggdogg  RealRawNews1  waikikibeech Not to worry  none of this happened  Multiple US military spokesmen have stated that zero USAF pilots have walked off the job over the vaccine mandate  They can t even  walk off the job  in the military anyways  that is called going AWOL https   t co e8AUkQliW0,2021-09-22 19:00:00
27,en,True,1440747223461990401,"Can someone get fired for not following a vaccine mandate? An Indiana law professor says ‘probably so’ 

https://t.co/c9wAfl1M2F",[],[],[],['https://t.co/c9wAfl1M2F'],USA,Can someone get fired for not following a vaccine mandate  An Indiana law professor says ‘probably so’ https   t co c9wAfl1M2F,2021-09-22 19:00:00
28,en,False,1440747146412638208,The venn diagram of people blaming businesses for the government vaccine mandate and people saying cops are just doing their jobs is a circle.,[],[],[],[],USA,The venn diagram of people blaming businesses for the government vaccine mandate and people saying cops are just doing their jobs is a circle ,2021-09-22 19:00:00
29,en,False,1440747140813230088,"@khimmelfarts @BasedCorp @ChristinaPushaw That’s not anti-vax, that’s anti-vax mandate. If he was anti-vax he would be telling people not to get them. My own doctor is pro vaccine, but told me it’s my choice, because it is.",[],[],"['khimmelfarts', 'BasedCorp', 'ChristinaPushaw']",[],USA, khimmelfarts  BasedCorp  ChristinaPushaw That’s not anti vax  that’s anti vax mandate  If he was anti vax he would be telling people not to get them  My own doctor is pro vaccine  but told me it’s my choice  because it is ,2021-09-22 19:00:00
30,en,False,1440747118881226753,"Daily Surge coming at you, Wednesday ...
https://t.co/TUobOmBNAp
-- Fair Question: Does Vaccine/Mask Mandate Argument Apply to Arriving Babies?
-- Unreported: Americans Own Guns for All Kinds of Reasons … and Use Them Responsibly, Pt. 3    
https://t.co/TUobOmBNAp
https://dailys https://t.co/NybTa6YqED",[],[],[],"['https://t.co/TUobOmBNAp', 'https://t.co/TUobOmBNAp']",USA,Daily Surge coming at you  Wednesday    https   t co TUobOmBNAp   Fair Question  Does Vaccine Mask Mandate Argument Apply to Arriving Babies    Unreported  Americans Own Guns for All Kinds of Reasons … and Use Them Responsibly  Pt  3    https   t co TUobOmBNAphttps   dailys https   t co NybTa6YqED,2021-09-22 19:00:00
31,en,True,1440747113059479559,"Baker notes that testing is a ""terrific surveillance tool,"" but that the ""primary objective"" of the vaccine mandate is, well, making sure people are vaccinated.",[],[],[],[],USA,Baker notes that testing is a  terrific surveillance tool   but that the  primary objective  of the vaccine mandate is  well  making sure people are vaccinated ,2021-09-22 19:00:00
32,en,True,1440747111268552713,"Asked about state trooper union's vaccine mandate lawsuit, Charlie Baker expresses opposition to a testing alternative:

""I want people who are face to face with public folks who work for the Commonwealth to be comfortable in knowing that those folks are vaccinated.""",['xp'],[],[],[],USA,Asked about state trooper union s vaccine mandate lawsuit  Charlie Baker eresses opposition to a testing alternative  I want people who are face to face with public folks who work for the Commonwealth to be comfortable in knowing that those folks are vaccinated  ,2021-09-22 19:00:00
33,en,False,1440747093694373890,Biden’s vaccine mandate concerns federal employee (from Livestream Q&amp;A #96) https://t.co/uEIzXW4xBU via @YouTube,[],[],['YouTube'],['https://t.co/uEIzXW4xBU'],USA,Biden’s vaccine mandate concerns federal employee  from Livestream Q amp A  96  https   t co uEIzXW4xBU via  YouTube,2021-09-22 19:00:00
34,en,False,1440746998294999049,"Way to go Oregon 🙄 

“Oregon School Staffer Protests Vaccine Mandate By Wearing Blackface” https://t.co/ijpU7cpF7l via @YouTube",['🙄'],[],['YouTube'],['https://t.co/ijpU7cpF7l'],USA,Way to go Oregon  “Oregon School Staffer Protests Vaccine Mandate By Wearing Blackface” https   t co ijpU7cpF7l via  YouTube,2021-09-22 19:00:00
35,en,True,1440746985821118467,"United Employees Sue Over Vaccine Mandate, As Airline Reveals Makes Semi-Public Who Is Unvaxxed https://t.co/jATWdolj3y via @garyleff",[],[],['garyleff'],['https://t.co/jATWdolj3y'],USA,United Employees Sue Over Vaccine Mandate  As Airline Reveals Makes Semi Public Who Is Unvaxxed https   t co jATWdolj3y via  garyleff,2021-09-22 19:00:00
36,en,False,1440746925163094016,@sudha_lakshmi @inthenameofsaf1 @DavidOC17377827 @JamesSurowiecki Wait out with NPI and vaccine mandate until vaccines are approved for kids under 12. By the end of this year and early next year.,[],[],"['sudha_lakshmi', 'inthenameofsaf1', 'DavidOC17377827', 'JamesSurowiecki']",[],USA, sudha lakshmi  inthenameofsaf1  DavidOC17377827  JamesSurowiecki Wait out with NPI and vaccine mandate until vaccines are approved for kids under 12  By the end of this year and early next year ,2021-09-22 19:00:00
37,en,False,1440746902446698506,'Violates Civil Rights Act of 1964' - United Airlines Employees Sue Over Company's Covid Vaccine Mandate https://t.co/GMHHybKdFj via @gatewaypundit,[],[],['gatewaypundit'],['https://t.co/GMHHybKdFj'],USA, Violates Civil Rights Act of 1964    United Airlines Employees Sue Over Company s Covid Vaccine Mandate https   t co GMHHybKdFj via  gatewaypundit,2021-09-22 19:00:00
38,en,False,1440746833748267016,@joelawlorph @PressHerald @GovJanetMills If she had guts she'd mandate the vaccine for all staff and eligible students.,[],[],"['joelawlorph', 'PressHerald', 'GovJanetMills']",[],USA, joelawlorph  PressHerald  GovJanetMills If she had guts she d mandate the vaccine for all staff and eligible students ,2021-09-22 19:00:00
39,en,False,1440746833559502856,"@OfficialTRHL I’m not fully radicalized yet, but I will be when they mandate the vaccine for small children. That’s when I start rioting.",[],[],['OfficialTRHL'],[],USA, OfficialTRHL I’m not fully radicalized yet  but I will be when they mandate the vaccine for small children  That’s when I start rioting ,2021-09-22 19:00:00
40,en,False,1440746669981638661,Australians are being shot by police for protesting COVID-19 vaccine work mandate https://t.co/4Sl3GmtHv6  An anti-vaccination protest i https://t.co/evPoUWW1EW,[],[],[],['https://t.co/4Sl3GmtHv6'],USA,Australians are being shot by police for protesting COVID 19 vaccine work mandate https   t co 4Sl3GmtHv6  An anti vaccination protest i https   t co evPoUWW1EW,2021-09-22 19:00:00
41,en,True,1440746501517443073,"Mayor, cop unions at odds on vaccine mandate https://t.co/Ye8VhXoC8f https://t.co/8uorZfSYoy",[],[],[],['https://t.co/Ye8VhXoC8f'],USA,Mayor  cop unions at odds on vaccine mandate https   t co Ye8VhXoC8f https   t co 8uorZfSYoy,2021-09-22 19:00:00
42,en,False,1440746486707326986,"@stephyssa @MelanyL08249168 @LeeroyPress LMAO....So BLM are democrats, the democrats are the ones putting in vaccine mandates, but god forbid the mandate includes black people. What you think they should be exempt because of their skin color. I'm against mandates for anybody but your just against them for POC. 🤣😂😅","['🤣', '😅', '😂']",[],"['stephyssa', 'MelanyL08249168', 'LeeroyPress']",[],USA, stephyssa  MelanyL08249168  LeeroyPress LMAO    So BLM are democrats  the democrats are the ones putting in vaccine mandates  but god forbid the mandate includes black people  What you think they should be exempt because of their skin color  I m against mandates for anybody but your just against them for POC  ,2021-09-22 19:00:00
43,en,True,1440746466910240770,"""Video: Vaccine Mandate Requirement, First COVID-19 Remote Work Suit, Whistleblower Awards Top $1 Billion – Employment Law This Week"" @EpsteinBecker #LaborLaw #VaccineMandate https://t.co/xLub5ji36y",[],"['LaborLaw', 'VaccineMandate']",['EpsteinBecker'],['https://t.co/xLub5ji36y'],USA, Video  Vaccine Mandate Requirement  First COVID 19 Remote Work Suit  Whistleblower Awards Top  1 Billion – Employment Law This Week   EpsteinBecker  LaborLaw  VaccineMandate https   t co xLub5ji36y,2021-09-22 19:00:00
44,en,False,1440746465115066368,"34% of Americans say they are more likely to buy from businesses with a vaccine mandate; 12% are less likely.

If you're selling expensive goods (hi, wineries, this means you), the percentage who prefer vaccine mandates goes up as income rises.

https://t.co/cD787CIVqq",['xp'],[],[],['https://t.co/cD787CIVqq'],USA,34  of Americans say they are more likely to buy from businesses with a vaccine mandate  12  are less likely If you re selling eensive goods  hi  wineries  this means you   the percentage who prefer vaccine mandates goes up as income rises https   t co cD787CIVqq,2021-09-22 19:00:00
45,en,False,1440746457498206209,United Airlines employees sue company over its 'draconian' COVID vaccine mandate | Fox Business https://t.co/OlDH1m0wcS,[],[],[],['https://t.co/OlDH1m0wcS'],USA,United Airlines employees sue company over its  draconian  COVID vaccine mandate   Fox Business https   t co OlDH1m0wcS,2021-09-22 19:00:00
46,en,False,1440746389999210499,Hmm my work just enforced a vaccine mandate. Good. Already got mine months ago,[],[],[],[],USA,Hmm my work just enforced a vaccine mandate  Good  Already got mine months ago,2021-09-22 19:00:00
47,en,False,1440746349092171779,Vaccines: LA firefighters lawsuit is 'directly aimed at trying to repeal the mandate' https://t.co/Q1oDCPj0jY via @YahooFinance,[],[],['YahooFinance'],['https://t.co/Q1oDCPj0jY'],USA,Vaccines  LA firefighters lawsuit is  directly aimed at trying to repeal the mandate  https   t co Q1oDCPj0jY via  YahooFinance,2021-09-22 19:00:00
48,en,False,1440746241453801476,"Pretty universally they can’t stand Trump, they’ve been vaccinated, they approve of Biden’s vaccine mandate, they’re worried about Covid resurgence thru unvaccinated/variants. Many regard themselves as politically somewhat homeless. Weirdly, theyre sort of small c old style GOP",[],[],[],[],USA,Pretty universally they can’t stand Trump  they’ve been vaccinated  they approve of Biden’s vaccine mandate  they’re worried about Covid resurgence thru unvaccinated variants  Many regard themselves as politically somewhat homeless  Weirdly  theyre sort of small c old style GOP,2021-09-22 19:00:00
49,en,False,1440746209656782850,@HenryJKraven Ummmm.... Aren't UNVACCINATED people getting struck with the variants much worse and they want to complain??? I think ALL employers should mandate the vaccine to PROTECT OTHERS AND THEIR FAMILIES!!!,[],[],['HenryJKraven'],[],USA, HenryJKraven Ummmm     Aren t UNVACCINATED people getting struck with the variants much worse and they want to complain    I think ALL employers should mandate the vaccine to PROTECT OTHERS AND THEIR FAMILIES   ,2021-09-22 19:00:00
50,en,False,1440746194578198534,"So Black Lives Matter considers the vaccine mandate and passport to be racist.   What are all the corporations , sports teams, banks ect going to do who sport BLM support in arenas and stadiums ?   #Covid #Cdnpoli #Onpoli https://t.co/rOxWl0i3L6",[],"['Covid', 'Cdnpoli', 'Onpoli']",[],['https://t.co/rOxWl0i3L6'],USA,So Black Lives Matter considers the vaccine mandate and passport to be racist    What are all the corporations   sports teams  banks ect going to do who sport BLM support in arenas and stadiums      Covid  Cdnpoli  Onpoli https   t co rOxWl0i3L6,2021-09-22 19:00:00
51,en,False,1440746174445592579,NH Divided Over Employer Vaccine Mandate; Most Unvaccinated will Leave Job if Shot Required: https://t.co/xZoXenJKNu #nhpolitics,[],['nhpolitics'],[],['https://t.co/xZoXenJKNu'],USA,NH Divided Over Employer Vaccine Mandate  Most Unvaccinated will Leave Job if Shot Required  https   t co xZoXenJKNu  nhpolitics,2021-09-22 19:00:00
52,en,False,1440746142833147906,"team lead: we will not be discussing the new office vaccine mandate in this meeting because I realize it's a sensitive subject. please reach out to me personally if you have questions or concerns: 

me, a slut for drama: https://t.co/8JBzdpqRx2",[],[],[],[],USA,team lead  we will not be discussing the new office vaccine mandate in this meeting because I realize it s a sensitive subject  please reach out to me personally if you have questions or concerns  me  a slut for drama  https   t co 8JBzdpqRx2,2021-09-22 19:00:00
53,en,False,1440746134918479879,@AngieMachado1 @BeaverBlitz Only going to games if vaccine mandate is in place. Let’s use the great science we have at our disposal.,[],[],"['AngieMachado1', 'BeaverBlitz']",[],USA, AngieMachado1  BeaverBlitz Only going to games if vaccine mandate is in place  Let’s use the great science we have at our disposal ,2021-09-22 19:00:00
54,en,False,1440746125368049665,'Violates Civil Rights Act of 1964' - United Airlines Employees Sue Over Company's Covid Vaccine Mandate https://t.co/r0eTVabcmi via @gatewaypundit,[],[],['gatewaypundit'],['https://t.co/r0eTVabcmi'],USA, Violates Civil Rights Act of 1964    United Airlines Employees Sue Over Company s Covid Vaccine Mandate https   t co r0eTVabcmi via  gatewaypundit,2021-09-22 19:00:00
