,tweet_lang,verified,id,tweet_text,tweet_emoticons,hashtags,mentions,tweet_urls,country,text_en,tweet_date
373,en,False,1440728936049045509,GiveSendGo - Illinois Firefighters against vaccine mandate : The #1 Free Christian Fundraising Site. https://t.co/ZNhLhGsLYr,[],[],[],['https://t.co/ZNhLhGsLYr'],USA,GiveSendGo   Illinois Firefighters against vaccine mandate   The  1 Free Christian Fundraising Site  https   t co ZNhLhGsLYr,2021-09-22 17:00:00
374,en,True,1440728915660607488,Forced vaccinations on health care workers will cripple hospitals and hurt patients. Look no further than ECMC. 400 dedicated health professionals lose their job on Monday. Hurts union employees and the poor that need health care. Thanks Kathy Hochul! https://t.co/zSih3DyFHp,[],[],[],['https://t.co/zSih3DyFHp'],USA,Forced vaccinations on health care workers will cripple hospitals and hurt patients  Look no further than ECMC  400 dedicated health professionals lose their job on Monday  Hurts union employees and the poor that need health care  Thanks Kathy Hochul  https   t co zSih3DyFHp,2021-09-22 17:00:00
375,en,False,1440728898170327043,Senator @jasonrapert joins #ConduitNews to discuss  the latest regarding vaccine mandates and how the Arkansas Legislature intends to fight back against the overreach by the Biden administration. #arpx #arnews #arleg #NoVaccineMandates https://t.co/AkWfLgziBX,[],"['ConduitNews', 'arpx', 'arnews', 'arleg', 'NoVaccineMandates']",['jasonrapert'],['https://t.co/AkWfLgziBX'],USA,Senator  jasonrapert joins  ConduitNews to discuss  the latest regarding vaccine mandates and how the Arkansas Legislature intends to fight back against the overreach by the Biden administration   arpx  arnews  arleg  NoVaccineMandates https   t co AkWfLgziBX,2021-09-22 17:00:00
376,en,False,1440728891190960143,"@truthvsagenda @LSW12612672511 JUST IN: A federal judge has extended the temporary ban on the New York State vaccine mandate for health care workers who claim a religious exemption (SABMYK religion says ""vaccines are God-given life manipulaton and therefore a sin) until October 12th

🏛 https://t.co/2htGMVposZ",['🏛'],[],"['truthvsagenda', 'LSW12612672511']",['https://t.co/2htGMVposZ'],USA, truthvsagenda  LSW12612672511 JUST IN  A federal judge has extended the temporary ban on the New York State vaccine mandate for health care workers who claim a religious exemption  SABMYK religion says  vaccines are God given life manipulaton and therefore a sin  until October 12th https   t co 2htGMVposZ,2021-09-22 17:00:00
377,en,False,1440728827492065292,"@ULethbridgeEdu Current event for class this week? ""Across Canada, school officials have weighed the pros and cons of mandating vaccines...But rather than one uniform order, each institution has come to their own recommendation..."" https://t.co/GpjWIKxO6w",[],[],['ULethbridgeEdu'],['https://t.co/GpjWIKxO6w'],USA, ULethbridgeEdu Current event for class this week   Across Canada  school officials have weighed the pros and cons of mandating vaccines   But rather than one uniform order  each institution has come to their own recommendation     https   t co GpjWIKxO6w,2021-09-22 17:00:00
378,en,False,1440728822140178444,"Pfizer and Fauci pushing to jab your kids

https://t.co/kgtqucyHFf",[],[],[],['https://t.co/kgtqucyHFf'],USA,Pfizer and Fauci pushing to jab your kidshttps   t co kgtqucyHFf,2021-09-22 17:00:00
379,en,False,1440728774060822545,https://t.co/Jbx3TKS8XD: At least two removed from Ontario junior hockey team after learning players were unvaccinated: commissioner [https://t.co/mvXzvf3W45] #TBay #ThunderBay,['XD'],"['TBay', 'ThunderBay']",[],"['https://t.co/Jbx3TKS8XD', 'https://t.co/mvXzvf3W45']",USA,https   t co Jbx3TKS8  At least two removed from Ontario junior hockey team after learning players were unvaccinated  commissioner  https   t co mvXzvf3W45   TBay  ThunderBay,2021-09-22 17:00:00
380,en,False,1440728762560094211,"Would an 'Immunity' Mandate Instill More Public Confidence? — Biden's sweeping vaccine mandates will only further erode public trust. Jesse Pelletier, M.D. https://t.co/MvGGZp5frR",[],[],[],['https://t.co/MvGGZp5frR'],USA,Would an  Immunity  Mandate Instill More Public Confidence  — Biden s sweeping vaccine mandates will only further erode public trust  Jesse Pelletier  M D  https   t co MvGGZp5frR,2021-09-22 17:00:00
381,en,True,1440728750077800453,"Four school employees in St. Charles and Geneva are challenging Gov. J.B. Pritzker’s vaccine mandate in court, arguing their employers have no legal right to require them to be vaccinated or tested for COVID-19. https://t.co/R3Z40gMSWa",[],[],[],['https://t.co/R3Z40gMSWa'],USA,Four school employees in St  Charles and Geneva are challenging Gov  J B  Pritzker’s vaccine mandate in court  arguing their employers have no legal right to require them to be vaccinated or tested for COVID 19  https   t co R3Z40gMSWa,2021-09-22 17:00:00
382,en,False,1440728678543945739,"Police Union Sues Over Vaccine Mandate, Demand COVID Deaths Be Considered 'Line of Duty'

https://t.co/CPZUbYWJLM",[],[],[],['https://t.co/CPZUbYWJLM'],USA,Police Union Sues Over Vaccine Mandate  Demand COVID Deaths Be Considered  Line of Duty https   t co CPZUbYWJLM,2021-09-22 17:00:00
383,en,False,1440728646533013509,"@CEStephens I hope the mask mandate stays in place, especially in schools. We’re getting closer to a vaccine for 5-11 year olds. 🙏🏻",['🙏🏻'],[],['CEStephens'],[],USA, CEStephens I hope the mask mandate stays in place  especially in schools  We’re getting closer to a vaccine for 5 11 year olds  ,2021-09-22 17:00:00
384,en,True,1440728629692956678,The plaintiffs in the lawsuit claim that United failed to authorize COVID vaccinations religious and medical accommodation requests for the COVID vaccine. https://t.co/JvkQWnRxHn,[],[],[],['https://t.co/JvkQWnRxHn'],USA,The plaintiffs in the lawsuit claim that United failed to authorize COVID vaccinations religious and medical accommodation requests for the COVID vaccine  https   t co JvkQWnRxHn,2021-09-22 17:00:00
385,en,False,1440728621811785737,"Already had my first person pushing back on the vaccine mandate. Over the phone. Calling twice. The second time it took me ten minutes to get them to stop trying to ""educate"" me about vaccines and natural immunity. This is going to suck.",[],[],[],[],USA,Already had my first person pushing back on the vaccine mandate  Over the phone  Calling twice  The second time it took me ten minutes to get them to stop trying to  educate  me about vaccines and natural immunity  This is going to suck ,2021-09-22 17:00:00
386,en,False,1440728615595872259,President Biden's executive order directs OHSA to draft an emergency requiring all companies with more than 100 employees to require a COVID-19 vaccine. Here's my take on the potential impact:  https://t.co/UyFlVUqusz #employmentlaw #Biden #VaccineMandate https://t.co/ttKBIrMEF9,[],"['employmentlaw', 'Biden', 'VaccineMandate']",[],['https://t.co/UyFlVUqusz'],USA,President Biden s executive order directs OHSA to draft an emergency requiring all companies with more than 100 employees to require a COVID 19 vaccine  Here s my take on the potential impact   https   t co UyFlVUqusz  employmentlaw  Biden  VaccineMandate https   t co ttKBIrMEF9,2021-09-22 17:00:00
387,en,False,1440728495110250496,"This is day one of Ontario’s vaccine mandate for indoor spaces. I had the pleasure of showing my receipt at this Starbucks. And I don’t know if this is coincidence, but I’m the only customer inside right now.",[],[],[],[],USA,This is day one of Ontario’s vaccine mandate for indoor spaces  I had the pleasure of showing my receipt at this Starbucks  And I don’t know if this is coincidence  but I’m the only customer inside right now ,2021-09-22 17:00:00
388,en,True,1440728434003435523,"Galvagni also says there has been “no operational impact” on hospitals that have a vaccine mandate for employees, but many unvaccinated nurses aren’t available because they’re in quarantine or isolation due to exposure.",['xp'],[],[],[],USA,Galvagni also says there has been “no operational impact” on hospitals that have a vaccine mandate for employees  but many unvaccinated nurses aren’t available because they’re in quarantine or isolation due to eosure ,2021-09-22 17:00:00
389,en,True,1440728361441980423,"Federal Employee Appeals Board Nominees Preview How They Will Reduce Case Backlog, Handle Vaccine Mandate Challenges https://t.co/EoTK6X3S78 https://t.co/qR5o9BUzfm",[],[],[],['https://t.co/EoTK6X3S78'],USA,Federal Employee Appeals Board Nominees Preview How They Will Reduce Case Backlog  Handle Vaccine Mandate Challenges https   t co EoTK6X3S78 https   t co qR5o9BUzfm,2021-09-22 17:00:00
390,en,False,1440728297344622595,apparently there’s vaccine mandate protests going on in Australia. i thought they was doing better than us?,[],[],[],[],USA,apparently there’s vaccine mandate protests going on in Australia  i thought they was doing better than us ,2021-09-22 17:00:00
391,en,True,1440728231720546306,@colin_dunlap Then you should absolutely get the back for your kids. I don’t know that anybody - especially not me - is saying anything different. The issue is with mandates because many people have different thoughts. And vaccine isn’t stopping the spread so there is no reason to mandate it,[],[],['colin_dunlap'],[],USA, colin dunlap Then you should absolutely get the back for your kids  I don’t know that anybody   especially not me   is saying anything different  The issue is with mandates because many people have different thoughts  And vaccine isn’t stopping the spread so there is no reason to mandate it,2021-09-22 17:00:00
392,en,False,1440728172098580495,Biden’s Approval Rating among Black Voters Falls after Private Sector Vaccine Mandate | National Review https://t.co/2KEWl4EiqS,[],[],[],['https://t.co/2KEWl4EiqS'],USA,Biden’s Approval Rating among Black Voters Falls after Private Sector Vaccine Mandate   National Review https   t co 2KEWl4EiqS,2021-09-22 17:00:00
393,en,False,1440728099318951942,Q3A #sageinspire Situations are still changing regarding #COVID19 protocols. Mask mandates 😷https://t.co/A0m9rQxgj7 and proof of vaccine https://t.co/OFJVE5om8v will impact other decisions @ksbw @CaliforniaOSBA https://t.co/l9IReDxy9K,['😷'],"['sageinspire', 'COVID19']","['ksbw', 'CaliforniaOSBA']","['https://t.co/A0m9rQxgj7', 'https://t.co/OFJVE5om8v', 'https://t.co/l9IReDxy9K']",USA,Q3A  sageinspire Situations are still changing regarding  COVID19 protocols  Mask mandates https   t co A0m9rQxgj7 and proof of vaccine https   t co OFJVE5om8v will impact other decisions  ksbw  CaliforniaOSBA https   t co l9IReDxy9K,2021-09-22 17:00:00
394,en,False,1440728074555838475,A PSA in regards to the NYC Vaccine Mandate https://t.co/ejsV4x2RTQ,[],[],[],[],USA,A PSA in regards to the NYC Vaccine Mandate https   t co ejsV4x2RTQ,2021-09-22 17:00:00
395,en,False,1440728072433455110,"@KevzPolitics @suezeecue And they have vaccine mandate, right",[],[],"['KevzPolitics', 'suezeecue']",[],USA, KevzPolitics  suezeecue And they have vaccine mandate  right,2021-09-22 17:00:00
396,en,False,1440728037109092363,"Let’s parlay this into vaccine mandate efficacy. Gain for having: normalcy. Loss for not: sports, movies, bars, restaurants, concerts, gyms, planes. Love, your friendly neighborhood live event creative director. https://t.co/xl6ikm7Evw",[],[],[],['https://t.co/xl6ikm7Evw'],USA,Let’s parlay this into vaccine mandate efficacy  Gain for having  normalcy  Loss for not  sports  movies  bars  restaurants  concerts  gyms  planes  Love  your friendly neighborhood live event creative director  https   t co xl6ikm7Evw,2021-09-22 17:00:00
397,en,False,1440728009430867976,"“It doesn’t appear any large district started this year w/ a full vaccine mandate in place, though the vaccine was available beginning last spring and teachers often were provided w/ early access to it. (One exception was @SuccessCharters...)” @matt_barnum https://t.co/AR8xZyiam0",[],[],"['SuccessCharters', 'matt_barnum']",['https://t.co/AR8xZyiam0'],USA,“It doesn’t appear any large district started this year w  a full vaccine mandate in place  though the vaccine was available beginning last spring and teachers often were provided w  early access to it   One exception was  SuccessCharters    ”  matt barnum https   t co AR8xZyiam0,2021-09-22 17:00:00
398,en,False,1440728003537895427,"@zachmiller @RedditCFB pretty sure WA state’s vaccine mandate for university employees went into effect yesterday, which also applies to Rolovich",[],[],"['zachmiller', 'RedditCFB']",[],USA, zachmiller  RedditCFB pretty sure WA state’s vaccine mandate for university employees went into effect yesterday  which also applies to Rolovich,2021-09-22 17:00:00
399,en,False,1440727788151967744,@ImSpeaking13 Fox News mandate is an urban legend. Biden lied again. There is no mandate. Despite that I have never heard one commentators say they have not had the vaccine. They do PSA on TV all the time. So what is there to sue them for? Fox News wipes the floor with any other network.,[],[],['ImSpeaking13'],[],USA, ImSpeaking13 Fox News mandate is an urban legend  Biden lied again  There is no mandate  Despite that I have never heard one commentators say they have not had the vaccine  They do PSA on TV all the time  So what is there to sue them for  Fox News wipes the floor with any other network ,2021-09-22 17:00:00
400,en,False,1440727779071258631,United Airlines accused of refusing employee exemptions to vaccine mandate - https://t.co/RaF7Nt2O0k,[],[],[],['https://t.co/RaF7Nt2O0k'],USA,United Airlines accused of refusing employee exemptions to vaccine mandate   https   t co RaF7Nt2O0k,2021-09-22 17:00:00
401,en,False,1440727761459441668,"@cspan And all those other countries are begging for the vaccine yet we have a country full of idiots spreading lies about a cure , start billing them the hospital stays , and the funeral,  if need be mandate the vaccine like what's been done with seatbelts and smoking,  fines and jail",[],[],['cspan'],[],USA, cspan And all those other countries are begging for the vaccine yet we have a country full of idiots spreading lies about a cure   start billing them the hospital stays   and the funeral   if need be mandate the vaccine like what s been done with seatbelts and smoking   fines and jail,2021-09-22 17:00:00
402,en,False,1440727657147101202,"Calif. professor takes a bold stand, sues university over vaccine mandate  - LifeSite https://t.co/yuBK3i9tSV",[],[],[],['https://t.co/yuBK3i9tSV'],USA,Calif  professor takes a bold stand  sues university over vaccine mandate    LifeSite https   t co yuBK3i9tSV,2021-09-22 17:00:00
403,en,False,1440727636855058442,a venn diagram of people calling UCT fascists' for a vaccine mandate and people who called for UCT to act like fascists' during FMF is basically a circle plus Phethani,[],[],[],[],USA,a venn diagram of people calling UCT fascists  for a vaccine mandate and people who called for UCT to act like fascists  during FMF is basically a circle plus Phethani,2021-09-22 17:00:00
404,en,False,1440727592990953479,@TimHoustonNS Read this Tim. A Harvard educated doctor in Alberta resigning due to vaccine mandate. We could hire him right?  https://t.co/JvhXX7pdoK,[],[],['TimHoustonNS'],['https://t.co/JvhXX7pdoK'],USA, TimHoustonNS Read this Tim  A Harvard educated doctor in Alberta resigning due to vaccine mandate  We could hire him right   https   t co JvhXX7pdoK,2021-09-22 17:00:00
405,en,False,1440727583239204865,"The Washington Post is entering dangerous territory here with an acknowledgment of the invisible unvaccinated but naturally immune.
 https://t.co/UtEzkCRrOj",[],[],[],['https://t.co/UtEzkCRrOj'],USA,The Washington Post is entering dangerous territory here with an acknowledgment of the invisible unvaccinated but naturally immune  https   t co UtEzkCRrOj,2021-09-22 17:00:00
406,en,False,1440727577237225480,@bclem2 @PinkIsles @NicholasTarnow1 @MichaelFickII @m_bultman There's a difference. Those are laws.....Mandate isn't. Who voted on this vaccine mandate?,[],[],"['bclem2', 'PinkIsles', 'NicholasTarnow1', 'MichaelFickII', 'm_bultman']",[],USA, bclem2  PinkIsles  NicholasTarnow1  MichaelFickII  m bultman There s a difference  Those are laws     Mandate isn t  Who voted on this vaccine mandate ,2021-09-22 17:00:00
407,en,False,1440727538536357903,"@GregBryk 29 year old here that did the ""right thing"" and was first in line for the phfizer vaccine. I am now dealing with pericarditis and have been for 4 weeks. Time spent in emerge, cardiologist stress test being run, x-rays. The whole 9. For a mandate to exist is asinine",[],[],['GregBryk'],[],USA, GregBryk 29 year old here that did the  right thing  and was first in line for the phfizer vaccine  I am now dealing with pericarditis and have been for 4 weeks  Time spent in emerge  cardiologist stress test being run  x rays  The whole 9  For a mandate to exist is asinine,2021-09-22 17:00:00
408,en,False,1440727529212448773,"I thought Clapton wasn't going to play at a venue that had a vaccine mandate. 

Eric Clapton Breaks Vow To Never Play Venue With Vaccine Mandate https://t.co/LqMOFcVdf3 via @YahooNews",[],[],['YahooNews'],['https://t.co/LqMOFcVdf3'],USA,I thought Clapton wasn t going to play at a venue that had a vaccine mandate  Eric Clapton Breaks Vow To Never Play Venue With Vaccine Mandate https   t co LqMOFcVdf3 via  YahooNews,2021-09-22 17:00:00
409,en,False,1440727506936483841,@pissgheti @njdotcom Stop lying businesses have the right to mandate vaccines including the COVID-19 vaccine.,[],[],"['pissgheti', 'njdotcom']",[],USA, pissgheti  njdotcom Stop lying businesses have the right to mandate vaccines including the COVID 19 vaccine ,2021-09-22 17:00:00
410,en,False,1440727485369307142,"@Alden_Mann @IfogetDafaka @StarAdvertiser Because he had a whole article written up about him losing everything over this mandate that attacked his freedums and then a week later decides, eh I'll just get the extremely safe and available vaccine https://t.co/luwNOBGMXg",[],[],"['Alden_Mann', 'IfogetDafaka', 'StarAdvertiser']",[],USA, Alden Mann  IfogetDafaka  StarAdvertiser Because he had a whole article written up about him losing everything over this mandate that attacked his freedums and then a week later decides  eh I ll just get the extremely safe and available vaccine https   t co luwNOBGMXg,2021-09-22 17:00:00
411,en,False,1440727297888165890,"Ummmm we will speak for ourselves ✊🏿
National Pee-u 
https://t.co/RNRsAmpfkq",['✊🏿'],[],[],['https://t.co/RNRsAmpfkq'],USA,Ummmm we will speak for ourselves National Pee u https   t co RNRsAmpfkq,2021-09-22 17:00:00
412,en,False,1440727178304393219,Biden’s Approval Rating among Black Voters Falls after Private-Sector Vaccine Mandate https://t.co/JgxwRoVSad the only ones who approve are the brainwashed low info voters who watch CNN,[],[],[],['https://t.co/JgxwRoVSad'],USA,Biden’s Approval Rating among Black Voters Falls after Private Sector Vaccine Mandate https   t co JgxwRoVSad the only ones who approve are the brainwashed low info voters who watch CNN,2021-09-22 17:00:00
413,en,False,1440727088743338003,@LagerfieldPadre @devtrospective Not really. Framing a rejection of a vaccine mandate as some rejection of Marxism really just shows that the people critical of Marx have no real understanding of politics outside of party partisanship.,[],[],"['LagerfieldPadre', 'devtrospective']",[],USA, LagerfieldPadre  devtrospective Not really  Framing a rejection of a vaccine mandate as some rejection of Marxism really just shows that the people critical of Marx have no real understanding of politics outside of party partisanship ,2021-09-22 17:00:00
414,en,False,1440727052403965953,United Airlines accused of refusing employee exemptions to vaccine mandate https://t.co/jTA6fAdwqv,[],[],[],['https://t.co/jTA6fAdwqv'],USA,United Airlines accused of refusing employee exemptions to vaccine mandate https   t co jTA6fAdwqv,2021-09-22 17:00:00
415,en,True,1440726976529010689,Report: 700-plus #Bills fans utilized refund after COVID vaccine mandate:  https://t.co/YpIFFYcIwZ,[],['Bills'],[],['https://t.co/YpIFFYcIwZ'],USA,Report  700 plus  Bills fans utilized refund after COVID vaccine mandate   https   t co YpIFFYcIwZ,2021-09-22 17:00:00
416,en,False,1440726946623614977,I just got called a concentration camp worker because of the vaccine mandate lmao,[],[],[],[],USA,I just got called a concentration camp worker because of the vaccine mandate lmao,2021-09-22 17:00:00
417,en,False,1440726925702434816,"@depression2019 @GainzyXBT The acceptable narrative is changing within the last 24 hours

https://t.co/2xaVMJXY5T

https://t.co/zAassG1OaB",[],[],"['depression2019', 'GainzyXBT']","['https://t.co/2xaVMJXY5T', 'https://t.co/zAassG1OaB']",USA, depression2019  GainzyXBT The acceptable narrative is changing within the last 24 hourshttps   t co 2xaVMJXY5Thttps   t co zAassG1OaB,2021-09-22 17:00:00
418,en,False,1440726914675535872,"Sunshine? No, not an option.
Exercise? No, not an option.
Healthy diet? No, not an option!
Vaccine? Yes, please, and mandate it for everyone. And maintain this 😷 requirement, too.",['😷'],[],[],[],USA,Sunshine  No  not an option Exercise  No  not an option Healthy diet  No  not an option Vaccine  Yes  please  and mandate it for everyone  And maintain this  requirement  too ,2021-09-22 17:00:00
419,en,False,1440726699356741634,"@BrianHedger Makes sense .. after all, our senile leader is trying to impose a vaccine mandate on employers of 100 or more , yet the Union for the USPS has them excluded , as well as all of congress , as well as anyone that immigrates here illegally 🤔",['🤔'],[],['BrianHedger'],[],USA, BrianHedger Makes sense    after all  our senile leader is trying to impose a vaccine mandate on employers of 100 or more   yet the Union for the USPS has them excluded   as well as all of congress   as well as anyone that immigrates here illegally ,2021-09-22 17:00:00
420,en,True,1440726673385607172,WHY? Don't they care? Peel school board refuses to implement workplace vaccine mandate in Mississauga and Brampton https://t.co/lA55bz3EIX,[],[],[],['https://t.co/lA55bz3EIX'],USA,WHY  Don t they care  Peel school board refuses to implement workplace vaccine mandate in Mississauga and Brampton https   t co lA55bz3EIX,2021-09-22 17:00:00
421,en,True,1440726568989454339,"Breaking: Draco was pro-vax!

United Airlines employees sue company over its 'draconian' COVID vaccine mandate | Fox Business https://t.co/7gsyQQG2qj",[],[],[],['https://t.co/7gsyQQG2qj'],USA,Breaking  Draco was pro vax United Airlines employees sue company over its  draconian  COVID vaccine mandate   Fox Business https   t co 7gsyQQG2qj,2021-09-22 17:00:00
422,en,False,1440726383731171331,United Airlines employees sue company over its 'draconian' COVID vaccine mandate https://t.co/lwjuw455Xq #FoxBusiness,[],['FoxBusiness'],[],['https://t.co/lwjuw455Xq'],USA,United Airlines employees sue company over its  draconian  COVID vaccine mandate https   t co lwjuw455Xq  FoxBusiness,2021-09-22 17:00:00
423,en,True,1440726313719906310,Massachusetts State Police Union Asks Judge To Delay Vaccine Mandate For Troopers (via @LouisaMoller ) https://t.co/byWVWuxgWT,[],[],['LouisaMoller'],['https://t.co/byWVWuxgWT'],USA,Massachusetts State Police Union Asks Judge To Delay Vaccine Mandate For Troopers  via  LouisaMoller   https   t co byWVWuxgWT,2021-09-22 17:00:00
424,en,False,1440726293251649538,"The same people shouting at the top of their lungs to get the vaccine and to push the mandate on the population are the same people asking the government for money, not getting enough sun, not working out, not eating healthy, and not having sex.",[],[],[],[],USA,The same people shouting at the top of their lungs to get the vaccine and to push the mandate on the population are the same people asking the government for money  not getting enough sun  not working out  not eating healthy  and not having sex ,2021-09-22 17:00:00
425,en,False,1440726285349654534,"@gflo82 @DKThomp Employers are always free to go beyond the federal requirement and mandate vaccine or termination with no testing option. That gets rid of the testing admin issue. My xlarge employer is doing that in fact, and they announced the policy 2 weeks b4 the federal rule announcement.",[],[],"['gflo82', 'DKThomp']",[],USA, gflo82  DKThomp Employers are always free to go beyond the federal requirement and mandate vaccine or termination with no testing option  That gets rid of the testing admin issue  My xlarge employer is doing that in fact  and they announced the policy 2 weeks b4 the federal rule announcement ,2021-09-22 17:00:00
426,en,False,1440726197638295556,"Calvin:

Their pl-Use the vaccine mandate to obliterate the military, and police.
-Bring in the UN to replace the military and police
-Remove all borders so criminals can overtake the country
-Disease skyrockets causing a population drop.
-Once 500k is achieved the NWO is done.",[],[],[],[],USA,Calvin Their pl Use the vaccine mandate to obliterate the military  and police  Bring in the UN to replace the military and police Remove all borders so criminals can overtake the country Disease skyrockets causing a population drop  Once 500k is achieved the NWO is done ,2021-09-22 17:00:00
427,en,False,1440726155754016772,Woman testimony right now says she's for by the vaccine mandate. Her two grandchildren have covid now and might have gotten it from school. Committee asked her no questions.,[],[],[],[],USA,Woman testimony right now says she s for by the vaccine mandate  Her two grandchildren have covid now and might have gotten it from school  Committee asked her no questions ,2021-09-22 17:00:00
