,tweet_lang,poi_name,poi_id,verified,id,tweet_text,tweet_emoticons,hashtags,mentions,tweet_urls,country,text_hi,tweet_date,text_en
240,hi,AmitShah,1447949844,True,1419335228418527236,कांग्रेस के समय कैंसर कैपिटल बना पूर्वोत्तर आज हेल्थ सेक्टर में इतना आगे बढ़ गया है कि जो मशीन पूरे देश में सिर्फ 5 है वैसी छठी मशीन आज असम में लगी है। लोग जिस ईलाज के लिए दिल्ली जाते थे वो असम में ही मिलेगा और जिन सुविधाओं के लिए गुवाहाटी आते हैं वो उनके जिले में उपलब्ध होंगी। https://t.co/GafkJaATHy,[],[],[],[],India,कांग्रेस के समय कैंसर कैपिटल बना पूर्वोत्तर आज हेल्थ सेक्टर में इतना आगे बढ़ गया है कि जो मशीन पूरे देश में सिर्फ 5 है वैसी छठी मशीन आज असम में लगी है। लोग जिस ईलाज के लिए दिल्ली जाते थे वो असम में ही मिलेगा और जिन सुविधाओं के लिए गुवाहाटी आते हैं वो उनके जिले में उपलब्ध होंगी। https   t co GafkJaATHy,2021-07-25 17:00:00,
241,hi,AmitShah,1447949844,True,1419334194707124228,"असम में दूसरी बार भाजपा की सरकार बनने का मतलब है, कि असम ने आंदोलन, आतंकवाद व हथियार तीनों को हमेशा के लिए छोड़कर विकास के रास्ते पर चलने का दृढ निश्चय किया है। https://t.co/n3g13sdfpr",[],[],[],[],India,असम में दूसरी बार भाजपा की सरकार बनने का मतलब है  कि असम ने आंदोलन  आतंकवाद व हथियार तीनों को हमेशा के लिए छोड़कर विकास के रास्ते पर चलने का दृढ निश्चय किया है। https   t co n3g13sdfpr,2021-07-25 17:00:00,
242,en,AmitShah,1447949844,True,1419317301707300873,"Laid the foundation stone of the Tamulpur Medical College and Hospital, which will greatly help our people of the BTR.

Also handed over the financial assistance to the kin of the COVID deceased. Our govt stand firmly with those who have lost their loved ones in this pandemic. https://t.co/HkkPMNiBOW",[],[],[],[],India,,2021-07-25 15:00:00,Laid the foundation stone of the Tamulpur Medical College and Hospital  which will greatly help our people of the BTR Also handed over the financial assistance to the kin of the COVID deceased  Our govt stand firmly with those who have lost their loved ones in this pandemic  https   t co HkkPMNiBOW
243,en,AmitShah,1447949844,True,1419310503520727040,A matter of great joy and pride for the entire nation that the Kakatiya Rudreshwara (Ramappa) Temple in Telangana has been inscribed as a UNESCO World Heritage Site. This iconic temple is a perfect illustration of the Grand Indian engineering skills &amp; craftsmanship. Proud moment! https://t.co/0WS5nBdbML,[],[],[],['https://t.co/0WS5nBdbML'],India,,2021-07-25 15:00:00,A matter of great joy and pride for the entire nation that the Kakatiya Rudreshwara  Ramappa  Temple in Telangana has been inscribed as a UNESCO World Heritage Site  This iconic temple is a perfect illustration of the Grand Indian engineering skills  amp  craftsmanship  Proud moment  https   t co 0WS5nBdbML
244,en,AmitShah,1447949844,True,1419280030597718024,"Inaugurated the Radio Therapy Block and dedicated to people the new LINAC machine in the State Cancer Institute, Guwahati. This will go a long way in providing better and free of cost treatment for cancer patients. https://t.co/EtCwD0BzVt",[],[],[],[],India,,2021-07-25 13:00:00,Inaugurated the Radio Therapy Block and dedicated to people the new LINAC machine in the State Cancer Institute  Guwahati  This will go a long way in providing better and free of cost treatment for cancer patients  https   t co EtCwD0BzVt
245,hi,AmitShah,1447949844,True,1419276553582616582,हिमाचल प्रदेश के किन्नौर में भूस्खलन से हुए हादसे में कई लोगों के निधन से अत्यंत दुखी हूँ। स्थानीय प्रशासन राहत कार्य में लगा है। इस हादसे में जिन लोगों ने अपनों को खोया है उनके प्रति अपनी संवेदनाएं व्यक्त करता हूँ व घायलों के शीघ्र ही स्वस्थ होने की प्रार्थना करता हूँ।,[],[],[],[],India,हिमाचल प्रदेश के किन्नौर में भूस्खलन से हुए हादसे में कई लोगों के निधन से अत्यंत दुखी हूँ। स्थानीय प्रशासन राहत कार्य में लगा है। इस हादसे में जिन लोगों ने अपनों को खोया है उनके प्रति अपनी संवेदनाएं व्यक्त करता हूँ व घायलों के शीघ्र ही स्वस्थ होने की प्रार्थना करता हूँ।,2021-07-25 13:00:00,
246,en,AmitShah,1447949844,True,1419247926312783877,"Had lunch and spent a good time interacting with our valiant @official_dgar personnel in Laitkor, Meghalaya.

Assam Rifles, the Guardians of the North East, is India’s oldest paramilitary force. The nation is proud of its bravery and courage. https://t.co/xHhC6ErwpV",[],[],['official_dgar'],[],India,,2021-07-25 11:00:00,Had lunch and spent a good time interacting with our valiant  official dgar personnel in Laitkor  Meghalaya Assam Rifles  the Guardians of the North East  is India’s oldest paramilitary force  The nation is proud of its bravery and courage  https   t co xHhC6ErwpV
247,en,AmitShah,1447949844,True,1419239057373024258,"Ramakrishna Mission is doing a great service to humanity following the teaching and ideals of Shri Ramakrishna Paramahamsa Ji.

Sharing some pictures from my visit to the Ramakrishna Mission Ashrama, Sohra in Meghalaya. https://t.co/E2MgNe5oh0",[],[],[],[],India,,2021-07-25 10:00:00,Ramakrishna Mission is doing a great service to humanity following the teaching and ideals of Shri Ramakrishna Paramahamsa Ji Sharing some pictures from my visit to the Ramakrishna Mission Ashrama  Sohra in Meghalaya  https   t co E2MgNe5oh0
248,hi,AmitShah,1447949844,True,1419237772418686983,"Today had the good fortune of visiting the Ramakrishna Mission Ashrama in Sohra, Meghalaya.

Paid tributes to Shri Ramakrishna Paramahamsa Ji and Swami Vivekananda Ji. https://t.co/19WVolDRlK",[],[],[],[],India,Today had the good fortune of visiting the Ramakrishna Mission Ashrama in Sohra  Meghalaya Paid tributes to Shri Ramakrishna Paramahamsa Ji and Swami Vivekananda Ji  https   t co 19WVolDRlK,2021-07-25 10:00:00,
249,en,AmitShah,1447949844,True,1419234736304627717,"Inaugurated the Greater Sohra Water Supply Scheme in Sohra, Meghalaya.

This project worth ₹25 crore is a collective effort of NESIDS and @MDoNER_India, which will provide clean drinking water to about 22,943 people of Sohra and its 12 surrounding villages. https://t.co/edCbbBoYxU",[],[],['MDoNER_India'],[],India,,2021-07-25 10:00:00,Inaugurated the Greater Sohra Water Supply Scheme in Sohra  Meghalaya This project worth ₹25 crore is a collective effort of NESIDS and  MDoNER India  which will provide clean drinking water to about 22 943 people of Sohra and its 12 surrounding villages  https   t co edCbbBoYxU
250,hi,AmitShah,1447949844,True,1419232332234444800,"यदि पानी का स्रोत शुद्ध नहीं है तो मानव स्‍वस्‍थ नहीं रहेगा। 

श्री @narendramodi जी ने जल जीवन मिशन के तहत देश की आजादी के 75 वर्ष व मेघालय के 50 वर्ष पूरे होने तक देश व मेघालय के दुर्गम क्षेत्रों के हर घर में नल से शुद्ध पीने का पानी पहुंचाने का महत्वाकांक्षी लक्ष्य लिया है। https://t.co/KkT24hb5Ze",[],[],['narendramodi'],[],India,यदि पानी का स्रोत शुद्ध नहीं है तो मानव स्‍वस्‍थ नहीं रहेगा। श्री  narendramodi जी ने जल जीवन मिशन के तहत देश की आजादी के 75 वर्ष व मेघालय के 50 वर्ष पूरे होने तक देश व मेघालय के दुर्गम क्षेत्रों के हर घर में नल से शुद्ध पीने का पानी पहुंचाने का महत्वाकांक्षी लक्ष्य लिया है। https   t co KkT24hb5Ze,2021-07-25 10:00:00,
251,hi,AmitShah,1447949844,True,1419230415554965509,"CAPF देश के अलग-अलग भागों में बड़ी संख्या में वृक्षारोपण कर रही है, मैं वहां की सभी पंचायतों व आमजन से आग्रह करता हूँ कि आप भी इसमें भागीदार बनें।

सोहरा (चेरापूंजी) को फिर से हरा भरा बनाने के लिए @official_dgar इस क्षेत्र को गोद ले रहा है, इसके लिए मैं उनकी सराहना करता हूँ। https://t.co/4eCfSmMmu2",[],[],['official_dgar'],[],India,CAPF देश के अलग अलग भागों में बड़ी संख्या में वृक्षारोपण कर रही है  मैं वहां की सभी पंचायतों व आमजन से आग्रह करता हूँ कि आप भी इसमें भागीदार बनें।सोहरा  चेरापूंजी  को फिर से हरा भरा बनाने के लिए  official dgar इस क्षेत्र को गोद ले रहा है  इसके लिए मैं उनकी सराहना करता हूँ। https   t co 4eCfSmMmu2,2021-07-25 10:00:00,
252,hi,AmitShah,1447949844,True,1419230111627235334,सोहरा जहाँ कुछ वर्षों पहले तक सबसे अधिक वर्षा होती थी उसे फिर से हरा भरा बनाने के लिए ₹50 करोड़ की लागत से 100 हेक्‍टेयर भूमि में नया वन बनाने की शुरुआत हो रही है। और अगले तीन वर्ष में यहाँ 1000 हेक्‍टेयर क्षेत्र में कुल 1 मिलियन पौधे लगाने का हमारा लक्ष्य है। https://t.co/qVkAR8zPe7,[],[],[],[],India,सोहरा जहाँ कुछ वर्षों पहले तक सबसे अधिक वर्षा होती थी उसे फिर से हरा भरा बनाने के लिए ₹50 करोड़ की लागत से 100 हेक्‍टेयर भूमि में नया वन बनाने की शुरुआत हो रही है। और अगले तीन वर्ष में यहाँ 1000 हेक्‍टेयर क्षेत्र में कुल 1 मिलियन पौधे लगाने का हमारा लक्ष्य है। https   t co qVkAR8zPe7,2021-07-25 10:00:00,
253,hi,AmitShah,1447949844,True,1419229903602425859,"मोदी जी ने देश में लगभग 14 करोड़ घरों में गैस चूल्‍हा पहुंचाकर कार्बन उत्‍सर्जन को रोका है। आज जलविद्युत व सोलर ऊर्जा क्षेत्र में भारत सबसे आगे है।

गर्व का विषय है कि पेरिस समझौते में @narendramodi जी की प्रस्‍तावित कार्य योजना के साथ दुनिया ग्‍लोबल वार्मिंग के खिलाफ लड़ रही है। https://t.co/JLKhn69J3U",[],[],['narendramodi'],[],India,मोदी जी ने देश में लगभग 14 करोड़ घरों में गैस चूल्‍हा पहुंचाकर कार्बन उत्‍सर्जन को रोका है। आज जलविद्युत व सोलर ऊर्जा क्षेत्र में भारत सबसे आगे है।गर्व का विषय है कि पेरिस समझौते में  narendramodi जी की प्रस्‍तावित कार्य योजना के साथ दुनिया ग्‍लोबल वार्मिंग के खिलाफ लड़ रही है। https   t co JLKhn69J3U,2021-07-25 10:00:00,
254,en,AmitShah,1447949844,True,1419209770611798017,"Launched the 'Green Sohra Afforestation Campaign'.
 
Sohra which was earlier known for its greenery has witnessed rampant deforestation in the past few decades.

I am sure that this joint campaign of the @official_dgar and the Meghalaya govt will restore the greenery of Sohra. https://t.co/kzVbYW6d0I",[],[],['official_dgar'],[],India,,2021-07-25 08:00:00,Launched the  Green Sohra Afforestation Campaign   Sohra which was earlier known for its greenery has witnessed rampant deforestation in the past few decades I am sure that this joint campaign of the  official dgar and the Meghalaya govt will restore the greenery of Sohra  https   t co kzVbYW6d0I
255,en,AmitShah,1447949844,True,1419168435519381506,Speaking at the launch of Green Sohra Plantation Drive of @official_dgar in Meghalaya. https://t.co/OtAgJizbht,[],[],['official_dgar'],['https://t.co/OtAgJizbht'],India,,2021-07-25 06:00:00,Speaking at the launch of Green Sohra Plantation Drive of  official dgar in Meghalaya  https   t co OtAgJizbht
256,en,AmitShah,1447949844,True,1418961436995379206,"Addressed the conference of the Chief Ministers, Chief Secretaries and DGPs of the North-Eastern States. 

Under the leadership of PM @narendramodi Ji, we are resolved to make our North-Eastern region the most developed and secure part of the country. https://t.co/f0M3x3qmgR",[],[],['narendramodi'],[],India,,2021-07-24 16:00:00,Addressed the conference of the Chief Ministers  Chief Secretaries and DGPs of the North Eastern States  Under the leadership of PM  narendramodi Ji  we are resolved to make our North Eastern region the most developed and secure part of the country  https   t co f0M3x3qmgR
257,en,AmitShah,1447949844,True,1418960461215698951,"Modi govt has done unprecedented work to accelerate the development of Meghalaya.

Both central and state governments are working together to develop this beautiful state.

Today Meghalaya has become a state with 100% ODF coverage. I congratulate CM @SangmaConrad Ji for this. https://t.co/VFkrh0dpGZ",[],[],['SangmaConrad'],[],India,,2021-07-24 16:00:00,Modi govt has done unprecedented work to accelerate the development of Meghalaya Both central and state governments are working together to develop this beautiful state Today Meghalaya has become a state with 100  ODF coverage  I congratulate CM  SangmaConrad Ji for this  https   t co VFkrh0dpGZ
258,en,AmitShah,1447949844,True,1418957987750809613,"Our North-Eastern region has one of the richest cultures in the world.

The languages, culture, music and dance of this region is what every Indian is proud of. So it is our collective responsibility to preserve and promote it. But it is not possible without good connectivity. https://t.co/VsG7ECsAJT",[],[],[],[],India,,2021-07-24 16:00:00,Our North Eastern region has one of the richest cultures in the world The languages  culture  music and dance of this region is what every Indian is proud of  So it is our collective responsibility to preserve and promote it  But it is not possible without good connectivity  https   t co VsG7ECsAJT
259,hi,AmitShah,1447949844,True,1418956018730651651,"पूरे उत्तरपूर्व क्षेत्र में मोदी सरकार तीन चीजों को महत्व देकर आगे बढ़ा रही है-
1) यहां के नृत्य-संगीत, भाषा व संस्कृति को संजोकर रखना
2) उत्तरपूर्व के सभी विवाद समाप्त कर शांतिपूर्ण क्षेत्र बनाना
3) एक विकसित क्षेत्र बनाकर इसे आजादी-पूर्व के GDP में योगदान के स्तर पर वापस लाना। https://t.co/rkuTtTFhLK",[],[],[],[],India,पूरे उत्तरपूर्व क्षेत्र में मोदी सरकार तीन चीजों को महत्व देकर आगे बढ़ा रही है 1  यहां के नृत्य संगीत  भाषा व संस्कृति को संजोकर रखना2  उत्तरपूर्व के सभी विवाद समाप्त कर शांतिपूर्ण क्षेत्र बनाना3  एक विकसित क्षेत्र बनाकर इसे आजादी पूर्व के GDP में योगदान के स्तर पर वापस लाना। https   t co rkuTtTFhLK,2021-07-24 15:00:00,
260,en,AmitShah,1447949844,True,1418955388972675082,"Since 2014, the connectivity of the North East has always been the top priority of PM @narendramodi Ji.

Modi govt is working relentlessly to connect all the state capitals of NE by Rail and Air before 2023-24. Whereas the work to increase road connectivity is also in full swing. https://t.co/OJPz37aIwc",[],[],['narendramodi'],[],India,,2021-07-24 15:00:00,Since 2014  the connectivity of the North East has always been the top priority of PM  narendramodi Ji Modi govt is working relentlessly to connect all the state capitals of NE by Rail and Air before 2023 24  Whereas the work to increase road connectivity is also in full swing  https   t co OJPz37aIwc
261,en,AmitShah,1447949844,True,1418954848339435525,"The North-East is one of the regions of the country where connectivity is a must.

Without better connectivity, neither the security of the entire region can be ensured, nor the glory and splendour of its culture can be regained, nor development can be accelerated here. https://t.co/5rBgADch5o",[],[],[],[],India,,2021-07-24 15:00:00,The North East is one of the regions of the country where connectivity is a must Without better connectivity  neither the security of the entire region can be ensured  nor the glory and splendour of its culture can be regained  nor development can be accelerated here  https   t co 5rBgADch5o
262,en,AmitShah,1447949844,True,1418909612321869825,"Inaugurated the Cryogenic Oxygen Plant and a Paediatric ward at the COVID Step Down Hospital in Umsawli, Shillong.

I am sure that these new facilities will further strengthen the healthcare infrastructure of Shillong and greatly help the people in the times to come. https://t.co/0HY7tIegWX",[],[],[],[],India,,2021-07-24 12:00:00,Inaugurated the Cryogenic Oxygen Plant and a Paediatric ward at the COVID Step Down Hospital in Umsawli  Shillong I am sure that these new facilities will further strengthen the healthcare infrastructure of Shillong and greatly help the people in the times to come  https   t co 0HY7tIegWX
263,en,AmitShah,1447949844,True,1418901826158563328,"Inaugurated the Inter-State Bus Terminus (ISBT) in Shillong, Meghalaya.

Connectivity in the NE states has always been the top priority of the NDA govt. This will further ease the people of Meghalaya and the neighbouring states. I congratulate CM @SangmaConrad Ji for this. https://t.co/QyCVkhnPLk",[],[],['SangmaConrad'],[],India,,2021-07-24 12:00:00,Inaugurated the Inter State Bus Terminus  ISBT  in Shillong  Meghalaya Connectivity in the NE states has always been the top priority of the NDA govt  This will further ease the people of Meghalaya and the neighbouring states  I congratulate CM  SangmaConrad Ji for this  https   t co QyCVkhnPLk
264,en,AmitShah,1447949844,True,1418889229317246976,"Laid the foundation stone of the Multipurpose Conference Centre and Exhibition facility in North Eastern Space Application Centre (NESAC), Umiam, Meghalaya. https://t.co/5AhGVXz55X",[],[],[],[],India,,2021-07-24 11:00:00,Laid the foundation stone of the Multipurpose Conference Centre and Exhibition facility in North Eastern Space Application Centre  NESAC   Umiam  Meghalaya  https   t co 5AhGVXz55X
265,en,AmitShah,1447949844,True,1418888956284858369,"Mapping of forest gap areas, expansion of the land area for horticulture development, Identification &amp; rejuvenation of wetlands, diversion of floodwater and assessment of Bamboo resources for livelihood needs are a few among many key ideas that were discussed during the meeting. https://t.co/S6znBWb7Wv",['xp'],[],[],[],India,,2021-07-24 11:00:00,Mapping of forest gap areas  eansion of the land area for horticulture development  Identification  amp  rejuvenation of wetlands  diversion of floodwater and assessment of Bamboo resources for livelihood needs are a few among many key ideas that were discussed during the meeting  https   t co S6znBWb7Wv
266,en,AmitShah,1447949844,True,1418888784393867265,"I applaud the efforts and dedication of Team NESAC and want to assure them that PM @narendramodi led central government is committed to providing advanced technology support to the region, that can transform the lives of our people of the North-Eastern states. https://t.co/xTXUEJwO0i",[],[],['narendramodi'],[],India,,2021-07-24 11:00:00,I applaud the efforts and dedication of Team NESAC and want to assure them that PM  narendramodi led central government is committed to providing advanced technology support to the region  that can transform the lives of our people of the North Eastern states  https   t co xTXUEJwO0i
267,en,AmitShah,1447949844,True,1418888627149426688,"Chaired a meeting to review the operation of the North Eastern Space Application Centre (NESAC) in Umiam, Meghalaya.

NESAC plays a key role in stimulating the overall growth of the North-Eastern region by using space science and technology. https://t.co/iIiQTWglIa",[],[],[],[],India,,2021-07-24 11:00:00,Chaired a meeting to review the operation of the North Eastern Space Application Centre  NESAC  in Umiam  Meghalaya NESAC plays a key role in stimulating the overall growth of the North Eastern region by using space science and technology  https   t co iIiQTWglIa
268,en,AmitShah,1447949844,True,1418878562451574784,"Inaugurating the Inter-State Bus Terminus (ISBT) in Mawiong, Meghalaya. Watch the address live! https://t.co/z6GfXH9r5B",[],[],[],['https://t.co/z6GfXH9r5B'],India,,2021-07-24 10:00:00,Inaugurating the Inter State Bus Terminus  ISBT  in Mawiong  Meghalaya  Watch the address live  https   t co z6GfXH9r5B
269,en,AmitShah,1447949844,True,1418835423946842116,"What a proud moment.

Every Indian is rejoicing this historic accomplishment of @mirabai_chanu at the #OlympicGames .

Let us #Cheer4India. https://t.co/iR8KrwFacY",[],"['OlympicGames', 'Cheer4India']",['mirabai_chanu'],['https://t.co/iR8KrwFacY'],India,,2021-07-24 07:00:00,What a proud moment Every Indian is rejoicing this historic accomplishment of  mirabai chanu at the  OlympicGames  Let us  Cheer4India  https   t co iR8KrwFacY
270,en,AmitShah,1447949844,True,1418825970639941637,"So proud of @mirabai_chanu for clinching the silver medal in the Women's 49kg Weightlifting category at the #OlympicGames.

Wishing you all the very best for your future endeavours. https://t.co/C6d4twJLWk",[],['OlympicGames'],['mirabai_chanu'],[],India,,2021-07-24 07:00:00,So proud of  mirabai chanu for clinching the silver medal in the Women s 49kg Weightlifting category at the  OlympicGames Wishing you all the very best for your future endeavours  https   t co C6d4twJLWk
