,tweet_lang,poi_name,poi_id,verified,id,tweet_text,tweet_emoticons,hashtags,mentions,tweet_urls,country,text_hi,tweet_date,text_en
820,hi,AmitShah,1447949844,True,1362727128119136261,"हम सभी के भाग्य में देश के लिए मरना नहीं है, मगर देश के लिए जीना ईश्वर ने हम पर छोड़ा है। 

जिन शहीदों ने देश के लिए अपनी जान का बलिदान दिया, उनका स्मरण करके अगर हम अपना बाकी का जीवन देश के लिए जीयें, तो उन वीरों के बलिदान को इससे बड़ी श्रद्धांजलि और कोई नहीं हो सकती है। https://t.co/6hRi1MFrMh",[],[],[],[],India,हम सभी के भाग्य में देश के लिए मरना नहीं है  मगर देश के लिए जीना ईश्वर ने हम पर छोड़ा है। जिन शहीदों ने देश के लिए अपनी जान का बलिदान दिया  उनका स्मरण करके अगर हम अपना बाकी का जीवन देश के लिए जीयें  तो उन वीरों के बलिदान को इससे बड़ी श्रद्धांजलि और कोई नहीं हो सकती है। https   t co 6hRi1MFrMh,2021-02-19 12:00:00,
821,hi,AmitShah,1447949844,True,1362727028315750403,"शहीदों की चिताओं पर जुड़ेंगे हर बरस मेले, वतन पर मरने वालों का यही बाकी निशां होगा।

मैं इससे आगे बस यही कहना चाहता हूं कि मेले तो जरूर लगाने चाहिए लेकिन जिस उद्देश्य के लिए उन्होंने अपना सर्वस्‍व न्‍योछावर किया है उस उद्देश्य को पूर्ण करने के लिए अपना जीवन भी लगाना जरूरी है। https://t.co/8LeE7Br7J2",[],[],[],[],India,शहीदों की चिताओं पर जुड़ेंगे हर बरस मेले  वतन पर मरने वालों का यही बाकी निशां होगा।मैं इससे आगे बस यही कहना चाहता हूं कि मेले तो जरूर लगाने चाहिए लेकिन जिस उद्देश्य के लिए उन्होंने अपना सर्वस्‍व न्‍योछावर किया है उस उद्देश्य को पूर्ण करने के लिए अपना जीवन भी लगाना जरूरी है। https   t co 8LeE7Br7J2,2021-02-19 12:00:00,
822,hi,AmitShah,1447949844,True,1362726864138104837,"लोगों की संपत्ति की कई बार कुर्की हुई, वीर सावरकर को एक ही जीवन में दो बार उम्रकैद हुई लेकिन फिर भी उन्होंने आजादी के लिए लड़ाई लड़ना नहीं छोड़ा।

इन लोगों ने सिर्फ आजादी नहीं बल्कि भारत पुनः विश्वगुरु बने इसलिए बलिदान दिया व जब तक हम इसकी सिद्धि न कर लें हम चैन से नहीं बैठ सकते। https://t.co/lGZifkNxv8",[],[],[],[],India,लोगों की संपत्ति की कई बार कुर्की हुई  वीर सावरकर को एक ही जीवन में दो बार उम्रकैद हुई लेकिन फिर भी उन्होंने आजादी के लिए लड़ाई लड़ना नहीं छोड़ा।इन लोगों ने सिर्फ आजादी नहीं बल्कि भारत पुनः विश्वगुरु बने इसलिए बलिदान दिया व जब तक हम इसकी सिद्धि न कर लें हम चैन से नहीं बैठ सकते। https   t co lGZifkNxv8,2021-02-19 12:00:00,
823,hi,AmitShah,1447949844,True,1362726315237904387,"नेताजी सुभाष चंद्र बोस जी एक उत्कृष्ट प्रशासक थे, वें कोलकाता के मेयर बने व दो बार कांग्रेस पार्टी के अध्यक्ष बने।

ये सुभाष बाबू की लोकप्रियता का परिचायक ही है कि एक बार तो वें गाँधी जी की इच्छा के विरुद्ध चुनाव लड़कर उनके प्रत्याशी को हराकर कांग्रेस के अध्यक्ष बने। https://t.co/80M3FBWAxP",[],[],[],[],India,नेताजी सुभाष चंद्र बोस जी एक उत्कृष्ट प्रशासक थे  वें कोलकाता के मेयर बने व दो बार कांग्रेस पार्टी के अध्यक्ष बने।ये सुभाष बाबू की लोकप्रियता का परिचायक ही है कि एक बार तो वें गाँधी जी की इच्छा के विरुद्ध चुनाव लड़कर उनके प्रत्याशी को हराकर कांग्रेस के अध्यक्ष बने। https   t co 80M3FBWAxP,2021-02-19 12:00:00,
824,hi,AmitShah,1447949844,True,1362724255381655552,"देश की जनता सुभाष बाबू को इतने सालों बाद आज भी बहुत प्यार व सम्मान से याद करती है।

बहुत प्रयास किए गए कि नेताजी को भुला दिया जाए लेकिन कोई कितना भी प्रयास करे, सुभाष बाबू की देशभक्ति, उनके कार्य और सर्वोच्च बलिदान पीढ़ियों तक भारतवासियों के मन में अमर रहेंगे। https://t.co/U8FXnBFPLJ",[],[],[],[],India,देश की जनता सुभाष बाबू को इतने सालों बाद आज भी बहुत प्यार व सम्मान से याद करती है।बहुत प्रयास किए गए कि नेताजी को भुला दिया जाए लेकिन कोई कितना भी प्रयास करे  सुभाष बाबू की देशभक्ति  उनके कार्य और सर्वोच्च बलिदान पीढ़ियों तक भारतवासियों के मन में अमर रहेंगे। https   t co U8FXnBFPLJ,2021-02-19 11:00:00,
825,en,AmitShah,1447949844,True,1362708869193994240,"Paid floral tributes to the brave martyrs of West Bengal, today at the National Library, Kolkata. Nation will forever remain indebted to their sacrifice. 

Also inaugurated an exhibition ‘Biplabi Bangla’ showcasing the unparalleled valor of these great freedom fighters. https://t.co/0Pn7KXJ1ZW",[],[],[],[],India,,2021-02-19 10:00:00,Paid floral tributes to the brave martyrs of West Bengal  today at the National Library  Kolkata  Nation will forever remain indebted to their sacrifice  Also inaugurated an exhibition ‘Biplabi Bangla’ showcasing the unparalleled valor of these great freedom fighters  https   t co 0Pn7KXJ1ZW
826,en,AmitShah,1447949844,True,1362683135725432833,Interview to @Zee24Ghanta. @ZeeNews https://t.co/2srky8R4VR,[],[],"['Zee24Ghanta', 'ZeeNews']",['https://t.co/2srky8R4VR'],India,,2021-02-19 09:00:00,Interview to  Zee24Ghanta   ZeeNews https   t co 2srky8R4VR
827,en,AmitShah,1447949844,True,1362666884881997825,"Paying tributes to our great revolutionaries of West Bengal at the iconic National Library, Kolkata. Watch live! https://t.co/Hz2EL5KvOh",[],[],[],['https://t.co/Hz2EL5KvOh'],India,,2021-02-19 08:00:00,Paying tributes to our great revolutionaries of West Bengal at the iconic National Library  Kolkata  Watch live  https   t co Hz2EL5KvOh
828,hi,AmitShah,1447949844,True,1362608370063052802,"राष्ट्रीयता के जीवंत प्रतीक छत्रपति शिवाजी महाराज ने अपनी अद्वितीय बुद्धिमता, अद्भुत साहस व उत्कृष्ट प्रशासनिक कौशल से सुशासन की स्थापना की। अपनी दूरदर्शिता से उन्होंने एक मजबूत नौसेना बनाई व कई जन-कल्याणकारी नीतियों की भी शुरुआत की। ऐसे राष्ट्रगौरव को कोटि-कोटि वंदन। https://t.co/6kf78TezQE",[],[],[],[],India,राष्ट्रीयता के जीवंत प्रतीक छत्रपति शिवाजी महाराज ने अपनी अद्वितीय बुद्धिमता  अद्भुत साहस व उत्कृष्ट प्रशासनिक कौशल से सुशासन की स्थापना की। अपनी दूरदर्शिता से उन्होंने एक मजबूत नौसेना बनाई व कई जन कल्याणकारी नीतियों की भी शुरुआत की। ऐसे राष्ट्रगौरव को कोटि कोटि वंदन। https   t co 6kf78TezQE,2021-02-19 04:00:00,
829,hi,AmitShah,1447949844,True,1362603332142006272,"अप्रतिम राष्ट्रभक्ति, त्याग व तपस्या की प्रतिमूर्ति @RSSorg के द्वितीय सरसंघचालक पूज्य श्री गुरूजी का सम्पूर्ण जीवन राष्ट्र की एकता,अखंडता व स्वाभिमान की रक्षा के लिए समर्पित रहा। गुरुजी ने अपने विचारों व आदर्शों से युवाओं को राष्ट्रसेवा के लिए संस्कारित करने का भगीरथ कार्य किया। https://t.co/qZS5FaOPjP",[],[],['RSSorg'],[],India,अप्रतिम राष्ट्रभक्ति  त्याग व तपस्या की प्रतिमूर्ति  RSSorg के द्वितीय सरसंघचालक पूज्य श्री गुरूजी का सम्पूर्ण जीवन राष्ट्र की एकता अखंडता व स्वाभिमान की रक्षा के लिए समर्पित रहा। गुरुजी ने अपने विचारों व आदर्शों से युवाओं को राष्ट्रसेवा के लिए संस्कारित करने का भगीरथ कार्य किया। https   t co qZS5FaOPjP,2021-02-19 03:00:00,
830,hi,AmitShah,1447949844,True,1362446279880568834,"नए कृषि कानूनों में पुरानी व्यवस्था का कोई भी विकल्प बंद नहीं हुआ है, बल्कि नया विकल्प जुड़ा है। कौन सा विकल्प तय करना है ये हमारे किसानों पर निर्भर है।

फिर भी अगर किसी को लगता है कि इसमें कुछ ऐसा है जो किसानों के हित में नहीं है, तो सरकार खुले मन से बातचीत करने के लिए तैयार है। https://t.co/UunuWd405b",[],[],[],[],India,नए कृषि कानूनों में पुरानी व्यवस्था का कोई भी विकल्प बंद नहीं हुआ है  बल्कि नया विकल्प जुड़ा है। कौन सा विकल्प तय करना है ये हमारे किसानों पर निर्भर है।फिर भी अगर किसी को लगता है कि इसमें कुछ ऐसा है जो किसानों के हित में नहीं है  तो सरकार खुले मन से बातचीत करने के लिए तैयार है। https   t co UunuWd405b,2021-02-18 17:00:00,
831,hi,AmitShah,1447949844,True,1362446097482878977,"बंगाल में आए दिन हिंसा व बम धमाके होते हैं, फैक्ट्रियां बंद हो रही हैं, कर्मचारियों को 7वां वेतन आयोग नहीं दिया।

ममता दीदी आप हमारा क्या हिसाब मांग रही हो, बंगाल की जनता आपका हिसाब मांग रही है। आपने उनसे जो वादे किए थे उसका रिपोर्ट कार्ड चुनाव में जनता के सामने लेकर जाइए। https://t.co/VCmel3l1lq",[],[],[],[],India,बंगाल में आए दिन हिंसा व बम धमाके होते हैं  फैक्ट्रियां बंद हो रही हैं  कर्मचारियों को 7वां वेतन आयोग नहीं दिया।ममता दीदी आप हमारा क्या हिसाब मांग रही हो  बंगाल की जनता आपका हिसाब मांग रही है। आपने उनसे जो वादे किए थे उसका रिपोर्ट कार्ड चुनाव में जनता के सामने लेकर जाइए। https   t co VCmel3l1lq,2021-02-18 17:00:00,
832,hi,AmitShah,1447949844,True,1362445365123764224,"ममता जी ने कम्युनिस्टों को हटाकर सत्ता परिवर्तन को ही परिवर्तन मान लिया। हम सरकार तो बदलेंगे ही लेकिन हमारे परिवर्तन का लक्ष्य सिर्फ मुख्यमंत्री बदलना नहीं, सोनार बांग्ला की रचना करना है।

देश में जहां भी मोदीजी के नेतृत्व में भाजपा सरकार बनी वहां हमने सुशासन का रिकॉर्ड बनाया है। https://t.co/TlF2yfnwgA",[],[],[],[],India,ममता जी ने कम्युनिस्टों को हटाकर सत्ता परिवर्तन को ही परिवर्तन मान लिया। हम सरकार तो बदलेंगे ही लेकिन हमारे परिवर्तन का लक्ष्य सिर्फ मुख्यमंत्री बदलना नहीं  सोनार बांग्ला की रचना करना है।देश में जहां भी मोदीजी के नेतृत्व में भाजपा सरकार बनी वहां हमने सुशासन का रिकॉर्ड बनाया है। https   t co TlF2yfnwgA,2021-02-18 17:00:00,
833,en,AmitShah,1447949844,True,1362406640486469632,"Fortunate to have visited the Aurobindo Bhavan and paid tributes to the legendary Sri Aurobindo ji. He was a staunch nationalist, who made stellar contribution to India’s freedom struggle. His thoughts and ideals helped greatly in shaping the future vision of our society. https://t.co/2wsU7QZwb1",[],[],[],[],India,,2021-02-18 14:00:00,Fortunate to have visited the Aurobindo Bhavan and paid tributes to the legendary Sri Aurobindo ji  He was a staunch nationalist  who made stellar contribution to India’s freedom struggle  His thoughts and ideals helped greatly in shaping the future vision of our society  https   t co 2wsU7QZwb1
834,en,AmitShah,1447949844,True,1362384582725705734,"The message is loud and clear...people of Bengal want Poribortan, they want BJP. https://t.co/gfLZBgBjB7",[],[],[],[],India,,2021-02-18 13:00:00,The message is loud and clear   people of Bengal want Poribortan  they want BJP  https   t co gfLZBgBjB7
835,en,AmitShah,1447949844,True,1362381287269404680,"Violence and anarchy can not stop Lotus from blooming in West Bengal.

Glimpses from the road show in Kakdwip. https://t.co/7BWuoTleoz",[],[],[],[],India,,2021-02-18 13:00:00,Violence and anarchy can not stop Lotus from blooming in West Bengal Glimpses from the road show in Kakdwip  https   t co 7BWuoTleoz
836,en,AmitShah,1447949844,True,1362373626981273608,Spent wonderful moments at Narayanpur village. Sharing some pictures. https://t.co/n9hMkRnMgh,[],[],[],[],India,,2021-02-18 12:00:00,Spent wonderful moments at Narayanpur village  Sharing some pictures  https   t co n9hMkRnMgh
837,en,AmitShah,1447949844,True,1362365098115833864,"Had lunch at Shri Subrata Biswas ji’s home in Narayanpur village, South 24 Parganas (West Bengal).

I thank Biswas ji and his family from the bottom of my heart for such warmth and hospitality. https://t.co/XUB19txbs1",[],[],[],[],India,,2021-02-18 12:00:00,Had lunch at Shri Subrata Biswas ji’s home in Narayanpur village  South 24 Parganas  West Bengal  I thank Biswas ji and his family from the bottom of my heart for such warmth and hospitality  https   t co XUB19txbs1
838,en,AmitShah,1447949844,True,1362358486697271300,"Live from the Roadshow in Kakdwip, West Bengal https://t.co/Weq1yb0jeA",[],[],[],['https://t.co/Weq1yb0jeA'],India,,2021-02-18 11:00:00,Live from the Roadshow in Kakdwip  West Bengal https   t co Weq1yb0jeA
839,en,AmitShah,1447949844,True,1362355288972533766,"Time to uproot the Syndicate Raj from the revered land of West Bengal.

Only BJP under the leadership of PM @narendramodi ji can fulfil the aspirations of people of Bengal. https://t.co/wpiGONHg4n",[],[],['narendramodi'],[],India,,2021-02-18 11:00:00,Time to uproot the Syndicate Raj from the revered land of West Bengal Only BJP under the leadership of PM  narendramodi ji can fulfil the aspirations of people of Bengal  https   t co wpiGONHg4n
840,en,AmitShah,1447949844,True,1362353931800616962,"I bow to my sisters and brothers of West Bengal for turning out in record numbers in today’s Poribortan Yatra in Kakdwip. 

These pictures indicate the enthusiasm towards BJP. https://t.co/upsTPpHmV7",[],[],[],[],India,,2021-02-18 11:00:00,I bow to my sisters and brothers of West Bengal for turning out in record numbers in today’s Poribortan Yatra in Kakdwip  These pictures indicate the enthusiasm towards BJP  https   t co upsTPpHmV7
841,hi,AmitShah,1447949844,True,1362333475781574658,"मेरे लिए बहुत सौभाग्य की बात है कि आज गंगासागर की इस पवित्र भूमि में आदिकाल से स्थित कपिल मुनि के आश्रम आने का अवसर मिला।

कपिल मुनि का ये मन्दिर सदियों से अध्यात्म और प्रकृति के संरक्षण का प्रतीक बना हुआ है।

यह हमारी अटूट आस्था का केंद्र है, सभी को यहाँ एक बार अवश्य आना चाहिए। https://t.co/yU4qkDBYkG",[],[],[],[],India,मेरे लिए बहुत सौभाग्य की बात है कि आज गंगासागर की इस पवित्र भूमि में आदिकाल से स्थित कपिल मुनि के आश्रम आने का अवसर मिला।कपिल मुनि का ये मन्दिर सदियों से अध्यात्म और प्रकृति के संरक्षण का प्रतीक बना हुआ है।यह हमारी अटूट आस्था का केंद्र है  सभी को यहाँ एक बार अवश्य आना चाहिए। https   t co yU4qkDBYkG,2021-02-18 09:00:00,
842,hi,AmitShah,1447949844,True,1362325691660787713,"आज सनातन धर्म की आस्था के महातीर्थ ‘गंगासागर’ में आकार अभिभूत हूँ।

मोक्षदायिनी माँ गंगा हिमालय से निकलकर असंख्य जीवनों का उद्धार कर यहाँ सागर में मिलती हैं।

इस पवित्र स्थल से एक अद्भुत ऊर्जा की प्राप्ति होती है और राष्ट्र व समाज की सेवा के लिए नयी शक्ति का संचार होता है। https://t.co/cOIBuw09Um",[],[],[],[],India,आज सनातन धर्म की आस्था के महातीर्थ ‘गंगासागर’ में आकार अभिभूत हूँ।मोक्षदायिनी माँ गंगा हिमालय से निकलकर असंख्य जीवनों का उद्धार कर यहाँ सागर में मिलती हैं।इस पवित्र स्थल से एक अद्भुत ऊर्जा की प्राप्ति होती है और राष्ट्र व समाज की सेवा के लिए नयी शक्ति का संचार होता है। https   t co cOIBuw09Um,2021-02-18 09:00:00,
843,en,AmitShah,1447949844,True,1362317105136246784,"Flagging off @BJP4Bengal’s fifth Poribortan Yatra from Kakdwip, West Bengal. Watch my address live! https://t.co/RGUx9T3K97",[],[],['BJP4Bengal'],['https://t.co/RGUx9T3K97'],India,,2021-02-18 08:00:00,Flagging off  BJP4Bengal’s fifth Poribortan Yatra from Kakdwip  West Bengal  Watch my address live  https   t co RGUx9T3K97
844,hi,AmitShah,1447949844,True,1362306764226486272,"भारत सेवाश्रम संघ, कोलकाता में स्वामी प्रणवानंद जी को श्रद्धा सुमन अर्पित कर गुरुजनों का आशीर्वाद लिया।

यह स्थान मानवता की नैतिक तथा आध्यात्मिक उन्नति का एक प्रमुख केंद्र है।

मैं युवाओं से आग्रह करता हूँ कि स्वामी जी के जीवन से प्रेरणा लेकर राष्ट्र निर्माण में अपना योगदान दें। https://t.co/xD3BeSCsjx",['xD'],[],[],[],India,भारत सेवाश्रम संघ  कोलकाता में स्वामी प्रणवानंद जी को श्रद्धा सुमन अर्पित कर गुरुजनों का आशीर्वाद लिया।यह स्थान मानवता की नैतिक तथा आध्यात्मिक उन्नति का एक प्रमुख केंद्र है।मैं युवाओं से आग्रह करता हूँ कि स्वामी जी के जीवन से प्रेरणा लेकर राष्ट्र निर्माण में अपना योगदान दें। https   t co 3BeSCsjx,2021-02-18 08:00:00,
