,tweet_lang,poi_name,poi_id,verified,id,tweet_text,tweet_emoticons,hashtags,mentions,tweet_urls,country,text_hi,tweet_date,text_en
501,hi,AmitShah,1447949844,True,1383054930433306627,"बैरकपुर की इस वीरभूमि को नमन करता हूँ। यहीं से शहीद मंगल पांडे ने अंग्रेजी शासन के विरुद्ध 1857 की क्रांति का बिगुल फूंका था।

इसबार बैरकपुर की जनता ने TMC के विरुद्ध बिगुल फूंक दिया है और भाजपा के असोल परिवर्तन के संकल्प के साथ दृढ़ता से खड़ी है।
#BanglarManushBJPErSathe https://t.co/tWtlWWEBkt",[],['BanglarManushBJPErSathe'],[],[],India,बैरकपुर की इस वीरभूमि को नमन करता हूँ। यहीं से शहीद मंगल पांडे ने अंग्रेजी शासन के विरुद्ध 1857 की क्रांति का बिगुल फूंका था।इसबार बैरकपुर की जनता ने TMC के विरुद्ध बिगुल फूंक दिया है और भाजपा के असोल परिवर्तन के संकल्प के साथ दृढ़ता से खड़ी है। BanglarManushBJPErSathe https   t co tWtlWWEBkt,2021-04-16 14:00:00,
502,hi,AmitShah,1447949844,True,1383042522247667724,"बंगाल और कृष्णानगर उत्तर का विकास सिर्फ भाजपा ही कर सकती है।

इसलिए कृष्णानगर उत्तर की जनता ने इस बार किसान, मतुआ और राजवंशी समाज को सताने वाली व उनका दमन करने वाली ममता सरकार को उखाड़ फैंकने का संकल्प लिया है। #BanglarManushBJPErSathe https://t.co/ooNch5vhdX",[],['BanglarManushBJPErSathe'],[],[],India,बंगाल और कृष्णानगर उत्तर का विकास सिर्फ भाजपा ही कर सकती है।इसलिए कृष्णानगर उत्तर की जनता ने इस बार किसान  मतुआ और राजवंशी समाज को सताने वाली व उनका दमन करने वाली ममता सरकार को उखाड़ फैंकने का संकल्प लिया है।  BanglarManushBJPErSathe https   t co ooNch5vhdX,2021-04-16 13:00:00,
503,en,AmitShah,1447949844,True,1383028012791173123,"Live from Khardaha, West Bengal. Watch my address. #BanglarManushBJPErSathe https://t.co/yOPIL8E9iN",[],['BanglarManushBJPErSathe'],[],['https://t.co/yOPIL8E9iN'],India,,2021-04-16 12:00:00,Live from Khardaha  West Bengal  Watch my address   BanglarManushBJPErSathe https   t co yOPIL8E9iN
504,en,AmitShah,1447949844,True,1383012537986285574,"Roadshow in Barrackpore, West Bengal. Watch Live! #BanglarManushBJPErSathe https://t.co/tm0onq4LsV",[],['BanglarManushBJPErSathe'],[],['https://t.co/tm0onq4LsV'],India,,2021-04-16 11:00:00,Roadshow in Barrackpore  West Bengal  Watch Live   BanglarManushBJPErSathe https   t co tm0onq4LsV
505,en,AmitShah,1447949844,True,1382990161189896193,Live from the roadshow in Krishnanagar Uttar assembly constituency. #BanglarManushBJPErSathe https://t.co/lqiewD3lhk,[],['BanglarManushBJPErSathe'],[],['https://t.co/lqiewD3lhk'],India,,2021-04-16 10:00:00,Live from the roadshow in Krishnanagar Uttar assembly constituency   BanglarManushBJPErSathe https   t co lqiewD3lhk
506,hi,AmitShah,1447949844,True,1382981920154284035,"दीदी ने तुष्टिकरण की राजनीति के लिए वर्षों से बंगाल में रह रहे हमारे मतुआ व नामशूद्र भाईयों को अपमानित कर हमेशा उनके साथ अन्याय ही किया है।

बंगाल में भाजपा सरकार बनने के बाद हम उन्हें न्याय व अधिकार देने का काम करेंगे।

तेहट्टा जनसभा के कुछ दृश्य। #BanglarManushBJPErSathe https://t.co/7EZ7phHwFj",[],['BanglarManushBJPErSathe'],[],[],India,दीदी ने तुष्टिकरण की राजनीति के लिए वर्षों से बंगाल में रह रहे हमारे मतुआ व नामशूद्र भाईयों को अपमानित कर हमेशा उनके साथ अन्याय ही किया है।बंगाल में भाजपा सरकार बनने के बाद हम उन्हें न्याय व अधिकार देने का काम करेंगे।तेहट्टा जनसभा के कुछ दृश्य।  BanglarManushBJPErSathe https   t co 7EZ7phHwFj,2021-04-16 09:00:00,
507,en,AmitShah,1447949844,True,1382961792645701635,"Speaking at a public meeting in Tehatta, West Bengal. #BanglarManushBJPErSathe https://t.co/qxyeYxBhdJ",[],['BanglarManushBJPErSathe'],[],['https://t.co/qxyeYxBhdJ'],India,,2021-04-16 08:00:00,Speaking at a public meeting in Tehatta  West Bengal   BanglarManushBJPErSathe https   t co qxyeYxBhdJ
508,hi,AmitShah,1447949844,True,1382546167641165824,"नैसर्गिक सौंदर्य से परिपूर्ण व समृद्ध सांस्कृतिक धरोहर की भूमि हिमाचल प्रदेश के सभी निवासियों को ‘हिमाचल दिवस’ की शुभकामनाएं।

देवभूमि ऐसे ही निरंतर प्रगति के पथ पर अग्रसर रहे व सभी प्रदेशवासी स्वस्थ व सशक्त हों ऐसी ईश्वर से कामना करता हूँ।",[],[],[],[],India,नैसर्गिक सौंदर्य से परिपूर्ण व समृद्ध सांस्कृतिक धरोहर की भूमि हिमाचल प्रदेश के सभी निवासियों को ‘हिमाचल दिवस’ की शुभकामनाएं।देवभूमि ऐसे ही निरंतर प्रगति के पथ पर अग्रसर रहे व सभी प्रदेशवासी स्वस्थ व सशक्त हों ऐसी ईश्वर से कामना करता हूँ।,2021-04-15 04:00:00,
509,hi,AmitShah,1447949844,True,1382158337207267328,"भारत रत्न बाबासाहेब अम्बेडकर जी ने समाज के वंचित वर्ग को शिक्षित व सशक्त किया और हमें न्याय व समता पर आधारित एक ऐसा प्रगतिशील संविधान दिया जिसने देश को एकता के सूत्र में बाँधने का काम किया।

बाबासाहेब का विराट जीवन व विचार हमारी प्रेरणा का केंद्र है।

उन्हें कोटिशः नमन। https://t.co/fdOQArrRhu",[],[],[],[],India,भारत रत्न बाबासाहेब अम्बेडकर जी ने समाज के वंचित वर्ग को शिक्षित व सशक्त किया और हमें न्याय व समता पर आधारित एक ऐसा प्रगतिशील संविधान दिया जिसने देश को एकता के सूत्र में बाँधने का काम किया।बाबासाहेब का विराट जीवन व विचार हमारी प्रेरणा का केंद्र है।उन्हें कोटिशः नमन। https   t co fdOQArrRhu,2021-04-14 02:00:00,
510,en,AmitShah,1447949844,True,1382012377692954625,"In Bengal, each and every section of society stands firmly with the BJP. Today, interacted with the people of Baranagar and Dum dum assembly constituencies in two different hall meetings and urged them to vote for BJP. https://t.co/C1ALWDEQHT",[],[],[],[],India,,2021-04-13 17:00:00,In Bengal  each and every section of society stands firmly with the BJP  Today  interacted with the people of Baranagar and Dum dum assembly constituencies in two different hall meetings and urged them to vote for BJP  https   t co C1ALWDEQHT
511,en,AmitShah,1447949844,True,1381989553247027209,People of Bengal are desperately waiting to bid farewell to Mamata Didi. Some glimpses from Bidhannagar. #BanglayEbarBJPAsche https://t.co/zrLRdhx46k,[],['BanglayEbarBJPAsche'],[],[],India,,2021-04-13 15:00:00,People of Bengal are desperately waiting to bid farewell to Mamata Didi  Some glimpses from Bidhannagar   BanglayEbarBJPAsche https   t co zrLRdhx46k
512,hi,AmitShah,1447949844,True,1381984000248401922,"ममता दीदी हमको बाहरी बोलती हैं।

दीदी,
कम्युनिस्ट पार्टी की विचारधारा बाहरी है जिसे चीन व रूस से आयात किया गया है।

कांग्रेस की लीडरशिप बाहरी है।

TMC के वोट बैंक घुसपैठिए हैं, जो बाहरी है।

हम तो इसी मिट्टी में पैदा हुए, इसी मिट्टी में मिल जाएंगे...तो भला हम बाहरी कैसे हुए? https://t.co/IdAqOsZj7G",[],[],[],[],India,ममता दीदी हमको बाहरी बोलती हैं।दीदी कम्युनिस्ट पार्टी की विचारधारा बाहरी है जिसे चीन व रूस से आयात किया गया है।कांग्रेस की लीडरशिप बाहरी है।TMC के वोट बैंक घुसपैठिए हैं  जो बाहरी है।हम तो इसी मिट्टी में पैदा हुए  इसी मिट्टी में मिल जाएंगे   तो भला हम बाहरी कैसे हुए  https   t co IdAqOsZj7G,2021-04-13 15:00:00,
513,hi,AmitShah,1447949844,True,1381983312973996037,"दीदी को चाय और चाय वाले, दोनों से नफरत है, दोनों से दुश्मनी है।

दीदी एक ओर, चाय मजदूरों की मजदूरी नहीं बढ़ाती और दूसरी ओर वह चाय वाले के बेटे को अपशब्द कहती हैं। 

दीदी को भले ही चाय बागानों और इसमें काम करने वाले मजदूरों से दुश्मनी हो लेकिन हमें दोनों से प्यार है। https://t.co/F8nD0G2AvX",[],[],[],[],India,दीदी को चाय और चाय वाले  दोनों से नफरत है  दोनों से दुश्मनी है।दीदी एक ओर  चाय मजदूरों की मजदूरी नहीं बढ़ाती और दूसरी ओर वह चाय वाले के बेटे को अपशब्द कहती हैं। दीदी को भले ही चाय बागानों और इसमें काम करने वाले मजदूरों से दुश्मनी हो लेकिन हमें दोनों से प्यार है। https   t co F8nD0G2AvX,2021-04-13 15:00:00,
514,hi,AmitShah,1447949844,True,1381982887004622859,"02 मई को बंगाल में भाजपा की सरकार बनने पर जिन भी गोरखा भाइयों पर झूठे मुकद्दमें आंदोलन के दौरान दर्ज हुए हैं, उसे एक सप्ताह के भीतर ही हटा दिया जाएगा। मैं गोरखा भाइयों से कहना चाहता हूँ कि आपका राजनीतिक वनवास अब खत्म होने वाला है। #BanglayEbarBJPAsche https://t.co/WdlKcZm0Kx",[],['BanglayEbarBJPAsche'],[],[],India,02 मई को बंगाल में भाजपा की सरकार बनने पर जिन भी गोरखा भाइयों पर झूठे मुकद्दमें आंदोलन के दौरान दर्ज हुए हैं  उसे एक सप्ताह के भीतर ही हटा दिया जाएगा। मैं गोरखा भाइयों से कहना चाहता हूँ कि आपका राजनीतिक वनवास अब खत्म होने वाला है।  BanglayEbarBJPAsche https   t co WdlKcZm0Kx,2021-04-13 15:00:00,
515,hi,AmitShah,1447949844,True,1381981995912228867,"दीदी एनआरसी के नाम पर गोरखा और नेपाली भाइयों को डरा रही हैं।

ममता दीदी, गोरखा बंधु घुसपैठिये नहीं हो सकते, वे देश की शान हैं। यह भूमि जितनी मेरी है, उतनी ही हमारे गोरखा और नेपाली भाइयों की भी है। #BanglayEbarBJPAsche https://t.co/x4H95zkbfA",[],['BanglayEbarBJPAsche'],[],[],India,दीदी एनआरसी के नाम पर गोरखा और नेपाली भाइयों को डरा रही हैं।ममता दीदी  गोरखा बंधु घुसपैठिये नहीं हो सकते  वे देश की शान हैं। यह भूमि जितनी मेरी है  उतनी ही हमारे गोरखा और नेपाली भाइयों की भी है।  BanglayEbarBJPAsche https   t co x4H95zkbfA,2021-04-13 15:00:00,
516,hi,AmitShah,1447949844,True,1381981599630127108,बंगाल में भाजपा सरकार बनने के छः महीने के अंदर ही सारे पहाड़ी क्षेत्र में पंचायती राज लागू होगा। #BanglayEbarBJPAsche https://t.co/BbxwuvWrKq,[],['BanglayEbarBJPAsche'],[],[],India,बंगाल में भाजपा सरकार बनने के छः महीने के अंदर ही सारे पहाड़ी क्षेत्र में पंचायती राज लागू होगा।  BanglayEbarBJPAsche https   t co BbxwuvWrKq,2021-04-13 15:00:00,
517,en,AmitShah,1447949844,True,1381965375491907592,Overwhelmed by the love and support from the people of Islampur. Here are some pictures from the roadshow. #BanglayEbarBJPAsche https://t.co/sNmd2EvF8E,[],['BanglayEbarBJPAsche'],[],[],India,,2021-04-13 14:00:00,Overwhelmed by the love and support from the people of Islampur  Here are some pictures from the roadshow   BanglayEbarBJPAsche https   t co sNmd2EvF8E
518,en,AmitShah,1447949844,True,1381952123747725315,Addressing a public meeting in Bidhannagar. Watch Live! #BanglayEbarBJPAsche https://t.co/tbnvI7k6e3,[],['BanglayEbarBJPAsche'],[],['https://t.co/tbnvI7k6e3'],India,,2021-04-13 13:00:00,Addressing a public meeting in Bidhannagar  Watch Live   BanglayEbarBJPAsche https   t co tbnvI7k6e3
519,hi,AmitShah,1447949844,True,1381935012505808903,"नागराकाटा में जनसभा को संबोधित किया।

बंगाल के चाय बागानों में काम करने वाले भाईयों-बहनों को ममता दीदी ने सिर्फ धोका दिया है।

इनकी चिंता बस भाजपा ने की है, उनके कल्याण के लिए मोदी जी ने ₹1000 करोड़ का फंड दिया। बंगाल में भाजपा सरकार बनने के बाद इन प्रयासों को और गति मिलेगी। https://t.co/ZCDGdFtPT4",[],[],[],[],India,नागराकाटा में जनसभा को संबोधित किया।बंगाल के चाय बागानों में काम करने वाले भाईयों बहनों को ममता दीदी ने सिर्फ धोका दिया है।इनकी चिंता बस भाजपा ने की है  उनके कल्याण के लिए मोदी जी ने ₹1000 करोड़ का फंड दिया। बंगाल में भाजपा सरकार बनने के बाद इन प्रयासों को और गति मिलेगी। https   t co ZCDGdFtPT4,2021-04-13 12:00:00,
520,hi,AmitShah,1447949844,True,1381920799305592836,"TMC, कम्युनिस्ट और कांग्रेस ने अपनी वोटबैंक की राजनीति के लिए वर्षों से बंगाल में पहाड़ और गोरखा समाज के भविष्य के साथ खिलवाड़ किया है।

मोदी जी गोरखा भाईयों-बहनों को देश की मुख्यधारा से जोड़ने के लिए कटिबद्ध हैं।

दार्जिलिंग जनसभा के कुछ दृश्य। #BanglayEbarBJPAsche https://t.co/oWoS9jh8Cw",[],['BanglayEbarBJPAsche'],[],[],India,TMC  कम्युनिस्ट और कांग्रेस ने अपनी वोटबैंक की राजनीति के लिए वर्षों से बंगाल में पहाड़ और गोरखा समाज के भविष्य के साथ खिलवाड़ किया है।मोदी जी गोरखा भाईयों बहनों को देश की मुख्यधारा से जोड़ने के लिए कटिबद्ध हैं।दार्जिलिंग जनसभा के कुछ दृश्य।  BanglayEbarBJPAsche https   t co oWoS9jh8Cw,2021-04-13 11:00:00,
521,en,AmitShah,1447949844,True,1381911863470907392,Roadshow in Islampur assembly constituency. Watch! #BanglayEbarBJPAsche https://t.co/h1VlGwboT2,[],['BanglayEbarBJPAsche'],[],['https://t.co/h1VlGwboT2'],India,,2021-04-13 10:00:00,Roadshow in Islampur assembly constituency  Watch   BanglayEbarBJPAsche https   t co h1VlGwboT2
522,en,AmitShah,1447949844,True,1381887368362303490,"Speaking at a public rally in Nagrakata, West Bengal. #BanglayEbarBJPAsche https://t.co/z4WReNzkYT",[],['BanglayEbarBJPAsche'],[],['https://t.co/z4WReNzkYT'],India,,2021-04-13 08:00:00,Speaking at a public rally in Nagrakata  West Bengal   BanglayEbarBJPAsche https   t co z4WReNzkYT
523,en,AmitShah,1447949844,True,1381862903511347202,Live from Darjeeling assembly constituency in West Bengal. Watch my speech! #BanglayEbarBJPAsche https://t.co/PGXJZE6sDG,[],['BanglayEbarBJPAsche'],[],['https://t.co/PGXJZE6sDG'],India,,2021-04-13 07:00:00,Live from Darjeeling assembly constituency in West Bengal  Watch my speech   BanglayEbarBJPAsche https   t co PGXJZE6sDG
524,hi,AmitShah,1447949844,True,1381809364609032192,"जलियांवाला बाग नरसंहार में शहीद हुए अमर बलिदानियों की वीरता व अदम्य साहस को कोटि-कोटि नमन।

माँ भारती को गुलामी की बेड़ियों से मुक्त कराने के लिए आपके सर्वोच्च बलिदान को यह कृतज्ञ राष्ट्र कभी भुला नहीं पाएगा।",[],[],[],[],India,जलियांवाला बाग नरसंहार में शहीद हुए अमर बलिदानियों की वीरता व अदम्य साहस को कोटि कोटि नमन।माँ भारती को गुलामी की बेड़ियों से मुक्त कराने के लिए आपके सर्वोच्च बलिदान को यह कृतज्ञ राष्ट्र कभी भुला नहीं पाएगा।,2021-04-13 03:00:00,
525,en,AmitShah,1447949844,True,1381808985003552777,"On the auspicious occasion of Sajibu Cheiraoba, I extend my warm greetings to our sister and brothers of Manipur. May this new year bring peace, joy and good fortune in everyone’s life.",[],[],[],[],India,,2021-04-13 03:00:00,On the auspicious occasion of Sajibu Cheiraoba  I extend my warm greetings to our sister and brothers of Manipur  May this new year bring peace  joy and good fortune in everyone’s life 
526,en,AmitShah,1447949844,True,1381808747417247745,"Navreh Mubarak! 

Best wishes to everyone on the auspicious occasion of Navreh. Praying for everyone's happiness and good health.",[],[],[],[],India,,2021-04-13 03:00:00,Navreh Mubarak  Best wishes to everyone on the auspicious occasion of Navreh  Praying for everyone s happiness and good health 
527,en,AmitShah,1447949844,True,1381808172344614914,"Wishing all my Sindhi friends on the holy occasion of Cheti Chand. May Lord Jhulelal bless us with utmost peace, harmony and prosperity.",[],[],[],[],India,,2021-04-13 03:00:00,Wishing all my Sindhi friends on the holy occasion of Cheti Chand  May Lord Jhulelal bless us with utmost peace  harmony and prosperity 
528,hi,AmitShah,1447949844,True,1381806353090453508,"सभी देशवासियों को हिन्दू नववर्ष विक्रम संवत-2078 की हार्दिक शुभकामनाएं। 

यह नववर्ष सभी के जीवन में उत्साह, उमंग व नई ऊर्जा का संचार करे। https://t.co/7GGsHV3PcW",[],[],[],[],India,सभी देशवासियों को हिन्दू नववर्ष विक्रम संवत 2078 की हार्दिक शुभकामनाएं। यह नववर्ष सभी के जीवन में उत्साह  उमंग व नई ऊर्जा का संचार करे। https   t co 7GGsHV3PcW,2021-04-13 03:00:00,
529,hi,AmitShah,1447949844,True,1381806206759497731,"नवरात्रि के पावन पर्व की सभी को हार्दिक शुभकामनाएँ।

जगत जननी माँ भगवती सभी के जीवन को अपार सुख, उत्तम स्वास्थ्य और समृद्धि से परिपूर्ण करें।

जय माता दी! https://t.co/CYNUCgj4gF",[],[],[],[],India,नवरात्रि के पावन पर्व की सभी को हार्दिक शुभकामनाएँ।जगत जननी माँ भगवती सभी के जीवन को अपार सुख  उत्तम स्वास्थ्य और समृद्धि से परिपूर्ण करें।जय माता दी  https   t co CYNUCgj4gF,2021-04-13 03:00:00,
530,hi,AmitShah,1447949844,True,1381635430685179910,"आज के रोड शो में सिलीगुड़ी की जनता भी “02 मई, दीदी गयी” के संकल्प के साथ पूरे जोश और उत्साह के साथ खड़ी दिखी।#Ebar200Paar https://t.co/UjzhIeDLeb",[],['Ebar200Paar'],[],[],India,आज के रोड शो में सिलीगुड़ी की जनता भी “02 मई  दीदी गयी” के संकल्प के साथ पूरे जोश और उत्साह के साथ खड़ी दिखी। Ebar200Paar https   t co UjzhIeDLeb,2021-04-12 16:00:00,
